"date","keyword","source","link","abstract"
"2026-05-06","biodiversity loss","Crossref/Applied Immunohistochemistry & Molecular Morphology","https://doi.org/10.1097/pai.0000000000001325","Both SMARCB1(INI-1)-deficient and FH (fumarate hydratase)-deficient renal cell carcinoma (RCC) have a male predominance, potentially overlapping high-grade histologic features, and typically poor clinical outcomes. SMARCB1(INI-1) deficiency is the characteristic pathogenic alteration in medullary (or medullary-like) RCC, which is aggressively treated with chemotherapy, primarily platinum-based. In contrast, a distinct set of agents, such as the combination of bevacizumab and erlotinib, is the principal systemic therapy consideration for FH-d..."
"2026-05-06","greenhouse gas emissions","Crossref/Building Simulation","https://doi.org/10.1007/s12273-026-1438-8",""
"2026-05-06","air pollution","Crossref/Environment, Development and Sustainability","https://doi.org/10.1007/s10668-026-07696-5",""
"2026-05-06","climate change","Crossref/Environment, Development and Sustainability","https://doi.org/10.1007/s10668-026-07664-z",""
"2026-05-06","global warming","Crossref/European Heart Journal","https://doi.org/10.1093/eurheartj/ehag322",""
"2026-05-06","biodiversity loss","Crossref/GeroScience","https://doi.org/10.1007/s11357-026-02284-x",""
"2026-05-06","climate change","Crossref/International Journal of Public Sector Management","https://doi.org/10.1108/ijpsm-07-2025-0311","PurposeThis article examines attempts to transform the funding, governance and management of municipal green spaces. It advances knowledge on what enables or prevents systemic change, focusing on the function and potential of rules within a three-year programme to “transform” greenspace management in the UK. We focus on how rules become interpretable and contestable “boundary objects” or interfaces between different actors as system change programmes are implemented."
"2026-05-06","greenhouse gas emissions","Crossref/International Journal of Structural Integrity","https://doi.org/10.1108/ijsi-11-2025-0300","PurposeThis study focuses on a first-stage stator vane of a gas turbine that developed fatigue cracks during service. A finite element–based fracture mechanics simulation was performed under thermo-mechanical coupling conditions with the aim of providing a practical approach for fatigue crack growth (FCG) analysis and FCG life prediction of the vane. Design/methodology/approachFirst, the potential crack growth directions were identified through a crack growth likelihood analysis."
"2026-05-06","greenhouse gas emissions","Crossref/Journal of Cannabis Research","https://doi.org/10.1186/s42238-026-00429-5","AbstractBackground The legalization of adult-use Cannabis sativa in New York State has created a need for research-based information on expected yield, production costs, revenue, and profitability for greenhouse cultivation. Limited data currently exist to inform growers and investors. This study evaluates both agronomic and economic outcomes for two flowering strategies—autoflower (light-insensitive) and photoperiod (light-sensitive) C."
"2026-05-06","flood","Crossref/Journal of Computer Science and Frontier Technologies","https://doi.org/10.63313/jcsft.9067","Flood disaster emergency question answering (QA) requires both structured fact retrieval and complex compositional reasoning. Existing large language model (LLM)-based knowledge graph QA methods still struggle to balance query flexibility and execution reliability. To address this contradiction, this paper proposes a white-box/black-box dual-modal structured query method for flood disaster spatiotemporal knowledge graph QA."
"2026-05-06","global warming","Crossref/Journal of Enterprising Communities: People and Places in the Global Economy","https://doi.org/10.1108/jec-01-2026-0030","PurposeThis study aims to explore how identity conflict (IC) influences entrepreneurial intention (EI) among Arab-Palestinian students in Israeli universities, a marginalized minority navigating complex national and cultural affiliations. Situating this inquiry within the framework of enterprising communities, it examines how entrepreneurship emerges as a response to social and structural inequalities. Design/methodology/approachA quantitative, cross-sectional design used an online questionnaire (n = 110)."
"2026-05-06","global warming","Crossref/Journal of Mechanics in Medicine and Biology","https://doi.org/10.1142/s0219519426500156","This study investigates how global cultural differences influence long-term care (LTC) and well-being among older adults. Specifically, it examines how the cultural backgrounds of various countries and regions shape the selection and implementation of care models for the elderly. By deepening the understanding of these cross-cultural dynamics, this study aims to inform the development of more effective policies and service models that enhance older adults’ care and well-being."
"2026-05-06","climate change","Crossref/Journal of Space Weather and Space Climate","https://doi.org/10.1051/swsc/2026017","In this study, we utilise satellite measurements to investigate variations in the magnetosphere. Using 8- to 12-hour time windows, we map the time-varying nightside magnetospheric fields up to degree and order 3, capturing lateral offsets from a simple tilted dipole model. We determine the field over the nightside hemisphere during geomagnetic storms and examine how azimuthal symmetry is disrupted at storm maxima and re-established during the storm recovery phase, as exemplified by the St."
"2026-05-06","greenhouse gas emissions","Crossref/Microsystems & Nanoengineering","https://doi.org/10.1038/s41378-026-01253-w","Abstract A new synthetic strategy and associated mechanism have been developed, in which two carrier conduction channels of n- and p-type semiconductors on the surface of one material are automatically and advantageously selected during surface reactivity. The key step is to uniformly channel non-equilibrium metal oxides of CuO x and SnO x throughout the sample by applying a flame chemical vapour deposition technique for 5 s. Unlike the original SnO 2 semiconductor and Cu metal, the resulting material possessed intermediate physicochemical p..."
"2026-05-06","air pollution","Crossref/Proceedings of the Royal Society B: Biological Sciences","https://doi.org/10.1098/rspb.2026.0153","AbstractVocalizations are ancient behaviours that require the complex coordination of breath and display. Understanding how laryngeal anatomy shapes vocalization provides insights into this diversity, its mechanisms and their evolution. Rodents are ideal for exploring this variation because of their diverse mechanisms and vocal structures."
"2026-05-06","biodiversity loss","Crossref/Psychiatric Services","https://doi.org/10.1176/appi.ps.20250605",""
"2026-05-06","environmental change","Crossref/Quality & Quantity","https://doi.org/10.1007/s11135-026-02823-w",""
"2026-05-06","greenhouse gas emissions","Crossref/Reaction Kinetics, Mechanisms and Catalysis","https://doi.org/10.1007/s11144-026-03132-x",""
"2026-05-06","biodiversity loss","Crossref/Reading & Writing","https://doi.org/10.4102/rw.v17i1.634","Background: Although the coronavirus disease 2019 (COVID-19) pandemic has significantly subsided, its educational repercussions persist, particularly in rural South African contexts. The abrupt transition to remote learning in 2020 disproportionately affected learners, particularly in under-resourced areas, resulting in significant learning loss – especially in reading among English First Additional Language (FAL) learners. Objectives: This qualitative study aimed to explore how the free voluntary reading (FVR) approach can be used to mitiga..."
"2026-05-06","climate change","Crossref/UCL Open Environment","https://doi.org/10.14324/111.444/ucloe.3512","The Philippines is one of the most vulnerable archipelagic low–middle-income countries in regard to the impacts of climate change. Consequently, Puerto Princesa City, a coastal city in central Palawan, Philippines, faces the challenges of these impacts, which affect the food security of its coastal communities. This research presents an assessment of perceived climate changes and investigates their impact on food security."
"2026-05-05","greenhouse gas emissions","Crossref/ACS ES&T Air","https://doi.org/10.1021/acsestair.5c00092",""
"2026-05-05","biodiversity loss","Crossref/AIDS","https://doi.org/10.1097/qad.0000000000004536","IntroductionPeople living with HIV (PWH) with interrupted medical care have a higher risk of viral rebound. We investigated the factors associated with loss to follow-up (LTFU) by combining socioeconomic data from three research cohorts with the nationwide follow-up data of the French Hospital Database on HIV (ANRS-CO4-FHDH). MethodsWe included individuals who entered the ANRS PRIMO (primary HIV-1 infection), CODEX (HIV-1 controllers) and COPANA (recent HIV-1 diagnosis) cohorts."
"2026-05-05","climate extremes","Crossref/ARACÊ","https://doi.org/10.56238/arev8n5-006","Diante da intensificação da crise climática e ambiental, torna-se imprescindível problematizar o papel do ensino de Química na formação dos sujeitos e na construção de uma sociedade socialmente responsável. Este artigo tem como objetivo analisar criticamente a quem serve o ensino de Química contemporâneo, considerando as tensões existentes entre os interesses industriais, o desenvolvimento tecnológico e a formação cidadã comprometida com a sustentabilidade. Fundamentado em uma abordagem teórica crítica, com ênfase nas contribuições da Educaç..."
"2026-05-05","drought","Crossref/Acta Geophysica","https://doi.org/10.1007/s11600-026-01873-w",""
"2026-05-05","climate change","Crossref/Adhyayan Journal","https://doi.org/10.3126/aj.v13i01.93846","As our world is combating the new challenges of climate change, the indigenous community possesses traditional knowledge that contributes valuable insights to the study area. In this context, this study explores the climatic knowledge of the Rajbanshi community in Jhapa district of Nepal on the basis of a local lens. The research design is explorative with an ethnographic study."
"2026-05-05","biodiversity loss","Crossref/Advanced Functional Materials","https://doi.org/10.1002/adfm.75710","ABSTRACT The development of microwave photonics requires monolithic integration of functional thin‐film layers on low‐loss substrates, but epitaxial film growth is limited to materials with compatible crystal structure and chemistry, hindering the flexibility of device design. Herein, high‐quality epitaxial BaTiO 3 thin films are fabricated onto low‐loss, non‐perovskite substrates, including sapphire and amorphous fused silica, via a flexible freestanding SrTiO 3 template strategy. Templated growth on SrTiO 3 membranes results in highly alig..."
"2026-05-05","air pollution","Crossref/Advanced Materials","https://doi.org/10.1002/adma.73191","ABSTRACTAt present, the power conversion efficiency of perovskite solar cells has exceeded 27%, attracting increasing attention from both academia and industry. However, fabricating high‐efficiency devices typically requires inert atmospheres, which inevitably increase manufacturing costs and hinder large‐scale commercialization of perovskite solar cells. This review systematically summarizes recent progress in the fabrication of perovskite solar cells under ambient air conditions."
"2026-05-05","global warming","Crossref/All Azimuth: A Journal of Foreign Policy and Peace","https://doi.org/10.20991/allazimuth.1944200","This paper explains how the geo-culturally motivated postcolonial views on global governance produce an essentially dichotomous notion of the non- Western agency defined in terms of “silence versus defiance”: habitually, the agency of the non-West is reduced to either “silence” (under hegemony) or “defiance” (under counter-hegemony) often postured in an opposition to the West. This phenomenon is embodied in the mainstream readings of global governance that reduce India’s agency to its spectacular gestures of defiance within the institutional..."
"2026-05-05","drought","Crossref/American Journal of Botany","https://doi.org/10.1002/ajb2.70200","AbstractPremise Understanding how plants adapt to spatial and temporal variation in water availability is central to predicting their responses to climate change. However, the genetic and physiological mechanisms underlying local adaptation to drought remain poorly understood, particularly in polyploid species. We investigated these mechanisms in Trifolium repens (white clover), a recently evolved allotetraploid characterized by broad ecological tolerance, global distribution, and extensive variation in life‐history traits."
"2026-05-05","biodiversity loss","Crossref/Analytical Chemistry","https://doi.org/10.1021/acs.analchem.5c07368",""
"2026-05-05","greenhouse gas emissions","Crossref/Annals of Critical Care","https://doi.org/10.21320/1818-474x-2026-2-31-40","INTRODUCTION: Acute massive blood loss is a critical condition associated with the loss of a significant volume of circulating blood, leading to hemorrhagic shock and multiorgan failure. In the setting of prehospital stage and scarce resources carrying out early and adequate intensive care may be impossible or significantly delayed. In these cases reduced oxygen delivery to tissues leads to severe ischemia, and cellular resistance to hypoxic damage becomes one of the key factors determining poor outcomes."
"2026-05-05","biodiversity loss","Crossref/Annals of Internal Medicine","https://doi.org/10.7326/annals-26-01727-im",""
"2026-05-05","biodiversity loss","Crossref/Annals of Surgery","https://doi.org/10.1097/sla.0000000000007080","Importance:Surgery often has lasting impacts on quality of life, which requires outcome measurement beyond 30 days. Even when long-term outcomes are measured, point-of-care risk calculators have not been developed for long-term outcomes. Objective:To develop a risk calculator for protracted recovery and loss of independence after surgery."
"2026-05-05","environmental change","Crossref/Applied Environmental Education & Communication","https://doi.org/10.1080/1533015x.2026.2659707",""
"2026-05-05","greenhouse gas emissions","Crossref/Applied Optics","https://doi.org/10.1364/ao.591618",""
"2026-05-05","environmental change","Crossref/Applied and Environmental Microbiology","https://doi.org/10.1128/aem.00286-26","ABSTRACT Airborne microscopic eukaryotes play important ecological roles, yet their temporal dynamics often appear stochastic and difficult to predict using concurrent meteorological variables. We conducted a high-resolution, 3-year survey of airborne fungi, protists, and metazoa in a temperate urban environment using quantitative PCR and amplicon sequencing. Seasonality varied markedly among groups: fungi and metazoa exhibited distinct annual cycles (peaking in late summer and winter, respectively), while protists displayed stochastic fluct..."
"2026-05-05","global warming","Crossref/Asian Journal of Pure and Applied Mathematics","https://doi.org/10.56557/ajpam/2026/v8i1278",""
"2026-05-05","drought","Crossref/Asian Research Journal of Current Science","https://doi.org/10.56557/arjocs/2026/v8i1171",""
"2026-05-05","biodiversity loss","Crossref/Astronomy & Astrophysics","https://doi.org/10.1051/0004-6361/202558658","The supermassive black hole (Sgr A*) in the Galactic center is surrounded by the S-star cluster consisting of young stars on eccentric orbits. Recently, the an S-star binary system, called D9, was found. Its detection was based on periodic emission in Brackettγ (Brγ)."
"2026-05-05","global warming","Crossref/Astronomy & Astrophysics","https://doi.org/10.1051/0004-6361/202658922","Diffuse gamma-ray emission is a key tracer of cosmic rays (CRs) in galaxies, encoding information about their transport, energetics, and interaction with the interstellar medium. Interpreting the Milky Way’s gamma-ray sky, however, remains challenging because the observed emission depends jointly on the CR distribution gas distribution, the position of the observer within the Galaxy. Using the Rhea suite of CR–magnetohydrodynamic (MHD) simulations of a Milky Way analog, we investigated how pion-decay gamma-ray emission varies with galactic e..."
"2026-05-05","air pollution","Crossref/Atmospheric Chemistry and Physics","https://doi.org/10.5194/acp-26-6015-2026","Abstract. Cloud morphological transitions strongly influence radiative effects and the regional radiation budget. Marine cold-air outbreaks (MCAOs) over the northwestern Atlantic feature such transitions."
"2026-05-05","climate change","Crossref/Atmospheric Chemistry and Physics","https://doi.org/10.5194/acp-26-5983-2026","Abstract. Aircraft emissions of nitrogen oxides (NOx= NO + NO2), aerosols, and aerosol precursors provide a non-negligible contribution to the climate impact of air traffic, and the uncertainty in their climate Effective Radiative Forcing (ERF) remains significant. This study presents results from a new model intercomparison of the impact of aircraft emissions involving five state-of-the-art global models including both tropospheric and stratospheric chemistry."
"2026-05-05","greenhouse gas emissions","Crossref/Atmospheric Chemistry and Physics","https://doi.org/10.5194/acp-26-5961-2026","Abstract. Mitigating anthropogenic methane emissions is widely recognized as an effective strategy to reduce near-term climate warming. Here, we use satellite observations from MethaneSAT (2024–2025) to characterize methane emissions from six oil and gas producing regions as a demonstration of MethaneSAT data capabilities."
"2026-05-05","greenhouse gas emissions","Crossref/Atmospheric Measurement Techniques","https://doi.org/10.5194/amt-19-2985-2026","Abstract. Formaldehyde (HCHO) is a ubiquitous atmospheric constituent, originating from primary emissions (natural and anthropogenic) and secondary production via the oxidation of volatile organic compounds (VOCs). In addition to being a regulated pollutant, HCHO is a key species used as a tracer of recent photochemical activity due to its short atmospheric lifetime and its role as a source of HOx radicals."
"2026-05-05","climate change","Crossref/Australian Journal of Mechanical Engineering","https://doi.org/10.1080/14484846.2026.2667120",""
"2026-05-05","climate change","Crossref/AЯGOS","https://doi.org/10.26034/fr.argos.2026.9756","The article explores classical theoretical debates on the routinization of authority. It departs from Max Weber’s sociology of power and his considerations on the routinization of charisma and discusses it in relation to Robert Michels’ concept of oligarchization and notions of institutionalization as a process of reciprocal typification in the Sociology of Knowledge. Based on a comparative discussion of the commonalities and differences of these approaches, I propose a working understanding for the empirical analysis of the routinization of..."
"2026-05-05","global warming","Crossref/BMC Global and Public Health","https://doi.org/10.1186/s44263-026-00268-9",NA
"2026-05-05","climate change","Crossref/BMJ","https://doi.org/10.1136/bmj.s620",""
"2026-05-05","drought","Crossref/Biogeosciences","https://doi.org/10.5194/bg-23-2985-2026","Abstract. Climate change-induced weather extremes are increasing the intensity and frequency of disturbance events, posing a major threat to forests globally. In Central Europe, hotter and drier summers, such as those during the 2018–2020 drought period, have led to widespread forest damage."
"2026-05-05","climate change","Crossref/Boletín de la Asociación de Geógrafos Españoles","https://doi.org/10.21138/bage.3705","This study examines the evolution of retail in Lisbon’s city centre over an extended timeframe. By contextualising these developments, the research offers a more comprehensive understanding of the city centre’s commercial transformation, particularly in response to tourism. The findings reveal significant variations among major commercial streets in both their composition and appeal, challenging the notion of uniform adaptation across the city centre."
"2026-05-05","biodiversity loss","Crossref/Brain","https://doi.org/10.1093/brain/awag163","AbstractBurst suppression (BS) is a highly stereotyped EEG pattern observed across a wide range of clinical contexts, from general anesthesia and postanoxic coma to neonatal encephalopathy. Despite its consistent appearance, BS comprises two distinct forms with markedly different implications. BS with identical bursts (IBS) is almost exclusively seen in patients with severe, irreversible encephalopathy and is consistently associated with poor neurological outcome."
"2026-05-05","climate change","Crossref/Buildings & Cities","https://doi.org/10.5334/bc.717","Climate-related urban risks are intensifying in Brazilian metropolitan areas, where socio-environmental inequalities and fragmented urbanisation shape uneven exposure and vulnerability. In Brazil, municipalities occupy a central place in responding to these risks within a federal legal framework that distributes responsibilities across multiple sectors and levels of government. This paper examines how key federal legal frameworks assign municipalities responsibilities related to the built environment and climate-risk governance, and what thi..."
"2026-05-05","climate extremes","Crossref/Bulletin of the American Meteorological Society","https://doi.org/10.1175/bams-d-25-0107.1","Abstract Severe convective storms were the costliest natural hazard globally in 2023, with hail as a major driver of economic losses. Single hail events regularly cause damage exceeding USD 4 billion in Europe (e.g. France 2022, Italy 2023)."
"2026-05-05","climate change","Crossref/Business Strategy and the Environment","https://doi.org/10.1002/bse.70898","ABSTRACTEven as world leaders emphasize the urgency of limiting global warming, a slow transition to a circular economy persists. While climate mitigation efforts focus on renewable energy and efficiency measures, addressing the 45% of emissions from product manufacturing remains critical. While previous research has focused on collaborative approaches like open innovation, other forms like open‐source hardware and open data remain understudied."
"2026-05-05","global warming","Crossref/Business Strategy and the Environment","https://doi.org/10.1002/bse.70971","ABSTRACT Although the circular economy ( CE ) is gaining popularity because of its propensity to optimise the sustainability of resources, few scholars have examined how this field has evolved in the Global South. Using bibliometric‐narrative analysis, our paper maps general and thematic trends of CE in the Global South using micro, meso, and macro level frameworks. Based on our dataset, retrieved from the WoS database, we found that the first reference to CE studies in the region emerged in 2007 and was largely focused on waste management a..."
"2026-05-05","global warming","Crossref/Business Strategy and the Environment","https://doi.org/10.1002/bse.70922","ABSTRACTThis manuscript presents an extensive examination of corporate sustainability reports from 340 firms included in the Forbes Global 2000, spanning a diverse array of industry sectors. The study investigates the relative significance of key drivers influencing sustainability strategies—specifically, institutional alignment, stakeholder engagement, and resource‐based advantages. Rather than assuming a single dominant strategic logic, the research recognizes that corporate sustainability strategies often represent combinations, shaped by..."
"2026-05-05","greenhouse gas emissions","Crossref/Business Strategy and the Environment","https://doi.org/10.1002/bse.70878","ABSTRACTThis study examines whether board networks influence corporate carbon emissions and the strategic pathways through which firms decarbonize. Using a sample of 1952 firms across 48 countries from 2003 to 2020, we employ dynamic stacked regressions that exploit exogenous carbon‐regulation shocks affecting firms connected through shared third‐party board memberships. We find that focal firms reduce absolute emissions by about 9%."
"2026-05-05","climate change","Crossref/CABI One Health","https://doi.org/10.1079/cabionehealth.2026.0012","AbstractBackground : Food security and nutrition are threatened globally due to climate change. The West African Sahel is particularly vulnerable to climate change given food systems that are highly dependent on rainfall and are currently complicated by significant governance and security challenges. The aim of this article is to propose a One Health framework that considers the complex interconnections within food systems in the Sahel using a systems thinking approach."
"2026-05-05","greenhouse gas emissions","Crossref/CIENCIA UNEMI","https://doi.org/10.29076/issn.2528-7737vol19iss51.2026pp1-14p","La acumulación de cadmio (Cd) en plantas de cacao representa una limitante crítica para la sostenibilidad productiva y la comercialización internacional del grano, lo que ha impulsado la búsqueda de estrategias agronómicas orientadas a reducir su biodisponibilidad en el suelo. Objetivo. Evaluar el efecto de enmiendas orgánicas y minerales sobre la acumulación y transferencia de Cd en plantas de cacao (Theobroma cacao L.) bajo condiciones controladas de invernadero."
"2026-05-05","global warming","Crossref/Cambridge Prisms: Global Mental Health","https://doi.org/10.1017/gmh.2026.10209",""
