"date","keyword","source","link","abstract"
"2026-04-01","Extrémy","Al Jazeera","https://www.aljazeera.com/news/2026/4/1/which-interests-being-served-by-war-irans-pezeshkian-asks-us-public?traffic_source=rss","In open letter, Iran's President Masoud Pezeshkian urges people in US to see beyond 'flood of distortions' as war rages."
"2026-04-01","Klimatická změna","Denik N","https://denikn.cz/2020449/prirode-je-jedno-jestli-jste-pravicak-nebo-levicak-klimaticka-zmena-se-proste-deje-rika-vedec-daniel-kortus/","„Fanoušci Motoristů mě nemají rádi, protože útočím na jejich modlu. Ale vůbec ne neprávem. Ve společnosti je silná nevraživost a lidem je jedno, jestli jim říkáte fakta, nebo ne,“ líčí ve Studiu N vědec Daniel Kortus, který na účtu Klimatomluva vyvrací mýty a dezinformace o klimatické změně."
"2026-04-01","Emise","Nature Climate","https://www.nature.com/articles/s41558-026-02597-x","Nature Climate Change, Published online: 01 April 2026; doi:10.1038/s41558-026-02597-xFood loss and waste (FLW) is often attributed to technoeconomic inefficiencies of food systems. However, using a mechanistic analysis framework, we show that food surplus and misconsumption accounted for 11% of global anthropogenic greenhouse gas emissions in 2021, exceeding FLW-associated emissions that are driven by technoeconomic constraints."
"2026-04-01","Klimatická změna","Nature Climate","https://www.nature.com/articles/s41558-026-02597-x","Nature Climate Change, Published online: 01 April 2026; doi:10.1038/s41558-026-02597-xFood loss and waste (FLW) is often attributed to technoeconomic inefficiencies of food systems. However, using a mechanistic analysis framework, we show that food surplus and misconsumption accounted for 11% of global anthropogenic greenhouse gas emissions in 2021, exceeding FLW-associated emissions that are driven by technoeconomic constraints."
"2026-04-01","Extrémy","OpenAlex","https://doaj.org/article/d210a1e000164f1ca451c5327a415831","Vegetation Growth Simulations of CLM5.0 in Southwest China under the 2009 -2010 Drought"
