"date","keyword","source","link","abstract"
"2026-04-30","Klimatická změna","OpenAlex","https://doi.org/10.5281/zenodo.19689850","Climate Change and Deliberative Democracy-Exploring Consciousness Among India's Youth"
"2026-04-30","Klimatická změna","OpenAlex","https://doi.org/10.5281/zenodo.19689851","Climate Change and Deliberative Democracy-Exploring Consciousness Among India's Youth"
"2026-04-30","Klimatická změna","OpenAlex","https://doi.org/10.5281/zenodo.19689953","Climate Change and Food Security: A Study of Agricultural Production Trends in Uttar Pradesh"
"2026-04-30","Klimatická změna","OpenAlex","https://doi.org/10.5281/zenodo.19689954","Climate Change and Food Security: A Study of Agricultural Production Trends in Uttar Pradesh"
"2026-04-30","Klimatická změna","OpenAlex","https://doi.org/10.5281/zenodo.19690073","Drowned Democracy: Climate change and the creation of urban vulnerability"
"2026-04-30","Klimatická změna","OpenAlex","https://doi.org/10.5281/zenodo.19690074","Drowned Democracy: Climate change and the creation of urban vulnerability"
"2026-04-30","Klimatická změna","OpenAlex","https://doi.org/10.5281/zenodo.19690398","Migration as Constrained Adaptation: Climate Change, Governance Failures, and Gendered Vulnerability in India"
"2026-04-30","Klimatická změna","OpenAlex","https://doi.org/10.5281/zenodo.19690399","Migration as Constrained Adaptation: Climate Change, Governance Failures, and Gendered Vulnerability in India"
"2026-04-30","Klimatická změna","OpenAlex","https://shs.hal.science/halshs-05405212","Connectez-vous pour contacter le contributeur Soumis le : lundi 8 décembre 2025-16:57:33 Dernière modification le : mardi 9 décembre 2025-03:17:34"
"2026-04-29","Extrémy","Al Jazeera","https://www.aljazeera.com/gallery/2026/4/29/iraqs-marshes-revived-long-awaited-rains-bring-life-back-to-wetlands?traffic_source=rss","Much-needed rain is bringing life back to the ancient ecosystem of the Huwaizah Marshes, after years of devastation."
"2026-04-29","Klimatická změna","BBC World","https://www.bbc.com/news/articles/cyv1zdey7pmo?at_medium=RSS&at_campaign=rss","Canada is weighing whether a year-round northern trade route to Europe from Churchill, Manitoba, is viable, as climate change speeds Arctic warming."
"2026-04-29","Extrémy","CT24","https://ct24.ceskatelevize.cz/clanek/pocasi/cesko-zasahlo-sucho-situace-se-jen-tak-nezlepsi-na-slovensku-je-jeste-hur-372891","Kvůli nedostatku srážek a stále vyšším teplotám se ve střední Evropě prohlubuje půdní sucho. Na některých místech už odborníci varují před závažnými dopady na zemědělství."
"2026-04-29","Extrémy","Denik N","https://denikn.cz/2050431/extremni-sucho-muze-brzy-zasahnout-vice-nez-polovinu-ceska-rika-zahradnicek/","Letošní duben je v Česku druhý nejsušší od roku 1961. Zima přitom nebyla tak bohatá na sníh, jak se často říkalo, připomíná klimatolog Pavel Zahradníček z Českého hydrometeorologického ústavu a ústavu Akademie věd ČR CzechGlobe. Voda chybí i tam, kde jí bývá dost, a rozhodující pro úrodu budou následující měsíce."
"2026-04-29","Extrémy","Nature Climate","https://www.nature.com/articles/s41558-026-02627-8","Nature Climate Change, Published online: 29 April 2026; doi:10.1038/s41558-026-02627-8Droughts and tropical cyclones are two well-known hazards that can interact in dynamic ways. Now, research shows that rainfall from tropical cyclones shortens and weakens droughts in coastal regions but not in a uniform way."
"2026-04-29","Klimatická změna","Nature Climate","https://www.nature.com/articles/s41558-026-02625-w","Nature Climate Change, Published online: 29 April 2026; doi:10.1038/s41558-026-02625-wFood security remains a major global challenge, which is only amplified by ongoing climate change. Here, I look back on a 2015 paper on climate change impacts on wheat and discuss subsequent research on agriculture and food security."
"2026-04-29","Klimatická změna","Nature Climate","https://www.nature.com/articles/s41558-026-02627-8","Nature Climate Change, Published online: 29 April 2026; doi:10.1038/s41558-026-02627-8Droughts and tropical cyclones are two well-known hazards that can interact in dynamic ways. Now, research shows that rainfall from tropical cyclones shortens and weakens droughts in coastal regions but not in a uniform way."
"2026-04-29","Extrémy","The Guardian World","https://www.theguardian.com/us-news/2026/apr/29/camp-mystic-texas-flood-apology","Tearful testimony details missed warnings and lack of plan as families oppose reopening of Texas campA director of Camp Mystic, the all-girls Christian camp in the Texas Hill Country where 25 campers and two counselors were killed in a flash flood last summer, has offered a tearful apology to victim’s families for the loss of life.“We tried our hardest that night. It wasn’t enough to save your daughters,” Edward Eastland said, at a joint Texas House and Senate committee panel in Austin investigating the deadly flooding. “I’m so sorry.” Conti..."
"2026-04-29","Emise","arXiv","https://arxiv.org/abs/2604.26408v1","Terahertz (THz) communication has emerged as a key enabler for sixth-generation (6G) networks, offering ultrawide bandwidths to support data-intensive applications such as holographic telepresence and immersive extended reality. Recent advances have enabled both electronics-based and photonics-based THz front-ends, each with distinct advantages and hardware limitations. While electronics-based solutions leverage mature semiconductor platforms, they suffer from amplified oscillator phase noise, frequency offsets, and nonlinearities introduced..."
"2026-04-29","Emise","arXiv","https://arxiv.org/abs/2604.26743v1","We report a detailed analysis of GAMA 376183, a powerful, heavily obscured active galactic nucleus (AGN) hosted by a low-mass galaxy ($M_\star \approx 10^{10}~M_{\odot}$) likely experiencing a galaxy merger. The source was initially identified due to its remarkably strong [Ne v] $\lambda3426$ emission, exhibiting a rest-frame equivalent width (EW) of $\approx 48$ A. We present $\sim100$ ks Nuclear Spectroscopic Telescope Array follow-up observations, confirming its heavily obscured nature with a column density (in $\mathrm{cm^{-2}}$) of $\lo..."
"2026-04-29","Emise","arXiv","https://arxiv.org/abs/2604.26571v1","Municipal solid waste incineration is increasingly central to urban waste management, yet its sustainability benefit depends on controlling carbon emissions and multiple air pollutants under highly heterogeneous operating conditions. Current data-driven models are often accurate within individual plants but are difficult to transfer across facilities, limiting their value for scalable emission-control strategies. Here we show that multi-site emission behaviour can be represented through transferable system-level structures when physical cons..."
"2026-04-29","Emise","arXiv","https://arxiv.org/abs/2604.26909v1","Long-range interactions between emitters give rise to collective phenomena, including superradiance, spin squeezing, and coherence protection, that are important to both fundamental physics and quantum technologies. Despite progress in cold atoms, coherent cavity-mediated all-to-all interactions have not yet been realized in a solid-state ensemble. Here we demonstrate such interactions in a $^{171}$Yb$^{3+}$:CaWO$_4$ crystal coupled to a microwave resonator, observing superradiant emission on resonance and unitary one-axis twisting dynamics ..."
"2026-04-29","Emise","arXiv","https://arxiv.org/abs/2604.26783v1","Using high-resolution data from the Chashan Broadband Solar radio spectrometer at meter wavelengths (CBSm) of the Chinese Meridian Project-Phase II (CMP-II), Li et al. (2025) identified a novel fine spectral structure of solar radio bursts, termed periodic beaded stripes, and proposed a generation mechanism. Here we report additional events and develop a quantitative method to determine the physical conditions in the emission region."
"2026-04-29","Emise","arXiv","https://arxiv.org/abs/2604.26539v1","The ICT sector has been one of the most successful and fastest-growing industry in history. While the environmental issue in this sector has mainly been addressed by assessing its footprint and, to a lesser extent, its avoided emissions or net impacts, the additional emissions from the digitalization of carbon-intensive activities, such as the Oil and Gas (O&G) sector, have rarely been discussed. By doing so, we have forgotten to count the own goals conceded over more than 20 years in the troubled relationship between the ICT and the O&G sec..."
"2026-04-29","Emise","arXiv","https://arxiv.org/abs/2604.26331v1","Several Lyman-alpha (Ly$α$) emitters deep into the reionization era exhibit double-peaked Ly$α$ emission profiles, raising the question of how the intergalactic medium can transmit photons blueward of the Ly$α$ resonance at such high redshifts. To investigate this, we compute Ly$α$ transmission along sightlines originating from galaxies in the Cosmic Dawn III simulation and identify cases that closely reproduce the observed double-peaked emission. In these cases, the sightlines intersect highly underdense voids located a few comoving megapar..."
"2026-04-29","Emise","arXiv","https://arxiv.org/abs/2604.26442v1","PSR J0437-4715 is a gamma-ray millisecond pulsar, which has been detected by Fermi-LAT. For understanding the nature, we analyze the GeV gamma-ray data obtained with Fermi-LAT around the pulsar region. Based on the pulsar timing ephemeris, we derived the gamma-ray pulse profile and defined on-pulse and off-pulse phase intervals."
"2026-04-29","Emise","arXiv","https://arxiv.org/abs/2604.26886v1","The 21cm emission line from neutral hydrogen (HI) contained within galaxies provides a way to make accurate spectroscopic redshift determinations in the radio part of the spectrum. Large radio arrays such as SKA-MID are coming online that will have the sensitivity and survey time required to catalogue hundreds of thousands to millions of HI galaxies, opening up the possibility of studying the cosmological large scale structure using this technique. The expected number counts and clustering properties of the galaxies are still quite poorly un..."
"2026-04-29","Emise","arXiv","https://arxiv.org/abs/2604.26773v1","The electron ionization predicted by the Migdal effect in dark matter-nucleus scattering enhances experimental sensitivity to sub-GeV dark matter. In this work, we demonstrate that lower-energy electron excitations provide a novel and promising pathway, enabling the detection of even lighter dark matter particles previously considered inaccessible for direct searches. Direct detection experiments employing a superfluid $^4$He target can exploit this channel by observing electronic excitations via UV-photon emission."
"2026-04-29","Emise","arXiv","https://arxiv.org/abs/2604.26745v1","Passive Gamma Emission Tomography (PGET) is an IAEA-approved technique for verifying spent nuclear fuel assemblies prior to geological disposal. Reconstructing the emission and attenuation maps from PGET measurements is a nonlinear ill-posed inverse problem, currently solved with a Levenberg-Marquardt (LM) scheme that requires 10-20 iterations to achieve sufficient accuracy. We propose an accelerated iterative solver that combines the LM algorithm with a Deep Gauss-Newton step, in which a learned operator refines the update proposed by the d..."
"2026-04-29","Emise","arXiv","https://arxiv.org/abs/2604.26702v1","We present the first detailed optical study of the cataclysmic variable SRGA J115215.0$-$510656, based on new time-resolved photometric and spectroscopic observations complemented by long-baseline Transiting Exoplanet Survey Satellite (TESS) data. The TESS light curve reveals deep, recurring eclipses consistent with a high-inclination geometry and an orbital period of 0.43567659(9)d. The eclipse morphology during outburst is consistent with a possible 'inside-out' type outburst and supports classification of the system as a U Gem-type dwarf ..."
"2026-04-29","Emise","arXiv","https://arxiv.org/abs/2604.26751v1","Ultrafast scintillators are indispensable for precise timing in high-energy physics and medical diagnostics. Fundamentally constrained by the trade-off between emission rate and light yield, conventional scintillators remain kinetically trapped in the sub-nanosecond regime, failing to break 50-picosecond limit. Here, we demonstrate a strategy to bypass this limitation by harnessing the coherent radiative acceleration in weakly confined CsPbCl3 perovskite nanocrystals to generate an ultrafast photon burst."
"2026-04-29","Emise","arXiv","https://arxiv.org/abs/2604.26911v1","JWST has shown a large diversity in warm Jupiter spectra, despite only small variations in the planetary parameters. However, the main driver of this diversity remains unclear. We aim to identify the mechanisms responsible for the spectral difference of three warm Jupiter-size exoplanets observed by JWST: whereas WASP-80b appears mostly cloud-free, both WASP-107b and WASP-69b have spectra dominated by clouds."
"2026-04-29","Emise","arXiv","https://arxiv.org/abs/2604.26253v1","We demonstrate that ultra-relativistic black hole encounters reveal a new regime of the two-body interaction in general relativity. Evolving equal-mass, nonspinning black holes with initial center-of-mass Lorentz factors up to $γ\approx 5.1$ using numerical relativity, we find that the resulting waveforms defy the standard expectation of a post-Newtonian description followed by a smooth transition to a prompt Kerr ringdown. Instead, at nonzero impact parameter, the system can exhibit prolonged, highly irregular emission and significant horiz..."
"2026-04-29","Extrémy","arXiv","https://arxiv.org/abs/2604.26359v1","We develop a unified statistical framework for attributing heatwaves as spatio-temporal phenomena under climate change. We quantify the impact of anthropogenic forcing on the probability and persistence of heatwaves not captured by standard marginal extreme-value approaches. Our methodology constructs a generative model for daily temperature fields that separates marginal nonstationarity from spatio-temporal dependence."
"2026-04-29","Extrémy","arXiv","https://arxiv.org/abs/2604.26303v1","Deep understanding of a field's soil moisture content is the leading indicator for predicting crop yields and making data driven decisions for irrigation and application of topical chemicals for drought resilience. Despite this importance, the cost of adopting and maintaining IoT infrastructure prevents modern farms from employing widespread real time soil moisture sensors. We present an end-to-end platform of buried battery-free sensor nodes and a mobile basestation that leverages the farmer's daily routine for data retrieval."
"2026-04-29","Klimatická změna","arXiv","https://arxiv.org/abs/2604.26359v1","We develop a unified statistical framework for attributing heatwaves as spatio-temporal phenomena under climate change. We quantify the impact of anthropogenic forcing on the probability and persistence of heatwaves not captured by standard marginal extreme-value approaches. Our methodology constructs a generative model for daily temperature fields that separates marginal nonstationarity from spatio-temporal dependence."
"2026-04-29","Klimatická změna","arXiv","https://arxiv.org/abs/2604.26776v1","Climate change necessitates rapid expansion of renewable energy, with wind energy offering a scalable and low-impact solution. However, accurate prediction of wind loads and power generation remains challenging due to uncertainties in wind shear and turbulence stresses under atmospheric boundary layer (ABL) conditions. High-fidelity Large Eddy Simulations (LES) are typically used to reduce these uncertainties but are computationally expensive and impractical for large-scale or real-time applications."
"2026-04-29","Klimatická změna","arXiv","https://arxiv.org/abs/2604.26594v1","Antarctic sea ice has undergone unprecedented changes in recent years, raising questions about how this key geophysical system is responding to climate change. Decades of slow expansion were replaced by a precipitous decline in 2014-2017, a subsequent apparent recovery, and a renewed collapse from 2022 to the present. We diagnosed sea ice concentration (SIC) from satellite observations with a hierarchical decomposition method based on Dynamic Mode Decomposition (DMD) that finds coherent spatiotemporal modes."
"2026-04-28","Klimatická změna","Nature Climate","https://www.nature.com/articles/s41558-026-02624-x","Nature Climate Change, Published online: 28 April 2026; doi:10.1038/s41558-026-02624-xIntegrating knowledge across climate risks, societal responses and their interactions is a critical yet persistently challenging goal. We argue that advanced artificial intelligence frameworks, specifically foundation models, offer a new opportunity to unify these domains and support climate decision-making."
"2026-04-28","Extrémy","Novinky","https://www.novinky.cz/clanek/domaci-zpravy-jihocesky-kraj-trebonskym-rybnikum-chybi-pres-20-procent-vody-sucho-je-nejvetsi-za-desitky-let-40575758","Takhle nízko byly hladiny vyhlášených třeboňských rybníků podle některých pamětníků kolem roku 1990. Chybí v nich přes dvacet procent vody. Podobné to bývá až v polovině léta a může to mít dopad na chov ryb i rekreaci."
"2026-04-28","Extrémy","Novinky","https://www.novinky.cz/clanek/pocasi-nezaprsi-silne-pudni-sucho-trapi-uz-polovinu-zeme-40575508","Až do konce týdne bude v Česku převládat slunečné počasí bez srážek. Dál se tak bude zhoršovat sucho, přičemž už nyní zasahuje minimálně výrazná forma téměř polovinu území. Od úterý navíc zesílí vítr, který ve vyschlé krajině opět zvýší riziko požárů."
"2026-04-28","Emise","OpenAlex","https://doi.org/10.21203/rs.3.rs-9533750/v1","Lifecycle Cost and Carbon Emission Analysis of Offshore Mechanical Systems – Comparing Traditional vs. Optimized Maintenance Approaches: Linking Cost Savings to CO₂ Reduction"
"2026-04-28","Emise","OpenAlex","https://doi.org/10.5194/acp-26-5747-2026","Long-term mercury isotope evidence for a shift toward background-dominated urban atmospheric mercury in North China under sustained emission controls"
"2026-04-28","Emise","OpenAlex","https://doi.org/10.5281/zenodo.19837475","Microplastics and Biodegradable Plastics as Hidden Amplifiers of Aquatic Greenhouse Gas Emissions: Mechanisms, Quantitative Evidence, and a Hazard-to-Forcing Framework"
"2026-04-28","Emise","OpenAlex","https://doi.org/10.5281/zenodo.19837476","Microplastics and Biodegradable Plastics as Hidden Amplifiers of Aquatic Greenhouse Gas Emissions: Mechanisms, Quantitative Evidence, and a Hazard-to-Forcing Framework"
"2026-04-28","Extrémy","OpenAlex","https://doi.org/10.5281/zenodo.19840304","A Cascaded Deep Learning Framework for Improved Forecasting of Drought-Flood Abrupt Alternation Events in the Hanjiang River Basin"
"2026-04-28","Extrémy","OpenAlex","https://doi.org/10.5281/zenodo.19840305","A Cascaded Deep Learning Framework for Improved Forecasting of Drought-Flood Abrupt Alternation Events in the Hanjiang River Basin"
"2026-04-28","Extrémy","OpenAlex","https://doi.org/10.9798/kosham.2026.26.2.53","A Machine Learning Approach to Predict Urban Flood Risk under Future Climate Change Scenarios: A Case Study of Jakarta, Indonesia"
"2026-04-28","Extrémy","OpenAlex","https://doi.org/10.5281/zenodo.19862963","Artificial intelligence for modelling coastal climate extremes"
"2026-04-28","Extrémy","OpenAlex","https://doi.org/10.5281/zenodo.19859507","cable13/Beetle-Drought-Prediction: Triggering webhook for Zenodo DOI generation"
"2026-04-28","Extrémy","OpenAlex","https://doi.org/10.5281/zenodo.19859508","cable13/Beetle-Drought-Prediction: Triggering webhook for Zenodo DOI generation"
"2026-04-28","Extrémy","OpenAlex","https://doi.org/10.5281/zenodo.19858957","CCART Number (v1.0): Climate Adjustment Factor for Flood Resilience Design — India"
"2026-04-28","Extrémy","OpenAlex","https://doi.org/10.5281/zenodo.19858958","CCART Number (v1.0): Climate Adjustment Factor for Flood Resilience Design — India"
"2026-04-28","Extrémy","OpenAlex","https://doi.org/10.5281/zenodo.19851080","Compounding extreme temperature, drought, flood events over European administrative regions"
"2026-04-28","Extrémy","OpenAlex","https://doi.org/10.5281/zenodo.19851081","Compounding extreme temperature, drought, flood events over European administrative regions"
"2026-04-28","Extrémy","OpenAlex","https://doi.org/10.5281/zenodo.19837801","Datasets underlying the publication of ""Understanding meteorological, runoff, and agricultural drought propagation and their influencing factors in an ensemble of multiple datasets"""
"2026-04-28","Extrémy","OpenAlex","https://doi.org/10.5281/zenodo.19837802","Datasets underlying the publication of ""Understanding meteorological, runoff, and agricultural drought propagation and their influencing factors in an ensemble of multiple datasets"""
"2026-04-28","Extrémy","OpenAlex","https://doi.org/10.9798/kosham.2026.26.2.157","Development and Evaluation of a Real-Time Flood Forecasting System Based on the K-series Integrated Modeling Framework in the Seomjin River Basin"
"2026-04-28","Extrémy","OpenAlex","https://doi.org/10.5281/zenodo.19842497","Flood Hazard Mapping and Risk Zoning in the Melamchi River Basin, Central Nepal"
"2026-04-28","Extrémy","OpenAlex","https://doi.org/10.5281/zenodo.19842498","Flood Hazard Mapping and Risk Zoning in the Melamchi River Basin, Central Nepal"
"2026-04-28","Extrémy","OpenAlex","https://doi.org/10.5281/zenodo.19861832","Flood Hazard Mapping and Risk Zoning in the Melamchi River Basin, Central Nepal"
"2026-04-28","Extrémy","OpenAlex","https://doi.org/10.9798/kosham.2026.26.2.23","Flood Risk Assessment at the Administrative District Level Based on SSP Scenarios"
"2026-04-28","Extrémy","OpenAlex","https://doi.org/10.12912/27197050/220342","Mapping flood susceptibility and settlement exposure using random forest for spatial planning in Barru regency"
"2026-04-28","Extrémy","OpenAlex","https://doi.org/10.26183/zy9a-b852","Regional flood frequency analysis: development of parameter regression techniques using a generalised extreme value distribution"
"2026-04-28","Extrémy","OpenAlex","https://doi.org/10.6084/m9.figshare.32111290","Sensing urban road inundation risk during extreme rainfall via a Vehicle-as-Flood-Gauge approach"
"2026-04-28","Extrémy","OpenAlex","https://doi.org/10.6084/m9.figshare.32111290.v1","Sensing urban road inundation risk during extreme rainfall via a Vehicle-as-Flood-Gauge approach"
"2026-04-28","Extrémy","OpenAlex","https://doi.org/10.5281/zenodo.19857125","shahoriarsarker-archive/Flood-Inundation-Mapping: Flood Inundation Mapping Code"
"2026-04-28","Extrémy","OpenAlex","https://doi.org/10.5281/zenodo.19857126","shahoriarsarker-archive/Flood-Inundation-Mapping: Flood Inundation Mapping Code"
"2026-04-28","Extrémy","OpenAlex","https://doi.org/10.5281/zenodo.19838100","Supplemental Materials for flood risk assessment and mitigation"
"2026-04-28","Extrémy","OpenAlex","https://doi.org/10.5281/zenodo.19838533","Supplemental Materials for flood risk assessment and mitigation"
"2026-04-28","Extrémy","OpenAlex","https://doi.org/10.14749/32113165","Surviving the dry spell: socio-economic, health, and adaptive challenges of drought in Muyexe village, South Africa"
"2026-04-28","Extrémy","OpenAlex","https://doi.org/10.21203/rs.3.rs-9531685/v1","The Dominant Role of Water Cycle Disruption in Regional Climate Extremes: A Quantitative Assessment Integrating Numerical Simulation and Urban Empirical Evidence"
"2026-04-28","Extrémy","OpenAlex","https://doi.org/10.21203/rs.3.rs-9345057/v1","Toward Climate Resilient Soybean Systems Global Review of Socioeconomic Constraints Genetic Mechanisms and Breeding Priorities under Drought Stress"
"2026-04-28","Extrémy","OpenAlex","https://doi.org/10.12912/27197050/220341","Urban sprawl, drainage inadequacy, and flood risk co-production in a semi-arid Algerian city: A diachronic geospatial and remote-sensing analysis of Khenchela (1985–2035)"
"2026-04-28","Klimatická změna","OpenAlex","https://doi.org/10.9798/kosham.2026.26.2.53","A Machine Learning Approach to Predict Urban Flood Risk under Future Climate Change Scenarios: A Case Study of Jakarta, Indonesia"
"2026-04-28","Klimatická změna","OpenAlex","https://doi.org/10.5281/zenodo.19854854","A Multimodal Approach to Heritage Preservation in the Context of Climate Change"
"2026-04-28","Klimatická změna","OpenAlex","https://doi.org/10.5281/zenodo.18599844","AMOC Tracking under Climate Change"
"2026-04-28","Klimatická změna","OpenAlex","https://doi.org/10.5281/zenodo.19853635","AMOC Tracking under Climate Change"
"2026-04-28","Klimatická změna","OpenAlex","https://doi.org/10.6084/m9.figshare.32112626","Building resilient and equitable farming practices to address food insecurity amid climate change in Sub-Saharan Africa: a scoping review"
"2026-04-28","Klimatická změna","OpenAlex","https://doi.org/10.6084/m9.figshare.32112626.v1","Building resilient and equitable farming practices to address food insecurity amid climate change in Sub-Saharan Africa: a scoping review"
"2026-04-28","Klimatická změna","OpenAlex","https://doi.org/10.6084/m9.figshare.32117635.v1","Climate Change & Class Actions"
"2026-04-28","Klimatická změna","OpenAlex","https://doi.org/10.5281/zenodo.19851844","Climate Change and Poverty: The Nexus Analysis of North East Nigeria"
"2026-04-28","Klimatická změna","OpenAlex","https://doi.org/10.5281/zenodo.19851845","Climate Change and Poverty: The Nexus Analysis of North East Nigeria"
