"date","keyword","source","link","abstract"
"2026-03-25","Emise","Crossref","https://doi.org/10.3389/fpubh.2026.1703400","BackgroundHearing loss and tinnitus in children are increasingly recognized as important public health concerns with potential long-term consequences for development and communication. The aim of this study was to determine the prevalence of hearing loss and tinnitus in children, and to examine the concordance between parental subjective assessments and otoacoustic emission (OAE) results. Secondary aims were to investigate the association between hearing loss and sociodemographic factors, parents’ level of education, and to evaluate the effe..."
"2026-03-25","Emise","Crossref","https://doi.org/10.21511/ee.17(1).2026.11","Type of the article: Research ArticleAbstractThis study examines the relationship between renewable energy consumption and economic growth in Morocco, while accounting for trade openness and CO₂ emissions per capita. Using annual data covering the period 1990–2024 and applying the Autoregressive Distributed Lag (ARDL) approach, the analysis captures both short-run dynamics and long-run relationships among the variables. The empirical results proved a long-term equilibrium relationship, as the bounds test rejects the null hypothesis of no coi..."
"2026-03-25","Emise","Crossref","https://doi.org/10.1002/ghg.70031","ABSTRACT Carbon capture, utilization, and storage (CCUS) is a key technology for enabling the large‐scale, low‐carbon utilization of fossil fuels. Scientific and rational source–sink matching is an important basis for site selection in CCUS cluster deployment projects. This study focuses on geological formations in North China, such as saline aquifers, coalfields, oil fields, and gas fields."
"2026-03-25","Emise","Crossref","https://doi.org/10.9734/ijecc/2026/v16i45365","In modern times, traditional farming methods are unsustainable and negatively impact the environment. Environmental deterioration mostly manifests as nutrient depletion in many emerging nations, which lowers the capacity for food production. Resource conservation technologies (RCTs) adoption and resource efficiency are challenges."
"2026-03-25","Emise","Crossref","https://doi.org/10.1051/0004-6361/202659501","The fate of massive stars during the latest stages of their evolution is highly dependent on their mass-loss rate and geometry. The geometry of the mass-loss process can be inferred from the shape of the circumstellar material, which has a significant influence on the evolution of massive stars (between 25 and 40 M_ i.e. type II SN progenitors."
"2026-03-25","Emise","Crossref","https://doi.org/10.1002/ghg.70029","ABSTRACT To mitigate the greenhouse effect, promoting the clean utilization of fossil fuels and advancing carbon capture, utilization, and storage (CCUS) technologies have become critical pathways. Among these approaches, CO 2 and CH 4 flooding, as key enhanced oil recovery (EOR) techniques, exhibit dual benefits in both emission reduction and production enhancement. In this study, molecular dynamics simulations are employed to systematically investigate the oil displacement behaviors of CO 2 and CH 4 in porous media reservoirs."
"2026-03-25","Emise","Crossref","https://doi.org/10.3389/fpls.2026.1774960","Background and aimsBiochar is a widely recognized amendment for augmenting crop productivity and mitigating greenhouse gas (GHG) emissions, particularly in degraded soil. However, optimal biochar rate and their mechanisms remain uncertain across different salinity severities. Methods To address this knowledge gap, a two crop seasons experiment was conducted from 2022 to 2023 on mildly (S1) and moderately (S2) saline soils, employing four biochar application rates: 0, 10, 20, and 40 t·ha -1 ."
"2026-03-25","Emise","Crossref","https://doi.org/10.70267/icsscs.20260110","As green development gradually gains momentum and global climate governance accelerates, pricing climate transition risks has become an important issue. Based on data from Chinese listed companies from 2010 to 2020, this paper constructs indicators for corporate carbon emission intensity and climate transition risk exposure. Using Fama-MacBeth regression and constructing carbon risk factors, it tests the existence of the “carbon premium” in the stock market and discusses its influencing factors and transmission mechanisms."
"2026-03-25","Emise","Crossref","https://doi.org/10.1057/s41599-026-06982-x",""
"2026-03-25","Emise","Crossref","https://doi.org/10.3390/su18073219","Climate change is radically altering the Earth’s natural ecosystems, with temperature/precipitation alterations resulting in mismatches between specific ecosystems and their ‘new’ climatic profiles. Without political action to curb greenhouse gas emissions, most plant/animal species will need to move to higher latitudes to ensure survival. Many are incapable of migrating rapidly and will thus be reliant on human intervention to relocate to new regions (assisted migration)."
"2026-03-25","Emise","Crossref","https://doi.org/10.1057/s41599-026-07027-z",""
"2026-03-25","Emise","Crossref","https://doi.org/10.1029/2025jd045035","Abstract Point sources are often major contributors of greenhouse gas and air pollutant emissions in urban areas. Dense air monitoring networks provide a unique avenue for studying point source emissions over long time periods. Here, we use the Berkeley Environmental Air‐quality and CO 2 Network (BEACO 2 N) to study CO 2 and air pollutant emissions from an oil refinery in the city of Richmond, CA."
"2026-03-25","Emise","Crossref","https://doi.org/10.1007/s40789-025-00857-3","Abstract Coal is crucial to China’s economic and social development. The two primary factors hindering the high-quality development of China’s coal industry are safety and emissions. Methane and coal spontaneous combustion have long posed major safety risks."
"2026-03-25","Emise","Crossref","https://doi.org/10.17645/oas.11583","Guandu Wetlands, an educational and research center in Taipei, provides conservation education for the public and university researchers. Mangroves within the wetlands deliver essential ecosystem services, socio-economic benefits, and play a critical role in mitigating rising CO₂ emissions. However, these ecosystems face threats from climate change and anthropogenic pressures."
"2026-03-25","Emise","Crossref","https://doi.org/10.3389/fenvs.2026.1783682","The National Forest City policy in China is inextricably linked to the country’s low-carbon development and its economic and social green transformation. In this paper, the policy is employed as a quasi-natural experiment to examine the impact of Forest City Construction (FCC) on carbon emission intensity. This paper uses the statistical yearbook data published on the official website of the government, based on the carbon emission intensity of 268 cities in China in the 19 years from 2003 to 2021, and uses the multi period double difference..."
"2026-03-25","Emise","Crossref","https://doi.org/10.1038/s44406-026-00020-0","AbstractSteel producers in the Global South face increasing pressure from trade and required emissions cuts. Renewable-rich regions could become key suppliers of low-carbon steel, but this vision remains conceptual and risks perpetuating extractivist patterns. Using the Global Energy System Model (GENeSYS-MOD), we assess technological, spatial and employment implications of South Africa’s steel transition."
"2026-03-25","Extrémy","Crossref","https://doi.org/10.3390/cli14040077","Botswana’s semi-arid climate makes it vulnerable to climate change, particularly drought, which threatens agricultural productivity. This study assesses drought impact on Botswana’s agricultural sector using Climate Hazards Center Infrared Precipitation with Station (CHIRPS) rainfall data and Climate Hazards Center Infrared Temperature with Station (CHIRTS) temperature data (25 km) to compute the Standardized Precipitation Index (SPI), Standardized Temperature Condition Index (STCI) and Standardized Precipitation Evapotranspiration Index (SP..."
"2026-03-25","Extrémy","Crossref","https://doi.org/10.53819/81018102t2550",""
"2026-03-25","Extrémy","Crossref","https://doi.org/10.1558/jsa.32963","This study examines local perceptions of the sky and climate in the semi-arid region of Coquimbo, northern Chile, based on interviews with individuals over 60 years old, including shepherds, former miners, artisans and farmers. It highlights that both the Sun and the Moon are considered responsible for the cycles of day and night, the seasons and climate changes. The planet Venus is also mentioned, identified both as the Morning Star and the Evening Star and associated with climate phenomena such as rain and drought."
"2026-03-25","Extrémy","Crossref","https://doi.org/10.1071/ma26108","Building climate resilience into ecosystem restoration is an adaptation priority for sustainable land management. A well-established approach to achieve this is climate-adjusted seed provenancing – sourcing a mix of local and non-local seeds from populations across a climatic gradient likely to be encountered in the future. However, this strategy has limits as terrestrial ecosystems comprise far more than their vegetation alone."
"2026-03-25","Extrémy","Crossref","https://doi.org/10.54740/ros.2026.011","Closed-basin lakes in semi-arid Mediterranean regions are critical indicators of hydroclimatic change. This study quantifies the dynamics of lake surface area (LSA) for six strategic Turkish lakes (Burdur, Salda, Yarisli, Karatas, Acigol, and Eber) from 2010 to 2024. Using multi-sensor satellite imagery (Landsat/Sentinel-2) and ERA5-Land climate data, we analyzed the impact of precipitation, evapotranspiration (ET0), and the SPEI-12 index."
"2026-03-25","Extrémy","Crossref","https://doi.org/10.1007/s11104-026-08510-x",""
"2026-03-25","Extrémy","Crossref","https://doi.org/10.51489/tuzal.1770170","Karst poljes are highly sensitive hydro-geomorphological systems where flooding poses persistent risks to agriculture and settlement. Their distinctive hydrological behavior and vulnerability demand systematic monitoring through remote sensing. However, flood mapping in poljes faces major challenges, including spectral confusion from reflective carbonate rocks, permanent water bodies, shadows, and the selection of appropriate thresholds."
"2026-03-25","Extrémy","Crossref","https://doi.org/10.3389/finmi.2026.1741397","Microbial biostimulants enhance crop resilience to drought and promote sustainable agricultural productivity. The present research aimed to elucidate the metabolomic variations induced by encapsulated microbial biostimulants for drought tolerance in groundnut. Two rhizobacterial strains, Acinetobacter calcoaceticus AC12 and Bacillus amyloliquefaciens BA13, were functionally tested for plant growth promoting attributes and osmolyte production under osmotic stress."
"2026-03-25","Extrémy","Crossref","https://doi.org/10.3897/jbgs.e177213","The Shared Socio-economic Pathways (SSPs) presented in the Sixth Assessment Report (AR6) of the Intergovernmental Panel on Climate Change (IPCC) indicate that increased variability and more frequent extremes in precipitation are expected to raise the risk of droughts and floods in South-Eastern Europe. According to climate projections, the potential increase in precipitation in the region is insignificant, while the rising temperatures and the associated increase in potential evapotranspiration may lead to a substantial intensification of dr..."
"2026-03-25","Extrémy","Crossref","https://doi.org/10.1038/s41598-026-42547-3",""
"2026-03-25","Extrémy","Crossref","https://doi.org/10.70382/tijbees.v11i4.074","The aim of this research was to determine the effectiveness of flood mitigation measures that have been implemented in order to build resilience against flood hazards in Amassoma in Bayelsa State, Nigeria. A descriptive survey method was used for the study. Questionnaires were administered to 364 respondents that were selected from Amassoma community."
"2026-03-25","Extrémy","Crossref","https://doi.org/10.1007/s10343-026-01317-x",""
"2026-03-25","Extrémy","Crossref","https://doi.org/10.1007/s44473-026-00129-1",""
"2026-03-25","Extrémy","Crossref","https://doi.org/10.62754/ais.v7i1.1325","In recent years, Turkey has become a place where loss of life and property due to natural disasters has increased. The rise in losses, particularly from floods, stems from construction in riverbeds and poor planning decisions. One of the most recent examples is the flood that occurred in the city center of Şanlıurfa, one of Turkey's major cities, on March 15, 2023, which resulted in the loss of 17 lives and material losses."
"2026-03-25","Extrémy","Crossref","https://doi.org/10.1071/wf25030","BackgroundWildfires can cause significant hydrologic impacts on watersheds. The immediate and long-term impacts of wildfires are especially concerning at the wildland–urban interface (WUI). AimThis research aims to combine multi-decadal observations and modeling in two high-elevation Arizona, USA, watersheds impacted by the 1977 Radio Fire and the 2019 Museum Fire to determine if heightened flood risk persists."
"2026-03-25","Extrémy","Crossref","https://doi.org/10.1007/s11600-026-01810-x",""
"2026-03-25","Extrémy","Crossref","https://doi.org/10.51489/tuzal.1789569","Floods, caused by the overflow of water from natural channels, are among the most destructive natural hazards, affecting human life, property, and ecosystems. Their impact is increasingly significant due to climate change and human-induced land use changes. This study aims to evaluate flood susceptibility in the Sarayköy district of Denizli province using spatial approaches and to compare the predictive performance of different modeling techniques."
"2026-03-25","Extrémy","Crossref","https://doi.org/10.1186/s40793-026-00878-8","AbstractBackground Improving drought tolerance of tree seedlings by plant growth-promoting microorganisms (PGPMs) is a promising approach for nature-based forest restoration. Identifying suitable microorganisms requires a robust selection, including efficient in planta screenings. Results We sampled at two forest sites in southern Germany with drought legacies and within a dry period to enhance the probability of isolating drought-tolerant microbes."
"2026-03-25","Extrémy","Crossref","https://doi.org/10.3390/w18070775","In 2024, the United States (US) and Mexico signed Minute 330, to address water scarcity in the Colorado River. Under Minute 330, Mexico committed to creating additional water savings through 2026, complementing conservation efforts by the US Lower Basin states during this period. In this paper, we examine the motivations behind Minute 330, its negotiations, and the state of its implementation to understand how it reflects the US–Mexico cooperative relationship amidst scarcity challenges in the basin."
"2026-03-25","Extrémy","Crossref","https://doi.org/10.1186/s12870-026-08625-4",""
"2026-03-25","Extrémy","Crossref","https://doi.org/10.1186/s40677-026-00378-4","AbstractFlooding is a significant natural hazard intensified by both human activities and environmental factors, posing risks to both ecological integrity and public safety. Effective flood susceptibility mapping (FSM) is essential for risk assessment and mitigation strategies. This study evaluates the performance of eight fuzzy logic operators within the fuzzy analytical hierarchy process (F_AHP) framework for assessing flood susceptibility in Koya, Iraq."
"2026-03-25","Extrémy","Crossref","https://doi.org/10.62754/ais.v7i1.1324","The number of natural disasters is increasing day by day due to climate change and pop-ulation growth. Disasters increase loss of life and property when city plans are prepared without sufficient consideration and land use decisions are made. In 2010, 2014 and 2021, floods in Antalya caused significant material losses in many districts."
"2026-03-25","Extrémy","Crossref","https://doi.org/10.3390/su18073220","Drought is a complex natural hazard with severe impacts on ecosystems, agriculture, water resources, and socio-economic stability. Understanding its spatiotemporal evolution is critical for effective drought monitoring and prevention. This study analyzed drought characteristics in Henan province from 1961 to 2023 using the Standardized Precipitation Evapotranspiration Index (SPEI), calculated from daily meteorological data at 111 meteorological stations."
"2026-03-25","Extrémy","Crossref","https://doi.org/10.1080/19475705.2026.2649445",""
"2026-03-25","Extrémy","Crossref","https://doi.org/10.1007/s40899-026-01345-5",""
"2026-03-25","Extrémy","Crossref","https://doi.org/10.5194/nhess-26-1515-2026","Abstract. Drought impact forecasting is essential for enhancing preparedness and mitigation strategies. However, identifying key predictors and achieving reliable predictions remains challenging."
"2026-03-25","Klimatická změna","Crossref","https://doi.org/10.3389/fpubh.2026.1769017","BackgroundThe direct and indirect health consequences of climate change are increasingly becoming evident. To address the critical public health challenges posed by climate change, medical and health professions students need to be equipped with relevant skills, and institutions are adopting initiatives to integrate climate education. This narrative review aimed to explore implemented interventions for incorporating climate change and health education into medical and health professions training."
"2026-03-25","Klimatická změna","Crossref","https://doi.org/10.9734/ijecc/2026/v16i45361","Agriculture is both impacted by climate change and a means of mitigation. Agricultural biodiversity enhances soil health, productivity, resilience, and food security, making diversified farming systems important for adapting to climate change and supporting sustainable agriculture. The present study was undertaken to assess plant species diversity within farming systems across selected districts of Kerala, analyse spatial variations in biodiversity, and examine its implications for climate-resilient and carbon-neutral agriculture."
"2026-03-25","Klimatická změna","Crossref","https://doi.org/10.3390/cli14040077","Botswana’s semi-arid climate makes it vulnerable to climate change, particularly drought, which threatens agricultural productivity. This study assesses drought impact on Botswana’s agricultural sector using Climate Hazards Center Infrared Precipitation with Station (CHIRPS) rainfall data and Climate Hazards Center Infrared Temperature with Station (CHIRTS) temperature data (25 km) to compute the Standardized Precipitation Index (SPI), Standardized Temperature Condition Index (STCI) and Standardized Precipitation Evapotranspiration Index (SP..."
"2026-03-25","Klimatická změna","Crossref","https://doi.org/10.1558/jsa.32963","This study examines local perceptions of the sky and climate in the semi-arid region of Coquimbo, northern Chile, based on interviews with individuals over 60 years old, including shepherds, former miners, artisans and farmers. It highlights that both the Sun and the Moon are considered responsible for the cycles of day and night, the seasons and climate changes. The planet Venus is also mentioned, identified both as the Morning Star and the Evening Star and associated with climate phenomena such as rain and drought."
"2026-03-25","Klimatická změna","Crossref","https://doi.org/10.1002/tie.70109","ABSTRACTGreen entrepreneurship is a potent force in constructing a more sustainable future. Green entrepreneurs can drive breakthrough ideas, encourage the creation of sustainable businesses, and foster sustainable development through advocating sustainable behaviors and technology. This study addresses Climate Change and Environmental Issues, adding to the recent wave of research on green entrepreneurship."
"2026-03-25","Klimatická změna","Crossref","https://doi.org/10.1007/s00484-026-03171-y",""
"2026-03-25","Klimatická změna","Crossref","https://doi.org/10.1088/1748-9326/ae5727","AbstractRenewable energy sources play a major role in future net-zero energy systems. However, achieving energy system resilience remains challenging, since renewables strongly depend on weather fluctuations, and future energy systems are subject to major design uncertainty. Existing literature mostly treats these types of uncertainty separately."
"2026-03-25","Klimatická změna","Crossref","https://doi.org/10.9734/ijecc/2026/v16i45360","Climate change has emerged as a major driver of agro-ecological instability, influencing temperature regimes, atmospheric carbon dioxide concentrations, precipitation patterns, and the frequency of extreme climatic events. This review aims to synthesize current knowledge on the impacts of climate change on sericulture, with particular emphasis on mulberry physiology, silkworm biology, and the vulnerability of non-mulberry silk ecosystems in Northeast India. These environmental changes pose significant challenges to sericulture, a climate-sen..."
"2026-03-25","Klimatická změna","Crossref","https://doi.org/10.1007/s10499-026-02483-5",""
"2026-03-25","Klimatická změna","Crossref","https://doi.org/10.70096/tssr.260402039","Energy security and climate change have become major global issues, especially for developing nations like India where environmental concerns and growing energy demand coexist. This study looks at how renewable energy can help with these issues, concentrating on obstacles to its growth at the regional level. India has made great strides in increasing its capacity for renewable energy, but it still faces several challenges, such as financial limitations, inconsistent policies and regulations, infrastructure constraints, technical capacity gap..."
"2026-03-25","Klimatická změna","Crossref","https://doi.org/10.1056/nejmx250020",""
"2026-03-25","Klimatická změna","Crossref","https://doi.org/10.1111/fog.70039","ABSTRACTCephalopods are commercially valuable invertebrates with short lifespans and rapid responsiveness to climate change, making them sensitive indicators of ecosystem dynamics. In recent decades, they have become the primary target species in the East China Sea (ECS) fishery following declines in demersal fish catches. Investigating the relationship between cephalopod populations and environmental factors enables researchers to characterize the ecological conditions conducive to their proliferation."
"2026-03-25","Klimatická změna","Crossref","https://doi.org/10.3390/land15040532","Vegetation restoration in water-limited regions typically increases evapotranspiration (ET) while reducing runoff. Over the past four decades, Daihai Lake in China’s northwest inland river basin has experienced significant shrinkage. Previous studies attribute this primarily to climate change and water resource exploitation, yet the impact of vegetation dynamics remains insufficiently examined."
"2026-03-25","Klimatická změna","Crossref","https://doi.org/10.3897/jbgs.e177213","The Shared Socio-economic Pathways (SSPs) presented in the Sixth Assessment Report (AR6) of the Intergovernmental Panel on Climate Change (IPCC) indicate that increased variability and more frequent extremes in precipitation are expected to raise the risk of droughts and floods in South-Eastern Europe. According to climate projections, the potential increase in precipitation in the region is insignificant, while the rising temperatures and the associated increase in potential evapotranspiration may lead to a substantial intensification of dr..."
"2026-03-25","Klimatická změna","Crossref","https://doi.org/10.1038/s41598-026-42547-3",""
"2026-03-25","Klimatická změna","Crossref","https://doi.org/10.3389/fanim.2026.1822588",""
"2026-03-25","Klimatická změna","Crossref","https://doi.org/10.1142/s0219877026500045","Climate change is a critical global challenge with significant implications for the environment, economy, and society. In response, governments worldwide have implemented various policies aimed at mitigating its effects. This article investigates why some countries are more innovative than others by examining the role of institutionalization of climate change mitigation policy on technological innovation."
"2026-03-25","Klimatická změna","Crossref","https://doi.org/10.1007/s12595-026-00612-9",""
"2026-03-25","Klimatická změna","Crossref","https://doi.org/10.15295/bmij.v14i1.2691","This study aims to identify and prioritise the challenges and facilitators that affect hospital resilience in the face of climate change. The study utilised the Fuzzy Analytic Hierarchy Process (AHP) method. First, challenges and facilitators were identified through a comprehensive literature review."
"2026-03-25","Klimatická změna","Crossref","https://doi.org/10.1007/s42690-026-01837-z",""
"2026-03-25","Klimatická změna","Crossref","https://doi.org/10.3390/ani16071007","Reducing enteric methane emissions from ruminants has emerged as a critical environmental priority in the face of global climate change, given the substantial contribution of methane to agricultural greenhouse gas outputs. This study evaluated the potential of spearmint essential oil (SEO) to reduce methane production and enhance energy utilization efficiency using an in vitro rumen fermentation system. The experiment comprised a control (CON, no additive), three SEO doses (L-SEO: 100 mg/L; M-SEO: 200 mg/L; H-SEO: 400 mg/L), and a commercial..."
