"date","keyword","source","link","abstract"
"2026-04-02","Klimatická změna","Crossref/International Journal of Environment and Climate Change","https://doi.org/10.9734/ijecc/2026/v16i45382","Harmful Algal Blooms (HABs) represent a critical environmental, public health, and socio-economic challenge for freshwater ecosystems across India. Driven primarily by anthropogenic nutrient loading, climate change, and altered hydrological regimes, the proliferation of toxic phytoplankton, particularly cyanobacteria, severely degrades lake water quality. This comprehensive analysis explores the multifaceted causes, profound ecological impacts, and localized management strategies for HABs in the context of Indian lakes, such as Dal Lake, Vem..."
"2026-04-02","Klimatická změna","Crossref/International Journal of Environment and Climate Change","https://doi.org/10.9734/ijecc/2026/v16i45383","In several developing countries, the quest for food sovereignty has sparked considerable interest at the local and regional levels. Food production is heavily dependent on traditional rain-fed agriculture, which is highly sensitive to climatic fluctuations. Understanding climatic cycles in relation to production systems and water resource availability is now the subject of a well-established consensus."
"2026-04-02","Emise","Crossref/International Journal of Sustainability in Higher Education","https://doi.org/10.1108/ijshe-01-2025-0010","PurposeEducation, in general, and higher education institutions, in particular, play a crucial role in driving the societal changes needed to address the climate crisis. While growing, there is still relatively little research on the inclusion of climate change in higher education, either within or across institutions, including in relation to education policy. Design/methodology/approachHigher education policies from all 50 US states and Washington D.C."
"2026-04-02","Klimatická změna","Crossref/International Journal of Sustainability in Higher Education","https://doi.org/10.1108/ijshe-01-2025-0010","PurposeEducation, in general, and higher education institutions, in particular, play a crucial role in driving the societal changes needed to address the climate crisis. While growing, there is still relatively little research on the inclusion of climate change in higher education, either within or across institutions, including in relation to education policy. Design/methodology/approachHigher education policies from all 50 US states and Washington D.C."
"2026-04-02","Extrémy","Crossref/International Research Journal of Modernization in Engineering Technology & Science","https://doi.org/10.56726/irjmets92756",NA
"2026-04-02","Klimatická změna","Crossref/JAAD Reviews","https://doi.org/10.1016/j.jdrv.2026.03.009",NA
"2026-04-02","Extrémy","Crossref/Journal of Agronomy and Crop Science","https://doi.org/10.1111/jac.70181","ABSTRACTClarifying the variation patterns of extreme climate events during crop growing period has important implications for mitigating agricultural disaster risks. However, previous studies have usually relied on fixed crop growing dates, without considering warming‐induced phenological responses. Moreover, the large‐scale climate driving mechanisms of climate extremes during crop growing period remain inconclusive."
"2026-04-02","Emise","Crossref/Journal of Animal Science","https://doi.org/10.1093/jas/skag057.035","AbstractGreenhouse gas (GHG) emissions from livestock production systems are a significant component of agricultural emissions, prompting interest in management strategies that may mitigate their impact. Grazing lands represent a substantial portion of the U.S. agricultural landscape and contribute significantly to carbon cycling and methane emissions."
"2026-04-02","Extrémy","Crossref/Journal of Animal Science","https://doi.org/10.1093/jas/skag057.040","AbstractThe Southern Great Plains is a major producer of crop and livestock commodities. However, the region is renowned for its variable weather patterns, making it more vulnerable to climate change. Variable environmental conditions, such as increased temperature, altered rainfall, and amplified wind velocity are expected to have the greatest effect on plant and animal production in the future."
"2026-04-02","Klimatická změna","Crossref/Journal of Animal Science","https://doi.org/10.1093/jas/skag057.040","AbstractThe Southern Great Plains is a major producer of crop and livestock commodities. However, the region is renowned for its variable weather patterns, making it more vulnerable to climate change. Variable environmental conditions, such as increased temperature, altered rainfall, and amplified wind velocity are expected to have the greatest effect on plant and animal production in the future."
"2026-04-02","Klimatická změna","Crossref/Journal of Earth System Science","https://doi.org/10.1007/s12040-026-02765-9",NA
"2026-04-02","Klimatická změna","Crossref/Journal of Micropalaeontology","https://doi.org/10.5194/jm-45-219-2026","Abstract. Further strengthening the multidisciplinary stratigraphic and paleo-environmental analysis of the Global Stratotype Section and Point (GSSP) Bartonian–Priabonian boundary of the Alano di Piave section (NE Italy), here, we present a data report of a highly resolved, quantitative marine palynological study emphasizing organic walled dinoflagellate cysts (dinocysts). The ensuing dataset is interpreted in an exploratory sense through empirical paleo-ecological grouping and spectral analysis."
"2026-04-02","Emise","Crossref/Journal of the Air & Waste Management Association","https://doi.org/10.1080/10962247.2026.2635085",NA
"2026-04-02","Emise","Crossref/Journal of the American Chemical Society","https://doi.org/10.1021/jacs.6c02654",NA
"2026-04-02","Klimatická změna","Crossref/Land","https://doi.org/10.3390/land15040584","As one of the most serious challenges in the 21st century, climate change poses a major threat to global grain production, especially in agricultural and populous countries such as China. This study employs the Vegetation Photosynthesis Model (VPM) and Geographically and Temporally Weighted Regression (GTWR) model to systematically quantify and analyze the spatio-temporal heterogeneous responses of three major crop yields (rice, maize, and wheat) to climate change from 2000 to 2018 in China. The results are as follows."
"2026-04-02","Klimatická změna","Crossref/Management Theory and Studies for Rural Business and Infrastructure Development","https://doi.org/10.15544/mts.2026.01",NA
"2026-04-02","Klimatická změna","Crossref/Molecular Ecology","https://doi.org/10.1111/mec.70309","ABSTRACTIn response to potentially stressful conditions, for example due to climate change, organisms can move, adjust through phenotypic plasticity and evolve. Evolution can act on mean trait values, or on plasticity itself. Whether phenotypic plasticity, evolution, or evolution of plasticity is the dominant response to environmental change is still subject to debate."
"2026-04-02","Extrémy","Crossref/Natural Hazards","https://doi.org/10.1007/s11069-026-08078-w","AbstractFlooding is a destructive natural hazard that is exacerbating due to climate change, causing significant socio-economic losses. Flood inundation models are critical tools in the mitigation and management of such hazards. Conventional standalone process-based models can be limited in real-time applications due to their computational intensity and the trade-off between accuracy, resolution and speed."
"2026-04-02","Extrémy","Crossref/Natural Hazards","https://doi.org/10.1007/s11069-026-08105-w",NA
"2026-04-02","Klimatická změna","Crossref/Natural Hazards","https://doi.org/10.1007/s11069-026-08078-w","AbstractFlooding is a destructive natural hazard that is exacerbating due to climate change, causing significant socio-economic losses. Flood inundation models are critical tools in the mitigation and management of such hazards. Conventional standalone process-based models can be limited in real-time applications due to their computational intensity and the trade-off between accuracy, resolution and speed."
"2026-04-02","Extrémy","Crossref/New Phytologist","https://doi.org/10.1111/nph.71105","SummaryPlants can escape drought by completing life cycles early, tolerate drought by increasing physiological limits, or avoid drought stress by obtaining or using water more efficiently. It remains unclear whether strategies vary within species across their distributional ranges due to trade‐offs, and whether species can exhibit plasticity in multiple traits simultaneously. We grew 19 populations of Eschscholzia californica collected along an aridity gradient in a glasshouse with high or low water, then applied a terminal drought treatment..."
"2026-04-02","Extrémy","Crossref/New Phytologist","https://doi.org/10.1111/nph.71132","SummaryIn northern China's tea plantations – where extreme drought is uncommon – subtle yet persistent mild drought increasingly shapes tea yield and quality. However, how tea plants link mild drought‐induced secondary metabolite accumulation to drought tolerance remains unknown. By integrating RNA‐seq analysis with functional validation and regulatory network characterization of CsTCP14b, we demonstrate that this transcription factor promotes flavonol biosynthesis, thereby enhancing reactive oxygen species (ROS) scavenging and conferring ea..."
"2026-04-02","Extrémy","Crossref/PLOS One","https://doi.org/10.1371/journal.pone.0344624","Soybean, a crucial source of protein and oil, faces significant yield reductions due to water stress, particularly at the flowering and pod-filling stages. This study evaluated 150 accessions from the Soybean Breeding Program of the International Institute of Tropical Agriculture (IITA) in Ibadan, Nigeria, under both well-watered and water-stressed conditions across two growing seasons using a multi-trait selection. Intermittent water stress was imposed at critical reproductive stages (35 and 63 DAS).Significant genetic variation (p < 0.001)..."
"2026-04-02","Extrémy","Crossref/Plant Cell Reports","https://doi.org/10.1007/s00299-026-03786-w",NA
"2026-04-02","Extrémy","Crossref/Plant Physiology and Biochemistry","https://doi.org/10.1016/j.plaphy.2026.111269",NA
"2026-04-02","Extrémy","Crossref/Plant Physiology and Biochemistry","https://doi.org/10.1016/j.plaphy.2026.111249",NA
"2026-04-02","Extrémy","Crossref/Plant and Soil","https://doi.org/10.1007/s11104-026-08422-w","AbstractAimsThe American bison is often recognized as an ecological engineer because their grazing and wallowing behavior increases plant diversity and productivity. These disturbances increase spatial heterogeneity and can alter plant nutrient and water dynamics. We assessed how bison grazing and wallowing affect grass chemistry and physiology, and whether grass evolutionary legacies mediate species-specific responses."
"2026-04-02","Extrémy","Crossref/Plants","https://doi.org/10.3390/plants15071093","Granule-bound starch synthase (GBSS) is primarily recognized for its role in amylose production and starch granule formation in plant plastids. While its biochemical function in storage organs has been well documented, its broader contribution to plant growth and stress adaptation remains less defined. To explore these aspects, the maize gene ZmGBSS1 was ectopically expressed in Arabidopsis thaliana and its physiological effects were examined."
"2026-04-02","Emise","Crossref/Polish Journal of Environmental Studies: Politics, Economics and Industry","https://doi.org/10.15244/peai/218181","Provincial-level carbon reduction policies in China are pivotal to achieving the national goals of carbon peaking and carbon neutrality. Understanding the spatiotemporal characteristics and influencing factors of provincial carbon emissions is essential for formulating and implementing effective emission reduction strategies. This study employs multi-source remote sensing data and selects Liaoning Province, a region with representative carbon emissions, as the research area."
"2026-04-02","Emise","Crossref/Potato Research","https://doi.org/10.1007/s11540-026-10015-0",NA
"2026-04-02","Extrémy","Crossref/Progress in Disaster Science","https://doi.org/10.1016/j.pdisas.2026.100566",NA
"2026-04-02","Klimatická změna","Crossref/Quarterly Journal of the Royal Meteorological Society","https://doi.org/10.1002/qj.70167","AbstractThe present study investigates several factors related to the assimilation of surface‐sensitive radiance observations over land from the Advanced Microwave Sounding Unit‐A within a non‐cycling one‐dimensional Ensemble‐Variational (1D‐EnVar) framework, with the aim of informing future improvements to numerical weather prediction (NWP) at Environment and Climate Change Canada (ECCC). These observations are currently not assimilated in ECCC's operational systems, since it requires accurate knowledge of both surface emissivity and skin t..."
"2026-04-02","Extrémy","Crossref/Regional Environmental Change","https://doi.org/10.1007/s10113-026-02578-y","AbstractThe 2023 drought in the Amazon triggered overlapping socioecological impacts across diverse riverine settings. We integrate hydrological indicators, remote sensing-based surface water mapping and media documented testimonies from communities in the Lower Amazon region to examine how environmental context mediates vulnerability. Communities were grouped into six hydro-geomorphic types across major river and floodplain environments."
"2026-04-02","Klimatická změna","Crossref/Regional Environmental Change","https://doi.org/10.1007/s10113-026-02575-1","Abstract Small-scale fisheries play a key socioeconomic role in coastal systems, supporting livelihoods and providing essential marine ecosystem services. This role has been maintained and has evolved over time into a diverse portfolio of fishing techniques known as métiers , sustained through local ecological knowledge. But nowadays, climate change heavily threatens this fishing sector, compromising local knowledge and the well-being of the communities that rely on it."
"2026-04-02","Extrémy","Crossref/Risks","https://doi.org/10.3390/risks14040082","Like other agricultural products, food legumes production faces uncertainty risks stemming from climate change, which may affect yields and consequently impact farmers’ livelihoods. Agricultural insurance serves as one of the climate change adaptation measures available to farmers, helping mitigate the impacts of climate change on agricultural production and livelihoods. While considerable attention has been paid to climate change adaptation through production-side measures, comparatively fewer micro level studies examine insurance adoption ..."
"2026-04-02","Klimatická změna","Crossref/Risks","https://doi.org/10.3390/risks14040082","Like other agricultural products, food legumes production faces uncertainty risks stemming from climate change, which may affect yields and consequently impact farmers’ livelihoods. Agricultural insurance serves as one of the climate change adaptation measures available to farmers, helping mitigate the impacts of climate change on agricultural production and livelihoods. While considerable attention has been paid to climate change adaptation through production-side measures, comparatively fewer micro level studies examine insurance adoption ..."
"2026-04-02","Emise","Crossref/SOIL","https://doi.org/10.5194/soil-12-371-2026","Abstract. A plant's development is strongly linked to the water and carbon (C) flows in the soil-plant-atmosphere continuum. Ongoing climate shifts will alter the water and C cycles and affect plant phenotypes."
"2026-04-02","Extrémy","Crossref/SOIL","https://doi.org/10.5194/soil-12-371-2026","Abstract. A plant's development is strongly linked to the water and carbon (C) flows in the soil-plant-atmosphere continuum. Ongoing climate shifts will alter the water and C cycles and affect plant phenotypes."
"2026-04-02","Extrémy","Crossref/Scientific Reports","https://doi.org/10.1038/s41598-026-40456-z",NA
"2026-04-02","Klimatická změna","Crossref/Scientific Reports","https://doi.org/10.1038/s41598-026-45849-8",NA
"2026-04-02","Emise","Crossref/Sensors","https://doi.org/10.3390/s26072205","Abandoned oil and gas wells pose significant risks to human health and the environment by emitting air pollutants, contaminating groundwater, and leaving behind hazardous debris. In the United States, approximately 3.9 million documented wells vary widely in the accuracy of their recorded locations and plugging status, creating major challenges for detection, mapping, and remediation. Existing well detection methods show some promise but often lose effectiveness under complex conditions, such as vegetation occlusion or construction without m..."
"2026-04-02","Klimatická změna","Crossref/Structure and Infrastructure Engineering","https://doi.org/10.1080/15732479.2026.2647030",NA
"2026-04-02","Emise","Crossref/Sustainability","https://doi.org/10.3390/su18073496","This study addresses the challenge of designing low-carbon supply chain pathways in the global seaborne metallurgical coal sector by developing an enhanced Ant Colony Optimisation (ACO) algorithm. This quantitative approach bridges operations research and sustainability science by identifying optimal supply pathways to minimise transportation-related carbon emissions. The enhanced framework incorporates coal-specific maritime logistical constraints and maintains Pareto efficiency across a comprehensive global dataset encompassing 201 mines, ..."
"2026-04-02","Emise","Crossref/Sustainability","https://doi.org/10.3390/su18073481","The limited existing studies elucidate the significant contribution of open dumpsites to greenhouse gas emissions in Sri Lanka and underscore the necessity of improved waste management practices. Considering this, this study formulates and implements a scenario-based transition framework to assess the potential for reducing greenhouse gas emissions by diverting biodegradable waste in a semi-urban governance setting in Sri Lanka, which is marked by data limitations and operational challenges. This study concludes that the environmental feasib..."
"2026-04-02","Emise","Crossref/Sustainability","https://doi.org/10.3390/su18073478","Achieving sustainability requires that energy transition generates measurable environmental benefits beyond the power sector, yet it remains unclear whether renewable electricity expansion is associated with lower waste sector methane intensity, a major source of short-lived climate forcing. Using a global country–year panel and two-way fixed effects, we examine whether this relationship, and its sustainability implications, varies with development stage, institutional quality, and waste system characteristics. We find no robust inverted-U E..."
"2026-04-02","Emise","Crossref/Sustainability","https://doi.org/10.3390/su18073484","New energy vehicle promotion (NEVP) is of great significance for the green and low carbon development of urban transportation. Based on the panel data of new energy vehicle sales, carbon emissions, and air quality in Chengdu, China, from 2014 to 2024, this paper employs multiple linear regression, distributed lag and multiple mediation pathway models to empirically examine the environmental benefits of NEVP. A heterogeneity analysis is also conducted by integrating the distribution of charging stations across urban circles."
"2026-04-02","Extrémy","Crossref/Sustainability","https://doi.org/10.3390/su18073482","Projected climate change indicates that drought intensity will increase across much of the Global South, intensifying water stress in semi-arid regions. In Botswana, rising temperatures and increasingly variable rainfall are exacerbating drought conditions, particularly for livestock-based systems that depend on reliable grazing and water resources. This study was conducted in the Lake Ngami basin, Botswana, a predominantly pastoral community, to examine the adaptation and resilience of pastoralists to drought and climate change."
"2026-04-02","Klimatická změna","Crossref/Sustainability","https://doi.org/10.3390/su18073482","Projected climate change indicates that drought intensity will increase across much of the Global South, intensifying water stress in semi-arid regions. In Botswana, rising temperatures and increasingly variable rainfall are exacerbating drought conditions, particularly for livestock-based systems that depend on reliable grazing and water resources. This study was conducted in the Lake Ngami basin, Botswana, a predominantly pastoral community, to examine the adaptation and resilience of pastoralists to drought and climate change."
"2026-04-02","Klimatická změna","Crossref/Sustainability","https://doi.org/10.3390/su18073454","Southern Europe is a climate change hotspot, with rising temperatures threatening the region’s tourism industry. While existing research has focused on supply-side adaptations and macro-level demand shifts, this study examines the demand side—tourist experience and adaptive behaviors at the micro-experiential level, with implications for broader discussions of resilience and adaptive capacity. The study analyzed 6466 TripAdvisor reviews from 11 open-air heritage sites in Italy, Greece, Spain, and Malta, linking reviews to site-relative therm..."
"2026-04-02","Extrémy","Crossref/Sustainability in Environment","https://doi.org/10.22158/se.v11n2p171","Using the temperature vegetation dryness index (TVDI), Sen’s slope estimation, and the Mann-Kendall test, this study analyzed the spatiotemporal characteristics and trends of drought in the Pearl River Basin from 2001 to 2023, and examined the influences of temperature and precipitation on TVDI. The results indicated that the average TVDI over the study period was 0.6607, with a standard deviation of 0.0186, reflecting a general state of moderate drought and a significant downward trend in drought severity. On average, the proportions of are..."
"2026-04-02","Klimatická změna","Crossref/Sustainable Development","https://doi.org/10.1002/sd.71020","ABSTRACTClimate change is one of the most profound ethical and existential challenges of the 21st century. Beyond its physical, economic, and environmental consequences, it raises fundamental moral questions about justice, equity, responsibility, and the right to a livable planet. This study provides a comprehensive review of literature published between 1990 and 2025 to examine how ethical reasoning and moral frameworks have shaped global, national, and local responses to the climate crisis."
"2026-04-02","Klimatická změna","Crossref/THE SCIENTIFIC ISSUES OF TERNOPIL VOLODYMYR HNATIUK NATIONAL PEDAGOGICAL UNIVERSITY. SERIES: GEOGRAPHY","https://doi.org/10.25128/2519-4577.26.1.5","Introduction. Setting objectives. The article provides a comparative analysis of the regional manifestations of climate change between 2014 and 2023, as well as their potential impact on landscape complexes of nature conservation areas of the Volyn region: the Cheremsky Nature Reserve and the Shatsky National Park."
"2026-04-02","Klimatická změna","Crossref/THE SCIENTIFIC ISSUES OF TERNOPIL VOLODYMYR HNATIUK NATIONAL PEDAGOGICAL UNIVERSITY. SERIES: GEOGRAPHY","https://doi.org/10.25128/2519-4577.26.1.16","The purpose of the work is assess of geoecological parameters and optimisation of land use structure of the Buchach municipal territorial community. During the study, special methods were used to determine the anthropogenic load, coefficients of ecological stability and anthropogenic transformation of the Buchach municipal community. Buchach municipal territorial community is located in the west of the Ternopil Region, Chortkiv district, covering an area of 524.2 km²."
"2026-04-02","Klimatická změna","Crossref/Transnational Legal Theory","https://doi.org/10.1080/20414005.2026.2650936",NA
"2026-04-02","Extrémy","Crossref/Vegetos","https://doi.org/10.1007/s42535-026-01646-2",NA
"2026-04-02","Extrémy","Crossref/Water","https://doi.org/10.3390/w18070858","Understanding the spatiotemporal streamflow patterns under future climate scenarios is critical for sustainable water resource management in large river basins. This study applied the Soil and Water Assessment Tool (SWAT), forced by five downscaled and bias-corrected CMIP6 global climate models, to evaluate historical (2008–2024) and future (2025–2049) streamflow patterns in the Missouri River Basin in the continental United States. Model calibration and validation were satisfactory, with NSE > 0.5, KGE ≥ 0.5, R2 > 0.5, and PBIAS within ±25%..."
"2026-04-02","Extrémy","Crossref/World","https://doi.org/10.3390/world7040058","This paper examines the impacts of climate-related hazards on water, sanitation, and hygiene (WASH) access and practices in rural Cambodia using a Vulnerability–Exposure–Adaptive Capacity (VEAC) framework. Drawing on survey data with 423 households and 96 local authorities across five climate-vulnerable provinces in rural Cambodia, the study integrates household experiences with perspectives from village, commune, and district authorities responsible for local WASH planning and service delivery. The analysis distinguishes exposure to floods ..."
"2026-04-02","Emise","Crossref/npj Clean Air","https://doi.org/10.1038/s44407-026-00061-w","AbstractAir pollution has emerged as a major public health challenge worldwide. Numerical simulations and single-site machine-learning approaches in air quality forecasting faced multiple limitations. It is urgent to develop a low-cost, efficient air quality forecasting model."
