"date","keyword","source","link","abstract"
"2026-03-27","Extrémy","Crossref/Forests","https://doi.org/10.3390/f17040420","Forest plantations, including those of Norway spruce, are increasingly threatened by drought in Central Europe. One of the measures understating this threat might be the use of drought-mitigative additives at planting. The effects of induced water limitation and the application of hydrogel Agrisorb and commercial ectomycorrhizal fungi (EMF) inoculum Ectovit on the development of 2 + 1 spruce seedlings were estimated in this study."
"2026-03-27","Extrémy","Crossref/Forests","https://doi.org/10.3390/f17040424","For the western Patagonia region (Argentina), climate change models predict a 1–3 °C increase in temperature and a 10%–30% reduction in precipitation. Patagonia native forests are home to a variety of soil fungi, including ectomycorrhizal fungi (EcM), which play a crucial role in drought-tolerant trees. However, the responses of soil fungi to changes in rainfall remain poorly understood."
"2026-03-27","Extrémy","Crossref/Forests","https://doi.org/10.3390/f17040422","Global climate change is reshaping Central European conifer forests, affecting growth and ecosystem dynamics. At the same time, tree species differ in their productivity and responses to climatic conditions. Across mid-elevation monocultures of European yew (Taxus baccata L.), Norway spruce (Picea abies [L.] Karst.), Scots pine (Pinus sylvestris L.), silver fir (Abies alba Mill.), and European larch (Larix decidua Mill.), we quantified stand structure, volume, biomass carbon sequestration, and growth–climate responses (1971–2023)."
"2026-03-27","Globální změna","Crossref/Frontiers in Earth Science","https://doi.org/10.3389/feart.2026.1728644","The Middle Jurassic represents a typical greenhouse climate period in Earth’s history, during which global carbon cycle perturbations and climatic events left significant records in continental strata. This study investigates the extremely thick coal seam of the Middle Jurassic Xishanyao Formation in the Wucaiwan mining area, Zhundong coalfield, Xinjiang, China. Through integrated coal petrological, geochemical, palynological, and organic geochemical analyses, combined with paleowildfire indicators, it aims to reconstruct the paleoenvironmen..."
"2026-03-27","Klimatická změna","Crossref/Frontiers in Environmental Science","https://doi.org/10.3389/fenvs.2026.1662390","Various strategies have been proposed to enhance the adaptive capacity to climate change. The majority of studies evaluating adaptive capacity have focused on the provincial level, with relatively fewer studies conducted at the municipal or sub-municipal levels. Also, much of the research tends to concentrate on specific aspects of climate change impacts."
"2026-03-27","Emise","Crossref/Frontiers in Plant Science","https://doi.org/10.3389/fpls.2026.1811299","IntroductionClimate change is expected to intensify temperature and precipitation variability in Mediterranean regions, creating uncertainty for soybean production. Methods In this study, the DSSAT-CROPGRO-Soybean model was run with three global climate models under two emission pathways (RCP 4.5 and RCP 8.5) across three future time periods: near-future (2016–2040), mid-century (2041–2070), and late-century (2071–2098). Bias correction significantly enhanced the reliability of climate inputs by reducing systematic temperature deviations and..."
"2026-03-27","Extrémy","Crossref/Frontiers in Plant Science","https://doi.org/10.3389/fpls.2026.1757730","IntroductionUnderstanding grapevine responses to water deficit and rewatering is essential for developing adaptive strategies to mitigate the negative impacts of climate change in Mediterranean viticulture. Methods This study evaluated the ecophysiological and biochemical behaviour of two emblematic Douro cultivars, Touriga Franca (TF) and Tinto Cão (TC), subjected to contrasting water regimes under potted controlled conditions. Physiological measurements of gas exchange, chlorophyll a fluorescence, relative water content (RWC), and leaf bio..."
"2026-03-27","Klimatická změna","Crossref/Frontiers in Plant Science","https://doi.org/10.3389/fpls.2026.1811299","IntroductionClimate change is expected to intensify temperature and precipitation variability in Mediterranean regions, creating uncertainty for soybean production. Methods In this study, the DSSAT-CROPGRO-Soybean model was run with three global climate models under two emission pathways (RCP 4.5 and RCP 8.5) across three future time periods: near-future (2016–2040), mid-century (2041–2070), and late-century (2071–2098). Bias correction significantly enhanced the reliability of climate inputs by reducing systematic temperature deviations and..."
"2026-03-27","Extrémy","Crossref/Geographies","https://doi.org/10.3390/geographies6020036","This study examines the propagation from meteorological to hydrological drought across representative river basins in Bulgaria, focusing on temporal and spatial characteristics of the process. Monthly precipitation and streamflow data for 1964–2023 were used to calculate the Standardized Precipitation Index (SPI-1 to SPI-12) and the Streamflow Drought Index (SDI-1). The results indicate an increase in drought frequency and severity during 1994–2023 compared to 1964–1993, particularly at longer accumulation scales (SPI-6 to SPI-12)."
"2026-03-27","Klimatická změna","Crossref/Geography and water resources","https://doi.org/10.55764/2957-9856/2026-1-97-107.9","The article presents the results of a study of the impact of climate change and large-scale atmospheric circulation processes on the level regime of the southern Caspian Sea. Based on an analysis of data from meteorological stations in Iran and Turkmenistan for the period 1961–2024, stable trends in air temperature increase and water balance transformation in the region have been identified. Particular attention is paid to the correlation analysis of the relationship between sea level and circulation patterns according to the Wangenheim-Girs..."
"2026-03-27","Extrémy","Crossref/Geological Society of America Bulletin","https://doi.org/10.1130/b38361.1","Drought events seriously impact our society, yet the occurrence and evolution of extreme drought events, and the underlying mechanisms for them, remain largely unknown in ancient times. Here, we present a suite of novel microbial lipid-based proxy records from the Chinese Loess Plateau, spanning the past 700 k.y., which reveal two contrasting drought regimes associated with distinct climatic backgrounds before and after the Mid-Brunhes Event (MBE, ca. 430 ka)."
"2026-03-27","Emise","Crossref/Greenhouse Gases: Science and Technology","https://doi.org/10.1002/ghg.70020","ABSTRACT The global food system accounts for roughly 25%–30% of total greenhouse gas (GHG) emissions. Without emission estimates, it is difficult to identify major sources of emissions as well as monitor the progress towards climate goals such as the Paris Agreement, net‐zero emissions and Carbon Credit. The rapidly evolving food system of India is contributing significantly to national GHG emissions; nevertheless, a comprehensive understanding of emissions across the food life cycle is still limited."
"2026-03-27","Extrémy","Crossref/Hydrological Processes","https://doi.org/10.1002/hyp.70494","ABSTRACTUnderstanding the complex interactions between different types of droughts is essential for effective drought prevention and disaster management. This study employed the extended convergent cross mapping (CCM) algorithm to analyse the interactions between meteorological drought (standardised precipitation index), soil drought (standardised soil moisture index), vegetation drought (standardised normalised difference vegetation index), and groundwater drought (standardised groundwater index) in the middle reach of the Heihe River Basin..."
"2026-03-27","Klimatická změna","Crossref/Hydrology and Earth System Sciences","https://doi.org/10.5194/hess-30-1607-2026","Abstract. The distinct hydrogeological configurations of karst terrains engender fundamentally divergent baseflow regimes compared with non-karst systems. However, there is still some uncertainty in the understanding of baseflow in global karst regions due to the variability of methods and differences in natural conditions in different regions."
"2026-03-27","Klimatická změna","Crossref/IFLA Journal","https://doi.org/10.1177/03400352261424417","Climate change education (CCE) is widely recognized as essential for sustainable development and resilience, yet the role of school information specialists remains underexplored. This study examines how information specialists in Omani school learning-resource centres support climate change literacy within the national context of Oman Vision 2040 and sustainability initiatives in basic education. Using a convergent mixed-methods design, it surveyed and collected open-ended responses from 22 information specialists in boys’ and girls’ schools..."
"2026-03-27","Extrémy","Crossref/Indian Journal of Public Administration","https://doi.org/10.1177/00195561261433670","Climate change is a major threat to the global community. Extreme weather causes loss of human life, damages infrastructure and the economy, and degrades the environment. Its repercussions are evident across countries."
"2026-03-27","Extrémy","Crossref/International Journal For Multidisciplinary Research","https://doi.org/10.36948/ijfmr.2026.v08i02.72522","Floods are one of the most frequently occurring natural disasters, causing massive damage to property, agriculture, economy, and human life. Accurate and timely flood prediction remains a major challenge due to the dynamic and nonlinear interactions of hydrological variables such as rainfall intensity, river discharge, soil moisture, and seasonal climate changes. This paper proposes an enhanced Flood Forecasting Model (FFM) that integrates Federated Learning with multiple deep learning architectures to predict flood events while preserving d..."
"2026-03-27","Klimatická změna","Crossref/International Journal of Environment and Geoinformatics","https://doi.org/10.26650/ijegeo.1795567","Global climate change is widely recognized as a largely irreversible process driven predominantly by anthropogenic activities. This phenomenon, which poses particularly severe threats to plant species, necessitates the identification of potential changes in species’ suitable habitats in order to develop effective preventive and adaptive strategies. In this study, potential changes in the suitable habitats of Prunus laurocerasus L.—a species of considerable importance for agricultural, landscaping, and forestry practices in Türkiye—were asses..."
"2026-03-27","Extrémy","Crossref/International Surgery Journal","https://doi.org/10.18203/2349-2902.isj20260859","Flood syndrome is a rare but serious complication of advanced liver disease, defined by spontaneous rupture of an umbilical hernia with sudden leakage of ascitic fluid. Chronic ascites increases intra-abdominal pressure, weakening the abdominal wall and predisposing to hernia formation. Skin ulceration or necrosis over the hernia sac may indicate impending rupture."
"2026-03-27","Extrémy","Crossref/JAWRA Journal of the American Water Resources Association","https://doi.org/10.1111/1752-1688.70107","ABSTRACTFlood mapping is critical for flood forecasting, preparedness, and risk management. In the United States, multiple federal agencies and organizations generate or archive flood inundation maps (FIM) using diverse models, data sources, and standards. The National Water Center (NWC) currently provides the only national‐scale operational FIM through its Height above nearest drainage (HAND) ‐based workflow; however, most other authoritative flood datasets remain isolated and underutilized due to inherent discrepancies in models, formats, ..."
"2026-03-27","Extrémy","Crossref/Journal of Climate","https://doi.org/10.1175/jcli-d-25-0381.1","AbstractMonsoon Low-Pressure Systems (LPS) are significant rain-bearing storms during the Indian summer monsoon, yet their impact on the interannual variation of Indian Summer Monsoon Rainfall (ISMR) remains uncertain. This study revisits the relationship between LPS and ISMR variations and extreme rainfall events, emphasizing the role of LPS-generated rainfall. A strong correlation is observed between LPS-generated rainfall and ISMR variations; years with an excess of ISMR correspond to increased LPS-induced rainfall, whereas years with a d..."
"2026-03-27","Emise","Crossref/Kastamonu University Journal of Forestry Faculty","https://doi.org/10.17475/kastorman.1916841","Aim of study: This study examines the impact of forest area expansion on greenhouse gas (GHG) emissions in Türkiye, focusing on the roles of industrial production, energy consumption, and economic growth.Area of study: The analysis covers Türkiye using annual data for the period 1990–2021. Data on GHG emissions, forest areas, industrial production, energy consumption, and economic growth were obtained from the Turkish Statistical Institute (TurkStat) and other official sources.Material and method: The study employs the autoregressive distrib..."
"2026-03-27","Klimatická změna","Crossref/Limnetica","https://doi.org/10.23818/limn.45.22","Understanding how climate change and human activity affect fragile mountain ecosystems is key to managing these environments under future climate scenarios, including global warming and increased aridity. Paleoecological records provide long-term insights into how ecosystems responded to past climate shifts and human impacts, especially during warm and/or dry phases. We present a multiproxy study of wetland sediments from the Sierra Nevada, southern Spain, using biotic (pollen, charcoal, biomarkers, chironomids, cladocerans) and abiotic (phy..."
"2026-03-27","Klimatická změna","Crossref/Medicine","https://doi.org/10.1097/md.0000000000048165","Climate change is increasingly recognized as a major global health threat, disproportionately affecting vulnerable populations such as pregnant women. However, limited research has examined its psychological impacts on this group. This study aimed to examine whether higher climate change awareness is associated with increased symptoms of depression, anxiety, and stress among pregnant women in Türkiye."
"2026-03-27","Klimatická změna","Crossref/Microbiology Research","https://doi.org/10.3390/microbiolres17040067","Climate change is intensifying winters in temperate regions, posing a serious threat to Apis mellifera health. The gut microbiome, a distinct community of core bacterial species, is central to overwintering success by supporting immune function, nutrient assimilation, and pathogen resistance, but is highly sensitive to environmental stressors such as cold temperatures and dietary shifts. Stress-induced perturbations can reshape the composition and relative abundance of the gut microbiome in honey bees, leading to adverse effects on host heal..."
"2026-03-27","Extrémy","Crossref/Microorganisms","https://doi.org/10.3390/microorganisms14040747","Drought is a major constraint on crop productivity, and microbial inoculants are increasingly explored to mitigate plant water stress. However, most inoculant discovery pipelines rely on trait-based screening performed outside the ecological context in which beneficial plant-microbe interactions naturally arise. In natural soils, drought-exposed plants can reshape the rhizosphere environment by altering carbon allocation and root exudation, thereby selectively recruiting microorganisms compatible with water-limited conditions and effectively..."
"2026-03-27","Emise","Crossref/Millennial Asia","https://doi.org/10.1177/09763996261427523","Environmental sustainability is a central concern in rapidly developing regions. This article investigates dynamic interactions among PM 2.5 , economic growth, trade, international tourism expenditures and air cargo transport for emerging Asian economies over the period 1990–2023. Using panel data methods with variance decomposition, we show that PM 2.5 is predominantly self-driven in the short run but increasingly shaped by external macroeconomic and sectoral forces over time."
"2026-03-27","Extrémy","Crossref/Nature Sustainability","https://doi.org/10.1038/s41893-026-01793-z","AbstractFire is a key process in tropical dry woodlands and savannahs, shaping their vegetation and ecological functioning. Yet, fires in these systems are increasingly a major sustainability concern, causing carbon emissions, biodiversity losses and human health impacts. Land-use change can lead to fewer fires (for example, through fire suppression) or more fires (for example, fires used for pasture management or land clearing), and climate change amplifies fire dynamics through hotter and drier conditions."
"2026-03-27","Extrémy","Crossref/PLOS Climate","https://doi.org/10.1371/journal.pclm.0000882","Increasing high temperatures, severe drought, altered rainfall patterns, and floods weaken essential infrastructure and services, increase risk of diseases, and disrupt women’s access to antenatal care. In Kenya, 2024 was the hottest on record with above normal rainfall, resulting in prolonged flooding. This paper describes the influence of adverse weather patterns on access to antenatal care in Kisumu and Migori Counties, adjacent to Lake Victoria."
"2026-03-27","Klimatická změna","Crossref/PLOS Climate","https://doi.org/10.1371/journal.pclm.0000712","Approximately 16 per cent of the global population lives with a disability, and an important proportion resides in low- and middle-income countries (LMICs), and present higher levels of poverty. Guatemala, classified as a middle-income country, is among the poorest nations in Latin America. It faces the challenges of climate change, including extreme weather events, which may disproportionately affect people with disabilities."
"2026-03-27","Klimatická změna","Crossref/PLOS Climate","https://doi.org/10.1371/journal.pclm.0000882","Increasing high temperatures, severe drought, altered rainfall patterns, and floods weaken essential infrastructure and services, increase risk of diseases, and disrupt women’s access to antenatal care. In Kenya, 2024 was the hottest on record with above normal rainfall, resulting in prolonged flooding. This paper describes the influence of adverse weather patterns on access to antenatal care in Kisumu and Migori Counties, adjacent to Lake Victoria."
"2026-03-27","Klimatická změna","Crossref/PLOS Global Public Health","https://doi.org/10.1371/journal.pgph.0006190","Climate change is increasingly recognized as a contextual determinant of health in low- and middle-income countries (LMICs). Climate-related stressors such as water scarcity and food insecurity may influence oral health indirectly by disrupting hygiene practices, dietary patterns, and access to care. However, epidemiological evidence examining these relationships remains limited, particularly in resource-limited settings."
"2026-03-27","Extrémy","Crossref/Remote Sensing","https://doi.org/10.3390/rs18070996","Frequent flash floods threaten human well-being, hydropower infrastructure, and ecosystems. However, the long-term evolution of flash flood patterns over recent decades remains insufficiently understood, particularly in data-scarce high-altitude regions. Using multi-source remote sensing data integrated with historical disaster records and field investigations, this study examined the spatiotemporal evolution and driving factors of flash floods across the Qinghai–Tibet Plateau (QTP)."
"2026-03-27","Klimatická změna","Crossref/Space and Culture, India","https://doi.org/10.20896/ddhd0k55","Climate change poses a significant challenge to human civilisation, and human activities continue in accelerate it. Yet, the traditionalist view of security is not ready to reformulate its military and state-centric approaches, which are confined mainly to the sovereignty, integrity, and cohesion of the nation. However, climate change can lead to multi-dimensional security threats ranging from mass migration, poverty, sectarian conflicts, xenophobia and collateral damage across nations and boundaries."
"2026-03-27","Emise","Crossref/Sustainability","https://doi.org/10.3390/su18073277","The sustainability of the wine sector depends on primary production practices and on the adaptability of plant material to climate change. This study evaluates the carbon footprint and technical efficiency of four grape varieties in Paionia using an integrated Life Cycle Assessment and Data Envelopment Analysis framework. A cradle-to-gate approach was adopted, with system boundaries extending from input production to harvest, and functional units of kg CO2e/ha to capture input intensity and kg CO2e/kg grape to assess product-level environmen..."
"2026-03-27","Extrémy","Crossref/Sustainability","https://doi.org/10.3390/su18073266","This study explores how demystifying Earth Observation (EO) through co-creation pathways and local language can enhance flood resilience and environmental governance in African informal cities. Using case studies from Maiduguri and Hadejia, Nigeria, the research employed a transdisciplinary mixed-methods design combining rapid evidence assessment, surveys, participatory workshops (n = 50 stakeholders) integrating simplified Sentinel-1/2 demonstrations, indigenous knowledge mapping, and pre-/post-engagement surveys on EO familiarity. Non-expe..."
"2026-03-27","Extrémy","Crossref/Sustainability","https://doi.org/10.3390/su18073288","The study presents a comprehensive spatio-temporal assessment of meteorological drought in the Upper Vistula basin, a region located in southern Poland. The analysis was based on monthly precipitation data from 30 meteorological stations covering the period 1961–2022. These data were used to calculate the Standardized Precipitation Index (SPI) for accumulation periods of 3, 6, 9, 12, 24, and 48 months."
"2026-03-27","Extrémy","Crossref/Water","https://doi.org/10.3390/w18070792","Climate change is expected to impact rainfall amount, seasonality, and dry/wet patterns, with direct implications for rainwater harvesting systems. This study aims to quantify how future rainfall may affect rainwater harvesting systems across Brazil by combining multi-model climate projections with a daily water balance model. A single-family social housing archetype (60 m2 roof area; four occupants; 150 L/day/person; non-potable demand equal to 30% of total demand) was simulated for 652 Brazilian cities, using bias-corrected daily rainfall ..."
"2026-03-27","Klimatická změna","Crossref/Water","https://doi.org/10.3390/w18070793","The FAO Irrigation and Drainage Paper 56, which was first published in 1998, has been widely recognized as a comprehensive guidebook for estimating crop evapotranspiration and calculating crop water requirements under various conditions, supporting the efficient management of water resources in agriculture. Over the past twenty-eight years, science and technology have significantly evolved in agricultural productivity and water resource mobilization, use, and management, as well as in research advances, data availability and management, and ..."
"2026-03-27","Klimatická změna","Crossref/Water","https://doi.org/10.3390/w18070792","Climate change is expected to impact rainfall amount, seasonality, and dry/wet patterns, with direct implications for rainwater harvesting systems. This study aims to quantify how future rainfall may affect rainwater harvesting systems across Brazil by combining multi-model climate projections with a daily water balance model. A single-family social housing archetype (60 m2 roof area; four occupants; 150 L/day/person; non-potable demand equal to 30% of total demand) was simulated for 652 Brazilian cities, using bias-corrected daily rainfall ..."
"2026-03-27","Emise","Crossref/npj Biodiversity","https://doi.org/10.1038/s44185-026-00123-y","AbstractClimate change is driving a global redistribution of marine biodiversity. As habitats shift, oceanographic connectivity (the transport of dispersive stages via ocean currents) becomes a critical, yet poorly understood, factor that can either facilitate or hinder species’ expansions into new areas. To quantify this influence, we developed a framework linking species distribution models with biophysical connectivity models to examine the redistribution of 467 marine forest species (seagrasses and brown macroalgae) under end-of-century ..."
"2026-03-26","Emise","Crossref/Aerospace","https://doi.org/10.3390/aerospace13040312","In order to provide an innovative form of urban air mobility, a new and versatile generation of small, highly automated aircraft is currently being developed. This is made feasible by the development of new technologies such as electrified powertrains, Vertical Take-Off and Landing capabilities and distributed propulsion systems. The operation of these novel aircraft types will generate a new source of air traffic noise."
"2026-03-26","Klimatická změna","Crossref/African Journal of Environment and Natural Science Research","https://doi.org/10.52589/ajensr-5hjrotyh","Climate change is a significant threat to pastoralism in East Africa, particularly in South Sudan, where rising temperatures and increasingly frequent extreme weather events such as prolonged droughts and severe floods have disrupted traditional livelihood systems. Increased g rainfall variability has made it difficult for pastoralists to predict seasonal patterns, undermining livestock production, worsening food insecurity, and intensifying socio-economic vulnerabilities. This study examines the impacts of climate change on pastoralist live..."
