"date","keyword","source","link","abstract"
"2026-03-26","Klimatická změna","Crossref/American Ethnologist","https://doi.org/10.1111/amet.70080","AbstractIn recent years, Berlin has emerged as an epicenter of climate activism in Germany. There, a range of groups have mobilized in opposition to the role of the German state and the EU in accelerating the climate crisis. Many activists now see conventional political responses as exhausted and have turned to increasingly radical forms of civil disobedience."
"2026-03-26","Emise","Crossref/Anadolu Üniversitesi İktisadi ve İdari Bilimler Fakültesi Dergisi","https://doi.org/10.53443/anadoluibfd.1723273","Reducing greenhouse gas emissions has become a critical global challenge, with growing attention in recent years. Transportation is a major contributor, ranking second after electricity and heating, making greenhouse gas (GHG) emission management vital for energy, automotive, and industry sectors. Electrical vehicles (EV) are seen to be an indispensable solution to mitigating greenhouse gas emissions."
"2026-03-26","Emise","Crossref/Asian Journal of Water, Environment and Pollution","https://doi.org/10.36922/ajwep026020005","Driven by the goal of mitigating global warming, centralized photovoltaic power stations are developing rapidly. While considering their power generation efficiency, a systematic assessment of their comprehensive impact on the ecosystem is necessary. In this review, the impact and driving factors of photovoltaic power stations on ecosystem composition and greenhouse gas (GHG) emissions are summarized, as well as the planning and management of photovoltaic power stations."
"2026-03-26","Emise","Crossref/Atmospheric Chemistry and Physics","https://doi.org/10.5194/acp-26-4215-2026","Abstract. Vapour condensation onto existing aerosol particles is important regarding aerosol health and climate effects. Existing particles can act as carriers for toxic vapours into the human respiratory tract."
"2026-03-26","Klimatická změna","Crossref/British Journal of Canadian Studies","https://doi.org/10.3828/bjcs.2026.4","This article examines Canada’s climate change record since the early 1990s. Early signs of global leadership soon evaporated and Canada became the worst climate change laggard in the G7. The article maintains that much of this poor record may be understood as a product of rapid growth in Alberta’s oil sands production, one of the world’s most GHG-intensive sources of petroleum."
"2026-03-26","Emise","Crossref/Canadian Pharmacists Journal / Revue des Pharmaciens du Canada","https://doi.org/10.3138/cpj-25-0040","Background:Health care contributes significantly to greenhouse gas emissions, climate change, and planetary health. While pharmacists are well-placed to address these issues, there is limited information on their views. The objective of the study was to assess the perspectives of pharmacists in British Columbia (BC) and their capacity to mitigate and adapt to climate change."
"2026-03-26","Emise","Crossref/Energies","https://doi.org/10.3390/en19071633","Sustainable economic development involves reducing heavy reliance on fossil energy resources and their associated environmental impacts. The complexity of this task increases significantly in oil-producing countries, given the hydrocarbons’ role in economic growth, GDP, and exports. In such cases, decoupling economic growth, energy consumption and emissions should be achieved gradually to ensure a smooth transition, which will require the development of a reliable approach."
"2026-03-26","Klimatická změna","Crossref/Environmental Conservation","https://doi.org/10.1017/s0376892926100356","SummaryClimate change is a significant challenge for biodiversity conservation in Australia and globally; conservation practitioners, researchers and policymakers need to find new ways to protect species, communities and habitats from the impacts of it. These new approaches – or adaptation interventions – require testing, approvals, permissions, funding and, in many cases, social licence. As such, there is a strong appetite for peer-to-peer sharing of research, new ideas and experiences in adapting biodiversity conservation to climate change..."
"2026-03-26","Emise","Crossref/Environmental Research Letters","https://doi.org/10.1088/1748-9326/ae57c3","AbstractBackground: In 2017, The Guardian published the headline ""Want to Fight Climate Change? Have Fewer Children,"" based on a controversial yet widely cited study estimating the carbon footprint of procreation—the amount of CO2 attributed to having one additional child. These findings reignited population–environment debates, intensified younger generations’ concerns about procreation, and prompted ethical debates about parental environmental responsibility."
"2026-03-26","Klimatická změna","Crossref/Environmental Research Letters","https://doi.org/10.1088/1748-9326/ae57c2","AbstractExtreme weather losses are increasing worldwide, driven by a combination of growth in socioeconomic exposure and hazards influenced by climate change. This trend is acutely felt in the insurance and reinsurance sectors, where severe convective storms, floods, wildfires, and tropical cyclones are generating unprecedented and compounding financial burdens. A central challenge is that traditional catastrophe models rely heavily on historical event statistics that may no longer represent current or emerging climate regimes."
"2026-03-26","Klimatická změna","Crossref/Environmental Reviews","https://doi.org/10.1139/er-2025-0223","Biodiversity serves as the foundation for human well-being and survival, yet it faces unprecedented threats. International trade has emerged as a primary driver of biodiversity loss, responsible for 30% of global species threats and exerting disproportionate impacts on developing countries. This paper reviews the complex relationship between international trade and biodiversity security, examining how trade-related factors, including agricultural expansion, climate change, deforestation, wildlife trade, and illegal hunting that contribute to..."
"2026-03-26","Klimatická změna","Crossref/Evolution","https://doi.org/10.1093/evolut/qpag054","AbstractClimate change is reshaping environments, raising questions about how species will endure. Pinto & Stelkens (2026) investigate whether hybridization aids adaptation using four yeast species and their interspecific F2 hybrids exposed to extreme temperature stress. While the parental species and their hybrids adapted to temperature extremes, hybrids exhibited unique evolutionary trajectories."
"2026-03-26","Klimatická změna","Crossref/Exploring Science Academic Conference Series","https://doi.org/10.70267/ic-aimees.2026020107","In view of the increasingly serious air pollution problem in China in recent years, especially the significant threat of PM2.5 to public health, this study focuses on the key driving factor of meteorological conditions, aiming to reveal the specific impact path of PM2.5 concentration in Beijing, and provide a solid theoretical basis and practical guidance for scientific formulation of provention and control strategies and effective response to climate change. Spearman correlation analysis, multiple linear regression and stepwise regression w..."
"2026-03-26","Klimatická změna","Crossref/Forests","https://doi.org/10.3390/f17040414","Against the backdrop of climate change, forest fires increasingly undermine ecosystem stability and reshape species distributions in Heilongjiang Province. Therefore, quantifying the drivers of fire occurrence and conducting long-term fire risk forecasting holds critical value for regional ecological security. Centered on the forested regions of Heilongjiang Province, this study systematically assessed the relative contributions of multi-source factors—including topography, vegetation, and meteorological conditions—to fire occurrence and com..."
"2026-03-26","Klimatická změna","Crossref/Frontiers in Climate","https://doi.org/10.3389/fclim.2026.1764243","BackgroundRainfed grape cultivation in the occupied West Bank of Palestine, a vital source of livelihood for over 7,000 farmers is under significant threat from climate change. While effective extension is crucial for building resilience, access to these services is highly limited by political and logistic challenges, with only 7.1% of farmers currently reached. Digital extension presents a potential solution to overcome these barriers, but rigorous evidence of its effectiveness in conflict-prone environments is lacking, as observational dat..."
"2026-03-26","Klimatická změna","Crossref/Frontiers in Sustainable Food Systems","https://doi.org/10.3389/fsufs.2026.1771937","Achieving Sustainable Food Production Systems (SFPS) remain the fundamental challenge of the agricultural sector across the world. This comes at a time where human population grows at approximately 0.84% worldwide, which then increases human needs for food and fibre. While dealing with this challenge, climate change presents another dimension of agricultural challenge, of both growth and development and also as a threat to the sector."
"2026-03-26","Extrémy","Crossref/Hydrogeology Journal","https://doi.org/10.1007/s10040-026-03063-w","AbstractThis study examined mountain-front stream recharge to a karst aquifer in the Denver Basin (USA) from 2016 to 2023, a period of minimal water use, using a combination of existing data (geologic maps, borehole drilling and logging records, geophysical surveys, and hydrochemical stream and groundwater data) and new monitoring efforts (stream gauging, near-stream drilling, and water level (WL) instrumentation at stream gauges and monitoring wells). Stream and karst aquifer WLs were jointly analyzed in the context of all data. In a northe..."
"2026-03-26","Rekordy","Crossref/Hydrology","https://doi.org/10.3390/hydrology13040103","Floods are among the extreme events associated with climate variability in the Lacramarca River basin, located in the department of Ancash, Peru. Meteorological phenomena such as El Niño during the periods 1982–1983 and 1997–1998, as well as the Coastal El Niño in 2017, constitute key reference events that motivated the development of the present study, based on a case study conducted in the area between the rural settlements of Santa Clemencia and Pampadura. This research is based on maximum precipitation data derived from historical climat..."
"2026-03-26","Klimatická změna","Crossref/IJTBI","https://doi.org/10.65713/ijtbiv2i127","Transformer models are emerging as practical solutions for climate change and ecological issues. Their ability to spot patterns and correlations in massive amounts of environmental data collected from sensors, satellites, and reports allows them to outperform earlier approaches. Their ability to document climatic patterns over extended periods makes them invaluable for risk assessment and real-time monitoring of changes."
"2026-03-26","Klimatická změna","Crossref/Indian Journal Of Agricultural Research","https://doi.org/10.18805/ijare.a-6469","Background: This study evaluates the impact of climatic factors (CFs) on rice production and yield in 19 states of India. The elasticities of rice yield and production with CFs were determined. Future projections of rice production and yield were also estimated."
"2026-03-26","Klimatická změna","Crossref/International Journal for Computational Civil and Structural Engineering","https://doi.org/10.22337/2587-9618-2026-22-1-169-178","The main regional features of subsidence clay soils common in Mongolia are high porosity, low humidity and underfilling within the seasonal deep freezing due to their heaving and sublimation loosening. Using such soils as foundations for buildings and structures under conditions of increasing humidity is difficult at the design and construction stages, as well as during operation. This paper examines the results of analytical calculations to identify the dependence of a decrease in the physical and mechanical properties of subsidence soils o..."
"2026-03-26","Emise","Crossref/International Journal of Latest Technology in Engineering Management & Applied Science","https://doi.org/10.51583/ijltemas.2026.15020000135","Green finance has become a key mechanism for mobilizing climate-aligned capital to advance sustainable development objectives. However, in many developing economies, the adoption and effectiveness of green financial instruments remain uneven and underexplored. Existing literature tends to be fragmented, with limited synthesis on how tools such as green bonds, blended finance, and ESG-linked investments generate measurable environmental and developmental impacts."
"2026-03-26","Klimatická změna","Crossref/International Migration","https://doi.org/10.1111/imig.70160","ABSTRACTThis study examines the role of climate change in shaping return migration intentions among international migrants. Using an original representative survey of over 1000 first‐generation West African migrants in Germany, we correlate variation in climate conditions in respondents' subnational regions of origin in West Africa to their return migration intentions. We also embed a survey experiment to test whether informational cues about future climate disasters in migrants' origin countries affect their desire to return home."
"2026-03-26","Klimatická změna","Crossref/JANOLI International Journal of Humanities and Linguistics","https://doi.org/10.64758/gazavy05","Climate change is most important topic for discussion of the current century. The main obstacle to understand is not only scientific but also how it impacts humans to human culturally and linguistically. Due to the changes happening in the 21st century climate change is now a threat to the humankind."
"2026-03-26","Extrémy","Crossref/Journal Of Plant Ecology","https://doi.org/10.1093/jpe/rtag058","AbstractExtreme drought events are becoming more frequent under climate warming, imposing deleterious effects on plant diversity and ecosystem functioning. Yet how such events influence the allocation of net primary productivity (NPP)—a key indicator of plant adaptation and carbon cycling—remains poorly understood. Using a coordinated extreme drought experiment across six grassland sites spanning Northern China’s Eurasian steppes, we investigated how extreme drought, implemented as control, chronic drought (66% precipitation reduction, May–A..."
"2026-03-26","Klimatická změna","Crossref/Journal of Climate","https://doi.org/10.1175/jcli-d-25-0418.1","AbstractThe westerly jet streams are a key component of North Atlantic climate, particularly during winter. Projections of European surface climate change depend largely on models’ ability to capture jet behaviour, which requires sufficient resolution in both the atmosphere and ocean. We evaluated the impact of model resolution on the winter climatological zonal wind and on eddy-driven jet position and speed simulated under historical (1950–2014) and future (2015–2050) climate conditions in an ensemble of fully coupled global climate models,..."
"2026-03-26","Klimatická změna","Crossref/Journal of the British Academy","https://doi.org/10.5871/jba/014.a03","Climate change is driven by the fossil fuel consumption of past and current generations. Its effects will disproportionately fall on today’s children and those yet to be born (‘future generations’). We chart the historical contribution of high-income countries, including the UK, to their climate futures before exploring the intergenerational orientations of two key actors in climate politics: the United Nations (UN), the collective voice of sovereign states, and adults with the right to vote in these states."
"2026-03-26","Klimatická změna","Crossref/Jurnal Ilmiah Rekayasa Pertanian dan Biosistem","https://doi.org/10.29303/jrpb.v14i1.1213","Climate change and land degradation threaten global ecology and food security. Biochar, produced via oxygen-limited thermochemical conversion of agricultural waste, offers a multifunctional solution. This narrative review with meta-analysis of quantitative outcomes (2010-2025 literature) synthesizes biochar production techniques, physicochemical properties, and sustainable agriculture applications, demonstrating biochar's critical role in soil health improvement and climate change mitigation."
"2026-03-26","Emise","Crossref/Land","https://doi.org/10.3390/land15040538","This study is based on time-series land use data of Xinjiang from 2000 to 2022. Using grid tools, bivariate autocorrelation models and other methods, we systematically analyzed the spatiotemporal variation characteristics of land use and ecosystem service value. The results show the following: Firstly, from 2000 to 2022, Xinjiang’s LUCC exhibits differentiated evolution characteristics: cropland, forestland, and built-up land expanded continuously, while the areas of grassland and unused land showed a steady reduction trend, and the area of ..."
"2026-03-26","Klimatická změna","Crossref/Land","https://doi.org/10.3390/land15040541","Climate change and rapid urbanization are intensifying flood risks in China, particularly in regions with complex terrain and dense populations. Traditional risk assessment methods often lack the flexibility to handle uncertainties in multi-dimensional risk systems. This study proposes a probabilistic flood risk assessment framework integrating Monte Carlo simulation with a composite indicator system from the perspective of disaster system theory."
"2026-03-26","Klimatická změna","Crossref/Nature Communications","https://doi.org/10.1038/s41467-026-70474-4","AbstractAs climate warming accelerates, shifts in plant phenology are reshaping the functioning and stability of terrestrial ecosystems. While the roles of climatic drivers in shaping phenological responses to warming are well established, the influence of intrinsic plant functional traits remains poorly understood. Here, we combine two complementary approaches through a meta-analysis of 124 field warming experiments and an analysis of long-term phenological monitoring networks (CPON and USA‑NPN) to evaluate phenological responses to warming..."
"2026-03-26","Extrémy","Crossref/The Indonesian Journal of Computer Science","https://doi.org/10.33022/ijcs.v15i2.5077","Meteorological drought is commonly defined as a prolonged deficiency in precipitation relative to the climatological norm for a given region. However, limitations in robustly quantifying and monitoring drought severity continue to impede decision-making across multiple sectors. Conventional tools, have exhibited substantial limitations in terms of accuracy, spatial–temporal resolution, and generalizability."
"2026-03-26","Klimatická změna","Crossref/npj Natural Hazards","https://doi.org/10.1038/s44304-025-00152-w","AbstractAlthough drought is a natural hazard, growing global concern surrounds its increasing frequency and severity due to climate change. Projections indicate that drought conditions are expected to intensify worldwide in the future, and Europe is no exception. Therefore, understanding the pattern and characteristics of future drought is crucial to developing region-specific adaptation strategies to enhance resilience."
