"date","keyword","source","link","abstract"
"2026-06-21","climate change","Crossref/Journal of the Science of Food and Agriculture","https://doi.org/10.1002/jsfa.70824","AbstractBACKGROUNDSuboptimal densities and regional environmental heterogeneity often constrain maize yield intensification. Increasing planting density and selecting climate‐adapted varieties are therefore critical for improving grain yield. RESULTS The study was conducted at 33 sites in the Guanzhong region from 2017 to 2021, addressing uncertainty in density–variety selection for local maize production."
"2026-06-21","climate extremes","Crossref/Journal of the Science of Food and Agriculture","https://doi.org/10.1002/jsfa.70824","AbstractBACKGROUNDSuboptimal densities and regional environmental heterogeneity often constrain maize yield intensification. Increasing planting density and selecting climate‐adapted varieties are therefore critical for improving grain yield. RESULTS The study was conducted at 33 sites in the Guanzhong region from 2017 to 2021, addressing uncertainty in density–variety selection for local maize production."
"2026-06-21","climate change","Crossref/Land Degradation & Development","https://doi.org/10.1002/ldr.70740","ABSTRACTThis study examined how green finance was associated with sustainable land management in selected land‐degraded provinces in China under climate stress. Using a balanced provincial panel of nine provinces from 2011 to 2023, the study constructed composite indices for sustainable land management, green finance and climate stress and estimated fixed‐effects, spatial and threshold models. The results showed that green finance was positively and significantly associated with sustainable land management."
"2026-06-21","climate change","Crossref/Land Degradation & Development","https://doi.org/10.1002/ldr.70696","ABSTRACTLivelihood assets, both renewable and nonrenewable, enhance adaptive capacity and facilitate climate‐smart agriculture (CSA). The CSA approach includes implementing farmers' technical knowledge and investing in different resources and technologies for the improvement of the farming system. This meta‐analysis examined the impact of livelihood capital on key elements of the CSA approach by synthesizing the findings of 63 original articles published between 1980 and 2025."
"2026-06-21","climate change","Crossref/Land Degradation & Development","https://doi.org/10.1002/ldr.70750","ABSTRACTSmallholder farmers in coastal Cameroon face accelerating soil degradation and climate variability. However, the adoption of sustainable agricultural practices (SAPs) remains uneven. This study examines how information behavior and motivational objectives shape SAP adoption in the Tiko municipality using a cross‐sectional survey of 122 household heads and a multivariate logistic framework."
"2026-06-21","climate extremes","Crossref/Land Degradation & Development","https://doi.org/10.1002/ldr.70750","ABSTRACTSmallholder farmers in coastal Cameroon face accelerating soil degradation and climate variability. However, the adoption of sustainable agricultural practices (SAPs) remains uneven. This study examines how information behavior and motivational objectives shape SAP adoption in the Tiko municipality using a cross‐sectional survey of 122 household heads and a multivariate logistic framework."
"2026-06-21","global warming","Crossref/OBSERVATÓRIO DE LA ECONOMÍA LATINOAMERICANA","https://doi.org/10.55905/oelv24n6-025","Este artigo analisa a Portaria CNPq nº 2.664, de 6 de março de 2026, que institui a Política de Integridade na Atividade Científica do Conselho Nacional de Desenvolvimento Científico e Tecnológico, com ênfase no tratamento dado ao uso de ferramentas de inteligência artificial generativa (IAG) na pesquisa acadêmica. A reflexão aqui desenvolvida examina a estrutura normativa do documento, considerando três parâmetros de análise: institucionalização da integridade científica, delimitação de condutas vedadas e princípios positivos, e estrutura d..."
"2026-06-21","climate change","Crossref/Obesity Reviews","https://doi.org/10.1111/obr.70184",NA
"2026-06-21","climate change","Crossref/Online Türk Sağlık Bilimleri Dergisi","https://doi.org/10.26453/otjhs.1828065","Objective: This study examined the relationship between pregnant women’s climate change awareness and worry and their risk perception during pregnancy. Materials and Methods: This descriptive study with a correlational design was conducted between November 2024 and May 2025. The study sample consisted of the pregnant women, with the recorded their trimester."
"2026-06-21","climate change","Crossref/Parasites & Vectors","https://doi.org/10.1186/s13071-026-07528-5","AbstractBackgroundClimate change is altering mosquito distributions and may reshape the risk of mosquito-borne diseases in the Republic of Korea (ROK). However, nationwide, multi-species projections for medically important mosquitoes remain limited. MethodsWe compiled 1,969 spatially filtered occurrence records for 18 mosquito species and developed species distribution models using MaxEnt."
"2026-06-21","drought","Crossref/Physical Education, Health and Social Sciences","https://doi.org/10.63163/jpehss.v4i2.1456","One of the most critical environmental factors that negatively impact the growth, yield and nutrient status of canola is drought stress caused by nutrient deficiency and oxidative damage. In the present study, the effect of Rhizobium leguminosarum on antioxidant defense mechanism and nutrient status of drought stressed canola plants was highlighted. The activity of important antioxidant enzymes like Superoxide Dismutase (SOD), Catalase (CAT) and Peroxidase (POD) was also found to be significantly improved by R."
"2026-06-21","drought","Crossref/Plant, Cell & Environment","https://doi.org/10.1111/pce.70691","Summary statement Beech ( Fagus sylvatica L.) trees with safer xylem hydraulic architecture recovered better from the 1976 drought than hydraulically efficient individuals, showing that conservative xylem structures, rather than high growth rates, may support resilience to extreme drought."
"2026-06-21","climate change","Crossref/Research Papers in Education","https://doi.org/10.1080/02671522.2026.2686939",NA
"2026-06-21","climate change","Crossref/Schizophrenia","https://doi.org/10.1038/s41537-026-00779-2",NA
"2026-06-21","drought","Crossref/Science and Technology Indonesia","https://doi.org/10.26554/sti.2026.11.3.1106-1126","Peatlands, as fragile ecosystems, are vulnerable to deforestation and altered hydrological regimes. The objectives of this study were to evaluate the effects of deforestation on runoff, drought, and fire severity in nine Peat Hydrological Units (KHG) in South Sumatra, Indonesia, in 2014–2025. The deforestation map was created by analyzing the Landsat-8 image through Spectral Mixture Analysis (SMA) and the Normalized Difference Fraction Index (NDFI)."
"2026-06-21","climate change","Crossref/Scientific Reports","https://doi.org/10.1038/s41598-026-52941-6","AbstractTropical coral reefs are threatened by rising seawater temperatures. However, cold-water intrusions to coral reefs by oceanic processes such as upwelling or internal waves, which propagate along the thermocline, can offer refugia from global warming. How reef temperatures and coral responses vary in such locations remains poorly understood due to limited in-situ observations."
"2026-06-21","climate change","Crossref/Scientific Reports","https://doi.org/10.1038/s41598-026-58621-9",NA
"2026-06-21","climate change","Crossref/Scientific Reports","https://doi.org/10.1038/s41598-026-57986-1",NA
"2026-06-21","global warming","Crossref/Scientific Reports","https://doi.org/10.1038/s41598-026-58951-8",""
"2026-06-21","flood","Crossref/South Asian History and Culture","https://doi.org/10.1080/19472498.2026.2691475",""
"2026-06-21","global warming","Crossref/Sustainable Development","https://doi.org/10.1002/sd.71365","ABSTRACTThe study examines how smart, green, and circular economies collectively contribute to achieving the Sustainable Development Goals (SDGs). Existing research has largely analyzed these paradigms separately, limiting understanding of their interconnections and combined sustainability impacts. To address this gap, the study integrates bibliometric science mapping with a PRISMA‐based systematic literature review of 690 peer‐reviewed articles indexed in Scopus and Web of Science between 2016 and 2026."
"2026-06-21","climate change","Crossref/Systems Research and Behavioral Science","https://doi.org/10.1002/sres.70101","ABSTRACTChina's service workplaces are rapidly integrating generative AI into customer‐facing routines, yet theory remains underspecified on how AI interface design cues translate into frontline employees' trust and evaluations of AI‐assisted service delivery. This paper develops a sociotechnical, employee‐centred framework to address this gap. Drawing on stimulus‐organism‐response (S‐O‐R) logic and human‐AI interaction scholarship, this conceptual article theorizes how two actionable interface design cues, AI anthropomorphism and AI respons..."
"2026-06-21","drought","Crossref/The Coleopterists Bulletin","https://doi.org/10.1649/0010-065x-80.2.258",""
"2026-06-21","global warming","Crossref/The European Physical Journal C","https://doi.org/10.1140/epjc/s10052-026-15965-w","Abstract In this article, we present a theoretical and phenomenological study of the gravastar in the presence of a global monopole in teleparallel gravity, specifically $$f(\mathbb {T})$$f(T) gravity. We have constructed the interior based on both the global monopole and the dark energy, and on the shell, we have taken the stiff matter equation of state. We studied the thin shell surrounding the gravastar using the Israel junction conditions and derived a sufficient condition for its stability."
"2026-06-21","global warming","Crossref/The International Journal of the History of Sport","https://doi.org/10.1080/09523367.2026.2674525",NA
"2026-06-21","global warming","Crossref/World Journal of Surgery","https://doi.org/10.1002/wjs.70465",""
"2026-06-21","global warming","Crossref/npj Ocean Sustainability","https://doi.org/10.1038/s44183-026-00218-w",""
