"date","keyword","source","link","abstract"
"2026-06-09","climate change","Crossref/Journal of Scientific Research and Reports","https://doi.org/10.9734/jsrr/2026/v32i64250","Climate change poses a serious threat to agricultural productivity, sustainability, and livelihood security in the Eastern part of India. The region is categorized as high productive zone with fertile alluvial soils, abundant water resources, and diverse cropping systems dominated by rice, wheat, maize, pulses, and oilseeds. In the same way, the region is critically vulnerable to unprecedented climate change; increasing temperatures, erratic monsoon rainfall, prolonged dry spells, floods, cyclones, and rising atmospheric carbon dioxide conce..."
"2026-06-09","climate extremes","Crossref/Journal of Space Weather and Space Climate","https://doi.org/10.1051/swsc/2026024","The Earth’s ionospheric dynamics are of multi-scale in nature, and the small-scale phenomena have been difficult to measure by in-situ techniques because of low data resolution. In this paper, we make use of the high-resolution Swarm faceplate plasma density data at 16 Hz to develop a set of parameters that can characterize multi-scale ionospheric structures and irregularities along the Swarm orbit. The new data is named as MUlti‑Scale Irregularities produCt (MUSIC) dataset."
"2026-06-09","global warming","Crossref/Journal of World Affairs: Voice of the Global South","https://doi.org/10.1177/29769442261460549",""
"2026-06-09","climate change","Crossref/Journal of the British Academy","https://doi.org/10.5871/jba/014.a14","Climate justice recognises climate change as a global chain of cause and effect in which those most affected are often not those responsible for, or benefiting from, its drivers. Meaningful involvement of citizens and diverse stakeholders is therefore critical for assessing the socio-environmental impacts of development interventions that may impede justice, as well as identifying vulnerabilities. This article presents the development of a multi-stakeholder climate justice game based on dilemma-focused case studies, designed to build sustain..."
"2026-06-09","global warming","Crossref/Jurnal Riset Teknik Komputer","https://doi.org/10.69714/q5x91837","The rapid advancement in human-computer interaction demands rigorous professional standardization to ensure the quality and ethics of interface development globally. This study aims to conduct a comparative analysis of global professional standards, with a primary focus on ISO 9241-110 and the rapidly evolving artificial intelligence (AI) interaction guidelines between 2020 and 2025. Using the Systematic Literature Review (SLR) method, this research evaluates relevant literature to identify convergences and divergences between conventional i..."
"2026-06-09","flood","Crossref/Jàmbá: Journal of Disaster Risk Studies","https://doi.org/10.4102/jamba.v18i1.2005","Disaster education has been using a conventional module-based approach, which is only a one-way information transfer process. This research aims to develop and test the Serious Disaster Games (SDG): Flood Alert to improve flood evacuation behaviour and intrinsic motivation as measured by two indicators, namely knowledge about best evacuation practices and self-efficacy in dealing with flood emergencies. This research used a one-group pre-test–post-test design involving 45 students."
"2026-06-09","climate extremes","Crossref/Land Degradation & Development","https://doi.org/10.1002/ldr.70717","ABSTRACT The objective of this study is to assess the future impact of climate change on soil erosion in Poland at a monthly scale. Using a Revised Universal Soil Loss Equation (RUSLE) modeling framework that integrates climate‐driven shifts in vegetation phenology and rainfall erosivity, we projected intra‐annual soil erosion dynamics under RCP4.5 and RCP8.5 scenarios for near (2041–2060) and far (2081–2100) future horizons. A novel method was developed to dynamically estimate the C factor based on the relationship between NDVI and accumula..."
"2026-06-09","drought","Crossref/Microbiology Resource Announcements","https://doi.org/10.1128/mra.01378-25","ABSTRACT We report the draft genome sequence of Bacillus velezensis CMAA1918, an osmotolerant rhizobacterium isolated from the drought-tolerant bromeliad Neoglaziovia variegata in the Caatinga biome. Genomic features associated with osmotic and drought-related stress responses, phosphate metabolism, siderophore production, and antimicrobial biosynthetic pathways underscore its potential relevance in water-limited agricultural systems."
"2026-06-09","climate change","Crossref/National Institute Economic Review","https://doi.org/10.1017/nie.2026.10092","Abstract We present simulation results of the macroeconomic effects of a green European Union (EU) public investment fund for the euro area using the macroeconometric simulation model National Institute Global Econometric Model. Our results show considerable negative gross domestic product (GDP) effects together with inflationary effects from CO 2 taxation alone. Accounting for climate change and the corresponding long-term damage to GDP, however, our results show that not acting on climate change now causes far more severe damages in the fu..."
"2026-06-09","climate change","Crossref/OSMANGAZİ JOURNAL OF MEDICINE","https://doi.org/10.20515/otd.1754923","Climate change significantly impacts adolescent health, yet research on subjective experiences remains scarce. This study aimed to evaluate climate change awareness and the specific mental health symptoms associated with extreme heatwaves among Turkish adolescents. This cross-sectional, descriptive study was conducted in a child and adolescent psychiatry outpatient clinic."
"2026-06-09","global warming","Crossref/Physical Review A","https://doi.org/10.1103/vsxl-lx35",""
"2026-06-09","climate change","Crossref/Plant Science Today","https://doi.org/10.14719/pst.13512","The study examined carbon dynamics and physical fractionation patterns of short-term organic amendment incorporation along with mineral nitrogen (N) fertilisation for two consecutive seasons in a sandy clay loam soil (ultisol) under intensive rice cultivation. Four organic amendments plus an unamended control, with four N levels at 0, 35, 70 and 105 kg ha-1 (designated N0, N35, N70, N105) were evaluated. The organic amendments included farmyard manure (FYM), jack tree (Artocarpus heterophyllus Lam.) leaves (ART), daincha (Sesbania aculeata P..."
"2026-06-09","climate change","Crossref/Review of European, Comparative & International Environmental Law","https://doi.org/10.1111/reel.70066","Abstract On 5 November 2025, the Czech Constitutional Court rejected the complaint in the landmark climate case (Pl. US 6/25). This concluded a 4‐year strategic litigation process, which challenged governmental inaction on climate change."
"2026-06-09","global warming","Crossref/Review of International Business and Strategy","https://doi.org/10.1108/ribs-09-2025-0136","PurposeThis study examines how participants in global virtual teams (GVTs) perceive collaboration challenges and success factors, rather than assuming cultural diversity is inherently disruptive. By focusing on participants’ interpretations of cultural differences and contrasting established theoretical barriers with the retrospective reflections of early career participants for whom virtual collaboration tools are familiar rather than novel, this study aims to determine if operational and adaptive skills outweigh national cultural differenc..."
"2026-06-09","global warming","Crossref/Review of International Political Economy","https://doi.org/10.1080/09692290.2026.2685030",""
"2026-06-09","climate change","Crossref/Review of Political Economy","https://doi.org/10.1080/09538259.2026.2675391",""
"2026-06-09","flood","Crossref/Scientific Data","https://doi.org/10.1038/s41597-026-07511-w",""
"2026-06-09","climate change","Crossref/Smart and Sustainable Built Environment","https://doi.org/10.1108/sasbe-10-2025-0669","PurposeThis study aims to generate evidence-based guidance for climate-responsive residential building design by comparing the energy and carbon performance of alternative wall-envelope materials across diverse climatic contexts. Design/methodology/approachA residential prototype was modelled as a case study and assessed for embodied carbon, cradle-to-grave environmental impacts and operational energy demand under projected future climate scenarios for the 2020s, 2050s and 2080s, incorporating anticipated changes in the electricity supply mi..."
"2026-06-09","climate change","Crossref/Social Change","https://doi.org/10.1177/00490857261453457","This commentary examines the conceptualisation and implementation of literacy in India with a specific focus on the shift from access-oriented frameworks to primarily outcome-based approaches. While this reorientation has expanded the access to literacy, it has at the same time narrowed the scope of the domain away from a transformative agenda of literacy. One of the concerns framed for this shift is that overreliance on standardisation often leads to rigid benchmarks and fosters a test-oriented culture reverberating global accountability po..."
"2026-06-09","climate change","Crossref/Social Change","https://doi.org/10.1177/00490857261453468",""
"2026-06-09","climate change","Crossref/Social Responsibility Journal","https://doi.org/10.1108/srj-06-2025-0610","PurposeThis study aims to extend cognitive dissonance theory by examining how consumers’ conflict between green and materialistic values relates to psychological discomfort and motivation to change consumption behavior. It also examines the role of psychological discomfort in these relationships. Design/methodology/approachA survey was conducted in Lithuania using an online standardized questionnaire administered to a stratified random sample of adults aged 18–65 (n = 600)."
"2026-06-09","climate change","Crossref/South Asian Journal of Social Sciences and Humanities","https://doi.org/10.48165/sajssh.2026.7203","Climate-induced displacement and persistent social stigma present an intensifying public health catastrophe for sex workers in South Asia, significantly impairing their mental health. This Systematic Literature Review examines the interrelationship of environmental, social, and legal vulnerabilities, the consequent mental health burden, and significant barriers to accessing support. The review, based on 30 sources, of which the majority were peer-reviewed (18) and Grey Literature articles (12), finds that climate-induced disasters exacerbate..."
"2026-06-09","climate extremes","Crossref/South Asian Journal of Social Sciences and Humanities","https://doi.org/10.48165/sajssh.2026.7203","Climate-induced displacement and persistent social stigma present an intensifying public health catastrophe for sex workers in South Asia, significantly impairing their mental health. This Systematic Literature Review examines the interrelationship of environmental, social, and legal vulnerabilities, the consequent mental health burden, and significant barriers to accessing support. The review, based on 30 sources, of which the majority were peer-reviewed (18) and Grey Literature articles (12), finds that climate-induced disasters exacerbate..."
"2026-06-09","climate change","Crossref/Strategic Change","https://doi.org/10.1002/jsc.70075","ABSTRACTThis study examines the impact of students' attitudes toward entrepreneurship education (ATEE) on their entrepreneurial intentions (EI) and whether this relationship is moderated by the university's entrepreneurial mission (UEM). Based on the Strategic Change Theory, the university's mission is presented as a strategic instrument through which organizations respond to environmental transformations. Using survey data from 1044 and Partial Least Squares Structural Equation Modeling (PLS‐SEM), the findings confirm that positive ATEE sig..."
"2026-06-09","climate change","Crossref/Sustainability and Climate Change","https://doi.org/10.1177/26922932261453410",""
"2026-06-09","flood","Crossref/Terrestrial, Atmospheric and Oceanic Sciences","https://doi.org/10.1007/s44195-026-00133-0","AbstractReliable flood susceptibility assessment under current and future climate-change scenarios is critical for regional disaster preparedness but is often limited by the scarcity of historical inundation records and field-surveyed data. To overcome this limitation, this study introduces a hybrid modeling framework that integrates high-performance hydrodynamics with machine learning (ML) to synthesize robust training datasets. Utilizing the GPU-accelerated Two-dimensional Runoff Inundation Toolkit for Operational Needs (TRITON), we simula..."
"2026-06-09","climate extremes","Crossref/The International Journal of Logistics Management","https://doi.org/10.1108/ijlm-05-2025-0359","PurposeThe rapid growth of last-mile logistics has increased the demand for sustainable and efficient delivery solutions. However, the environmental motivations behind the adoption of crowdshipping (CS) remain largely overlooked. This study aims to investigate how environmental knowledge (EK) and climate change anxiety (CCA) directly and indirectly influence CS adoption, with self-image (SIM) serving as a moderating variable."
"2026-06-09","climate change","Crossref/Urbanisation","https://doi.org/10.1177/24557471261455734","Cities constitute sites of climate vulnerability, especially marginalised urban locations like informal settlements. Yet there appears to be an inverse connection between climate vulnerability and governing responsibility. Marginalised urban settlements remain excluded from decisions and subsequently responses that inform and define climate adaptation agendas."
"2026-06-09","climate change","Crossref/Urbanisation","https://doi.org/10.1177/24557471261455172","This article examines the spatial intersection between urban informality and climate risk in the Metropolitan Area of Rio de Janeiro, focusing on the vulnerability of informal populations to flooding, landslides and sea-level rise. Drawing on the most recent census data and spatial analysis, the study employs the Brazilian Institute of Geography and Statistics’ urban concentration framework to assess intra-metropolitan disparities, highlighting the concentration of informal settlements in environmentally fragile zones. The analysis reveals a..."
"2026-06-09","climate change","Crossref/Visual Studies","https://doi.org/10.1080/1472586x.2026.2678213",""
"2026-06-08","climate extremes","Crossref/ACS Agricultural Science & Technology","https://doi.org/10.1021/acsagscitech.6c00516",NA
"2026-06-08","global warming","Crossref/Acta Ethnographica Hungarica","https://doi.org/10.1556/022.2024.00021","AbstractOne important component of our accumulated knowledge about Transylvanian villages is the (partial) autonomy of these villages, understood from a historical perspective, at the level of both households and village communities. Another important component is the marked presence of interhousehold cooperation. Based on this autonomy and cooperation, and their eradication, the present paper argues that social, economic, and political restructuring has made village communities, once heavily reliant on endogenous resources, increasingly dep..."
"2026-06-08","climate change","Crossref/Acta Geotechnica","https://doi.org/10.1007/s11440-026-03054-x",NA
"2026-06-08","climate extremes","Crossref/Acta Silvatica & Lignaria Hungarica","https://doi.org/10.37045/aslh-2026-0002","Urban forests can support municipal climate action while delivering a broad range of additional ecosystem services. This study assesses the city of Sárvár, Hungary (1,125 ha of forests and 470 ha of other tree-covered areas) to quantify carbon-related ecosystem services and monetize selected non-market benefits. Carbon stocks and sequestration were estimated by tree species group using National Forestry Database records (2010–2023), Copernicus Tree Cover Density data, and IPCC greenhouse-gas inventory methodology."
"2026-06-08","climate extremes","Crossref/Acta Silvatica & Lignaria Hungarica","https://doi.org/10.37045/aslh-2026-0001","Phenology is a key bioindicator of climate change; however, the genetic and environmental drivers of phenological traits still remain poorly understood. The authors analyzed large-scale patterns of bud burst and bud set (i.e. of vegetation period length) in Eastern European Scots pine provenances to assess the influence of climatic factors and the role of inheritance in phenological adaptation."
"2026-06-08","climate change","Crossref/Administrative Sciences","https://doi.org/10.3390/admsci16060274","Turnover is a major concern for hotel and hospitality industry on a global scale. This research focuses on Dubai 5-star hotels in terms of transactional leadership and how employees perceive its influence on climate and contract fulfillment. This research combines the premises of social exchange, organizational support, and psychological contract, and organizational climate theories to support the development of hypotheses."
"2026-06-08","climate change","Crossref/Agricultural Research","https://doi.org/10.1007/s40003-026-00995-3",NA
"2026-06-08","climate extremes","Crossref/Agricultural Research","https://doi.org/10.1007/s40003-026-00995-3",""
"2026-06-08","climate change","Crossref/Agriculture","https://doi.org/10.3390/agriculture16121273","Grassland ecosystems on the Tibetan Plateau play a critical role in the global carbon cycle, however, the quantitative influence of extreme climate events on their carbon sink dynamics remains insufficiently understood. This study focused on the Sanjiangyuan (Three-River-Source) region, a representative alpine pastoral area, employed net ecosystem productivity (NEP) estimation, Theil–Sen trend analysis, the coefficient of variation, the Hurst index, and ridge regression modeling to quantify the spatiotemporal characteristics of grassland car..."
"2026-06-08","climate change","Crossref/Al-Farooq Journal of Sciences","https://doi.org/10.65405/3n7p5q77","تهدف هذه الدراسة إلى تحليل الدور المحوري الذي تؤديه إدارة التغيير في إنجاح مشاريع التحول الرقمي داخل المؤسسات التعليمية والمكتبات الجامعية الليبية، باعتبارها ركيزة أساسية لتطوير الأداء المؤسسي وتعزيز جودة الخدمات الأكاديمية والبحثية. اعتمدت الدراسة على المنهج الوصفي التحليلي المقارن، من خلال مراجعة الأدبيات العالمية واستعراض النماذج الإدارية الحديثة (مثل Kotter، ADKAR، والنموذج الليبي PACE)، مع مناقشة التحديات المحلية المرتبطة بالموارد البشرية، البنية التحتية، والتمويل. أظهرت النتائج أن نجاح التحول الرقمي يتطلب قيادة استراتيجية واعية، إشراك ..."
"2026-06-08","climate extremes","Crossref/American Journal of Environment and Climate","https://doi.org/10.54536/ajec.v5i2.6366","The study examined the impacts of agriculture, forests, and built-up areas on the water quality indices of the Pinacanauan de Tuguegarao (PdT) River, a designated Water Quality Management Area in northern Philippines. GIS and Pearson correlation analysis were used to determine the relationship between land use and land cover (LULC) and the water quality parameters using a 500-m buffer zone around the sampling station. Data used in the study include focus group discussions (FGD), on-site visits, LULC from ESRI Sentinel-2 imagery with a 10-m r..."
"2026-06-08","global warming","Crossref/Annals of Data Science","https://doi.org/10.1007/s40745-026-00706-3",NA
"2026-06-08","global warming","Crossref/Annals of Medicine & Surgery","https://doi.org/10.1097/ms9.0000000000005226","Five billion people, more than half of humanity, lack access to safe, affordable surgical care. While conventional surgical infrastructure requires decades and trillions of dollars to replicate in low-resource settings, emerging non-incisional technologies offer an alternative paradigm. Histotripsy is a focused ultrasound modality that mechanically destroys tissue without incisions, anesthesia, or prolonged hospitalization."
"2026-06-08","climate change","Crossref/Artefactum - revista de estudos interdisciplinares","https://doi.org/10.23900/artefactum.v25i2.2901","This study evaluated the efficiency of rubberized paint in sealing cracks, waterproofing, and improving the thermal performance of residential facades exposed to the climatic conditions of Palmas, Brazil. The research adopted a quantitative-qualitative approach, with applied and descriptive-exploratory characteristics, and was developed through complementary laboratory analysis and three experimental procedures: thermal performance testing on zinc roofing sheets, waterproofing testing on concrete blocks, and application on a cracked wall und..."
"2026-06-08","climate extremes","Crossref/Artefactum - revista de estudos interdisciplinares","https://doi.org/10.23900/artefactum.v25i2.2901","This study evaluated the efficiency of rubberized paint in sealing cracks, waterproofing, and improving the thermal performance of residential facades exposed to the climatic conditions of Palmas, Brazil. The research adopted a quantitative-qualitative approach, with applied and descriptive-exploratory characteristics, and was developed through complementary laboratory analysis and three experimental procedures: thermal performance testing on zinc roofing sheets, waterproofing testing on concrete blocks, and application on a cracked wall und..."
"2026-06-08","drought","Crossref/Asian Journal of Environment & Ecology","https://doi.org/10.9734/ajee/2026/v25i7959","Environmental degradation, climate change impacts and increasing water pollution exacerbates the challenges and threats facing lotic and lentic ecosystems, resulting in the continued loss of aquatic habitats and biodiversity, contamination of drinking water sources and reduced fisheries production. We collected surface water and sediment grab samples during the dry conditions (March 2008 and February – March 2009) and characterized the trace element contents, sources and distribution in major perennial rivers, hot-spring and Lake Baringo, fo..."
"2026-06-08","global warming","Crossref/Asian Spine Journal","https://doi.org/10.31616/asj.2026.0221",NA
"2026-06-08","climate change","Crossref/BDJ In Practice","https://doi.org/10.1038/s41404-026-3600-5",""
"2026-06-08","climate change","Crossref/BMC Nursing","https://doi.org/10.1186/s12912-026-04855-x",NA
"2026-06-08","climate extremes","Crossref/BMC Nursing","https://doi.org/10.1186/s12912-026-04855-x",NA
"2026-06-08","global warming","Crossref/BMC Public Health","https://doi.org/10.1186/s12889-026-28019-3","AbstractBackgroundSecondhand smoke (SHS) remains a preventable public health hazard that disproportionately affects adolescents. Despite the implementation of tobacco control measures in Saudi Arabia, SHS exposure within homes persists. This study assessed the prevalence of household SHS exposure among adolescents and examined its association with current tobacco/nicotine product use behaviors, including cigarettes, shisha, and e-cigarettes, using nationally representative data from the 2022 Global Youth Tobacco Survey (GYTS)."
"2026-06-08","global warming","Crossref/Beijing International Review of Education","https://doi.org/10.1177/25902547261450658","Teacher education is nationally regulated yet increasingly shaped by cross-border agendas. While internationalisation is widely articulated in institutional strategies, implementation in initial teacher education (ITE) is reported as uneven across contexts and programme components. This narrative review clarifies how internationalisation in ITE is defined, driven, enacted, and critically assessed."
"2026-06-08","global warming","Crossref/Business Strategy and the Environment","https://doi.org/10.1002/bse.71012","ABSTRACTThe importance of sustainable initiatives and their impact on corporate financial performance (CFP) remains a subject of considerable academic debate, frequently characterized by mixed and inconclusive results. Such inconsistency stems from the overlooked and complex nature of sustainable initiatives, financial mechanisms, and inherent heterogeneity across industries and geographical regions within the global supply chain. To address these issues, this study analyzes the higher order of the nonlinear impacts of Environmental, Social,..."
"2026-06-08","climate change","Crossref/CAOS – Revista Eletrônica de Ciências Sociais","https://doi.org/10.46906/caos.n36.77653.p12-16","O presente dossiê da Revista Caos reúne um conjunto de artigos que discutem as tensões, resistências e possibilidades de vida humana e não humana frente ao avanço das mudanças climáticas. Os trabalhos abrangem a importância da ficção na construção de imaginários e na disseminação de informações, sejam elas dados científicos ou fabulações sobre os fins de mundo; discussões em torno do bem-viver e a relevância das propostas teórico-metodológicas para refletir sobre formas de aterramento; bem como a necessidade de evidenciar as formas de resist..."
