"date","keyword","source","link","abstract"
"2026-05-27","Klimatická změna","BBC World","https://www.bbc.com/news/articles/c62rrj66p3eo?at_medium=RSS&at_campaign=rss","The combined effects of a heat dome and climate change have brought extreme warmth to western Europe."
"2026-05-27","Rekordy","BBC World","https://www.bbc.com/news/articles/c62rrj66p3eo?at_medium=RSS&at_campaign=rss","The combined effects of a heat dome and climate change have brought extreme warmth to western Europe."
"2026-05-27","Klimatická změna","Nature Climate","https://www.nature.com/articles/s41558-026-02644-7","Nature Climate Change, Published online: 27 May 2026; doi:10.1038/s41558-026-02644-7Climate debates often frame individual behaviour and systems change as distinct pathways to action. We suggest that social change arises from individuals’ agency within their roles in societal systems, and that this agency should be actively leveraged to achieve meaningful climate change mitigation."
"2026-05-27","Rekordy","Novinky","https://www.novinky.cz/clanek/pocasi-studena-fronta-se-hlasi-i-tak-jeste-padaly-teplotni-rekordy-40580232","Ve středu přes Česko přešla studená fronta, před ní ale teploty místy opět vystoupaly nad 30 °C. Česko tak zažilo pátý tropický den v řadě a téměř pětina stanic zaznamenala denní rekord. Zatímco ve středu se studená fronta na většině území projevila jen zesílením větru, ve čtvrtek už by se mělo výrazněji ochladit."
"2026-05-27","Extrémy","The Guardian World","https://www.theguardian.com/world/2026/may/27/five-villagers-found-alive-in-laos-cave-as-search-continues-for-two-missing","Video appears to show divers discovering group sitting on a rock surrounded by flood waterRescuers have reached five of seven people who have been trapped for a week in a flooded, remote cave in Laos, after days spent navigating narrow, inundated passageways amid persistent rain.Video footage shared on social media by rescue divers showed the five men crouched together on a rocky ledge in a dark cave chamber, surrounded by muddy water. “There’s no need to cry,” one of the rescue team told the men, who first entered the cave on Wednesday. Two..."
"2026-05-27","Rekordy","iDNES","https://www.idnes.cz/ekonomika/domaci/teplotni-rekordy-cesko-nakup-klimatizace-kremy-bazeny-heureka-mluvci-prodej-narust-ochlazovace-zajem.A260527_174749_ekonomika_fohl#utm_source=rss&utm_medium=feed&utm_campaign=zpravodaj&utm_content=main","Obchodníci zaznamenávají vysoký nárůst prodeje klimatizací, bazénů či opalovacích krémů. Podle mluvčího on-line srovnávače cen Heureka Ondřeje Švedy se zvýšil růst letního sortimentu o téměř 90 procent. Česko zažívá poslední dny teplotní rekordy."
"2026-05-27","Rekordy","iDNES","https://www.idnes.cz/zpravy/domaci/teplotni-rekordy-cesko-chmu-straznice.A260527_175746_domaci_pari#utm_source=rss&utm_medium=feed&utm_campaign=zpravodaj&utm_content=main","V Česku pátým dnem v řadě padaly teplotní rekordy. Ve středu je zaznamenalo 31 ze 171 stanic, které fungují alespoň 30 let. Vysoko teploty stoupaly zejména na jihu země."
