"date","keyword","source","link","abstract"
"2026-06-09","climate change","Crossref/ANTYAJAA: Indian Journal of Women and Social Change","https://doi.org/10.1177/24556327261453647","India became a forerunner country for introducing the National Family Planning Programme (NFPP) in 1952, which has now witnessed shifts in policy approach and implementation. This requires re-examining programme commitment and investment for realization of fulfilling women’s reproductive rights. This narrative review article, using an intersectional feminist perspective, aims to analyze the policy approach of the Indian Family Planning Programme (FPP) and understand contraceptive practices of women within their social contexts."
"2026-06-09","drought","Crossref/Advanced Science","https://doi.org/10.1002/advs.76034","ABSTRACT Drought stress severely restricts plant growth and crop productivity. Although numerous transcription factors have been linked to drought responses, the regulatory networks underlying drought tolerance in rice remain incompletely understood. Here, through a CRISPR/Cas9‐based genetic screen of a rice mutant population, we identified a mutant with decreased drought tolerance, osdt2 ."
"2026-06-09","global warming","Crossref/American Journal of Botany","https://doi.org/10.1002/ajb2.70218",""
"2026-06-09","global warming","Crossref/Annals of Medicine & Surgery","https://doi.org/10.1097/ms9.0000000000005147",""
"2026-06-09","climate change","Crossref/BMC Medical Ethics","https://doi.org/10.1186/s12910-026-01516-1","AbstractBackgroundClimate change increasingly affects population health and healthcare systems. While normative frameworks emphasize physicians’ societal role in climate protection, empirical evidence on how general practitioners perceive and address climate- and environment-related issues in daily clinical practice remains somewhat limited and not yet fully consistent across studies. Methods We conducted a nationwide cross-sectional online survey among general practitioners ( N = 500; 38.2% female) in Germany."
"2026-06-09","drought","Crossref/BMC Plant Biology","https://doi.org/10.1186/s12870-026-09216-z",""
"2026-06-09","drought","Crossref/BMC Plant Biology","https://doi.org/10.1186/s12870-026-09061-0",""
"2026-06-09","climate change","Crossref/BMC Public Health","https://doi.org/10.1186/s12889-026-28078-6",""
"2026-06-09","climate change","Crossref/BMC Women's Health","https://doi.org/10.1186/s12905-026-04526-8",""
"2026-06-09","climate change","Crossref/BMJ","https://doi.org/10.1136/bmj-2026-617782",""
"2026-06-09","global warming","Crossref/Boundary Value Problems","https://doi.org/10.1186/s13661-026-02313-w",""
"2026-06-09","climate change","Crossref/Climate Policy","https://doi.org/10.1080/14693062.2026.2675275",""
"2026-06-09","flood","Crossref/Communications Earth & Environment","https://doi.org/10.1038/s43247-026-03747-x",""
"2026-06-09","global warming","Crossref/Communications Earth & Environment","https://doi.org/10.1038/s43247-026-03750-2",""
"2026-06-09","global warming","Crossref/Community Development","https://doi.org/10.1080/15575330.2026.2687064",""
"2026-06-09","climate extremes","Crossref/Competitiveness Review: An International Business Journal","https://doi.org/10.1108/cr-03-2026-0181","PurposeThis research aims to examine the global academic landscape of energy supply chain risk within the framework of geopolitical risk, economic policy uncertainty and climate policy uncertainty. It explores the intellectual structure, overarching research topics and trends that are shaping the development of this fast-developing area. Design/methodology/approachTo achieve its objective, the authors used bibliometric techniques to analyse a data set of 344 publications from the Web of Science Core Collection between 2014 and 2025."
"2026-06-09","climate change","Crossref/Construction Innovation","https://doi.org/10.1108/ci-12-2025-0560","PurposeThis study aims to develop a decision-making approach that supports sustainable building upgrades or modifications where choices include a set of climate change risk mitigation options. The approach places all costs and benefits, both direct and intangible, onto a common monetary scale that includes ripple effects of potential climate-induced disruptions. Design/methodology/approachCurrent approaches do not include rigorous methodologies that can be implemented by practitioners, and they do not monetize disruption ripple effects."
"2026-06-09","flood","Crossref/Discover Geoscience","https://doi.org/10.1007/s44288-026-00588-1",""
"2026-06-09","global warming","Crossref/Discover Sustainability","https://doi.org/10.1007/s43621-026-03690-z","AbstractPlastic pollution has emerged as a defining socio-environmental challenge of the twenty-first century, with its most severe impacts felt in the Global South. While alternatives to conventional plastics are increasingly promoted, policy responses in low- and middle-income countries remain fragmented, under-enforced, and poorly aligned with local realities. This paper introduces a novel policy blueprint matrix, an evidence-based framework that can help accelerate the adoption and production of plastic alternatives and non-plastic subst..."
"2026-06-09","climate change","Crossref/Environmental Justice","https://doi.org/10.1177/19394071261441568","In the past decade, as environmental justice activist-scholars have engaged with critical social theories including the Black Radical Tradition, decolonial scholarship, urban political ecologies, and abolitionist thinking, they have debated whether the movement’s longstanding state-focused strategies can truly bring about a just and sustainable future. In the context of this debate, as well as the Trump administration’s evisceration of environmental and EJ regulations, this article investigates how state funding has affected climate justice ..."
"2026-06-09","climate change","Crossref/Environmental Monitoring and Assessment","https://doi.org/10.1007/s10661-026-15529-1",NA
"2026-06-09","global warming","Crossref/Environmental Science & Technology","https://doi.org/10.1021/acs.est.6c01834",""
"2026-06-09","climate change","Crossref/Environmental Science and Pollution Research","https://doi.org/10.1007/s11356-026-37912-8","AbstractWildfire risk is increasing in the eastern U.S., yet spatial and climate-driven assessments remain limited. This study evaluates climate change impacts on wildfire risk in the Upper James Watershed (UJW) using baseline (2000–2019), near-future (2021–2040), and far-future (2061–2080) projections from a 12-model CMIP6 global climate model (GCM) ensemble under SSP2–4.5 and SSP5–8.5. A wildfire risk model was developed in ArcGIS Pro using nine key factors and validated with MODIS hotspot data, showing good agreement between modeled risk ..."
"2026-06-09","climate change","Crossref/Environmental Values","https://doi.org/10.1177/09632719261458976","How environmental and climate challenges that often evoke strong negative emotions are communicated and responded to is of great importance. These include forest fires, plastic pollution and flooding that can produce fear, sadness and powerlessness. Images are important to this communication, yet how these challenges are captured through visual communication tools and to what outcomes requires further research."
"2026-06-09","global warming","Crossref/European Radiology","https://doi.org/10.1007/s00330-026-12567-8","AbstractObjectivesTo analyze the intercontinental differences and inequities in the management of hepatocellular carcinoma (HCC), including surveillance, diagnosis, and treatment, through the survey responses from the participants of the Global Abdominal Imaging Forum on HCC, organized by the European Society of Gastrointestinal and Abdominal Radiology (ESGAR). Materials and methodsAn online anonymous survey was distributed to the attendees of the Global Abdominal Imaging Forum on HCC. The survey consisted of 14 multiple-choice questions, co..."
"2026-06-09","global warming","Crossref/Evidence-based HRM: a Global Forum for Empirical Scholarship","https://doi.org/10.1108/ebhrm-02-2026-0078","PurposeAlthough the protective roles of spirituality and psychological resilience against burnout are well documented, existing research largely treats these resources as parallel predictors. Challenging this assumption, the present study proposes and tests a hierarchical resource model in which psychological resilience serves as the hypothesized conduit through which employee spirituality mitigates emotional exhaustion. Design/methodology/approachCross-sectional survey data were collected from 223 millennial “sandwich generation” employees ..."
"2026-06-09","climate change","Crossref/Facilities","https://doi.org/10.1108/f-10-2025-0185","PurposeThis study aims to examine how social networks and facility management interact to strengthen community resilience to climate change in vulnerable communities in northern Ghana. Design/methodology/approachA qualitative design was adopted, using semi-structured interviews with 15 purposively selected participants, comprising community leaders, local government officials, district-level technical personnel and non-governmental organisation representatives. Data were analysed through Braun and Clarke’s six-phase thematic analysis, suppor..."
"2026-06-09","climate change","Crossref/Frontiers in Audiology and Otology","https://doi.org/10.3389/fauot.2026.1861653","IntroductionThe acoustic change complex (ACC), a cortical auditory evoked potential, reflects the brain's ability to detect changes in an ongoing sound. This study investigates the influence of pre-change stimulus duration on the ACC in normal-hearing adults. MethodologyTwenty normal-hearing adults (10 men, 10 women) participated."
"2026-06-09","drought","Crossref/Frontiers in Plant Science","https://doi.org/10.3389/fpls.2026.1840313","Drought is one of the most important abiotic stresses affecting plant growth and productivity worldwide. Soybean [ Glycine max (L.) Merr.] is particularly sensitive to drought stress, which can cause yield losses of up to 40%. This study aimed to identify genomic regions associated with canopy wilting, a key indicator of drought response in soybean, using genome-wide association analysis."
"2026-06-09","climate change","Crossref/Frontiers in Water","https://doi.org/10.3389/frwa.2026.1843395","IntroductionClimate change is profoundly altering hydrological cycles, posing serious challenges to agricultural sustainability and water resource security. MethodsQuantifying the sensitivity of agro-hydrological processes to climate variability is therefore essential for developing effective adaptation strategies. In this study, a calibrated and improved Soil and Water Assessment Tool (SWAT) model, combined with sensitivity analysis was employed to evaluate the sensitivity and contributions of key climatic factors to major agro-hydrological..."
"2026-06-09","drought","Crossref/Geology, Ecology, and Landscapes","https://doi.org/10.1080/24749508.2026.2681801",""
"2026-06-09","climate change","Crossref/German Law Journal","https://doi.org/10.1017/glj.2026.10209","AbstractWhile the judgement of the European Court of Human Rights (ECtHR) in KlimaSeniorinnen v. Switzerland has been hailed by many as a landmark in climate change and human rights litigation, the response by Switzerland and many intervening parties has been less favorable. For instance, the Swiss legislative has been very critical in its review of the judgement, claiming it to be “judicial activism.” By dissecting the criticism voiced in the aftermath of the KlimaSeniorinnen judgement and by comparing this case to similar cases by national..."
"2026-06-09","global warming","Crossref/Global Journal of Emerging Market Economies","https://doi.org/10.1177/09749101261453433","This study examines how sustainable energy finance and environmental regulatory quality jointly influence two dimensions of Sustainable Development Goal-7 in sub-Saharan Africa: energy cleanability and energy accessibility. Covering 26 countries from 2005 to 2022, the analysis introduces novel composite indices derived using principal component analysis. The relationships were estimated using panel-corrected standard errors and feasible generalized least squares, complemented by the method-of-moments quantile regression and subregional break..."
"2026-06-09","global warming","Crossref/Global Policy","https://doi.org/10.1111/1758-5899.70182","ABSTRACTThis study examines how political actors leverage social media in Afghanistan as a tool for political legitimation. Framing social media as a potential supply of legitimacy, it analysed X (formerly known as Twitter) content posted by the former Afghan government, humanitarian and Taliban political accounts between January 2020 and December 2022 using qualitative thematic analysis and descriptive statistics. The analysis explores how the Taliban seeks to construct legitimacy at the national and international levels by examining two ce..."
"2026-06-09","global warming","Crossref/Global Surgical Education - Journal of the Association for Surgical Education","https://doi.org/10.1007/s44186-026-00539-x",""
"2026-06-09","global warming","Crossref/Glosains: Jurnal Sains Global Indonesia","https://doi.org/10.59784/glosains.v7i2.750","Background: Acne vulgaris is common in adolescents and young adults and can decrease quality of life. Self-medication with creams containing topical corticosteroids is still prevalent and has the potential to trigger inflammatory acne. Objective: This study assessed the relationship between exposure to steroid-containing creams and the appearance of inflammatory acne."
"2026-06-09","climate change","Crossref/Healthcare","https://doi.org/10.3390/healthcare14121624","Background/Objectives: Climate change worry is an emerging concern in youth mental health, but little is known about how it is associated with positive psychological functioning among university students. This study examined whether climate change worry was associated with flourishing and whether this association showed a cross-sectional statistical indirect effect through anxiety and depressive symptoms, with physical activity specified as a first-stage boundary condition. Methods: A cross-sectional anonymous survey was conducted in April 2..."
"2026-06-09","flood","Crossref/Humanities Horizon","https://doi.org/10.63373/3047-8014/55","Land use and land cover (LULC) changes significantly influence watershed hydrological processes and flood risk. This study assessed the effects of long-term LULC change on the hydrological response of the Anambra Watershed between 1995 and 2025 using Remote Sensing (RS), Geographic Information Systems (GIS), and HEC-HMS hydrological modelling. Satellite imagery was analyzed to quantify historical land cover changes, while HEC-HMS was employed to simulate rainfall–runoff responses under varying land use conditions."
"2026-06-09","climate change","Crossref/Iconic Research and Engineering Journals","https://doi.org/10.64388/irev9i12-1718664",""
"2026-06-09","climate change","Crossref/Inland Waters","https://doi.org/10.1080/20442041.2026.2686312",""
"2026-06-09","flood","Crossref/International Journal of Disaster Risk Science","https://doi.org/10.1007/s13753-026-00742-w","Abstract Coastal flooding poses a significant threat to China’s coastal zones, driven by the combined effects of global climate change and rapid urbanization. However, owing to notable discrepancies in data accuracy, model construction, and parameter settings, the applicability of findings from existing regional studies is limited when extrapolated to broader macroscale risk assessments. Therefore, this study quantitatively assessed the risk of casualties and economic losses in China’s coastal areas under different return period scenarios us..."
"2026-06-09","climate change","Crossref/International Journal of Environment and Climate Change","https://doi.org/10.9734/ijecc/2026/v16i65503","Climate-related shocks, such as extreme heatwaves and catastrophic flooding increasingly threaten global developmental gains. The study identified three core dimensions-Environmental, Social, and Economic efficiency. A mixed-method approach was employed, combining qualitative insights from literature and expert consultations with quantitative techniques for index construction and validation."
"2026-06-09","climate change","Crossref/International Journal of Environment and Climate Change","https://doi.org/10.9734/ijecc/2026/v16i65502","Accurate estimation of reference evapotranspiration (ET₀) is important for irrigation scheduling, crop water requirement estimation, and agricultural water management. Reliable prediction of ET₀ helps improve irrigation efficiency and supports effective utilization of available water resources. Conventional evapotranspiration estimation methods often require complete meteorological datasets, which may not always be available in many agricultural regions."
"2026-06-09","climate change","Crossref/International Journal of Environment and Climate Change","https://doi.org/10.9734/ijecc/2026/v16i65501","Pulse crops are vital for global food and nutritional security owing to their high protein content and ability to fix atmospheric nitrogen. However, declining soil fertility, low nutrient-use efficiency, and excessive dependence on chemical fertilizers have necessitated the development of sustainable nutrient management strategies. The integration of biofertilizers and nano-fertilizers represents a sustainable and technologically advanced approach to enhance soil health, nutrient efficiency, and crop productivity in pulse-based systems."
"2026-06-09","climate change","Crossref/Journal of Business and Psychology","https://doi.org/10.1007/s10869-026-10132-0","Abstract Organizational climate is widely acknowledged as a key construct for examining how organizations shape employee behavior. However, a comprehensive theoretical understanding of the mechanisms and boundary conditions of why and when organizational climate exerts its effects is still lacking. In our research, we conceptualize the organization as a social context and draw on theories of social influence to develop a theoretical framework of how organizational climate affects employee behavior."
"2026-06-09","climate change","Crossref/Journal of Climate","https://doi.org/10.1175/jcli-d-25-0744.1","AbstractRecent studies suggest that the El Niño–Southern Oscillation (ENSO) exerts a stronger influence on the East Asian winter monsoon (EAWM) in early winter than in late winter. Here we show that this subseasonality is not a persistent feature of the climate system but instead exhibits pronounced nonstationarity. Using reanalysis datasets, idealized numerical experiments, and CMIP6 AMIP simulations, we find that a statistically significant early–late winter contrast occurs mainly during the late 1970s to late 1990s, while it is weak or ab..."
"2026-06-09","climate change","Crossref/Journal of Climate","https://doi.org/10.1175/jcli-d-26-0047.1","AbstractRecent studies have noticed that wintertime extreme surface wind frequency (ESWF) over the South China Sea (SCS)—one of the world’s busiest shipping lanes—is on the rise. This trend poses heightened threats to maritime transportation and offshore operations along the heavily trafficked East Asian coastline. By using 44 years (1979–2022) ERA5 reanalysis data, we verify a statistically significant increasing trend in winter ESWF (daily mean 10-m wind speed > 10.8 m/s) over the northern SCS."
"2026-06-09","climate extremes","Crossref/Journal of Climate","https://doi.org/10.1175/jcli-d-25-0417.1","AbstractThe barrier layer (BL) influences air–sea heat exchange and plays a key role in regulating global climate change. Here, we provide a detailed assessment of the ability of models contributing to the sixth phase of the Coupled Model Intercomparison Project (CMIP6) to represent the BL in the Southern Ocean. Our findings indicate that, while the CMIP6 models generally reproduce the seasonal cycle and spatial distribution of the Southern Ocean BL, the simulation results for BL thickness (BLT) remain too thin in comparison to observations."
"2026-06-09","climate extremes","Crossref/Journal of Climate","https://doi.org/10.1175/jcli-d-25-0458.1","AbstractMarine heatwaves (MHWs) threaten marine ecosystems and significantly impact weather patterns. In the Arabian Sea, summer MHWs are of particular concern due to their potential impacts on the Indian summer monsoon, a lifeline for nearly a billion people. However, the drivers of these MHWs and their influence on atmospheric circulation and monsoon rainfall remain poorly understood."
"2026-06-09","climate extremes","Crossref/Journal of Climate","https://doi.org/10.1175/jcli-d-25-0597.1","Abstract Soil moisture (SM) and vapor pressure deficit (VPD) are key climate factors influencing vegetation growth, especially in water-limited regions where water availability controls vegetation dynamics, particularly in grasslands where food security is threatened. Understanding the mechanisms of these two moisture-related variables is critical for improving predictions of ecosystem responses to climate change, if their complex nonlinear dynamics and lagged interactions are well captured. In this study, we used the Jacobian Regularized-ba..."
"2026-06-09","global warming","Crossref/Journal of Disease and Global Health","https://doi.org/10.56557/jodagh/2026/v19i210695","Background: Emerging and re-emerging zoonotic infections continue to pose major public health challenges in Odisha, India. Scrub typhus and anthrax are increasingly recognized as important zoonotic diseases affecting rural and tribal populations. Methods: A systematic literature review was conducted following PRISMA-guided principles."
"2026-06-09","climate change","Crossref/Journal of Earth System Science","https://doi.org/10.1007/s12040-026-02846-9",""
"2026-06-09","global warming","Crossref/Journal of Economic and Administrative Sciences","https://doi.org/10.1108/jeas-02-2026-0146","PurposeThis study examines the psychological mechanism necessary to convert accounting professionals' human capital (critical thinking skills and emotional intelligence) into perceived accounting education meaningfulness within the context of an emerging economy, China. Specifically, it tests the mediating role of global citizenship orientation and the moderating role of case-based learning intensity. Design/methodology/approachA two-wave, time-lagged quantitative survey design was employed with 452 final-year accounting students across majo..."
"2026-06-09","global warming","Crossref/Journal of Global Marketing","https://doi.org/10.1080/08911762.2026.2686542",""
"2026-06-09","global warming","Crossref/Journal of Global Marketing","https://doi.org/10.1080/08911762.2026.2682331",""
"2026-06-09","global warming","Crossref/Journal of Global Mobility","https://doi.org/10.1108/jgm-11-2025-0121","PurposeAfrican migrant entrepreneurship remains under-researched despite increasing migration flows from Africa. This scoping review examines literature to identify critical gaps and establish an integrated theoretical framework, with emphasis on the Australian context. Design/methodology/approachA Population, Concept, Context (PCC) scoping review model was employed, examining articles published from 2007 onwards."
"2026-06-09","global warming","Crossref/Journal of Global Responsibility","https://doi.org/10.1108/jgr-07-2025-0189","PurposeThis study aims to investigate the impact of green finance (GF) on environmental performance (EP). It further examines how country-level cultural dimensions such as uncertainty avoidance (UCA) and long-term orientation (LTO) interact with this relationship. In addition, the moderating role of sustainable development (SD) at the country level is also explored."
"2026-06-09","flood","Crossref/Journal of Hydrometeorology","https://doi.org/10.1175/jhm-d-25-0081.1","AbstractWith global warming, the intensity and frequency of floods have markedly increased, which results in substantial losses of life and property. The Pearl River Basin (PRB) in South China, with its complex topography, remains highly susceptible to flooding. To enhance the precision of flood simulation and forecast in the PRB, an overland flow scheme was first integrated into the community Noah land surface model with multiparameterization options (Noah-MP) and subsequently coupled with the Weather Research and Forecasting (WRF) model."
"2026-06-09","climate change","Crossref/Journal of Public Budgeting, Accounting & Financial Management","https://doi.org/10.1108/jpbafm-05-2025-0128","PurposeFew analyses evaluate how institutional arrangements for climate participatory budgeting (CPB) lead to co-creation, especially in the context of the United States. This study examines two questions: (1) To what extent do public finance institutions, such as climate-related earmarked funding mechanisms and climate budgeting and investment platforms, facilitate co-creation; and (2) How do institutional environments shape these co-creation dynamics in climate finance and budgeting? Design/methodology/approachThe study adopts a qualitativ..."
"2026-06-09","climate change","Crossref/Journal of Public Health in Africa","https://doi.org/10.4102/jphia.v17i1.1895","Skin cancer incidence is rising both globally and in South Africa, and evidence shows that sunburns in childhood significantly affect the risk of developing melanoma in later life. Sun protection in childhood remains an underutilised avenue for preventive medicine in South Africa. In contrast to South Africa, countries like Australia have implemented numerous state and national sun programmes that have shown significant success, with declining melanoma rates in younger populations."
