"date","keyword","source","link","abstract"
"2026-03-26","Extrémy","Al Jazeera","https://www.aljazeera.com/video/newsfeed/2026/3/26/video-storms-wash-away-vehicles-and-flood-homes-across-middle-east?traffic_source=rss","Vehicles were washed away in floods in Oman and homes were flooded in Syria as storms brought floods across the region."
"2026-03-26","Emise","Crossref","https://doi.org/10.3390/pr14071060","The implementation of methanol-ammonia dual-fuel engines has the potential to contribute to a reduction in carbon emissions in the environment. The present study employs numerical simulations of the methanol-ammonia dual-fuel engine to investigate methanol direct injection pre-injection strategies. The impact of pre-main injection time interval and pre-injection quantity was investigated on output power, output torque, cylinder pressure and exhaust emissions such as NOX, HC, CO, and CO2."
"2026-03-26","Emise","Crossref","https://doi.org/10.1007/s10668-026-07538-4",""
"2026-03-26","Emise","Crossref","https://doi.org/10.46914/1562-2959-2026-1-1-229-252","In Central Asian countries, there is a complex relationship between economic growth, energy consumption, and environmental pollution. An increase in economic production is often accompanied by an increase in energy consumption, which, in turn, can lead to an increase in pollutant emissions. However, there are opportunities to break this link, for example, by increasing energy efficiency and switching to renewable energy sources."
"2026-03-26","Emise","Crossref","https://doi.org/10.3138/cpj-25-0040","Background:Health care contributes significantly to greenhouse gas emissions, climate change, and planetary health. While pharmacists are well-placed to address these issues, there is limited information on their views. The objective of the study was to assess the perspectives of pharmacists in British Columbia (BC) and their capacity to mitigate and adapt to climate change."
"2026-03-26","Emise","Crossref","https://doi.org/10.1002/sd.70939","ABSTRACTClimate change and rising global temperatures are significantly affecting energy consumption patterns and carbon emissions. This study directly contributes to the United Nations Sustainable Development Goals (SDGs), particularly SDG 13 (Climate Action), SDG 7 (Affordable and Clean Energy), and SDG 12 (Responsible Consumption and Production). This study investigates the relationship between temperature and energy‐related emissions from coal, diesel, electricity, and natural gas using panel data from eight Chinese provinces covering th..."
"2026-03-26","Emise","Crossref","https://doi.org/10.1007/s00704-026-06162-6",""
"2026-03-26","Emise","Crossref","https://doi.org/10.53443/anadoluibfd.1723273","Reducing greenhouse gas emissions has become a critical global challenge, with growing attention in recent years. Transportation is a major contributor, ranking second after electricity and heating, making greenhouse gas (GHG) emission management vital for energy, automotive, and industry sectors. Electrical vehicles (EV) are seen to be an indispensable solution to mitigating greenhouse gas emissions."
"2026-03-26","Emise","Crossref","https://doi.org/10.3390/aerospace13040312","In order to provide an innovative form of urban air mobility, a new and versatile generation of small, highly automated aircraft is currently being developed. This is made feasible by the development of new technologies such as electrified powertrains, Vertical Take-Off and Landing capabilities and distributed propulsion systems. The operation of these novel aircraft types will generate a new source of air traffic noise."
"2026-03-26","Emise","Crossref","https://doi.org/10.3389/fsufs.2026.1824096",""
"2026-03-26","Emise","Crossref","https://doi.org/10.1088/1674-1056/ae5784","AbstractAluminum nitride is a vital wide-bandgap semiconductor for deep-ultraviolet optoelectronics, yet the deterministic control of its intrinsic defects remains a challenge for sputtered films. In this work, (002)-oriented AlN thin films were synthesized on silicon substrates via radio-frequency reactive magnetron sputtering at a low temperature of 300 °C. The resulting films exhibited high crystallinity, dense nanocrystalline morphology, and superior optical transparency with a characteristic absorption edge below 250 nm."
"2026-03-26","Emise","Crossref","https://doi.org/10.3390/agriengineering8040120","Electromagnetic treatment (EMF) can stimulate seed germination and plant development, including mitigating the negative effects of stressors. One non-invasive approach to detecting the early effects of EMF exposure is the study of gas exchange dynamics during the seed imbibition stage. Gas chromatography was used to assess the effect of low-intensity non-thermal EMF on the concentration of H2, O2, CO2, and NH3 gases in the “soil–pea seed” system under optimal conditions and under salt stress."
"2026-03-26","Emise","Crossref","https://doi.org/10.3828/bjcs.2026.4","This article examines Canada’s climate change record since the early 1990s. Early signs of global leadership soon evaporated and Canada became the worst climate change laggard in the G7. The article maintains that much of this poor record may be understood as a product of rapid growth in Alberta’s oil sands production, one of the world’s most GHG-intensive sources of petroleum."
"2026-03-26","Emise","Crossref","https://doi.org/10.1111/jpet.70111","ABSTRACTWe explore alternate allocations of responsibility for greenhouse gas emissions policies in a small open federation. Emissions result from consumption and production of a tradeable dirty good. Emissions control policies are based on social values which depend on the allocation of policy responsibility."
"2026-03-26","Emise","Crossref","https://doi.org/10.1093/nsr/nwag192","AbstractMethane (CH4) accounts for about one third of the current anthropogenic greenhouse gas-driven warming. Rivers, particularly those draining human-impacted landscapes, are important sources of CH4 to the atmosphere. Yet, effective mitigation of this important flux remains elusive due to the lack of accurate quantification of human-induced emissions and a poor understanding of its key aquatic drivers."
"2026-03-26","Emise","Crossref","https://doi.org/10.30586/pek.1792565","This study investigates the impact of environmental factors on Turkey’s sovereign credit default swap (CDS) spreads over the period 2005–2023. Using annual data on greenhouse gas (GHG) emissions per capita, energy use per capita, and five-year CDS spreads, we apply the Autoregressive Distributed Lag (ARDL) bounds testing approach and its associated Error Correction Model (ECM) to capture both short-run and long-run dynamics. Unit root tests reveal mixed integration orders, justifying the ARDL framework."
"2026-03-26","Emise","Crossref","https://doi.org/10.1038/s44304-025-00152-w","AbstractAlthough drought is a natural hazard, growing global concern surrounds its increasing frequency and severity due to climate change. Projections indicate that drought conditions are expected to intensify worldwide in the future, and Europe is no exception. Therefore, understanding the pattern and characteristics of future drought is crucial to developing region-specific adaptation strategies to enhance resilience."
"2026-03-26","Emise","Crossref","https://doi.org/10.36922/ajwep026020005","Driven by the goal of mitigating global warming, centralized photovoltaic power stations are developing rapidly. While considering their power generation efficiency, a systematic assessment of their comprehensive impact on the ecosystem is necessary. In this review, the impact and driving factors of photovoltaic power stations on ecosystem composition and greenhouse gas (GHG) emissions are summarized, as well as the planning and management of photovoltaic power stations."
"2026-03-26","Emise","Crossref","https://doi.org/10.1002/gcb4.70013","ABSTRACT Increases in nitrogen (N) emissions during the 20th century resulted in the atmospheric deposition of N leading to nitrogen saturation in several terrestrial ecosystems. The Clean Air Act of 1970 has proven to be among the more effective pieces of environmental legislation, decreasing the level of N deposition throughout the United States. Recent studies suggest a hysteretic model may be an appropriate way to describe such changes, predicting a time lag of varying duration in response to decreased N."
"2026-03-26","Emise","Crossref","https://doi.org/10.64808/engineeringperspective.1813220","In the current work, biodiesel production from safflower oil was executed with modified household home microwave oven. Engine tests were performed at full load and different engine speeds such as 1400, 1800, 2200, 2600 and 3000 rpm. Test engine was operated with diesel and B15 (15% safflower oil biodiesel and 85% diesel blend)."
"2026-03-26","Emise","Crossref","https://doi.org/10.53443/anadoluibfd.1726247","This study examines the Income Inequality and Health Hypothesis (IINH) in an environmental context across 27 OECD countries between 1990 and 2018. The Pooled Mean Group-ARDL (PMG-ARDL) model is employed to assess the joint short- and long-run effects of income inequality and CO₂ emissions on life expectancy (LE), controlling for health expenditure and mortality rates. The results indicate that income inequality significantly reduces life expectancy in the long run, while CO₂ emissions negatively affect LE across both short- and long-term hor..."
"2026-03-26","Emise","Crossref","https://doi.org/10.1021/acs.energyfuels.5c06286",""
"2026-03-26","Emise","Crossref","https://doi.org/10.3390/en19071633","Sustainable economic development involves reducing heavy reliance on fossil energy resources and their associated environmental impacts. The complexity of this task increases significantly in oil-producing countries, given the hydrocarbons’ role in economic growth, GDP, and exports. In such cases, decoupling economic growth, energy consumption and emissions should be achieved gradually to ensure a smooth transition, which will require the development of a reliable approach."
"2026-03-26","Emise","Crossref","https://doi.org/10.5194/acp-26-4215-2026","Abstract. Vapour condensation onto existing aerosol particles is important regarding aerosol health and climate effects. Existing particles can act as carriers for toxic vapours into the human respiratory tract."
"2026-03-26","Emise","Crossref","https://doi.org/10.3390/land15040538","This study is based on time-series land use data of Xinjiang from 2000 to 2022. Using grid tools, bivariate autocorrelation models and other methods, we systematically analyzed the spatiotemporal variation characteristics of land use and ecosystem service value. The results show the following: Firstly, from 2000 to 2022, Xinjiang’s LUCC exhibits differentiated evolution characteristics: cropland, forestland, and built-up land expanded continuously, while the areas of grassland and unused land showed a steady reduction trend, and the area of ..."
"2026-03-26","Emise","Crossref","https://doi.org/10.1007/s10533-026-01319-x",""
"2026-03-26","Emise","Crossref","https://doi.org/10.1007/s41748-026-01067-w","Abstract During the COVID-19 pandemic, partial lockdown measures in Egypt created a natural experiment to assess their impact on toxic polycyclic aromatic hydrocarbons (PAHs) bound to fine particulate matter (PM 2.5 ) in semi-arid regions. While global air quality changes during lockdowns are documented, data on PAH characterization and associated health risks in understudied subtropical North African urban areas remain scarce. This study addresses this gap by examining changes in PAH profiles, sources, and population risks in suburban Giza."
"2026-03-26","Emise","Crossref","https://doi.org/10.63313/epp.9022","To achieve precise planning for Anhui Province’s carbon neutrality pathway, this paper constructs a combined forecasting model using Grey Model (GM (1,1)), exponential smoothing, and ARIMA time series, and aggregates the forecasting results using the inverse of the Mean Absolute Percentage Error (MAPE). Empirical results indicate that the combined forecasting model reduced the average MAPE to 2.49% for the 2005-2022 forecast period, representing a decrease of 4.05%, 1.56%, and 0.58% compared to the average MAPEs of the grey system, exponenti..."
"2026-03-26","Emise","Crossref","https://doi.org/10.1002/sd.70997","ABSTRACT This study applies wavelet quantile correlation (WQC) analysis to examine relationships between CO 2 emissions, GDP, and tourism across 10 major tourist destinations. Findings demonstrate that these relationships vary significantly across countries, quantiles, and time scales. Rapidly industrializing economies (China, Turkey, Mexico, and Thailand) maintain strong positive correlations between GDP and emissions throughout all periods, with tourism exacerbating environmental pressures long‐term."
"2026-03-26","Emise","Crossref","https://doi.org/10.5194/acp-26-4231-2026","Abstract. The origins, spatial distribution, and diffusion mechanisms of aerosols hold practical guiding significance for regional haze governance. The vertical and horizontal fluxes of aerosols serve as effective parameters for assessing the diffusion efficiency of aerosols, but they are less exploited due to insufficient observations."
"2026-03-26","Extrémy","Crossref","https://doi.org/10.1111/nph.71088","SummaryRoots are responsible for soil water uptake, yet little is known about how variation in fine‐root traits relates to whole‐tree water movement, particularly during periods of drought. By combining a 3‐yr dataset monitoring sap flow rates with measures of fine‐root biomass, length, and morphology across 10 tree species, we addressed hypotheses concerning the role of fine‐root system size and morphology in determining tree responses to summer drought as well as potential changes in their relative importance under more severe droughts. Gr..."
"2026-03-26","Extrémy","Crossref","https://doi.org/10.64539/sjcs.v2i2.2026.411","Flooding remains one of the most devastating natural hazards in developing countries, with significant impacts on human lives, infrastructure, and livelihoods. In Nigeria, particularly in Bayelsa State, recurrent flooding events highlight the need for effective and accessible flood risk communication systems. However, existing approaches largely rely on static and non-interactive dissemination channels, limiting timely public engagement and response."
"2026-03-26","Extrémy","Crossref","https://doi.org/10.3390/hydrology13040103","Floods are among the extreme events associated with climate variability in the Lacramarca River basin, located in the department of Ancash, Peru. Meteorological phenomena such as El Niño during the periods 1982–1983 and 1997–1998, as well as the Coastal El Niño in 2017, constitute key reference events that motivated the development of the present study, based on a case study conducted in the area between the rural settlements of Santa Clemencia and Pampadura. This research is based on maximum precipitation data derived from historical climat..."
"2026-03-26","Extrémy","Crossref","https://doi.org/10.64388/irev9i9-1715170",""
"2026-03-26","Extrémy","Crossref","https://doi.org/10.1111/1477-9552.70037","ABSTRACTGrasslands in Central Europe are increasingly affected by droughts, leading to lower hay yields and reduced profits for dairy farmers. The insurance hypothesis suggests that extensively managed, species‐rich grassland is more drought resistant than intensively managed grassland. However, it produces lower yields in non‐drought years, creating a trade‐off between maximising yield and improving stability."
"2026-03-26","Extrémy","Crossref","https://doi.org/10.1007/s41748-026-01097-4",""
"2026-03-26","Extrémy","Crossref","https://doi.org/10.1186/s12870-026-08634-3",""
"2026-03-26","Extrémy","Crossref","https://doi.org/10.1111/pce.70498","ABSTRACT Drought‐induced tree mortality underscores the need for improved physiological models to predict tree responses to water stress. We employed a hysteresis modelling approach analyzing diel water absorption and desorption cycles to understand drought‐induced shifts in physiological thresholds. We applied this approach to sap flow (Js), stem diameter fluctuation (SDF), stem volumetric water content fluctuation (SVWCF), and vapour pressure deficit (VPD), datasets from two throughfall reduction experiments in contrasting ecosystems: a cl..."
"2026-03-26","Extrémy","Crossref","https://doi.org/10.1080/23311932.2026.2639363",""
"2026-03-26","Extrémy","Crossref","https://doi.org/10.3126/gjn.v19i1.92144","This study presents flood hazard mapping and risk assessment using a hydrodynamic simulation in HEC-RAS tool, focusing on a 38 km stretch of the river from Chisapani to the Nepal-India border in the Lower Karnali River Basin (KRB). A time series of daily mean discharge records from the Chisapani gauging station was used for model simulations. Flood magnitudes of 10-, 20-, 50-, and 100- year return periods (YRPs) were estimated using Gumbel’s distribution, with the 100-YRP daily discharge of 20,343 m3/s."
"2026-03-26","Extrémy","Crossref","https://doi.org/10.64388/irev9i9-1715168",""
"2026-03-26","Extrémy","Crossref","https://doi.org/10.1038/s44304-025-00152-w","AbstractAlthough drought is a natural hazard, growing global concern surrounds its increasing frequency and severity due to climate change. Projections indicate that drought conditions are expected to intensify worldwide in the future, and Europe is no exception. Therefore, understanding the pattern and characteristics of future drought is crucial to developing region-specific adaptation strategies to enhance resilience."
"2026-03-26","Extrémy","Crossref","https://doi.org/10.1007/s11069-026-08076-y",""
"2026-03-26","Extrémy","Crossref","https://doi.org/10.1111/plb.70207",""
"2026-03-26","Extrémy","Crossref","https://doi.org/10.3389/fpls.2026.1714253","‘JinYe’ is a different cultivar of Callicarpa bodinieri whose leaves are golden yellow. Drought stress occurs in many regions and has a significant effect on plant development. In this study, the metabolome and transcriptome of C."
"2026-03-26","Extrémy","Crossref","https://doi.org/10.3390/land15040541","Climate change and rapid urbanization are intensifying flood risks in China, particularly in regions with complex terrain and dense populations. Traditional risk assessment methods often lack the flexibility to handle uncertainties in multi-dimensional risk systems. This study proposes a probabilistic flood risk assessment framework integrating Monte Carlo simulation with a composite indicator system from the perspective of disaster system theory."
"2026-03-26","Extrémy","Crossref","https://doi.org/10.3390/environments13040183","The Anastasia River (southern Sakhalin Island) is a key salmon spawning ground, where summer storm floods can drastically alter benthic communities that form the diet of fish. This study assessed the impact of heavy rainfall on the benthic macroinvertebrates in the lower reaches of the river by analyzing taxonomic composition, biomass, and fatty acid (FA) profiles of dominant taxa before and after a flood event. A catastrophic decline in biomass was observed (from 35.7 ± 4.4 g m−2 to 1.74 ± 0.68 g m−2), alongside a significant shift in commu..."
"2026-03-26","Extrémy","Crossref","https://doi.org/10.1111/pce.70474","Summary statement Cotton ( Gossypium hirsutum ) drought sensitivity depends strongly on flowering stage, but stage‐resolved, non‐destructive detection remains limited. Using controlled short‐term droughts imposed at early, mid, or late flowering, we integrated multispectral and hyperspectral canopy phenotyping with physiology and explainable machine learning to identify spectral predictors of metabolic status and recovery. Early and mid‐flowering drought responses were largely recoverable, whereas late‐flowering drought caused the most poten..."
"2026-03-26","Extrémy","Crossref","https://doi.org/10.1007/s40502-026-00928-w",""
"2026-03-26","Extrémy","Crossref","https://doi.org/10.33022/ijcs.v15i2.5077","Meteorological drought is commonly defined as a prolonged deficiency in precipitation relative to the climatological norm for a given region. However, limitations in robustly quantifying and monitoring drought severity continue to impede decision-making across multiple sectors. Conventional tools, have exhibited substantial limitations in terms of accuracy, spatial–temporal resolution, and generalizability."
"2026-03-26","Extrémy","Crossref","https://doi.org/10.1007/s10040-026-03063-w","AbstractThis study examined mountain-front stream recharge to a karst aquifer in the Denver Basin (USA) from 2016 to 2023, a period of minimal water use, using a combination of existing data (geologic maps, borehole drilling and logging records, geophysical surveys, and hydrochemical stream and groundwater data) and new monitoring efforts (stream gauging, near-stream drilling, and water level (WL) instrumentation at stream gauges and monitoring wells). Stream and karst aquifer WLs were jointly analyzed in the context of all data. In a northe..."
"2026-03-26","Extrémy","Crossref","https://doi.org/10.1080/19475705.2026.2649567",""
"2026-03-26","Extrémy","Crossref","https://doi.org/10.1007/s11069-026-08082-0",""
"2026-03-26","Extrémy","Crossref","https://doi.org/10.1371/journal.pone.0345552","Soil moisture is considered a key component for the structural integrity of engineered ecosystems, such as sea dikes. Although plants are important determinants of physical soil properties in dike greening, research lacks on the extent to which greater biodiversity can mitigate soil moisture loss during extreme weather events. This provided the motivation to investigate the influence of two plant communities of different species composition – namely, an herb-dominated vegetation area (‘Mix-Herb’) compared to a grass-dominated area (‘Mix-Gras..."
"2026-03-26","Extrémy","Crossref","https://doi.org/10.1038/s44304-026-00183-x",""
"2026-03-26","Extrémy","Crossref","https://doi.org/10.1007/s11756-026-02168-7",""
"2026-03-26","Extrémy","Crossref","https://doi.org/10.1007/s11069-026-08046-4",""
"2026-03-26","Extrémy","Crossref","https://doi.org/10.3390/plants15071018","Climate warming and drought often co-occur to form warm–dry climate patterns. However, systematic comparative studies of the responses of invasive plants from different families to their combined effects remain limited. We conducted a greenhouse experiment to investigate the interactive effects of warm (normal vs."
"2026-03-26","Klimatická změna","Crossref","https://doi.org/10.1080/00958964.2026.2618249",""
"2026-03-26","Klimatická změna","Crossref","https://doi.org/10.1038/s41467-026-70474-4","AbstractAs climate warming accelerates, shifts in plant phenology are reshaping the functioning and stability of terrestrial ecosystems. While the roles of climatic drivers in shaping phenological responses to warming are well established, the influence of intrinsic plant functional traits remains poorly understood. Here, we combine two complementary approaches through a meta-analysis of 124 field warming experiments and an analysis of long-term phenological monitoring networks (CPON and USA‑NPN) to evaluate phenological responses to warming..."
"2026-03-26","Klimatická změna","Crossref","https://doi.org/10.3390/hydrology13040103","Floods are among the extreme events associated with climate variability in the Lacramarca River basin, located in the department of Ancash, Peru. Meteorological phenomena such as El Niño during the periods 1982–1983 and 1997–1998, as well as the Coastal El Niño in 2017, constitute key reference events that motivated the development of the present study, based on a case study conducted in the area between the rural settlements of Santa Clemencia and Pampadura. This research is based on maximum precipitation data derived from historical climat..."
"2026-03-26","Klimatická změna","Crossref","https://doi.org/10.29303/jrpb.v14i1.1213","Climate change and land degradation threaten global ecology and food security. Biochar, produced via oxygen-limited thermochemical conversion of agricultural waste, offers a multifunctional solution. This narrative review with meta-analysis of quantitative outcomes (2010-2025 literature) synthesizes biochar production techniques, physicochemical properties, and sustainable agriculture applications, demonstrating biochar's critical role in soil health improvement and climate change mitigation."
"2026-03-26","Klimatická změna","Crossref","https://doi.org/10.3138/cpj-25-0040","Background:Health care contributes significantly to greenhouse gas emissions, climate change, and planetary health. While pharmacists are well-placed to address these issues, there is limited information on their views. The objective of the study was to assess the perspectives of pharmacists in British Columbia (BC) and their capacity to mitigate and adapt to climate change."
"2026-03-26","Klimatická změna","Crossref","https://doi.org/10.1111/1477-9552.70037","ABSTRACTGrasslands in Central Europe are increasingly affected by droughts, leading to lower hay yields and reduced profits for dairy farmers. The insurance hypothesis suggests that extensively managed, species‐rich grassland is more drought resistant than intensively managed grassland. However, it produces lower yields in non‐drought years, creating a trade‐off between maximising yield and improving stability."
