"date","keyword","source","link","abstract"
"2026-06-22","global warming","Crossref/Global and Regional Dimensions of International Economic Relations","https://doi.org/10.58861/tae.grdier.2026.10","This study analyzes the role of economic sanctions as a key instrument in contemporary trade wars. It traces their evolution from limited and unsystematic measures in the past to highly specialized mechanisms of geoeconomic influence. The focus is placed on modern forms of sanctions, including financial restrictions, technological controls, and secondary sanctions, which are used to achieve economic and political dominance."
"2026-06-22","global warming","Crossref/Global and Regional Dimensions of International Economic Relations","https://doi.org/10.58861/tae.grdier.2026.03","The primary objective of this study is to analyze the role and effectiveness of the franchising model as a strategy for sustainable development and global expansion within the tourism sector. The research focuses on identifying the specific advantages for franchisors (rapid entry into new markets with low capital risk) and franchisees (access to an established brand, know-how, and marketing support). A comprehensive approach was employed, including a comparative analysis of leading international franchise chains in the hotel and restaurant i..."
"2026-06-22","global warming","Crossref/Global and Regional Dimensions of International Economic Relations","https://doi.org/10.58861/tae.grdier.2026.15","This research analyzes consumer perceptions and brand recognition of Lindor within the competitive landscape of Ferrero Rocher, Merci, and Milka. The primary objective is to evaluate the degree of brand awareness and perceived quality relative to competitors, culminating in the development of a positioning map based on consumer attitudes. The methodology employs a mixed-methods approach: a qualitative spontaneous recall test with five respondents and a quantitative online survey involving 25 participants using a 5-point Likert scale to asses..."
"2026-06-22","global warming","Crossref/Glosains: Jurnal Sains Global Indonesia","https://doi.org/10.59784/glosains.v7i3.756","Background: This research addresses the gap in creating value in wellness gastro tourism through innovation and wellness experiences rooted in Indonesia’s culinary heritage. Objective: This study aims to examine the role of entrepreneurship in creating value through innovation and experiential wellness in the context of wellness gastro tourism. Methods: The study employed a quantitative approach using Partial Least Squares Structural Equation Modeling (PLS-SEM)—selected for its suitability in handling complex latent variable models with non-..."
"2026-06-22","global warming","Crossref/Glosains: Jurnal Sains Global Indonesia","https://doi.org/10.59784/glosains.v7i3.773","Background: Tagetes erecta L. (Gemitir flower) is known to have potential antibacterial activity; however, its use in topical preparations is limited by low solubility and stability. Objective: This study aims to optimize the nanoemulsion formulation of Gemitir flower extract using virgin coconut oil (VCO) as the oil phase, Tween 80 as the surfactant, and PEG 400 as the cosurfactant."
"2026-06-22","global warming","Crossref/Hacettepe Sağlık İdaresi Dergisi","https://doi.org/10.61859/hacettepesid.1785731","Ivan Illich’s theoretical framework is based on the industrialization of modern healthcare and the argument that this process deepens health inequalities. Global pandemics, such as COVID-19, have validated Illich's perspective by clearly exposing the inequalities in access to healthcare. This study aims to re-evaluate the injustices created by global pandemics in healthcare systems from Ivan Illich’s critical perspective."
"2026-06-22","drought","Crossref/Horticulture, Environment, and Biotechnology","https://doi.org/10.1007/s13580-026-00820-4",""
"2026-06-22","climate change","Crossref/Housing Studies","https://doi.org/10.1080/02673037.2026.2679774",""
"2026-06-22","climate change","Crossref/Humanities and Social Sciences Communications","https://doi.org/10.1057/s41599-026-07994-3",""
"2026-06-22","drought","Crossref/Hydrology and Earth System Sciences","https://doi.org/10.5194/hess-30-3715-2026","Abstract. Land use strongly influences water partitioning, water availability, and ecohydrological resilience in drought-sensitive regions. Forest management plays a critical role through its effects on water use, which depends on forest type, forest density, root water uptake, yet the ecohydrological consequences of different forest management strategies – particularly in terms of blue and green water fluxes – remain poorly quantified."
"2026-06-22","global warming","Crossref/Icelandic Review of Politics & Administration","https://doi.org/10.13177/irpa.a.2026.22.1.3","Since its introduction in the presidential address of the International Studies Association’s annual convention in 2014, Global IR has captured a great deal of scholarly attention. While Global IR’s aim – namely, to make the discipline of IR more inclusive and more reflective of its “multiple and diverse foundations” (Acharya 2014, 1) – was generally welcomed as a desirable and necessary development, academics have debated its contributions, critiqued its underlying assumptions, and discussed methods for achieving it for more than a decade. ..."
"2026-06-22","global warming","Crossref/Industrial Relations Journal","https://doi.org/10.1111/irj.70042","ABSTRACTThis paper applies the efficiency, equity and voice (EEV) framework to dispute resolution mechanisms in Brazilian banking, empirically extending it in three ways: separating procedural from accessible equity; recognising collective strategic value beyond individual dispute performance; and treating efficiency‐equity trade‐offs as institutionally contingent, explaining mechanism proliferation as multi‐actor adaptation."
"2026-06-22","global warming","Crossref/Innovative Marketing","https://doi.org/10.21511/im.22(2).2026.25","Type of the article: Research ArticleAbstractInnovative marketing increasingly requires reliable market intelligence signals that reduce uncertainty, support product positioning, and guide venture financing in technology-intensive green and digital markets. This study aims to assess how patent-based technological signals shape innovative market development by predicting the formation and venture financing of green and digital energy start-ups, while also examining whether entrepreneurial market entry and funding stimulate subsequent patentin..."
"2026-06-22","global warming","Crossref/International Journal of Disclosure and Governance","https://doi.org/10.1057/s41310-026-00386-8",NA
"2026-06-22","climate change","Crossref/International Journal of Environment and Climate Change","https://doi.org/10.9734/ijecc/2026/v16i75521","This study assessed ichthyofaunal diversity and selected physicochemical water quality parameters of Dahod Reservoir in Raisen district, Madhya Pradesh, India. The reservoir, constructed in 1958, is used for irrigation and water supply and also supports aquatic biodiversity. Monthly sampling was conducted from December 2025 to April 2026 at four selected sites, namely Bithori, Dahod, Landing Centre and Imaliya Gondi, with the assistance of local fishermen."
"2026-06-22","climate change","Crossref/International Journal of Environment and Climate Change","https://doi.org/10.9734/ijecc/2026/v16i75520","Pea (Pisum sativum L.) is a short-duration legume crop valued for its protein-rich seeds, fodder use and contribution to soil fertility through nitrogen fixation. The present study examined the population dynamics of major insect pests of pea and their association with selected meteorological variables during the rabi season of 2024–25 at Khalsa College, Amritsar, Punjab, India. The experiment was laid out in a randomised block design with thirteen treatments and three replications."
"2026-06-22","climate change","Crossref/International Journal of Environment and Climate Change","https://doi.org/10.9734/ijecc/2026/v16i75522","Rising temperature adversely affects cereal production and threatens global food security. Wheat is highly vulnerable to heat stress, which reduces its growth, development and productivity. A field experiment was conducted during the rabi seasons of 2024–25 and 2025–26 at Bihar Agricultural University, Sabour, to evaluate the effect of heat stress mitigators on wheat growth under different sowing windows."
"2026-06-22","global warming","Crossref/International Journal of Gynecology & Obstetrics","https://doi.org/10.1002/ijgo.71143","AbstractObjectivesThis study examines global and regional trends in maternal mortality (1990–2023) and explores shifts in cause‐specific and age‐specific patterns using the latest Global Burden of Disease (GBD) 2023 data. MethodsWe analyzed maternal deaths and age‐standardized mortality rates (ASMR) globally and across Sociodemographic Index (SDI) and GBD regions. Temporal trends were assessed using estimated annual percentage changes (EAPC)."
"2026-06-22","global warming","Crossref/International Journal of Health Promotion and Education","https://doi.org/10.1080/14635240.2026.2687288",""
"2026-06-22","global warming","Crossref/International Journal of Pure and Applied Sciences","https://doi.org/10.29132/ijpas.1838407","Earthquakes cause severe loss of life and widespread destruction, making accurate magnitude estimation a critical component of disaster management. Although literature contains numerous studies, many rely on a limited set of models or specific data types, thereby failing to provide a comprehensive and holistic comparison between classical machine learning and deep learning approaches. Furthermore, only a limited number of studies evaluate model performance using multiple and diverse error metrics, highlighting the need for a more systematic ..."
"2026-06-22","climate change","Crossref/International Journal of Research in Interdisciplinary Studies","https://doi.org/10.65138/ijris.2026.v4i6.321","Poor academic engagement remains a relevant concern in diverse educational settings. This study examines the contribution of School Climate, Sense of Alienation, and Perceived Religious Discrimination as determinants of Academic Engagement among 105 Senior High School Muslim students. Diagnostic research design, purposive sampling, survey technique, and multiple regression analysis were applied."
"2026-06-22","climate change","Crossref/International Journal of Sustainability in Higher Education","https://doi.org/10.1108/ijshe-07-2025-0770","PurposeThis study aims to investigate the extent to which Mediterranean universities are structurally prepared to deliver climate and environmental change education. It examines the alignment between institutional declarations of commitment and the availability of curricular, faculty and interdisciplinary resources. Design/methodology/approachData were collected from 47 universities in Europe, the Maghreb and the Middle East through a harmonized survey developed under the UNIMED Subnetwork on Climate and Environmental Change."
"2026-06-22","global warming","Crossref/International Journal of Urban Sciences","https://doi.org/10.1080/12265934.2026.2682502",""
"2026-06-22","global warming","Crossref/International Journal of the Sociology of Leisure","https://doi.org/10.1007/s41978-026-00218-7",""
"2026-06-22","global warming","Crossref/International Politics","https://doi.org/10.1057/s41311-026-00786-1",""
"2026-06-22","climate change","Crossref/Journal of ""Social Science:Theory and Practice""","https://doi.org/10.65164/ndz0gc92","The article examines the impact of a child with autism spectrum disorder (ASD) on the emotional and psychological climate of the family. The relevance of the study is due to the increasing prevalence of ASD and the need for a comprehensive understanding of family factors affecting the adaptation of all its members. The emotional reactions of parents, features of intra-family interaction, changes in family role structure, and levels of psychological stress are analyzed."
"2026-06-22","global warming","Crossref/Journal of Applied Phycology","https://doi.org/10.1007/s10811-026-03917-6","AbstractKelp forests are among the most extensive and productive coastal ecosystems, yet they remain underrepresented in global conservation policy despite widespread declines driven by interacting global- (i.e., ocean warming, marine heatwaves) to local-scale stressors. At the same time, kelp conservation and restoration efforts are expanding rapidly across regions, but measures of success and syntheses tend to primarily focus on ecological conditions and trends, not on conservation and restoration actions. To fill this gap, we developed a ..."
"2026-06-22","global warming","Crossref/Journal of Bone and Joint Surgery","https://doi.org/10.2106/jbjs.26.00521",NA
"2026-06-22","global warming","Crossref/Journal of Digital Business and Global Economy","https://doi.org/10.64243/jodigbi.02.3.08","This study takes State Civil Servants (ASN) of the Ministry of Home Affairs of the Republic of Indonesia as its research subjects and aims to verify the impact of workplace counseling on ASN’s job performance, as well as the mediating role of work engagement. It adopts a quantitative explanatory research design, using 50 ASN who participated in the 2025 Counseling Week program as the study sample. Data was collected via Likert-scale questionnaires and analyzed using the partial least squares structural equation modeling tool available in Sma..."
"2026-06-22","climate change","Crossref/Journal of Educational Psychology","https://doi.org/10.1037/edu0001050.supp",""
"2026-06-22","global warming","Crossref/Journal of Global Agriculture and Ecology","https://doi.org/10.56557/jogae/2026/v18i310739","Smallholder farming systems in sub-Saharan Africa, South Asia and Mediterranean environments often operate under simultaneous water limitation and soil nutrient constraints, reducing crop productivity and resource-use efficiency. This review examines how integrated soil-water-plant modelling can support coordinated management of irrigation and fertiliser inputs in low-resource agricultural systems. It focuses on the mechanistic links among soil water movement, nutrient transport, root uptake, crop physiological response and nutrient loss pat..."
"2026-06-22","global warming","Crossref/Journal of Global Responsibility","https://doi.org/10.1108/jgr-04-2025-0107","PurposeIn recent years, there has been a growing trend to understand individuals’ purchase intentions and responsible consumption habits within the framework of the sustainable development goals. However, research on the psychosocial antecedents of sustainable purchase intentions and consumption behaviors remains insufficient. Based on goal-framing theory and the theory of reasoned action, this study aims to examine the effects of hedonic and gain goals, personal attitudes and subjective norms on sustainable purchase intentions and behaviors."
"2026-06-22","climate change","Crossref/Journal of Latin American Studies","https://doi.org/10.1017/s0022216x26101400","AbstractThis article examines the historical process from environmental to climate activism in Chile, showing how it has occupied an intermediate and dynamic position that connects the local and the global, often ahead of national policies. Through an ethnographic approach and a genealogical and historical methodology (reviewing primary newspaper sources and administrative records), complemented by nine in-depth interviews, this research analyses the trajectories, organisations and knowledge of activists in relation to national institutions ..."
"2026-06-22","global warming","Crossref/Journal of Management for Global Sustainability","https://doi.org/10.13185/2244-6893.1324",""
"2026-06-22","global warming","Crossref/Journal of Management for Global Sustainability","https://doi.org/10.13185/2244-6893.1325",""
"2026-06-22","global warming","Crossref/Journal of Management for Global Sustainability","https://doi.org/10.13185/2244-6893.1322",""
"2026-06-22","global warming","Crossref/Journal of Management for Global Sustainability","https://doi.org/10.13185/2244-6893.1323",""
"2026-06-22","global warming","Crossref/Journal of Management for Global Sustainability","https://doi.org/10.13185/2244-6893.1321","This study examines the market channel preferences of traditional rice farmers and traders in Abra, Philippines, and identifies the socio-economic, institutional, and production factors influencing these choices. Using a mixed-methods approach, data were collected from 139 respondents through surveys and 52 qualitative interviews. Logistic regression and thematic analysis were employed to explain market behavior."
"2026-06-22","heatwave","Crossref/Journal of Oceanology and Limnology","https://doi.org/10.1007/s00343-026-6007-6",""
"2026-06-22","climate change","Crossref/Journal of Organizational Change Management","https://doi.org/10.1108/jocm-02-2025-0097","PurposeAiming to deepen understanding of managerial communication strategies that can foster transformational change while enhancing employee wellbeing, we examine whether managers' perspective-taking displays, intended to regulate employees' emotions, mitigate resistance to robotization and we explore the psychological mechanisms underlying this effect. Design/methodology/approachTo test the model, an experimental study was conducted with 203 participants. The collected data were analyzed using the PROCESS macro (Hayes, 2022) to test sequen..."
"2026-06-22","global warming","Crossref/Journal of Robotic Surgery","https://doi.org/10.1007/s11701-026-03592-2",""
"2026-06-22","global warming","Crossref/Journal of Robotic Surgery","https://doi.org/10.1007/s11701-026-03602-3",NA
"2026-06-22","global warming","Crossref/Journal of Robotic Surgery","https://doi.org/10.1007/s11701-026-03599-9",NA
"2026-06-22","global warming","Crossref/Journal of the Knowledge Economy","https://doi.org/10.1007/s13132-026-03362-3",""
"2026-06-22","global warming","Crossref/Journal of the Pediatric Infectious Diseases Society","https://doi.org/10.1093/jpids/piag045","Global health programs are facing unprecedented funding threats. This perspective examines the ramifications of institutional disinvestment on child health and global security, while outlining essential advocacy-driven opportunities to mitigate these risks."
"2026-06-22","global warming","Crossref/Jurnal Inovasi Global","https://doi.org/10.58344/jig.v4i6.543","Penyelesaian sengketa waris adat pada masyarakat Suku Sasak di Lombok merupakan bagian penting dari sistem hukum adat yang masih hidup dan berkembang berdampingan dengan hukum nasional di Indonesia. Penelitian ini bertujuan untuk menganalisis mekanisme penyelesaian sengketa waris adat Suku Sasak serta mengkaji peran lembaga adat dan nilai-nilai budaya dalam menjaga keseimbangan sosial masyarakat. Metode yang digunakan adalah penelitian yuridis empiris dengan pendekatan sosiologis dan normatif, melalui studi literatur serta observasi terhadap..."
"2026-06-22","global warming","Crossref/Jurnal Inovasi Global","https://doi.org/10.58344/jig.v4i6.545","Lingkungan yang penuh tekanan, penolakan, atau minim validasi dapat menimbulkan perasaan rendah diri, kecemasan, dan masalah perilaku pada anak. Penelitian ini bertujuan untuk mengetahui gambaran efikasi diri pada anak usia 6–8 tahun di komunitas Children See Children Do (CSCD) Kota Kupang. Jenis penelitian kualitatif dengan pendekatan deskriptif digunakan dengan melibatkan 9 partisipan yang ditentukan melalui teknik purposive sampling."
"2026-06-22","global warming","Crossref/Jurnal Inovasi Global","https://doi.org/10.58344/jig.v4i6.544","Indonesia sebagai negara kepulauan terbesar di dunia memiliki potensi kelautan yang sangat besar, namun tingkat literasi kelautan (ocean literacy) di kalangan siswa masih tergolong rendah. Kurikulum Merdeka melalui mata pelajaran IPAS terintegrasi membuka peluang untuk memperkenalkan literasi kelautan sejak pendidikan dasar. Penelitian ini bertujuan menganalisis muatan literasi kelautan (ocean literacy) dalam buku teks IPAS kelas V SD Kurikulum Merdeka dari dua sudut pandang, yaitu pedagogik (cara penyajian agar mudah dipahami siswa) dan kur..."
"2026-06-22","climate change","Crossref/Link Medical Journal","https://doi.org/10.61919/gwqes144","Background: Climate-sensitive disease outbreaks are increasingly shaped by rainfall, flooding, water insecurity, heat, sanitation disruption, and vector ecology, but community response also depends on how risk is communicated. Qualitative inquiry is needed to understand how people interpret warnings, assess trust, respond to uncertainty and misinformation, and judge whether recommended protective actions are feasible in everyday conditions. Objective: This study explored community perceptions of risk communication during climate-sensitive di..."
"2026-06-22","global warming","Crossref/National Science Review","https://doi.org/10.1093/nsr/nwag347","AbstractTemperatures could routinely exceed the optimal levels for photosynthesis as global warming intensifies, imposing thermal stress on the productivity of vegetation. We utilised satellite-derived canopy temperature and gross primary productivity (GPP) data from 2003 to 2024 to identify the ecosystem-level optimal canopy temperature (Tcan opt) for global photosynthesis and the extent of any thermal acclimation, which may offset warming impacts. Our findings indicated that across the globe, heat-induced restrictions on global photosynthe..."
"2026-06-22","climate change","Crossref/Nature Climate Change","https://doi.org/10.1038/s41558-026-02657-2",""
"2026-06-22","climate change","Crossref/Nature Climate Change","https://doi.org/10.1038/s41558-026-02670-5","AbstractClimate warming is driving more frequent and intense heat extremes. Yet, changes in heat stress, the leading cause of weather-related mortality, remain poorly quantified at the global scale. Here, using the Universal Thermal Climate Index, we assess heat stress globally since 1950, examining daytime extremes, nocturnal heat and compound daytime–nighttime events, revealing a pronounced, multidimensional intensification."
"2026-06-22","climate extremes","Crossref/Nature Communications","https://doi.org/10.1038/s41467-026-74516-9",""
"2026-06-22","global warming","Crossref/Nature Communications","https://doi.org/10.1038/s41467-026-74157-y",""
"2026-06-22","climate extremes","Crossref/Nature Geoscience","https://doi.org/10.1038/s41561-026-02020-2",""
"2026-06-22","climate change","Crossref/Nature Health","https://doi.org/10.1038/s44360-026-00157-3",""
"2026-06-22","global warming","Crossref/Nature Human Behaviour","https://doi.org/10.1038/s41562-026-02489-2",""
"2026-06-22","global warming","Crossref/Neuroepidemiology","https://doi.org/10.1159/000552994","Objective To synthesize population-based studies of epilepsy prevalence published between 1980 and 2025, estimate pooled global prevalence, characterize regional differences, quantify temporal trends, and examine the influence of study characteristics and development indicators (Human Development Index [HDI] and Socio-demographic Index [SDI]). Methods We systematically searched PubMed, Embase, Web of Science, Scopus, and the Cochrane Library for observational studies published from January 1, 1980 to December 31, 2025. Random-effects meta-an..."
"2026-06-22","global warming","Crossref/New Global Studies","https://doi.org/10.1515/ngs-2026-0026","AbstractSo far, degrowth scholarship remains largely shaped by a form of methodological localism or nationalism that risks reproducing current asymmetric and colonial relations on the global scale. Against this background, our introduction to the forum argues that degrowth can only adequately be theorized through the lens of global (inter)dependencies: structurally reproduced relations of dependence and mutual entanglement that operate across national borders and generate growth imperatives, constrain policy space, and displace ecological an..."
"2026-06-22","climate change","Crossref/Oikos","https://doi.org/10.1002/oik.11677","Climate disruption threatens the persistence of temperature‐sensitive species in many regions. Some species may be able to moderate hyperthermia risk by using cooler subsurface microclimates, a strategy that could afford some level of population resilience. However, such behavioral responses may interact with environmental factors, making it challenging to determine vulnerability."
"2026-06-22","drought","Crossref/Oikos","https://doi.org/10.1002/oik.12061","Although plant diversity is known to enhance community stability to biological invasions, its interaction with environmental stressors remains poorly understood. We examined how drought stress affects the stability of native communities with different levels of plant diversity to invasion, by establishing experimental plant communities (300 plots) across a species richness gradient (1, 2, 4, 8 and 16 species), introducing the invasive herb Symphyotrichum subulatum to half of the communities, and applying three drought treatments (no, moderat..."
"2026-06-22","climate change","Crossref/PLOS Climate","https://doi.org/10.1371/journal.pclm.0000853","Climate education is vital for developing climate solutions that address the Paris Accord and the United Nations Sustainable Development Goals. However, climate education amongst scientists from the Global South is generally lower than their Global North counterparts. Training, capacity development, and access to similar opportunities are necessary but currently insufficient to level the playing field for skills and participation in the advancement of climate science."
