"date","keyword","source","link","abstract"
"2026-06-08","global warming","Crossref/International Review of Education","https://doi.org/10.1007/s11159-025-10201-1","Abstract This article examines how student teachers in a post-disaster context make sense of global citizenship education (GCE) through a combination of Pancasila (an Indigenous philosophy derived from Sanskrit) and citizenship education (together referred to as PPKn) in Aceh Province, Indonesia. This qualitative study involved a group of final-year student teachers (6 male and 2 female) who were undertaking teaching practice as part of their teacher education programme in 2020. Based on semi-structured interview data, the findings suggest t..."
"2026-06-08","climate change","Crossref/Jeomorfolojik Araştırmalar Dergisi","https://doi.org/10.46453/jader.1947415","This study examines shoreline change at Lara Beach, located on the Antalya coast of Türkiye, over the 1984–2025 period using a Google Earth Engine (GEE)-based remote sensing workflow and comparison with the Digital Shoreline Analysis System (DSAS). The main aim is to identify the direction, magnitude, and alongshore spatial variability of long-term shoreline change. The analysis was carried out using Landsat Collection 2 Level 2 Surface Reflectance imagery for seven primary epochs representing 1984, 1990, 2000, 2010, 2015, 2020, and 2025."
"2026-06-08","climate change","Crossref/Journal of Adolescence","https://doi.org/10.1002/jad.70187","ABSTRACTIntroductionIn recent years, millions of adolescents have joined school strikes to demand climate action from governments and industries, standing in solidarity with young people from future generations and from vulnerable geographical regions (i.e., the Global South). The goal of the present study is to explore adolescents' climate activism from a developmental science perspective, analyzing how climate activism may be rooted in adolescents' developing identity and developmentally salient motives. MethodsEleven 14–18‐year‐old Dutch ..."
"2026-06-08","climate change","Crossref/Journal of Advances in Biology & Biotechnology","https://doi.org/10.9734/jabb/2026/v29i64022","Climate change poses an unprecedented challenge to global food security, threatening to undermine decades of agricultural progress through increased temperatures, erratic precipitation patterns, prolonged droughts, and intensified pest and disease pressures. Crop breeding, empowered by transformative advances in genomics, high-throughput phenotyping, and precision biotechnology, has emerged as a cornerstone strategy for developing resilient varieties capable of sustaining productivity under rapidly shifting environmental conditions. This rev..."
"2026-06-08","climate extremes","Crossref/Journal of Advances in Biology & Biotechnology","https://doi.org/10.9734/jabb/2026/v29i64022","Climate change poses an unprecedented challenge to global food security, threatening to undermine decades of agricultural progress through increased temperatures, erratic precipitation patterns, prolonged droughts, and intensified pest and disease pressures. Crop breeding, empowered by transformative advances in genomics, high-throughput phenotyping, and precision biotechnology, has emerged as a cornerstone strategy for developing resilient varieties capable of sustaining productivity under rapidly shifting environmental conditions. This rev..."
"2026-06-08","climate change","Crossref/Journal of Agrarian Change","https://doi.org/10.1111/joac.70095","ABSTRACTWhy have Indonesia's decennial agricultural censuses defined their key unit of analysis, the ‘agricultural household’, differently? How do changes to that category shape knowledge production among those who rely on census data? This paper compares definitions of the agricultural household across seven censuses with international recommendations to show Indonesia's state causes the shifts in meaning endogenously."
"2026-06-08","drought","Crossref/Journal of Agricultural and Food Chemistry","https://doi.org/10.1021/acs.jafc.6c02574",""
"2026-06-08","drought","Crossref/Journal of Applied Informatics Science","https://doi.org/10.65897/jais.v2.i1.87","Water management in rice fields remained a challenge, especially during drought conditions caused by suboptimal manual irrigation systems. Inaccurate timing and water volume often led to insufficient water supply for crops. This study aimed to develop a prototype of an automatic irrigation system based on the Internet of Things using ESP32 and a fuzzy logic method to reduce the risk of drought."
"2026-06-08","climate change","Crossref/Journal of Applied Youth Studies","https://doi.org/10.1007/s43151-026-00219-z","AbstractIn this paper, I explore young people’s diplomatic practices in shaping climate diplomacy through a case study of the United Nations Secretary-General’s Youth Advisory Group on Climate Change. Drawing on interviews with group members and analysis of their digital communication on X, the paper examines how youth navigate the tensions between grassroots activism and institutional diplomacy. While advisory groups provide opportunities for youth inclusion in global climate governance, they also impose constraints shaped by institutional ..."
"2026-06-08","climate change","Crossref/Journal of Climate","https://doi.org/10.1175/jcli-d-25-0436.1","AbstractEast Antarctica experienced two recent heatwaves with no historical precedent, in March 2022 in Wilkes Land (WL), and July–August 2024 in Dronning Maud Land (DML). In this study, a large ensemble of seasonal hindcasts is used with the “UNprecedented Simulated Extremes using ENsembles” (UNSEEN) technique to contextualise these events by determining whether similar or even more extreme events are possible in the current climate. The observed WL March 2022 event was so extraordinary that the anomaly in UNSEEN ensemble’s most extreme eve..."
"2026-06-08","climate change","Crossref/Journal of Climate","https://doi.org/10.1175/jcli-d-25-0589.1","Abstract Optically-thick clouds largely emit thermal radiation at their cloud top temperature across the longwave spectrum. However, the degree to which cloud top temperature dominates outgoing longwave radiation depends on how the clouds share spectral space with Earth’s major greenhouse gases. In this work we leverage analytical models of spectral emission by CO 2 and H 2 O to understand how spectral overlap between gases and clouds impacts the longwave cloud radiative effect (CRE) and cloudy-sky feedbacks."
"2026-06-08","climate extremes","Crossref/Journal of Climate","https://doi.org/10.1175/jcli-d-25-0339.1","AbstractThe Makassar Strait throughflow (MST), the major component of the Indonesian throughflow, exhibited an unprecedented strong northward anomaly in the upper 150 m from January to February of 2017. The anomalous northward MST was associated with two Madden-Julian Oscillation (MJO) events originating in the Indian Ocean. The first MJO successfully traversed the Maritime Continent (MC) to the Pacific Ocean, while the second was impeded."
"2026-06-08","global warming","Crossref/Journal of Dementia and Alzheimer's Disease","https://doi.org/10.3390/jdad3020028","Background: Dementia and Type 2 diabetes (T2D) represent two of the most pressing global public health challenges of our time, both exacerbated by physical inactivity. These conditions disproportionately affect Global Majority populations, who experience earlier onset, higher prevalence, and poorer access to culturally appropriate preventive care. However, conventional research and interventions often overlook the sociocultural and structural factors that underpin this disparity."
"2026-06-08","global warming","Crossref/Journal of Disease and Global Health","https://doi.org/10.56557/jodagh/2026/v19i210693","Pandemics and public health emergencies expose vulnerabilities in healthcare systems, disrupt other sectors that provide essential services, and exacerbate socioeconomic inequalities among populations. This narrative review assesses components of pandemic preparedness, health system resilience, and strategies of recovery from a global health crisis. Lessons from COVID-19 and other previous pandemics—such as the importance of early warning systems, robust surveillance, adaptive workforce deployment, sustainable supply chains, and strong gover..."
"2026-06-08","climate change","Crossref/Journal of Educational Research - EDUCATION","https://doi.org/10.62792/ut.education.v8.i15-16.p3227","The topic of this research paper is the management of changes in primary schools, based on the ""New Concept,"" and the results that have come from these changes. The aim of this research is to explore how much these educational changes have actually achieved the expected results. To investigate the changes that have taken place within the school, focusing on teachers’ work and cooperation with parents, several research tasks need to be carried out: Analysis and review of literature that discusses the importance of accepting changes by teacher..."
"2026-06-08","climate change","Crossref/Journal of Foodservice Business Research","https://doi.org/10.1080/15378020.2026.2683501",NA
"2026-06-08","global warming","Crossref/Journal of Global Ecology and Environment","https://doi.org/10.56557/jogee/2026/v22i310694","Accurately tracking carbon dynamics by sources, sinks, and removals in Malawi’s Land Use, Land-Use Change, and Forestry (LULUCF) sector is critical for understanding the country’s contribution to global greenhouse gas (GHG) balances and for guiding effective climate policy. However, there is little research in Malawi on tracking these gas fluxes (emissions and removals) from their sources and sinks. A study was conducted to track carbon dynamics by sources, sinks, and removals in Malawi’s LULUCF sector for the period 2018-2022."
"2026-06-08","global warming","Crossref/Journal of Global Mobility","https://doi.org/10.1108/jgm-09-2025-0087","PurposeThis study aims to identify the dominant career anchors of French top chefs from Michelin-starred restaurants in France and abroad. Design/methodology/approachBased on surveys and interviews conducted with 14 French chefs from Michelin-starred restaurants between 2023 and 2024, we explore the motivations behind their professional mobility. The data were organized into an integrative set of career anchor categories that synthesize prior research."
"2026-06-08","global warming","Crossref/Journal of Global Optimization","https://doi.org/10.1007/s10898-026-01623-8",""
"2026-06-08","global warming","Crossref/Journal of Global Responsibility","https://doi.org/10.1108/jgr-07-2025-0196","PurposeThis study aims to investigate how firm value (FVA) affects Environment, Social and Governance controversies (ESGC), testing whether strong Environmental, Social and Governance practices (ESGP) and greater gender diversity on corporate boards (BGED) mitigates negative market reactions. Design/methodology/approachUsing a quantitative research approach, this study conducts panel data regressions on a sample of 3,584 observations from companies listed in the STOXX 600 index over the period spanning from 2015 to 2023. FindingsThe results ..."
"2026-06-08","climate change","Crossref/Journal of Historical Linguistics","https://doi.org/10.1075/jhl.24047.ceu","Abstract Semantic change proceeds via an A > A/B (> B) trajectory ( Traugott & Dasher 2002 ). While semantic extension (i.e., A > A/B) is now relatively well-understood, semantic loss (i.e., A/B (>B)) is not. This article argues that the mechanism of semantic extension is a determinant of the likelihood of loss."
"2026-06-08","global warming","Crossref/Journal of Islamic Accounting and Business Research","https://doi.org/10.1108/jiabr-01-2026-0055","PurposeThis paper aims to investigate the bank environmental, social and governance (ESG) performance and profitability relationship by focusing on the heterogeneous response of Islamic and conventional banks to negative ESG-related news. Design/methodology/approachThe analysis uses an unbalanced panel of 547 banks globally from 2000 to 2024 using a two-step system generalized method of moments approach to estimate the impact of ESG and ESG controversies across Islamic and conventional banks. FindingsHigher ESG scores are positively associat..."
"2026-06-08","climate change","Crossref/Journal of Islamic Education Research","https://doi.org/10.35719/jier.v7i2.555","Students' learning motivation can be shaped by the quality of the institutional environment and the leadership figures they encounter daily. Empirical studies that integrate Kiai leadership and institutional climate as simultaneous determinants within a single theoretical framework remain insufficient. This study addresses this gap by simultaneously and partially testing the influence of these two variables on students' learning motivation, grounded in Bandura's Social Cognitive Theory, which asserts that external environmental factors syste..."
"2026-06-08","climate extremes","Crossref/Journal of Islamic Education Research","https://doi.org/10.35719/jier.v7i2.555","Students' learning motivation can be shaped by the quality of the institutional environment and the leadership figures they encounter daily. Empirical studies that integrate Kiai leadership and institutional climate as simultaneous determinants within a single theoretical framework remain insufficient. This study addresses this gap by simultaneously and partially testing the influence of these two variables on students' learning motivation, grounded in Bandura's Social Cognitive Theory, which asserts that external environmental factors syste..."
"2026-06-08","global warming","Crossref/Journal of Management Research and Analysis","https://doi.org/10.18231/j.jmra.23442.1780908625",""
"2026-06-08","climate change","Crossref/Journal of Perinatology","https://doi.org/10.1038/s41372-026-02745-3",""
"2026-06-08","climate change","Crossref/Journal of Political Stability Archive","https://doi.org/10.63468/jpsa.4.3.38","This study focuses on how AI-driven talent analytics (AITA) and ESG-aligned compensation structures (ESGC) affect organizational performance, especially when it comes to sustainability. The researchers collected data from 423 managers and professionals and ran them through partial least squares structural equation modeling (PLS-SEM). They drew from the resource-based view (RBV), the social embeddedness theory (SET) and open systems theory (OST)."
"2026-06-08","climate extremes","Crossref/Journal of Political Stability Archive","https://doi.org/10.63468/jpsa.4.3.38","This study focuses on how AI-driven talent analytics (AITA) and ESG-aligned compensation structures (ESGC) affect organizational performance, especially when it comes to sustainability. The researchers collected data from 423 managers and professionals and ran them through partial least squares structural equation modeling (PLS-SEM). They drew from the resource-based view (RBV), the social embeddedness theory (SET) and open systems theory (OST)."
"2026-06-08","global warming","Crossref/Journal of Spacecraft and Rockets","https://doi.org/10.2514/1.a36637",""
"2026-06-08","climate change","Crossref/Journal of Sustainable Education","https://doi.org/10.71257/jse.v3i1.5274","Bullying is a severe and pervasive global concern that has a detrimental effect on the mental and physical well-being of children. It is an intentional and recurring pattern of hostile behavior targeted others who are considered to be weaker than themselves. Bullying can take in many different forms, each with specific features, including verbal, physical, social, and cyberbullying."
"2026-06-08","flood","Crossref/Journal of the American Chemical Society","https://doi.org/10.1021/jacs.5c15246",""
"2026-06-08","climate change","Crossref/Journalism Studies","https://doi.org/10.1080/1461670x.2026.2684762",NA
"2026-06-08","climate extremes","Crossref/Journalism Studies","https://doi.org/10.1080/1461670x.2026.2684762",""
"2026-06-08","climate change","Crossref/Jurnal Akuntansi, Keuangan, dan Manajemen","https://doi.org/10.35912/jakman.v7i3.6350","Purpose: This study examines how climate-related risk is identified and assessed in financial statement audits and analyzes its implications for auditor independence and professional skepticism within a risk-based auditing framework in regional Public Accounting Firms in Indonesia. Methodology: This qualitative exploratory study was conducted through semi-structured interviews with four auditors from regional Public Accounting Firms in Makassar, Indonesia, each with a minimum of three years of audit experience. Document analyses of Internati..."
"2026-06-08","climate change","Crossref/Land","https://doi.org/10.3390/land15061006","In the highly climate- and ecology-sensitive eastern margin of the Qinghai–Tibet Plateau (QTP), understanding the adaptation behaviors of agro-pastoralists is crucial for reconfiguring human–climate–ecosystem interactions. However, existing studies often overlook the bounded rationality of micro-level decision-makers. Based on behavioral decision theory, this study constructs a “Perception–Capital–Adaptation” analytical framework."
"2026-06-08","climate change","Crossref/Land","https://doi.org/10.3390/land15061010","Under increasing land constraints and food security pressures, understanding the direction of agricultural technological change is essential for improving land use efficiency. This study investigates the regional disparities, distributional dynamics, and spatial convergence of biased technological change in Chinese agriculture. Dagum Gini decomposition is used to identify regional differences and their sources, kernel density estimation examines distributional dynamics, and spatial econometric models test convergence patterns."
"2026-06-08","global warming","Crossref/Letters in Mathematical Physics","https://doi.org/10.1007/s11005-026-02096-2",""
"2026-06-08","climate change","Crossref/Management in Health","https://doi.org/10.5233/1nmg1v74","Ambrosia (Ambrosia artemisiifolia) is an invasive plant with highly allergenic pollen, which spreads rapidly, especially in urban and abandoned agricultural areas.Increasing temperatures and the extension of the warm season favor both the early and prolonged flowering of ambrosia, as well as the production of a greater amount of pollen.Ambrosia is one of the strongest causes of seasonal allergic rhinitis, triggering or worsening: bronchial asthma, allergic conjunctivitis, chronic respiratory problems. [1].The impact on public health consists..."
"2026-06-08","climate change","Crossref/Mathematics","https://doi.org/10.3390/math14122045","This work investigates the complex dynamics of two novel Holling type II predator–prey (PP) models under the impact of climate change and controlled by the Caputo and Caputo–Fabrizio fractional operators. Here, Holling type II and static changes are considered using the first PP model, while the other PP model is considered when periodic changes over time are employed. In the presence of each fractional operator, the stability analysis of all equilibrium states is studied, and the conditions of asymptotically stability are obtained."
"2026-06-08","drought","Crossref/Meteorologica","https://doi.org/10.24215/1850468xe043","El núcleo agrı́cola del sudeste de la Provincia de Córdoba ocupa una región de planicies con aguas subterráneas cercanas a la superficie, capaces de complementar los aportes pluviales en periodos en los que son deficitarios. Este trabajo investiga cómo impactó la última sequı́a 2019-2023 sobre la humedad del suelo superficial, la humedad del suelo en profundidad y el nivel freático, en 8 sitios cercanos a la localidad de Marcos Juárez. Para ello, analizamos observaciones puntuales de nivel freático (NF) y cuatro productos (SMAP-L4, SMOS-L3-L..."
"2026-06-08","climate change","Crossref/Museum Management and Curatorship","https://doi.org/10.1080/09647775.2026.2678164",""
"2026-06-08","climate change","Crossref/Nature Climate Change","https://doi.org/10.1038/s41558-026-02642-9",""
"2026-06-08","climate change","Crossref/Nature Climate Change","https://doi.org/10.1038/s41558-026-02607-y","AbstractThe EU Carbon Border Adjustment Mechanism (CBAM) aims to level carbon-related costs between domestic and foreign producers to avoid carbon leakage. Although most existing CBAM studies focus on country-level or sector-level aggregates, the policy is applied to individual goods, where emissions performance and trade strategies vary widely across producers. Item-level compliance therefore depends on facility-level characteristics, making firm-level analysis critical to understanding actual exposure and early behavioural adjustments."
"2026-06-08","climate extremes","Crossref/Nature Communications","https://doi.org/10.1038/s41467-026-74040-w","AbstractClimate models project that hotspot regions where soil moisture (SM) influences air temperature (T) will shift and strengthen, affecting droughts and heatwaves, yet the mechanisms driving these changes remain uncertain. Here, we use Coupled Model Intercomparison Project Phase 6 output and find divergent regional responses in SM–T coupling to different future emission scenarios during boreal summer. Under the low-end SSP1-2.6 scenario, SM–T coupling expands across all historical hotspots, while under the high-end SSP5-8.5 scenario, wa..."
"2026-06-08","global warming","Crossref/Nature Food","https://doi.org/10.1038/s43016-026-01370-9",""
"2026-06-08","global warming","Crossref/Neurosurgery","https://doi.org/10.1227/neu.0000000000004120",""
"2026-06-08","global warming","Crossref/Orbis Litterarum","https://doi.org/10.1111/oli.70050","Abstract This article examines how contemporary global fiction interrogates the limits of the human through literary form, employing posthuman refusal as its analytical framework. Drawing on Francesca Ferrando's discussions of posthuman refusal as a mode of resisting anthropocentric closure, the study situates refusal as a reading practice attentive to the ways literature suspends human centrality. The argument is further informed by formalist insights (Jameson, Levine), biopolitical theory (Foucault, Agamben, Mbembe), and the instability of..."
"2026-06-08","climate change","Crossref/PLOS Climate","https://doi.org/10.1371/journal.pclm.0000958","While recent studies have advanced our understanding of how heat affects mental health, the underlying mechanisms of this relationship remain fragmented. Previous reviews have emphasized broad and general physiological, psychological, behavioural, and social pathways, often neglecting the heterogeneity of mental disorders in terms of vulnerability and outcomes. We conducted a narrative review to tackle this gap and propose an outcome-oriented framework to better integrate evidence on heat-related mental health risks."
"2026-06-08","global warming","Crossref/PLOS Global Public Health","https://doi.org/10.1371/journal.pgph.0005875","We develop and rigorously analyze a deterministic SEITR (Susceptible–Exposed–Infectious–Treated–Recovered) model that incorporates distancing and treatment interventions to examine the transmission dynamics of tuberculosis. The basic reproduction number ( R0 ) is computed and decomposed to determine the threshold conditions for disease persistence. We propose a next-generation matrix formulation to determine the stability of the disease-free state and demonstrate that tuberculosis dies out whenever R0 < 1."
"2026-06-08","global warming","Crossref/PROSPECTS","https://doi.org/10.1007/s11125-026-09765-z","AbstractUNESCO recently issued a new global report in which it considered a new social contract that updates the organization’s discourse on the teaching profession. This research study therefore pursues two goals: on the one hand, analysis of the discourse in the UNESCO’s two latest reports (1996, 2021), and on the other hand, identification of the role played in them by the main characteristics of teaching. This involved two complementary methodologies: content analysis and critical discourse analysis."
"2026-06-08","global warming","Crossref/Paediatrics & Child Health","https://doi.org/10.1093/pch/pxag032","AbstractThe paediatric health care provider (HCP) plays a pivotal role in the care of children with global developmental delay (GDD) and intellectual developmental disorder (IDD). This role encompasses early detection of developmental concerns, guiding families through the diagnostic process, coordinating care with other HCPs and educators, and ensuring that appropriate interventions are accessed. A comprehensive review of the medical history, completion of a thorough physical assessment, and the initiation of a genomic investigation—dependi..."
"2026-06-08","global warming","Crossref/Paediatrics & Child Health","https://doi.org/10.1093/pch/pxag031","RésuméLes prestataires de soins aux enfants jouent un rôle essentiel auprès des enfants ayant un retard global du développement et un trouble de développement intellectuel. Ce rôle englobe la détection précoce des problèmes de développement, l’orientation des familles tout au long du processus diagnostique, la coordination des soins avec d’autres prestataires de soins aux enfants et avec les enseignants et les mesures pour garantir l’accès aux interventions appropriées. Une évaluation approfondie de l’histoire médicale, un examen physique ap..."
