"date","keyword","source","link","abstract"
"2026-04-02","Emise","Crossref/npj Clean Air","https://doi.org/10.1038/s44407-026-00066-5","Abstract India experiences severe air pollution driven by human activities. The role of anthropogenic chlorine is significant yet underexplored, with its mechanisms poorly understood and impacts largely unquantified, despite its importance in atmospheric oxidation and secondary pollutant formation. Using the GEOS-Chem chemical transport model, we quantify the impact of human-derived chlorine emissions on particulate chloride (pCl − ), particulate matter (PM 2.5 ), ClNO 2 , and O 3 in the boundary layer over India."
"2026-04-02","Emise","Crossref/npj Climate and Atmospheric Science","https://doi.org/10.1038/s41612-026-01376-x","AbstractSynoptic weather systems play a crucial role in transporting moisture to Antarctica. Climate models project significant changes in these systems, including a wintertime intensification and a summertime poleward shift, with implications for Antarctic ice mass balance. Our analysis of CMIP6 model output shows synoptic moisture fluxes across the Antarctic Circle increasing by 2–6% per decade under high-emission scenarios, accounting for 24% of winter and 93% of summer total moisture transport trends."
"2026-04-02","Klimatická změna","Crossref/npj Natural Hazards","https://doi.org/10.1038/s44304-026-00201-y","AbstractIntensifying fire weather extremes increasingly threaten Europe, with recent wildfires linked to human-induced climate change. Yet, little is known about spatially compounding fire danger events—days when multiple regions simultaneously face extreme fire weather—which can trigger widespread fires and potentially overwhelm shared EU firefighting resources, amplifying impacts. Here, we analyse spatially compounding fire danger by combining burned area observations (2001–2015), ERA5-based Fire Weather Index data (1950–2024), and CMIP6 c..."
"2026-04-01","Klimatická změna","Crossref/Allergy","https://doi.org/10.1111/all.70316",NA
"2026-04-01","Emise","Crossref/Atmospheric Pollution Research","https://doi.org/10.1016/j.apr.2026.103007",NA
"2026-04-01","Klimatická změna","Crossref/BMC Pediatrics","https://doi.org/10.1186/s12887-026-06773-y",NA
"2026-04-01","Extrémy","Crossref/BMC Plant Biology","https://doi.org/10.1186/s12870-026-08690-9",NA
"2026-04-01","Emise","Crossref/Batteries","https://doi.org/10.3390/batteries12040125","Autonomous battery electric vehicles (BEVs) have the potential to reshape urban mobility systems, yet their sustainability impacts remain underexplored in Gulf-region cities where traffic dynamics, land-use structures, and environmental conditions differ substantially from Western contexts. This study introduces a Saudi-specific assessment framework that integrates monetised externalities with empirically calibrated traffic dynamics to evaluate how automation influences safety, congestion, land use, emissions, and noise. To the best of our k..."
"2026-04-01","Emise","Crossref/Chemistry & Biodiversity","https://doi.org/10.1002/cbdv.202503669","ABSTRACT To explore the dynamic variation of floral volatile organic compounds (VOCs) in Dendrobium sinense across different flowering stages and their interactions with pollinators, this study analyzed the composition and relative abundance of VOCs during bud, blooming, and aging stages. Floral VOCs were collected using headspace solid‐phase microextraction coupled with gas chromatography‐mass spectrometry (HS‐SPME‐GC‐MS). 22 VOCs from eight classes were identified, with esters and terpenoids as the dominant components."
"2026-04-01","Klimatická změna","Crossref/Climate Dynamics","https://doi.org/10.1007/s00382-025-07972-6",NA
"2026-04-01","Klimatická změna","Crossref/Climate Dynamics","https://doi.org/10.1007/s00382-026-08122-2",NA
"2026-04-01","Klimatická změna","Crossref/Communications Earth & Environment","https://doi.org/10.1038/s43247-026-03446-7",NA
"2026-04-01","Emise","Crossref/ENGINEERING Management","https://doi.org/10.1007/s42524-026-5190-7",NA
"2026-04-01","Klimatická změna","Crossref/Earth Systems and Environment","https://doi.org/10.1007/s41748-026-01142-2",NA
"2026-04-01","Extrémy","Crossref/Earth's Future","https://doi.org/10.1029/2025ef007314","AbstractEffective water resource management under climate change is dependent on reliable modeling of future water availability, yet significant uncertainties remain due to shifting precipitation patterns and limitation in climate modeling. This study investigates a multiple‐lines‐of‐evidence approach aimed at reducing the uncertainty in projections of streamflow, specifically focusing on extreme flood events as proxies for total annual flows. Using subdaily rainfall‐runoff models calibrated for four climatically diverse Australian catchment..."
"2026-04-01","Klimatická změna","Crossref/Earth's Future","https://doi.org/10.1029/2025ef007314","AbstractEffective water resource management under climate change is dependent on reliable modeling of future water availability, yet significant uncertainties remain due to shifting precipitation patterns and limitation in climate modeling. This study investigates a multiple‐lines‐of‐evidence approach aimed at reducing the uncertainty in projections of streamflow, specifically focusing on extreme flood events as proxies for total annual flows. Using subdaily rainfall‐runoff models calibrated for four climatically diverse Australian catchment..."
"2026-04-01","Emise","Crossref/Economic Modelling","https://doi.org/10.1016/j.econmod.2026.107610",NA
"2026-04-01","Extrémy","Crossref/Ecosphere","https://doi.org/10.1002/ecs2.70600","AbstractInner Mongolia, situated in an arid and semiarid region, is characterized by a fragile ecological environment heavily impacted by frequent and intense droughts. The accurate assessment of ecological drought and identification of its drivers are crucial for drought disaster management in this area. In this study, we propose a novel ecological drought index, the kernel temperature vegetation drought index (kTVDI), which refines the traditional temperature vegetation drought index (TVDI) by incorporating the kernel normalized difference..."
"2026-04-01","Emise","Crossref/Environment, Development and Sustainability","https://doi.org/10.1007/s10668-026-07578-w",NA
"2026-04-01","Klimatická změna","Crossref/Environmental Education Research","https://doi.org/10.1080/13504622.2026.2648640",NA
"2026-04-01","Extrémy","Crossref/Environmental Research Letters","https://doi.org/10.1088/1748-9326/ae5a4b","AbstractThe rising frequency, intensity, and persistence of temperature and dry-climate extremes such as heatwaves, very hot days and nights, and prolonged dry spells, pose significant challenges to ecosystems and human well-being. Accurately characterizing these extremes is crucial for informing watershed management strategies aimed at building ecosystem resilience and guiding sustainable water resource planning. This study addresses a critical knowledge gap by examining how Climate Extreme Indices (CEIs) influence fractional evapotranspira..."
"2026-04-01","Klimatická změna","Crossref/Environmental Research Letters","https://doi.org/10.1088/1748-9326/ae5a4a","AbstractHydroclimatic extremes such as droughts cause significant anomalies in the global carbon cycle, e.g., via reductions in ecosystem gross primary production (GPP), and hamper the storage capacity of the terrestrial carbon sink. At the same time, across snow covered ecosystems, plant-water availability is often dependent on the snowpack melt during spring and summer. Snow droughts, i.e., anomalous reductions in the amount of water stored in the snowpack, represent an emerging hydroclimatic extreme for these ecosystems."
"2026-04-01","Klimatická změna","Crossref/Environmental Science & Technology","https://doi.org/10.1021/acs.est.6c00494",NA
"2026-04-01","Emise","Crossref/Environmental Science and Pollution Research","https://doi.org/10.1007/s11356-026-37697-w",NA
"2026-04-01","Emise","Crossref/Environmental and Resource Economics","https://doi.org/10.1007/s10640-025-01057-y",NA
"2026-04-01","Emise","Crossref/Environments","https://doi.org/10.3390/environments13040190","This study assesses long-term structural changes in greenhouse gas (GHG) intensity across 38 OECD member countries over the period of 2000–2020 using a multidimensional Z-score standardization framework. GHG intensity was measured using three activity-based indicators—emissions per unit of land area, per capita emissions, and emissions per unit GDP—which were then aggregated into a Composite GHG Intensity Score (GHGIS) to facilitate cross-country comparison while accounting for differences in territorial scale, demographic structure, and eco..."
"2026-04-01","Klimatická změna","Crossref/Environments","https://doi.org/10.3390/environments13040189","Sustainable water use behavior in households is a crucial component in facing the impacts of climate change on water conditions, especially in urban areas and their surroundings in countries like Indonesia. This study examines household water use behavior in urban and peri-urban areas of Surabaya and Sidoarjo in Indonesia by integrating environmental spatial characteristics and using psycho-social factors. This research methodology includes statistical analysis with the aim of examining the variable in relation to household water behavior an..."
"2026-04-01","Emise","Crossref/Eurasian Journal of Ecology","https://doi.org/10.26577/eje86120265","Karaganda, one of the most heavily polluted industrial cities worldwide, experiences severe air quality challenges due to emissions from coal mining, metallurgical industry and coal-fired power plants. This study investigates the influence of meteorological parameters on PM₂.₅ concentrations and associated air pollution episodes in Karaganda, Central Kazakhstan, using a monthly dataset spanning 2017–2024. The meteorological parameters including temperature (°C), relative humidity (%), atmospheric pressure (hPa), wind speed (m/s) and pollutan..."
"2026-04-01","Extrémy","Crossref/Frontiers in Built Environment","https://doi.org/10.3389/fbuil.2025.1751381","Flooding is a problem that causes losses, so efforts to solve flood problems are efforts to minimize losses. To reduce the losses caused as much as possible, there are several approaches to overcome losses through incident management and its impacts. The purpose of this study is to investigate variations in water levels in the Ogan Ilir Watershed in order to monitor fluctuations in water levels to prevent current and future flood problems."
"2026-04-01","Extrémy","Crossref/Frontiers in Plant Science","https://doi.org/10.3389/fpls.2026.1753761","Drought stress severely limits maize germination and early seedling growth by reducing germination percentage, seedling vigor, water uptake, and biomass, while prolonging mean germination time. This study evaluated the ameliorative effects of seed priming with gibberellic acid (GA 3 ) and melatonin on 10 maize genotypes (CLO 2450, DHM 117, SML 1, VQL 1, SKM 1, SML 2, LM 13, SML 163, SML 165, and SML 28) under 10% PEG-induced osmotic stress. Germination traits, water relations, biomass accumulation, and biochemical parameters, including α-amy..."
"2026-04-01","Klimatická změna","Crossref/Frontiers in Sociology","https://doi.org/10.3389/fsoc.2026.1743306","Climate change is an urgent issue that experts across disciplines and borders have been attempting to bring to the forefront of public discussion for decades. Understanding the socio-political and ideological factors influencing public perspectives on climate change has become critical in modernity, where reflexivity—the vigilance and response to environmental risk—and its counterforce, anti-reflexivity, shape how individuals and institutions react to climate change. There has been little synthesis of the empirical literature on reflexivity ..."
"2026-04-01","Klimatická změna","Crossref/GeoJournal","https://doi.org/10.1007/s10708-026-11625-4",NA
"2026-04-01","Extrémy","Crossref/Humanitarian and Natural Sciences Journal","https://doi.org/10.53796/hnsj74/2",NA
"2026-04-01","Klimatická změna","Crossref/ICES Journal of Marine Science","https://doi.org/10.1093/icesjms/fsag033","AbstractClimate change and the associated changes in environmental conditions are major challenges for sustainable fisheries management. Scientific advice needs to take modifications in stock productivity into account to safeguard healthy stocks, and to secure viable fisheries, which provide economic and social benefits. We include temperature-dependent stock-recruitment relationships into an ecological-economic multispecies optimization model for major Western Baltic fisheries."
"2026-04-01","Extrémy","Crossref/ISPRS International Journal of Geo-Information","https://doi.org/10.3390/ijgi15040148","Given the increasing frequency and intensity of floods, which are mostly caused by continuous climate change and growing human pressures on the environment, accurately identifying areas that are susceptible to flooding is a crucial priority for risk reduction and long-term land use planning. Thus, this research examines multilevel flood susceptibility mapping across North Macedonia, using 328 past flood occurrences, 14 conditioning variables derived from a digital elevation model, simplified lithology, and calculated direct runoff. The metho..."
"2026-04-01","Klimatická změna","Crossref/ISPRS International Journal of Geo-Information","https://doi.org/10.3390/ijgi15040148","Given the increasing frequency and intensity of floods, which are mostly caused by continuous climate change and growing human pressures on the environment, accurately identifying areas that are susceptible to flooding is a crucial priority for risk reduction and long-term land use planning. Thus, this research examines multilevel flood susceptibility mapping across North Macedonia, using 328 past flood occurrences, 14 conditioning variables derived from a digital elevation model, simplified lithology, and calculated direct runoff. The metho..."
"2026-04-01","Emise","Crossref/International Journal Of Community Medicine And Public Health","https://doi.org/10.18203/2394-6040.ijcmph20261006","Background: Ambient air pollution is a growing public health concern, especially in low- and middle-income countries, where healthcare workers may be exposed despite operating in clinical environments. Sources such as generator fumes and vehicle emissions can contribute to chronic respiratory symptoms among hospital staff. Methods: A descriptive cross-sectional survey was conducted among 332 healthcare workers selected through stratified random sampling."
"2026-04-01","Extrémy","Crossref/International Journal of Disaster Risk Science","https://doi.org/10.1007/s13753-026-00713-1","Abstract Exposed built-up land in flood areas is a vital indicator determining flood losses. It potentially changes in the context of rapid urbanization and climate change particularly in hotspot countries like China. However, a comprehensive understanding of the spatiotemporal patterns of flood extent and exposed built-up lands is hampered due to limited information of historical floods."
"2026-04-01","Klimatická změna","Crossref/International Journal of Disaster Risk Science","https://doi.org/10.1007/s13753-026-00713-1","Abstract Exposed built-up land in flood areas is a vital indicator determining flood losses. It potentially changes in the context of rapid urbanization and climate change particularly in hotspot countries like China. However, a comprehensive understanding of the spatiotemporal patterns of flood extent and exposed built-up lands is hampered due to limited information of historical floods."
"2026-04-01","Klimatická změna","Crossref/International Journal of Environment and Climate Change","https://doi.org/10.9734/ijecc/2026/v16i45379","Climate change has emerged as one of the most pressing global challenges with several stresses on goats impacting them directly and indirectly. The sustainability of goat farming depends on farmer’s knowledge of the changing climate. The current study was conducted to assess the knowledge level of goat farmers’ on climate change and its association with selected socio-economic variables."
"2026-04-01","Extrémy","Crossref/International Journal of Science, Strategic Management and Technology","https://doi.org/10.55041/ijsmt.v2i3.412","Floods pose a critical threat to human life, infrastructure and the economic stability. Old ways of predicting floods use maps that don't change and reports that come in late which makes them not very helpful for making quick decisions and sending out early warnings.To make predicting floods we created a new system that uses information about the land past rainfall and river flows along with special computer programs and maps to create detailed flood risk zones. This system gets information from satellites and river sensors in almost real-ti..."
"2026-04-01","Extrémy","Crossref/Iraqi National Journal of Earth Science (INJES)","https://doi.org/10.33899/injes.v26i2.56088","The research deals with hydraulic modeling processes to understand the behavior of rivers by creating a simulation system for river flow. This research aims to model the Diyala River flood wave in the city of Baqubah to determine the risk areas and their risk degrees. A scientific methodology is used based on quantitative analysis and computer programming, using flood wave data for the years 1988 and 2019."
"2026-04-01","Klimatická změna","Crossref/Island Studies Journal","https://doi.org/10.24043/001c.159184","Many reports of low-lying islands dealing with climate change impacts presume that forced migration is the expected and inevitable response, leading to the theorization of climate migration (sometimes termed ‘climigration’) for islanders. In reality, islanders tend to express a preference for staying in their homes and adapting, as demonstrated by Maldives. Through a longitudinal study involving on-site research in 2013, 2017, and 2023, we conducted 38 interviews with 25 Maldivian leaders."
"2026-04-01","Extrémy","Crossref/Journal of African Earth Sciences","https://doi.org/10.1016/j.jafrearsci.2026.106130",NA
"2026-04-01","Extrémy","Crossref/Journal of Degraded and Mining Lands Management","https://doi.org/10.15243/jdmlm.2026.132.10165","This study presents an integrated approach for flood risk zonation using Geographic Information Systems (GIS), which combines spatial multi-criteria analysis (MCDA) with the Group Fuzzy Analytic Hierarchy Process (GFAHP) and fuzzy overlay techniques. Nine flood-influencing factors were considered, namely Digital Elevation Model (DEM), Slope, Normalized Difference Vegetation Index (NDVI), Horizontal Overland Flow Distance (HOFD), Vertical Overland Flow Distance (VOFD), Topographic Position Index (TPI), Topographic Wetness Index (TWI), Curve N..."
"2026-04-01","Extrémy","Crossref/Journal of Environmental Management","https://doi.org/10.1016/j.jenvman.2026.129522",NA
"2026-04-01","Emise","Crossref/Journal of Global Entrepreneurship Research","https://doi.org/10.1007/s40497-026-00522-2",NA
"2026-04-01","Extrémy","Crossref/Journal of Hydrology","https://doi.org/10.1016/j.jhydrol.2026.135433",NA
"2026-04-01","Emise","Crossref/Journal of Logistics, Informatics and Service Science","https://doi.org/10.33168/jliss.2026.0406",NA
"2026-04-01","Emise","Crossref/Journal of Petroleum Technology","https://doi.org/10.2118/0426-0010-jpt","_This article, written by JPT Technology Editor Chris Carpenter, contains highlights of paper SPE 225131, “From Emissions to Revenue: Emissions Reduction and Hydrocarbon Recovery From Permeate Through Acid-Gas-Removal Unit Optimization and Synergizing of Upstream and Downstream Processes,” by Ariff S. Ismail, Elmi B. Ismail, and Haslina Abdullah, SPE, Petronas, et al."
"2026-04-01","Extrémy","Crossref/Journal of Plant Physiology","https://doi.org/10.1016/j.jplph.2026.154766",NA
"2026-04-01","Klimatická změna","Crossref/Journal of the Civil Engineering Forum","https://doi.org/10.22146/jcef.18841","The increase in global temperature has caused climate change, resulting in changes in the distribution of rainfall patterns, seasonal shifts, changes in water availability, and water scarcity. At present, water scarcity in Semajid watershed in Pamekasan Regency is increasing with climate change. Water scarcity will be increasingly difficult to predict due to highly complex dynamics of atmospheric circulation and local climate phenomena such as El Niño-Southern Oscillation (ENSO)."
"2026-04-01","Klimatická změna","Crossref/Medical Science Monitor","https://doi.org/10.12659/msm.953550",NA
"2026-04-01","Extrémy","Crossref/Modeling Earth Systems and Environment","https://doi.org/10.1007/s40808-026-02779-8","AbstractUrban flood events pose significant risks to pedestrian safety. Analyzing pedestrian stability, during those events, enables the correlation of hazard levels with flood dynamics, which helps to identify critical areas and suggest evacuation routes. The present study introduces a novel approach for determining instability-thresholds for pedestrians during urban flooding."
"2026-04-01","Klimatická změna","Crossref/Molecular & Cellular Toxicology","https://doi.org/10.1007/s13273-026-00617-7",NA
"2026-04-01","Klimatická změna","Crossref/National Journal of Medical Research","https://doi.org/10.55489/njmr.160220261344",NA
"2026-04-01","Extrémy","Crossref/Natural Hazards","https://doi.org/10.1007/s11069-025-07751-w","AbstractDrought is among the most severe hydro-meteorological events, and it is expected to become even more critical and recurrent in multiple regions worldwide. The availability of hydrological information months ahead is crucial for developing effective early warning strategies, which often remain focused on meteorological drought, and to support effective adaptation programs and enhanced preparedness. The Copernicus Emergency Management System (CEMS) provides seasonal ensemble forecasts of river discharge based on the LISFLOOD hydrologic..."
"2026-04-01","Emise","Crossref/Nature","https://doi.org/10.1038/d41586-026-00931-z",NA
"2026-04-01","Emise","Crossref/Nature Climate Change","https://doi.org/10.1038/s41558-026-02597-x",NA
"2026-04-01","Klimatická změna","Crossref/PLOS Climate","https://doi.org/10.1371/journal.pclm.0000887","Climate change is increasing the frequency and severity of emergencies such as floods and fires, worldwide. These events disproportionally affect equity deserving groups and are becoming a growing driver of social inequity. Emergency management (EM) governance shapes how these groups experience emergencies and their aftermath."
"2026-04-01","Klimatická změna","Crossref/PLOS Climate","https://doi.org/10.1371/journal.pclm.0000813","Climate change poses serious risks to coastal livelihoods and marine ecosystems. Ghana’s artisanal fisheries sector is vital for food security and employment, yet fisherfolk’s climate adaptation awareness remains understudied. The mixed research methodologies were adopted in this study."
"2026-04-01","Klimatická změna","Crossref/PLOS Climate","https://doi.org/10.1371/journal.pclm.0000874","Community engagement is central to building climate resilience, yet participation varies across social groups and places. In this study we examined predictors of willingness to engage in community-level climate resilience activities in Israel, emphasizing gaps across ethnic and residential contexts. Data were drawn from a national survey of adults (n = 1,492) with hyper-representation of vulnerable populations."
"2026-04-01","Klimatická změna","Crossref/PLOS One","https://doi.org/10.1371/journal.pone.0342400","Soybeans and oilseed rape are the main oil crops in China. Assessing the potential geographical distributions of soybean and oilseed rape in China under global warming trends can provide a scientific basis for agricultural production. In this study, 19 climate factors were used as environmental settings based on the MaxEnt model, and the dominant factors were screened and analyzed to predict the potential distributions of soybean and oilseed rape under three climate scenarios of shared socio-economic pathways (SSP) in simulated historical an..."
"2026-04-01","Klimatická změna","Crossref/Pediatric Clinics of North America","https://doi.org/10.1016/j.pcl.2026.02.001",NA
"2026-04-01","Extrémy","Crossref/Plant Science","https://doi.org/10.1016/j.plantsci.2026.113123",NA
"2026-04-01","Extrémy","Crossref/Plant and Soil","https://doi.org/10.1007/s11104-026-08499-3","AbstractBackground and Aims Climate change is posing a major threat to global agricultural productivity. Plant growth-promoting bacteria (PGPB) have emerged as sustainable tools to enhance crop tolerance to abiotic stress through different mechanisms. This study aimed to evaluate the physiological, biochemical, and transcriptomic responses of the Altoandina oat variety ( Avena sativa AV25T) under water deficit and to determine the effectiveness of PGPB inoculation."
"2026-04-01","Klimatická změna","Crossref/Plant and Soil","https://doi.org/10.1007/s11104-026-08499-3","AbstractBackground and Aims Climate change is posing a major threat to global agricultural productivity. Plant growth-promoting bacteria (PGPB) have emerged as sustainable tools to enhance crop tolerance to abiotic stress through different mechanisms. This study aimed to evaluate the physiological, biochemical, and transcriptomic responses of the Altoandina oat variety ( Avena sativa AV25T) under water deficit and to determine the effectiveness of PGPB inoculation."
"2026-04-01","Extrémy","Crossref/Protoplasma","https://doi.org/10.1007/s00709-026-02191-0",NA
