"date","keyword","source","link","abstract"
"2026-04-08","Klimatická změna","OpenAlex","https://doi.org/10.5281/zenodo.18909243","Climate Change And Governance In Kogi State, Nigeria (1999–2023)"
"2026-04-08","Klimatická změna","OpenAlex","https://doi.org/10.5281/zenodo.18909244","Climate Change And Governance In Kogi State, Nigeria (1999–2023)"
"2026-04-08","Klimatická změna","OpenAlex","https://doi.org/10.5281/zenodo.18909847","Climate Change And Integrating Artificial Intelligence (Ai) As A Useful Tool In Teaching And Learning Among Biology Education Students Academic Performance At Federal University Lokoja, Kogi State"
"2026-04-08","Klimatická změna","OpenAlex","https://doi.org/10.5281/zenodo.18909848","Climate Change And Integrating Artificial Intelligence (Ai) As A Useful Tool In Teaching And Learning Among Biology Education Students Academic Performance At Federal University Lokoja, Kogi State"
"2026-04-08","Klimatická změna","OpenAlex","https://doi.org/10.5281/zenodo.18909951","Climate Change And Integrating Artificial Intelligence (Ai) As A Useful Tool In Teaching And Learning Among Biology Education Students Academic Performance At Federal University Lokoja, Kogi State"
"2026-04-08","Klimatická změna","OpenAlex","https://doi.org/10.5281/zenodo.18908766","Indigenous Traditional Ecological Knowledge as a Response to Climate Change and Conflict Mitigation in Tivland, Benue State, Nigeria"
"2026-04-08","Klimatická změna","OpenAlex","https://doi.org/10.5281/zenodo.18908767","Indigenous Traditional Ecological Knowledge as a Response to Climate Change and Conflict Mitigation in Tivland, Benue State, Nigeria"
"2026-04-08","Klimatická změna","The Guardian World","https://www.theguardian.com/australia-news/live/2026/apr/08/ben-roberts-smith-court-anthony-albanese-labor-angus-taylor-matt-canavan-liberal-national-coalition-fuel-prices-oil-crisis-iran-war-ntwnfb","Follow updates liveGet our breaking news email, free app or daily news podcastCyclone-hammered reefs can take many years to recover, study findsStorm-ravaged coral reefs might never have the years required to recover if tropical cyclones become more intense and frequent due to climate change, marine researchers say. Continue reading..."
"2026-04-07","Klimatická změna","Nature Climate","https://www.nature.com/articles/s41558-026-02602-3","Nature Climate Change, Published online: 07 April 2026; doi:10.1038/s41558-026-02602-3Meeting global temperature targets requires deep mitigation across sectors. Moving away from cost optimality when allocating mitigation by sector, the authors link integrated assessment models and portfolio analysis to identify and balance trade-offs between Sustainable Development Goal indicators."
"2026-04-07","Klimatická změna","Nature Climate","https://www.nature.com/articles/s41558-026-02611-2","Nature Climate Change, Published online: 07 April 2026; doi:10.1038/s41558-026-02611-2Lessons from the International Court of Justice Advisory Opinion for Indigenous rights"
"2026-04-07","Emise","OpenAlex","https://doi.org/10.4271/2026-01-0321","Achieving Euro 7 WHSC NOx Emission Targets from a Spark Ignited Engine Using Methanol-Hydrogen Co-Fuelling"
"2026-04-07","Emise","OpenAlex","https://doi.org/10.4271/2026-01-0419","Assessing Energy Use, Cost, and Emissions of Small Regional Rail Vehicles: Methodology and Case Study on a German Track"
"2026-04-07","Emise","OpenAlex","https://doi.org/10.4271/2026-01-0457","Cradle-To-Grave Assessment of Austrian Passenger Car Traffic based on Actual Vehicle Movements and Derivation of Future Forecasts for Minimising Greenhouse Gas Emissions"
"2026-04-07","Emise","OpenAlex","https://doi.org/10.4271/2026-01-0333","Effect of Passive Pre-Chamber Geometry on Performance and Emissions of a Single-Cylinder Natural Gas Large Bore Engine"
"2026-04-07","Emise","OpenAlex","https://doi.org/10.4271/2026-01-0304","Effect of Renewable Fuel Blends on Particulate Emissions in Warm-Up Conditions in a GDI Engine"
"2026-04-07","Emise","OpenAlex","https://doi.org/10.5281/zenodo.19445902","Projected amplification of global warming by warming-induced greenhouse gas emissions"
"2026-04-07","Emise","OpenAlex","https://doi.org/10.5281/zenodo.19445903","Projected amplification of global warming by warming-induced greenhouse gas emissions"
"2026-04-07","Extrémy","OpenAlex","https://doi.org/10.1016/j.ejrh.2026.103418","Climate change overrides population dynamics in driving flood exposure in the Yangtze River Basin"
"2026-04-07","Extrémy","OpenAlex","https://doi.org/10.1016/j.agwat.2026.110320","Does irrigation modernization enhance drought performance? Evidence from a qualitative comparative analysis"
"2026-04-07","Klimatická změna","OpenAlex","https://doi.org/10.1016/j.ejrh.2026.103418","Climate change overrides population dynamics in driving flood exposure in the Yangtze River Basin"
"2026-04-07","Klimatická změna","The Guardian World","https://www.theguardian.com/society/ng-interactive/2026/apr/08/world-held-hostage-reliance-fossil-fuels-health-christiana-figueres","Exclusive: Former UN climate chief to co-chair Lancet Commission examining how sea-level rise is reshaping health, wellbeing and inequalityWhat are the health impacts of sea-level rise, and who should pay?Christiana Figueres: Sea-level rise is a health crisis and we must hold polluters accountableCountries are being “held hostage” by their reliance on fossil fuels, a former UN climate chief has warned, describing the health impacts of climate change as “the mother of all injustices”.Christiana Figueres, an international climate negotiator wh..."
"2026-04-07","Emise","arXiv","https://arxiv.org/abs/2604.05392v1","An accurate polarization calibration is essential for a spectral data analysis and Zeeman splitting measurements. Two anomalies challenge our understanding of OH megamasers in IRAS 02524+2046: an unexplained 1667/1665 MHz flux-ratio deviation, and complex Stokes V signatures. Well-calibrated sensitive polarization observations are required to understand them."
"2026-04-07","Emise","arXiv","https://arxiv.org/abs/2604.05406v1","The stability of binary mass transfer is a critical problem for binary evolution. We systematically calculate the adiabatic mass-loss model for naked helium stars with masses ranging from 10\,$M_{\odot}$ to 80\,$M_{\odot}$ to study the critical mass ratio ($q_\textrm{crit}$) of Wolf-Rayet binaries. We set up two prescriptions about Wolf-Rayet stellar wind and consider the isotropic re-emission effect during adiabatic mass loss."
"2026-04-07","Emise","arXiv","https://arxiv.org/abs/2604.05879v1","In this short comment, I discuss the relationship between the results presented in arXiv:2512.01403 and those previously published in Phys.~Rev.~D~101,~083011~(2020). The 2020 study provides a full Monte Carlo simulation of cosmic-ray interactions with the solar atmosphere using the FLUKA code, including realistic solar-atmosphere models, PFSS/Parker/BIFROST magnetic-field configurations, and predictions for gamma rays, electrons, positrons, neutrons, and neutrinos. Given the substantial scientific overlap -- particularly in the modelling of..."
"2026-04-07","Emise","arXiv","https://arxiv.org/abs/2604.05663v1","Traffic signal control (TSC) is a core component of intelligent transportation systems (ITS), aiming to reduce congestion, emissions, and travel time. Recent approaches based on reinforcement learning (RL) and large language models (LLMs) have improved adaptivity, but still suffer from limited interpretability, insufficient interaction data, and weak generalization to heterogeneous intersections. This paper proposes CuraLight, an LLM-centered framework where an RL agent assists the fine-tuning of an LLM-based traffic signal controller."
"2026-04-07","Emise","arXiv","https://arxiv.org/abs/2604.05823v1","We investigate the light statistics of an ensemble of independent motionless two-level atoms in a product state. We identify the conditions under which the cold atomic ensemble emits thermal light statistics characterized by the Gaussian Moment Theorem. For the theorem to hold, we derive for each correlation order two conditions on the atom number and the ratio of coherent to incoherent light emission."
"2026-04-07","Emise","arXiv","https://arxiv.org/abs/2604.05990v1","Direct Air Carbon Capture and Storage (DACCS) can mitigate hard-to-abate emissions, e.g. from transport or industry. However, there is a wide variety of cost estimates for DACCS, driven, to a significant extent, by differences in electricity cost."
"2026-04-07","Emise","arXiv","https://arxiv.org/abs/2604.06051v1","The discovery of topological phases has introduced a new dimension to materials science. Three-dimensional (3D) topological insulators (TIs) are a remarkable class of matter that is insulating in the bulk while hosting conductive topological surface states (TSSs) with unique charge and spin properties. High-order harmonic generation (HHG) has emerged as a powerful tool to probe condensed matter systems by providing insights into their electronic structure and dynamic behavior."
"2026-04-07","Emise","arXiv","https://arxiv.org/abs/2604.05576v1","Extremely high-peaked BL Lac objects - also named extreme blazars - are among the most energetic and persistent extragalactic accelerators in the Universe, defined by a synchrotron emission peaking above $10^{17}$ Hz in X-rays. Such emission is then reprocessed and produces radiation extending deeply into very-high-energy (VHE, energy E>100 GeV) gamma rays. Observations in this energy band - optimally investigated by the Imaging Air-Shower Cherenkov telescopes - are crucial for probing the physical processes that drive their extreme behavior."
"2026-04-07","Emise","arXiv","https://arxiv.org/abs/2604.05471v1","Extragalactic jets exhibit a wide range of propagation orientations relative to the host galaxy's principal axis. This study investigate the spatiotemporal evolution of jets as a function of their propagation direction within their triaxial hosts-introducing varying degrees of environmental hindrance-and as a function of internal jet properties (while maintaining identical jet power)-introducing varying collimation and thrust. Observational data on extended radio sources are re-analyzed to identify key traits arising from variations in jet o..."
"2026-04-07","Emise","arXiv","https://arxiv.org/abs/2604.05951v1","We report on the lattice location of the short-lived ion implanted nuclear probe 6He (t1/2=807 ms) in diamond, which was performed using the beta emission channeling method at CERN's ISOLDE facility. 6He was implanted with 30 keV into a single-crystalline artificial diamond sample kept at a temperature ranging from 30 deg C up to 800 deg C. By means of comparing the measured emission channeling patterns along different crystallographic directions with simulated yields for a variety of possible sites, we conclude that the implanted 6He occupi..."
"2026-04-07","Emise","arXiv","https://arxiv.org/abs/2604.05703v1","The material ejected from a binary neutron star merger produces ""kilonova,"" a radioactively powered emission at ultraviolet, optical, and infrared wavelengths. The early-phase spectra of the kilonova AT2017gfo, following the gravitational wave event GW170817, exhibit a strong absorption feature around $1\,\mathrm{μm}$. Helium (He) and strontium (Sr) have been proposed as the candidate elements contributing to this feature."
"2026-04-07","Emise","arXiv","https://arxiv.org/abs/2604.05473v1","Spontaneous emission of a quantum emitter, such as an excited atom, is a fundamental process in quantum electrodynamics (QED), typically associated with exponential decay to the ground state accompanied by irreversible photon emission. This simple Markovian picture, however, is profoundly modified in the presence of time-delayed feedback, structured continua, or cooperative emission, as occurs when an emitter radiates in front of a mirror, when several emitters radiate collectively, or in the case of a giant atom. In such regimes, strong non..."
"2026-04-07","Emise","arXiv","https://arxiv.org/abs/2604.05905v1","PG~1553+113 is the blazar with the most-significantly detected periodic patter in its multiwavelength (MWL) emission, making it one of the most promising candidates for hosting a supermassive black hole binary. However, the presence of this periodic behavior in the X-ray band remains under debate, largely due to the lack of continuous monitoring. This has led to differing conclusions in previous studies."
"2026-04-07","Emise","arXiv","https://arxiv.org/abs/2604.05666v1","The extension of coherent $ω$-$2ω$ control schemes, recently implemented in free-electron lasers (FELs), to molecular systems offers new opportunities to control chemical dynamics on the electronic timescale, potentially allowing for the steering of reactions along previously inaccessible pathways. We have implemented such a scheme at the seeded FERMI FEL to retrieve the relative phases between one-photon (frequency $2ω$) and two-photon (frequency $ω$) ionization paths in the hydrogen molecule as a function of photoelectron energy and emissi..."
"2026-04-07","Emise","arXiv","https://arxiv.org/abs/2604.05707v1","Breath acetone represents a promising non-invasive biomarker for monitoring fat oxidation during exercise. However, its utility is limited by confounding factors, as well as by the fact that significant changes in concentration occur only hours post-exercise, which makes real-time assessment difficult. We performed an untargeted screening for volatile organic compounds (VOCs) that could serve as markers of fat oxidation beyond acetone, and investigated whether breath measurements taken during exercise could predict post-exercise changes in f..."
"2026-04-07","Klimatická změna","arXiv","https://arxiv.org/abs/2604.05423v1","Climate change is reshaping species interactions and movement across fragmented landscapes. Despite this, most mathematical models assume random diffusion, overlooking the influence of directed movement. Here, we develop a graph based reaction-diffusion-advection framework explicitly incorporating directional movement induced by environmental gradients."
