"date","keyword","source","link","abstract"
"2026-05-15","climate extremes","Crossref/Journal of Climate","https://doi.org/10.1175/jcli-d-25-0232.1","AbstractThe Great Plains low-level jet (GPLLJ) is a major mechanism of atmospheric moisture transport, contributing to warm-season precipitation in the central United States. We have found enhanced GPLLJ activity associated with subseasonal dry soil moisture anomalies over the southern Great Plains. We hypothesize that subseasonal dry soil moisture anomalies modulate GPLLJ intensity through warmer near-surface temperatures, deepening of the planetary boundary layer, and stronger geostrophic and ageostrophic winds, leading to nocturnal superg..."
"2026-05-15","climate extremes","Crossref/Journal of Climate","https://doi.org/10.1175/jcli-d-25-0591.1","AbstractMore than half of winter extreme precipitation days in the southern Philippines occurred in La Niña years during 1996–2022. Present study investigates atmospheric circulation patterns and synoptic systems leading to the occurrence of those extreme precipitations. It is found that La Niña winter extreme precipitation in the southern Philippines tends to occur when the East Asian winter monsoon is stronger."
"2026-05-15","climate extremes","Crossref/Journal of Climate","https://doi.org/10.1175/jcli-d-25-0320.1","AbstractThe global-mean radiation imbalance at the top of the atmosphere (GMTOA) is an important indicator of the climate response to anthropogenic greenhouse forcing. Natural variability perturbs this radiation imbalance on interannual and decadal time scales, confounding the externally forced signal. However, limited observations hinder efforts to understand the mechanisms of internally generated radiation imbalance."
"2026-05-15","climate extremes","Crossref/Journal of Climate","https://doi.org/10.1175/jcli-d-25-0552.1","AbstractPaleoclimate records indicate substantial decreases in precipitation associated with the South Asian monsoon in response to Atlantic meridional overturning circulation (AMOC) perturbations, yet the underlying mechanisms remain poorly understood. In this study, we investigate the impacts of a collapsed AMOC on the South Asian monsoon using a suite of North Atlantic freshwater hosing simulations conducted with the NCAR Community Earth System Model, version 1 (CESM1), global climate model under preindustrial conditions. Our results show..."
"2026-05-15","climate extremes","Crossref/Journal of Climate","https://doi.org/10.1175/jcli-d-25-0583.1","Abstract Polar amplification describes the predicted reduction in the latitudinal surface temperature gradient, which will have physical implications for midlatitude dynamics. The precise nature of these dynamical consequences remains unclear. Here, we explore aspects of polar amplification by way of 24 distinct idealized laboratory experiments."
"2026-05-15","climate extremes","Crossref/Journal of Climate","https://doi.org/10.1175/jcli-d-25-0437.1","AbstractThe Japan sea polar airmass convergence zone (JPCZ) frequently produces short-duration heavy snowfall events over the coastal plains along the Sea of Japan. This study investigates long-term changes in the JPCZ using a 5-km dynamical downscaling dataset based on reanalysis data. The frequency of JPCZ events shows no significant long-term trend from 1959 to 2022 but shows pronounced decadal-scale variability."
"2026-05-15","climate extremes","Crossref/Journal of Climate","https://doi.org/10.1175/jcli-d-25-0288.1","AbstractThis study evaluates the performance of CMIP6 models in simulating synoptic-scale fronts and their associated precipitation over East Asia, with a focus on winter, spring, and the Taiwan mei-yu season. A modified front detection method incorporating low-level cyclonic shear improves the identification of mei-yu fronts. Results show that CMIP6 models reasonably reproduce the spatial distribution of frontal activity but underestimate the frequency of fronts and frontal precipitation in southern China, while overestimating frontal activ..."
"2026-05-15","climate extremes","Crossref/Journal of Climate","https://doi.org/10.1175/jcli-d-25-0360.1","Abstract El Niño–Southern Oscillation (ENSO) is experiencing changes, including an increasing occurrence of central Pacific (CP)-type ENSO and weakening of intensity, with mechanisms still under debate. Previous studies of subsurface turbulent mixing ( κ υ ) revealed close correlations between its interannual variability ( ) and ENSO evolution and its importance on CP-type ENSO. However, how to adequately represent in climate models and how it modulates ENSO variability remain unclear."
"2026-05-15","climate extremes","Crossref/Journal of Climate","https://doi.org/10.1175/jcli-d-25-0016.1","Abstract Long-term historical surface incident solar radiation ( R s ) is essential for investigating climate change and evaluating climate model performance. Yet, the reliability of the available century-long reanalysis R s products over mainland China remains uncertain. In this study, we systematically compare the performance of five twentieth-century reanalyses in simulating R s over mainland China, using sunshine-duration-derived R s from approximately 2400 meteorological stations (1960–2010)."
"2026-05-15","climate extremes","Crossref/Journal of Climate","https://doi.org/10.1175/jcli-d-25-0536.1","AbstractConstraining future changes to Atlantic tropical cyclone activity remains challenging, in part because these changes may be sensitive to patterns of warming in the equatorial Pacific. This study examines the time-dependent potential intensity response of the Atlantic to Pacific sea surface temperature (SST) forcing. Using a “double column” model framework under weak-temperature-gradient dynamics, it is shown that the transient response of Atlantic potential intensity to Pacific SST forcing is opposite in sign to the equilibrium respo..."
"2026-05-15","global warming","Crossref/Journal of Climate","https://doi.org/10.1175/jcli-d-24-0682.1","AbstractThe North Water Polynya (NOW) is one of the most productive biological regions in the Arctic with high importance to Inuit and Greenlandic communities. To provide insights into the potential changes of this region as global temperatures rise, we investigated the sea ice and physical and biological oceanic responses of the NOW to low (2°C) and high (>3.5°C) levels of warming using the Community Earth System Model, version 1. As global temperatures increase, sea ice production decreases, spring open water area increases, and summer ope..."
"2026-05-15","global warming","Crossref/Journal of Climate","https://doi.org/10.1175/jcli-d-25-0184.1","AbstractEl Niño–Southern Oscillation (ENSO) is the leading mode of coupled ocean–atmosphere climate variability on interannual time scales over the tropical Pacific and substantially influences the global climate system. There is great heat redistribution between the equatorial and off-equatorial Pacific regions during ENSO events, which can be described by the “recharge–discharge oscillator” paradigm. By analyzing a 35-member Community Earth System Model (CESM) Large Ensemble (CESM-LE) and 25 Coupled Model Intercomparison Model phase 6 (CMI..."
"2026-05-15","global warming","Crossref/Journal of Climate","https://doi.org/10.1175/jcli-d-25-0635.1","AbstractThis study investigates the relative contributions of large-scale thermodynamic and dynamic processes to decadal and multidecadal changes in Atlantic tropical cyclone (TC) activity, spanning the historical record since the late nineteenth century, and extending to 2100 projections. We employ a framework that decomposes TC counts into precursor disturbances that transition into fully developed storms, applied to multiensemble simulations of two TC-permitting atmospheric models. Using these models, we conduct controlled experiments wit..."
"2026-05-15","greenhouse gas emissions","Crossref/Journal of Coordination Chemistry","https://doi.org/10.1080/00958972.2026.2672996",NA
"2026-05-15","global warming","Crossref/Journal of Craniofacial Surgery","https://doi.org/10.1097/scs.0000000000012946","Introduction:Craniofacial clefts are among the most prevalent congenital anomalies worldwide and represent a substantial public health burden. Their impact is disproportionately high in Africa, where limited access to timely surgical care and comprehensive health services—including feeding support, speech therapy, and psychosocial care—exacerbates outcomes and contributes to long-term disability and reduced quality of life. This study provides a novel contribution by systematically contextualizing both the fatal and nonfatal burden of cranio..."
"2026-05-15","climate change","Crossref/Journal of Creativity in Mental Health","https://doi.org/10.1080/15401383.2026.2674626",NA
"2026-05-15","climate change","Crossref/Journal of Economic Studies","https://doi.org/10.1108/jes-12-2025-0974","PurposeWe investigate the impact of various climate message framings on environmental willingness to pay (WTP) across two countries, the USA and the Netherlands, chosen for their differing economic, cultural and environmental contexts. Design/methodology/approachBased on the theories of environmental communication and message framing, we conducted a randomized survey experiment (N = 1,511) exposing participants to four different informational messages: no information, general climate information, specific climate health impact, behavioral im..."
"2026-05-15","climate extremes","Crossref/Journal of Economic Studies","https://doi.org/10.1108/jes-12-2025-0974","PurposeWe investigate the impact of various climate message framings on environmental willingness to pay (WTP) across two countries, the USA and the Netherlands, chosen for their differing economic, cultural and environmental contexts. Design/methodology/approachBased on the theories of environmental communication and message framing, we conducted a randomized survey experiment (N = 1,511) exposing participants to four different informational messages: no information, general climate information, specific climate health impact, behavioral im..."
"2026-05-15","global warming","Crossref/Journal of Economics and Trade","https://doi.org/10.56557/jet/2026/v11i110591","Background: The growing importance of South–South cooperation has shifted attention toward regional trade arrangements among developing economies as alternative engines of growth and integration. BIMSTEC represents one such strategic framework through which India seeks to expand regional connectivity, trade integration, and economic collaboration across the Bay of Bengal region. Aims: This study investigates India’s bilateral trade with BIMSTEC countries by estimating South–South trade elasticities within a gravity-model framework."
"2026-05-15","global warming","Crossref/Journal of Economics, Finance And Management Studies","https://doi.org/10.47191/jefms/v9-i5-18","Mexico’s trade strategy sits at the intersection of global openness, regional dependence and institutional renegotiation. This article examines how Mexico’s world trade profile and free trade agreement negotiations have evolved from broad liberalisation to a more complex framework centred on the United States-Mexico-Canada Agreement (USMCA), global value chains and nearshoring. It asks, first, how Mexico’s dense agreement network has shaped trade structure, foreign direct investment and value-chain participation and, secondly, what strategic..."
"2026-05-15","greenhouse gas emissions","Crossref/Journal of Energy Resources Technology, Part A: Sustainable and Renewable Energy","https://doi.org/10.1115/1.4071949","AbstractThis study experimentally investigates the influence of ignition timing on combustion characteristics, knock behavior, and emissions in a direct-injection spark-ignition (DISI) engine fueled with gasoline (G100) and 30 vol.% alcohol–gasoline blends (E30 and ISB30). Full-load experiments were conducted at 3000, 4000, and 5000 rpm with ±5°CA spark timing variations. Ignition timing was identified as the dominant parameter controlling combustion phasing and knock intensity."
"2026-05-15","climate change","Crossref/Journal of English Linguistics","https://doi.org/10.1177/00754242261424450","Recent studies have documented the retreat of the Northern Cities Shift (NCS) in the Inland North, as well as the advance of a split between pre-nasal and pre-oral /æ/ (B at/Ban Split) and a merger of /ɑ/ and /ɔ/ ( cot and caught , Low-Back Merger) in dialects throughout North America. The present study investigates the status of these three changes-in-progress for fifteen speakers in an urban neighborhood of Rochester, New York, located in close proximity to a university. Our analysis draws on a series of oral history interviews collected i..."
"2026-05-15","climate change","Crossref/Journal of Environmental Economics and Policy","https://doi.org/10.1080/21606544.2026.2670414",NA
"2026-05-15","climate extremes","Crossref/Journal of Forestry Research","https://doi.org/10.1007/s11676-026-02070-7",NA
"2026-05-15","climate extremes","Crossref/Journal of Forestry Research","https://doi.org/10.1007/s11676-026-02069-0",NA
"2026-05-15","climate change","Crossref/Journal of Global Agriculture and Ecology","https://doi.org/10.56557/jogae/2026/v18i210593","The environment and livelihoods of farmers in semi-arid sub-Saharan Africa are increasingly threatened by climate variability and ecosystem degradation. Climate-Smart Agriculture (CSA) is advocated as a strategy for resilience building, evidence of the structural pathways in which it operates is limited especially in fragile dryland contexts. This study aims to determine if and how policy interventions by community-supported agriculture enhance community resilience through the accumulation of livelihood capital and institutional mediation in..."
"2026-05-15","global warming","Crossref/Journal of Global Agriculture and Ecology","https://doi.org/10.56557/jogae/2026/v18i210589","Agricultural input subsidies remain one of the most debated agricultural policy instruments in Sub-Saharan Africa. Governments continue to use them because smallholder farmers face high input prices, weak credit markets, poor rural infrastructure, and climate-related production risks that limit the adoption of fertilizer, improved seed, and other productivity-enhancing technologies. This paper examines how subsidy programs have evolved from broad state-led distribution systems toward more targeted and market-oriented approaches, with attenti..."
"2026-05-15","global warming","Crossref/Journal of Global Ecology and Environment","https://doi.org/10.56557/jogee/2026/v22i210592","Climate change impacts are making agricultural production systems increasingly vulnerable to meeting the growing food demands of the global population. In India, the challenge is even greater, as only 3.73% of agricultural land supports 17.76% of the world's population. To ensure safe food for all, agricultural practices must shift towards sustainability and climate resilience, particularly given that over 80% of farmers in India are smallholders with an average landholding of 0.38 hectares."
"2026-05-15","global warming","Crossref/Journal of Global Health","https://doi.org/10.7189/jogh.16.04147",NA
"2026-05-15","global warming","Crossref/Journal of Global Health","https://doi.org/10.7189/jogh.16.04154",NA
"2026-05-15","global warming","Crossref/Journal of Global Health","https://doi.org/10.7189/jogh.16.04082",NA
"2026-05-15","climate change","Crossref/Journal of Global Health Economics and Policy","https://doi.org/10.7189/001c.161341","BackgroundDespite the widely acknowledged impacts of climate change, the effect of climate change on women’s health remains underexplored in quantitative scientific research. This study investigates how climate hazards, and specifically landslides, influence intimate partner violence (IPV) and explores the broader implications of these findings for future research and understanding of IPV risk. MethodsDrawing on nationally representative data from 1993 to 2019 from 156 different countries, this study used a two-way fixed effects model to pre..."
"2026-05-15","global warming","Crossref/Journal of Global Health Economics and Policy","https://doi.org/10.7189/001c.161583","BackgroundThe rapid adoption of artificial intelligence (AI) in African healthcare presents both transformative opportunities and structural risks. While AI-enabled diagnostic technologies may expand clinical capacity and improve service delivery, their deployment also raises questions of data sovereignty, infrastructural dependency, regulatory auditability, and unequal value capture. MethodsThis exploratory multi-case analysis examines four African health technology firms: Helium Health, Ubenwa, Neural Labs Africa, and Envisionit Deep AI."
"2026-05-15","global warming","Crossref/Journal of Global Mobility","https://doi.org/10.1108/jgm-05-2025-0052","PurposeRelationships between expatriates and host country nationals (HCNs) are critical to expatriate adjustment and knowledge transfer. This paper adopts a multi-stakeholder perspective to explore the conditions and organisational actions that stakeholders perceive as contributing to positive expatriate–HCN relationships. Design/methodology/approachA qualitative study was conducted, drawing on 25 semi-structured interviews with four stakeholder groups: expatriates, HCNs, host country line managers (HCLMs), and international HRM (IHRM) profe..."
"2026-05-15","greenhouse gas emissions","Crossref/Journal of Materials Science","https://doi.org/10.1007/s10853-026-12844-3","Abstract TiO 2 nanoparticles can exhibit benefits in various areas, including physics, chemistry, biology, the environment, and agriculture, among others, for the advancement of the world. In this research work, TiO 2 nanomaterials are fabricated using a green synthesis technique called mechanical attrition and analysis of their properties for CO gas sensors. The structural study confirmed the stable tetragonal crystal structure for TiO 2 samples, reducing the crystallinity and forming defects at higher milling times."
"2026-05-15","climate change","Crossref/Journal of Organizational Change Management","https://doi.org/10.1108/jocm-01-2026-0071","PurposeResearch has underscored the relevance of the decree of “inclusive” education for the education system. The United Nations' Convention on the Rights of Persons with Disabilities provides countries that have already ratified the convention with the – politically grounded – opportunity to bring about organizational change in their education system. From a systems theory perspective, sensu Niklas Luhmann, it is explored to what extent “inclusive” education as a grand change agenda is processed or resisted through the internal programming..."
"2026-05-15","greenhouse gas emissions","Crossref/Journal of Physics D: Applied Physics","https://doi.org/10.1088/1361-6463/ae5a46","AbstractGas generation induced by DC voltage-driven plasma–liquid interactions was investigated in comparison with conventional electrolysis. By covering all but the tip of the electrode with a dielectric, a stable plasma could be generated in water without a gas flow, even under DC voltage operation. The amount of gas generated was compared between plasma-driven electrolysis and conventional electrolysis."
"2026-05-15","flood","Crossref/Journal of Risk Research","https://doi.org/10.1080/13669877.2026.2667760",NA
"2026-05-15","greenhouse gas emissions","Crossref/Journal of Risk and Financial Management","https://doi.org/10.3390/jrfm19050362","The intersection of financial innovation and environmental sustainability offers important opportunities for low- and middle-income (LMI) countries. This study examines the association between FinTech investment, geopolitical-economic uncertainty, urbanization, economic development, and carbon dioxide (CO2) emissions in LMI countries. CO2 emissions per capita are used as an environmental outcome indicator rather than as a direct measure of green finance."
"2026-05-15","climate change","Crossref/Journal of Tourism and Leisure Studies","https://doi.org/10.18848/2470-9336/cgp/a51","Weather and climate variability have been widely acknowledged as increasingly influencing tourism performance and destination sustainability. While previous studies on tourism climatology have mainly focused on tourist demand and macroeconomic impacts, limited attention has been paid to the perceptions and behavioral responses of host communities residing in tourism precincts. This study contributes toward filling this research gap by investigating how residents in three major tourism hubs in Kenya, Nairobi (urban), Mombasa (coastal), and Ma..."
"2026-05-15","climate extremes","Crossref/Journal of Tourism and Leisure Studies","https://doi.org/10.18848/2470-9336/cgp/a51","Weather and climate variability have been widely acknowledged as increasingly influencing tourism performance and destination sustainability. While previous studies on tourism climatology have mainly focused on tourist demand and macroeconomic impacts, limited attention has been paid to the perceptions and behavioral responses of host communities residing in tourism precincts. This study contributes toward filling this research gap by investigating how residents in three major tourism hubs in Kenya, Nairobi (urban), Mombasa (coastal), and Ma..."
"2026-05-15","global warming","Crossref/Journal of Transportation Science and Technology","https://doi.org/10.55228/jtst150307","High-speed railway (HSR) systems operating at velocities up to 350 km/h impose stringent requirements on vehicle–track interaction, wheel–rail contact mechanics, and infrastructure maintenance strategies. At such speeds, railway systems behave as highly coupled nonlinear systems. Small variations in contact conditions or track geometry can significantly amplify dynamic responses."
"2026-05-15","global warming","Crossref/Journal of World Economy","https://doi.org/10.63593/jwe.2026.03.05","This study analyzes Uganda and the East African Community’s (EAC) positioning within the evolving architecture of global tax governance, specifically focusing on the Base Erosion and Profit Shifting (BEPS) and Two-Pillar solutions. This research utilizes a structural power theoretical lens and a qualitative exploratory case study design to examine how institutional asymmetries and technical capacity constraints influence the bargaining power of developing nations. Data were collected through key informant interviews with tax policymakers and..."
"2026-05-15","greenhouse gas emissions","Crossref/Journal of the Association of Environmental and Resource Economists","https://doi.org/10.1086/742219",NA
"2026-05-15","greenhouse gas emissions","Crossref/Journal of the Physical Society of Japan","https://doi.org/10.7566/jpsj.95.054802",NA
"2026-05-15","greenhouse gas emissions","Crossref/Journal of the Physical Society of Japan","https://doi.org/10.7566/jpsj.95.053801",NA
"2026-05-15","climate change","Crossref/Journal on Applied and Chemical Physics","https://doi.org/10.46632/jacp/5/2/3","Climate change has emerged as a major global threat to biodiversity, inflicting severe impacts on ecosystems and species. Shifts in temperature, precipitation, and climatic conditions alter natural habitats and disrupt ecological equilibrium, leading to habitat degradation and fragmentation. As rising temperatures affect the physiology, behavior, migration patterns, and distribution of organisms, survival becomes increasingly difficult for many species."
"2026-05-15","global warming","Crossref/Journalism","https://doi.org/10.1177/14648849261452333","Academic scholarship on alternative media remains Western-centric, presenting the view that such media features counter-hegemonic content and contributes to social movements and active citizenship. This paper synthesizes the work of scholars from the Global South/ non-West for the first time, analyzing top-cited journal articles produced by authors from the regions of Africa, Asia, Latin America, and the Middle East to discover, using the inductive approach, how “alternativeness” is conceived of and represented in the non-West. This stands o..."
"2026-05-15","flood","Crossref/Jàmbá Journal of Disaster Risk Studies","https://doi.org/10.4102/jamba.v18i1.2013","Botswana’s economy is highly exposed to floods, estimated to cost an average of $90 million, about 0.56% of the total annual country gross domestic product. Flooding is common in urban catchments, including Botswana’s Notwane Catchment. The catchment is characterised by increased population anchored in the capital Gaborone, infrastructure expansion and altered natural drainage."
"2026-05-15","global warming","Crossref/LEA - Lingue e Letterature d'Oriente e d'Occidente","https://doi.org/10.36253/lea-1824-484x-16294","In this article, we give a corpus-based overview of traces of influence from foreign languages that can be found in Matriculation Examination essays written by Swedish L1 speakers in Finland. We place our findings in an educational context where the Swedish L1 test, and especially its essay, requires formal language use and adaptation towards the prevailing Swedish language norms. Even in this high-stakes exam with high demands on normative language use, the influence of foreign languages can be seen."
