"date","keyword","source","link","abstract"
"2026-05-15","global warming","Crossref/Akuntansi dan Ekonomi Pajak: Perspektif Global","https://doi.org/10.61132/aeppg.v3i2.2220","This study aims to determine the effect of tax planning and capital structure on firm value, with firm size as a moderator. The population in this study is all non-cyclical consumer companies in the food and beverage subsector listed on the Indonesia Stock Exchange (IDX) for the 2020-2024 period. The type of research used in this study is quantitative associative with secondary data."
"2026-05-15","greenhouse gas emissions","Crossref/Angewandte Chemie","https://doi.org/10.1002/ange.5511899","ABSTRACT Semiconducting covalent organic frameworks (COFs) that combine structural order with porous characteristics are promising candidates for chemiresistive sensors. Understanding carrier transport behavior and improving their electrical properties remain critical challenges due to the low intrinsic conductivity of semiconducting COFs and the difficulty of electronic device fabrication. Herein, we propose a strategy that introduces acidic electron acceptors into a semiconductive COF, Py‐1P, to modulate its electrical properties."
"2026-05-15","greenhouse gas emissions","Crossref/Angewandte Chemie International Edition","https://doi.org/10.1002/anie.5511899","ABSTRACT Semiconducting covalent organic frameworks (COFs) that combine structural order with porous characteristics are promising candidates for chemiresistive sensors. Understanding carrier transport behavior and improving their electrical properties remain critical challenges due to the low intrinsic conductivity of semiconducting COFs and the difficulty of electronic device fabrication. Herein, we propose a strategy that introduces acidic electron acceptors into a semiconductive COF, Py‐1P, to modulate its electrical properties."
"2026-05-15","global warming","Crossref/Anthropological Review","https://doi.org/10.18778/1898-6773.89.2.02","IntroductionDementia incidence is rising worldwide, driven largely by population ageing and demographic transition. Although dietary factors have been proposed as modifiable contributors, the role of dairy consumption remains unclear, with inconsistent findings across regions, populations, and product types. Study aim This study examined whether total dairy supply independently predicts dementia incidence at the population level after accounting for key demographic and socioeconomic indicators."
"2026-05-15","climate change","Crossref/Applied and Environmental Microbiology","https://doi.org/10.1128/aem.00487-26","ABSTRACT Land-use change is widely recognized as a driver of zoonotic disease emergence, yet its effects are often context-dependent. In an article published in Applied and Environmental Microbiology , J. A."
"2026-05-15","climate change","Crossref/Asian Journal of Advanced Research and Reports","https://doi.org/10.9734/ajarr/2026/v20i51366","Household vulnerability to climate variability in urban slums is driven by interconnected socioeconomic, environmental, and institutional inequalities that heighten risk and limit adaptive capacity, particularly among low-income populations. This study examined differentiated household vulnerability to climate variability in Korogocho and Kahawa Soweto informal settlements in Nairobi, Kenya, where households experienced varying levels of risk despite similar environmental exposure. Vulnerability was conceptualized as a function of socioecono..."
"2026-05-15","climate change","Crossref/BDJ Team","https://doi.org/10.1038/s41407-026-3312-z",NA
"2026-05-15","climate change","Crossref/BMC Digital Health","https://doi.org/10.1186/s44247-026-00268-7","AbstractBackgroundExisting research presents mixed findings regarding the effect of mobile apps for promoting behavioural change in occupational settings. This systematic literature review and meta-analysis aimed to evaluate the effectiveness of mobile apps in promoting behavioural change, such as increasing physical activity, among employed adults. A literature search was performed across four databases: PubMed, SCOPUS, PsycINFO, and Web of Science, between 2008 and 2026."
"2026-05-15","climate change","Crossref/BMJ","https://doi.org/10.1136/bmj.s955",NA
"2026-05-15","global warming","Crossref/BMJ","https://doi.org/10.1136/bmj.s918",NA
"2026-05-15","global warming","Crossref/Benchmarking: An International Journal","https://doi.org/10.1108/bij-12-2025-1154","PurposeAs global supply chains grow increasingly complex, volatile, and sustainability-sensitive, effective supply chain due diligence (SCDD) has become a critical strategic imperative for organizations. Despite this importance, many firms struggle to identify and prioritize the interrelated factors necessary for successful implementation. Design/methodology/approachThe research employs a mixed qualitative and structured modelling approach."
"2026-05-15","climate change","Crossref/Black Sea Journal of Agriculture","https://doi.org/10.47115/bsagriculture.1860873","The effects of global climate change in our country have begun to be felt in many economic and social sectors. The sector that is most sensitive to climate is the agricultural sector. The discussions on plant production, food security and access to them, which are a part of the agricultural sector, have started to increase in our country as in other world states."
"2026-05-15","climate change","Crossref/Black Sea Journal of Agriculture","https://doi.org/10.47115/bsagriculture.1867244","Agriculture remains a critical sector of Nigeria’s economy, providing livelihoods for most rural households and contributing significantly to food security. Yam (Dioscorea spp.) is one of Nigeria’s most important staple crops, valued for its nutritional, economic, and socio-cultural significance. However, yam production is increasingly threatened by climate change through rising temperatures, erratic rainfall, flooding, and increased pest and disease incidence, particularly in flood-prone areas such as Anambra West Local Government Area of A..."
"2026-05-15","greenhouse gas emissions","Crossref/Black Sea Journal of Agriculture","https://doi.org/10.47115/bsagriculture.1911694","Medicinal and aromatic plants (MAPs) are increasingly important in global agriculture due to their extensive use in pharmaceutical, nutraceutical, cosmetic, and food industries, where their value is largely determined by biomass yield and the concentration of bioactive secondary metabolites. However, the production of MAPs under open-field conditions is often constrained by environmental variability, leading to inconsistent yield and phytochemical composition. In this context, controlled environment agriculture (CEA), particularly smart gree..."
"2026-05-15","climate change","Crossref/Black Sea Journal of Engineering and Science","https://doi.org/10.34248/bsengineering.1933198","This study examines the Energy Performance of courtyard residential typology in Hot-Dry Climate Regions using Numerical Analysis Methods, focusing on Courtyard geometry (Width-to-length ratio), Number of storeys, and Window-to-wall ratio (WWR) parameters. Within the scope of the study, three different building models (single-storey, two-storey, and three-storey) were created for Şanlıurfa province, which represents Türkiye's hot-dry climate characteristics. Building envelope thermal transmittance values were determined according to TS 825:20..."
"2026-05-15","climate extremes","Crossref/Black Sea Journal of Engineering and Science","https://doi.org/10.34248/bsengineering.1933198","This study examines the Energy Performance of courtyard residential typology in Hot-Dry Climate Regions using Numerical Analysis Methods, focusing on Courtyard geometry (Width-to-length ratio), Number of storeys, and Window-to-wall ratio (WWR) parameters. Within the scope of the study, three different building models (single-storey, two-storey, and three-storey) were created for Şanlıurfa province, which represents Türkiye's hot-dry climate characteristics. Building envelope thermal transmittance values were determined according to TS 825:20..."
"2026-05-15","greenhouse gas emissions","Crossref/Black Sea Journal of Engineering and Science","https://doi.org/10.34248/bsengineering.1907493","This study examines the determinants of carbon dioxide (CO₂) emissions in 12 countries from the Balkans, Black Sea, and Caucasus region over the period 1990–2024. It extends the literature by including freshwater withdrawal and aquaculture production as explanatory variables. The study also controls for GDP, population density, and electricity consumption as additional covariates."
"2026-05-15","climate change","Crossref/Bulletin of Science and Practice","https://doi.org/10.33619/2414-2948/126/45","Global climate change and rapid population growth have led to an increased demand for food, particularly grain products. One way to address this issue is to effectively utilize the genetic potential of existing crops by determining the yield, stress tolerance, quality, and other traits of varieties acquired locally and internationally, and then applying them in breeding. This article is devoted to the evaluation and results of crossing different hybrid combinations of common wheat belonging to four botanical varieties (Graecum (Koern.) Mansf..."
"2026-05-15","climate change","Crossref/Bulletin of University of Agricultural Sciences and Veterinary Medicine Cluj-Napoca. Horticulture","https://doi.org/10.15835/buasvmcn-hort:2025.0006","Climate change represents one of the most serious challenges for Romanian agriculture, directly affecting productivity, crop stability, and food security, especially in the southern regions. These negative climate trends are expected to worsen in the future due to rising temperatures, the increasing incidence of extreme weather events, and the changes in precipitation patterns. Vegetable growers who carry out their activity in protected spaces (greenhouses, solariums) are increasingly feeling the effects of these transformations, especially ..."
"2026-05-15","drought","Crossref/CURRENT APPLIED SCIENCE AND TECHNOLOGY","https://doi.org/10.55003/cast.2026.269229","Rice production faces serious threats from salinity and drought, which individually or in combination disrupt source-sink relationships and grain yield formation. While the effects of each stress have been widely studied, their interactive impact from a source-sink perspective remains unclear. This study investigated source-sink dynamics and grain yield formation in rice under single and dual salinity-drought stresses."
"2026-05-15","global warming","Crossref/Cambridge Prisms: Global Mental Health","https://doi.org/10.1017/gmh.2026.10227",NA
"2026-05-15","greenhouse gas emissions","Crossref/Carbon Footprints","https://doi.org/10.20517/cf.2026.15","Regional disparities in greenhouse gas (GHG) emissions are substantial across large and economically diverse territories in Russia, making subnational assessments important for the implementation of national climate policy. As a major industrial and energy-producing region in the Volga Federal District, the Republic of Tatarstan provides a relevant case for examining emission dynamics under sustained economic growth. This study investigates the trends and driving forces of GHG emissions generated from fuel combustion in Tatarstan over the pe..."
"2026-05-15","greenhouse gas emissions","Crossref/Chemical Product and Process Modeling","https://doi.org/10.1515/cppm-2025-0325","AbstractThe zinc oxide rotary kiln in the zinc smelter industry is the primary source of carbon emissions, causing an imbalance between zinc recovery and emissions. To speed up zinc restoration, large fuel amounts are used which increases carbon dioxide emissions. Due to the kiln’s sensitivity to hydrometallurgical factors and external inconsistencies, it is very challenging to keep the temperature variation in control at the reaction zone and rotating tail within the specified ranges, particularly when using standard controllers which affec..."
"2026-05-15","climate change","Crossref/Climate of the Past","https://doi.org/10.5194/cp-22-1023-2026","Abstract. The alkenone-derived U37K′ proxy is crucial for the reconstruction of past sea surface temperatures in marine sedimentary archives. Recent advances in mass spectrometry imaging (MSI) now allow the measurement of alkenone abundance at the micrometer scale."
"2026-05-15","climate extremes","Crossref/Climate of the Past","https://doi.org/10.5194/cp-22-1023-2026","Abstract. The alkenone-derived U37K′ proxy is crucial for the reconstruction of past sea surface temperatures in marine sedimentary archives. Recent advances in mass spectrometry imaging (MSI) now allow the measurement of alkenone abundance at the micrometer scale."
"2026-05-15","global warming","Crossref/Clinical Pharmacology & Therapeutics","https://doi.org/10.1002/cpt.70339",NA
"2026-05-15","global warming","Crossref/Communications in Contemporary Mathematics","https://doi.org/10.1142/s0219199726500525","The global existence of strong solutions to the compressible viscous magnetohydrodynamic (MHD) equations in [Formula: see text] remains a significant open problem. When there is no magnetic diffusion, even small data global well-posedness is unknown. This study investigates the Cauchy problem in [Formula: see text] for the compressible viscous MHD equations with horizontal magnetic diffusion."
"2026-05-15","global warming","Crossref/Communications in Mathematical Analysis and Applications","https://doi.org/10.4208/cmaa.2025-0026","This paper is concerned with the radiation hydrodynamics model which describes the motion of the compressible gas with radiative heat transfer phenomena. For this model, to the best of our knowledge, most of the global existence results in multi-dimensional space with large initial data are related to solutions with some symmetry. While considering general solutions, such results only have been established under the condition that the $H^l$-norm $(l\ge 2)$ of initial perturbation is sufficiently small."
"2026-05-15","global warming","Crossref/Computing and Artificial Intelligence","https://doi.org/10.59400/cai4243","Artificial Intelligence (AI) and Computer Vision (CV) are rapidly transforming animal welfare, conservation, and ecosystem management by enabling scalable, real-time analysis of large multimodal datasets. Traditional monitoring approaches are increasingly inadequate due to the exponential growth of visual and sensor data across farms, urban ecosystems, and wildlife habitats. This paper presents a structured review of AI/CV methodologies—including convolutional neural networks, You Only Look Once (YOLO)-based detection, and pose estimation—fo..."
"2026-05-15","global warming","Crossref/Critical Sociology","https://doi.org/10.1177/08969205261444399","This article examines the rise of the global far right as a cross-national networked political project. While education is central to the far-right’s international authoritarian projects and ambitions, sociologists have been slow to examine the centrality of education to the global far right. Drawing on the so-called “international turn” in far-right studies, this article outlines four pillars of a global far-right educational architecture and then proposes elements to a critical sociology to map, analyze, counter, and resist it."
"2026-05-15","global warming","Crossref/Cureus","https://doi.org/10.7759/cureus.108931",NA
"2026-05-15","greenhouse gas emissions","Crossref/Cureus","https://doi.org/10.7759/cureus.108925",NA
"2026-05-15","greenhouse gas emissions","Crossref/Cureus Journal of Business and Economics","https://doi.org/10.7759/s44404-025-00067-9",NA
"2026-05-15","climate change","Crossref/Discover Environment","https://doi.org/10.1007/s44274-026-00743-y",NA
"2026-05-15","global warming","Crossref/Discover Geoscience","https://doi.org/10.1007/s44288-026-00548-9","AbstractFractal dimension has gathered broad interest for application in several geoscientific disciplines. This study presents a modified method for calculating it by a novel implementation of its underlying mathematical theory leading to several practical benefits. Instead of congruent quadrilaterals or circles in the Euclidean space, Discrete Global Grid Systems (DGGSs) are proposed as covering sets for geospatial vector data to calculate the Minkowski-Bouligand dimension using the box-counting principle."
"2026-05-15","climate change","Crossref/Economic Development and Cultural Change","https://doi.org/10.1086/742299",NA
"2026-05-15","global warming","Crossref/Energies","https://doi.org/10.3390/en19102372","When the global energy transition is analyzed through economic lenses, the constraints imposed by the laws of thermodynamics are often overlooked. This study addresses the Latecomer’s Dilemma—the predicament of semi-peripheral nations compelled to decarbonize without the capital stock accumulated following the example of the countries of the Global North during their more than two hundred years of industrial development associated with the saturation of the atmosphere with carbon dioxide. A novel phase space model of the Anthropocene is cons..."
"2026-05-15","global warming","Crossref/Energies","https://doi.org/10.3390/en19102371","South Korea’s official development assistance to the energy sector has increased steadily over the past decade, reaching USD 232.20 million in 2024. Yet public willingness to pay for renewable energy official development assistance remains largely unknown. This study uses a discrete choice experiment with 1000 nationally representative South Korean respondents and a mixed logit model to estimate marginal willingness to pay for key project attributes, including electrification, greenhouse gas reduction, firm expansion, expert training, and re..."
"2026-05-15","greenhouse gas emissions","Crossref/Energies","https://doi.org/10.3390/en19102370","Due to the strong heterogeneity of the reservoir, early gas breakthrough and low CO2 displacement efficiency are common issues in the CO2 flooding process of domestic gravel reservoirs. This study focuses on a gravel reservoir in Xinjiang, proposing a quantitative evaluation method that combines early gas breakthrough identification and the inversion of gas channel characteristic parameters. The aim is to provide theoretical support and technical guidance for gas breakthrough risk warning, injection-production system optimization, and contro..."
"2026-05-15","greenhouse gas emissions","Crossref/Energy & Fuels","https://doi.org/10.1021/acs.energyfuels.6c00956",NA
"2026-05-15","flood","Crossref/Environmental Research Communications","https://doi.org/10.1088/2515-7620/ae6ec4","AbstractThis study develops an integrated comparative assessment framework that couples highresolution pluvial flood rain-on-grid (RoG) modeling with a GIS-based tsunami hazard assessment for coastal sites. The approach enables return-period-dependent flood risk assessment across pluvial and tsunami hazards using physically based, computationally efficient metrics.The framework bridges the pluvial flood and tsunami communities by linking two-dimensional shallow-water RoG simulations for localized pluvial hazards (500-1000 year return periods..."
"2026-05-15","greenhouse gas emissions","Crossref/Environmental Research: Infrastructure and Sustainability","https://doi.org/10.1088/2634-4505/ae6e6b","AbstractCoal-fired electricity generates significant direct combustion emissions, but the full life cycle greenhouse gas (GHG) emissions are less understood in the United States under current conditions. This analysis presents an updated benchmark to the life cycle GHG emissions of coal-fired electricity by coal power plant in the US. The analysis includes the impacts of mining and coal delivery; direct land use change from surface mining and power plant-associated infrastructure; power plant infrastructure construction; direct combustion em..."
"2026-05-15","climate change","Crossref/Environmental Research: Water","https://doi.org/10.1088/3033-4942/ae6e69",NA
"2026-05-15","greenhouse gas emissions","Crossref/Environmental Science & Technology","https://doi.org/10.1021/acs.est.6c04642",NA
"2026-05-15","greenhouse gas emissions","Crossref/Environmental Science & Technology","https://doi.org/10.1021/acs.est.5c17089",NA
"2026-05-15","climate extremes","Crossref/Environmental and Ecological Statistics","https://doi.org/10.1007/s10651-026-00730-9","Abstract This paper develops a record-based framework for detecting structural changes in climate time series, with a focus on daily air temperature. The approach combines three elements: a linear drift model (LDM) to represent progressive warming with approximately stationary daily variability; the concept of $$\delta$$δ records, requiring each new record to exceed the previous maximum record level within a fixed threshold, and filtering out records that have become inflated in the presence of trend; a CUSUM-like statistic, calibrated on a ..."
"2026-05-15","global warming","Crossref/Eos","https://doi.org/10.1029/2026eo260147","A new study reevaluates the use of vapor pressure deficit, or VPD, in climate models to predict increases in area burned by wildfire across the U.S. West."
"2026-05-15","global warming","Crossref/Eos","https://doi.org/10.1029/2026eo260156","Cuts to climate science risk halting or even erasing decades of progress in global change research—just as risks from rising seas demand better data, informed decisionmaking, and faster action."
"2026-05-15","greenhouse gas emissions","Crossref/European Journal of Medical Research","https://doi.org/10.1186/s40001-026-04562-y",NA
"2026-05-15","greenhouse gas emissions","Crossref/Experimental and Computational Multiphase Flow","https://doi.org/10.1007/s42757-025-0256-z",NA
"2026-05-15","global warming","Crossref/Exploring Science Academic Conference Series","https://doi.org/10.70267/icsscs.20260118","This study examines six representative micro-dramas from major Chinese and international platforms between 2025 and 2026, conducting a comparative textual analysis across three dimensions: narrative temporal structure, character relationship construction, and narrative driving mechanisms. Drawing on transcultural communication theory and Genette’s narrative discourse theory, the study analyzes how narrative strategies are shaped within different cultural contexts. The findings suggest that Chinese micro-dramas tend to incorporate social rela..."
"2026-05-15","climate change","Crossref/Family Medicine","https://doi.org/10.22454/fammed.2026.453888",NA
"2026-05-15","global warming","Crossref/Frontiers in Amphibian and Reptile Science","https://doi.org/10.3389/famrs.2026.1841535","Winter climate change is an underrecognized but potentially strong predictor of biodiversity loss in temperate ecosystems. This study investigates the role of winter warming and snowpack decline in driving local extirpation of amphibians and reptiles across the Midwestern United States, providing model-based insights consistent with underlying ecological mechanisms. A multi-decadal, species-integrated dataset was compiled, combining population dynamics, survival metrics, and climate variables for four climate-sensitive taxa: Acris blanchardi..."
"2026-05-15","climate change","Crossref/Frontiers in Climate","https://doi.org/10.3389/fclim.2026.1745732","This study investigates the statistics of extreme sea levels (ESLs) along the northwest coast of Ireland. We focused on the combined effects of storm surges, semidiurnal high tides, and projected relative mean sea level rise under two climate scenarios (RCP 4.5 and RCP 8.5) for the 21st century (2006–2100), comparing them against a historical baseline (1951–2000). Storm surge estimates were derived from a finite element ocean model configured for the North Atlantic and forced exclusively with EURO-CORDEX downscaled atmospheric fields (atmosp..."
"2026-05-15","climate change","Crossref/Frontiers in Climate","https://doi.org/10.3389/fclim.2026.1845902","Accurate rainfall prediction is critical for climate adaptation, agriculture, water resource management, and other arenas, especially in tropical monsoon regions like Coastal Ghana. Rainfall exhibits strong seasonality, non-linearity, and high interannual variability in these areas. Traditional statistical models such as ARIMA struggle to capture these complex dynamics, especially during extreme rainfall events."
"2026-05-15","climate extremes","Crossref/Frontiers in Climate","https://doi.org/10.3389/fclim.2026.1845902","Accurate rainfall prediction is critical for climate adaptation, agriculture, water resource management, and other arenas, especially in tropical monsoon regions like Coastal Ghana. Rainfall exhibits strong seasonality, non-linearity, and high interannual variability in these areas. Traditional statistical models such as ARIMA struggle to capture these complex dynamics, especially during extreme rainfall events."
"2026-05-15","greenhouse gas emissions","Crossref/Frontiers in Earth Science","https://doi.org/10.3389/feart.2026.1785833","At a burial depth of 5,000 m, large gas resources are hosted in Lower Triassic oolitic shoal carbonates in the Puguang Field, Sichuan, China. Dissolution and dolomitization primarily preserve effective porosity and permeability, whereas heterogeneous diagenetic fabrics strongly limit hydrocarbon production. This study characterizes spatial variations in rock texture across the Feixianguan Formation to clarify diagenetic controls and constrain reservoir distributions."
