"date","keyword","source","link","abstract"
"2026-04-01","Klimatická změna","Crossref/PLOS Climate","https://doi.org/10.1371/journal.pclm.0000874","Community engagement is central to building climate resilience, yet participation varies across social groups and places. In this study we examined predictors of willingness to engage in community-level climate resilience activities in Israel, emphasizing gaps across ethnic and residential contexts. Data were drawn from a national survey of adults (n = 1,492) with hyper-representation of vulnerable populations."
"2026-04-01","Klimatická změna","Crossref/PLOS One","https://doi.org/10.1371/journal.pone.0342400","Soybeans and oilseed rape are the main oil crops in China. Assessing the potential geographical distributions of soybean and oilseed rape in China under global warming trends can provide a scientific basis for agricultural production. In this study, 19 climate factors were used as environmental settings based on the MaxEnt model, and the dominant factors were screened and analyzed to predict the potential distributions of soybean and oilseed rape under three climate scenarios of shared socio-economic pathways (SSP) in simulated historical an..."
"2026-04-01","Klimatická změna","Crossref/Pediatric Clinics of North America","https://doi.org/10.1016/j.pcl.2026.02.001",""
"2026-04-01","Extrémy","Crossref/Plant Science","https://doi.org/10.1016/j.plantsci.2026.113123",""
"2026-04-01","Extrémy","Crossref/Plant and Soil","https://doi.org/10.1007/s11104-026-08499-3","AbstractBackground and Aims Climate change is posing a major threat to global agricultural productivity. Plant growth-promoting bacteria (PGPB) have emerged as sustainable tools to enhance crop tolerance to abiotic stress through different mechanisms. This study aimed to evaluate the physiological, biochemical, and transcriptomic responses of the Altoandina oat variety ( Avena sativa AV25T) under water deficit and to determine the effectiveness of PGPB inoculation."
"2026-04-01","Klimatická změna","Crossref/Plant and Soil","https://doi.org/10.1007/s11104-026-08499-3","AbstractBackground and Aims Climate change is posing a major threat to global agricultural productivity. Plant growth-promoting bacteria (PGPB) have emerged as sustainable tools to enhance crop tolerance to abiotic stress through different mechanisms. This study aimed to evaluate the physiological, biochemical, and transcriptomic responses of the Altoandina oat variety ( Avena sativa AV25T) under water deficit and to determine the effectiveness of PGPB inoculation."
"2026-04-01","Extrémy","Crossref/Protoplasma","https://doi.org/10.1007/s00709-026-02191-0",""
"2026-04-01","Extrémy","Crossref/Regional Studies, Regional Science","https://doi.org/10.1080/21681376.2026.2645485",""
"2026-04-01","Emise","Crossref/Scientific Reports","https://doi.org/10.1038/s41598-026-46922-y","AbstractRobotics is widely regarded as a key driver of digital transformation and green industrial upgrading, yet its environmental implications remain ambiguous. Existing studies primarily focus on the emission effects of robot applications, while largely neglecting robotics manufacturing as an energy- and resource-intensive industrial activity. Using panel data from 277 Chinese prefecture-level cities from 2008 to 2019, this study examines the relationship between robotics manufacturing development and urban carbon emissions."
"2026-04-01","Emise","Crossref/Scientific Reports","https://doi.org/10.1038/s41598-026-45624-9","AbstractThis study assesses historical trends and future projections of extreme precipitation events in Central Europe’s Vistula and Oder (Odra) transboundary river basins using climate indices recommended by the Expert Team on Climate Change Detection and Indices (ETCCDI). Utilizing bias-corrected EURO-CORDEX regional climate models under the high-emission RCP8.5 scenario, we evaluated changes in the frequency, intensity, and contribution of heavy precipitation events from 2006 to 2100 compared to a historical baseline (1990–2019). The find..."
"2026-04-01","Emise","Crossref/Scientific Reports","https://doi.org/10.1038/s41598-026-45162-4",""
"2026-04-01","Extrémy","Crossref/Scientific Reports","https://doi.org/10.1038/s41598-026-45624-9","AbstractThis study assesses historical trends and future projections of extreme precipitation events in Central Europe’s Vistula and Oder (Odra) transboundary river basins using climate indices recommended by the Expert Team on Climate Change Detection and Indices (ETCCDI). Utilizing bias-corrected EURO-CORDEX regional climate models under the high-emission RCP8.5 scenario, we evaluated changes in the frequency, intensity, and contribution of heavy precipitation events from 2006 to 2100 compared to a historical baseline (1990–2019). The find..."
"2026-04-01","Klimatická změna","Crossref/Scientific Reports","https://doi.org/10.1038/s41598-026-45624-9","AbstractThis study assesses historical trends and future projections of extreme precipitation events in Central Europe’s Vistula and Oder (Odra) transboundary river basins using climate indices recommended by the Expert Team on Climate Change Detection and Indices (ETCCDI). Utilizing bias-corrected EURO-CORDEX regional climate models under the high-emission RCP8.5 scenario, we evaluated changes in the frequency, intensity, and contribution of heavy precipitation events from 2006 to 2100 compared to a historical baseline (1990–2019). The find..."
"2026-04-01","Extrémy","Crossref/Stochastic Environmental Research and Risk Assessment","https://doi.org/10.1007/s00477-026-03212-3",""
"2026-04-01","Extrémy","Crossref/Stochastic Environmental Research and Risk Assessment","https://doi.org/10.1007/s00477-026-03210-5",""
"2026-04-01","Extrémy","Crossref/Stochastic Environmental Research and Risk Assessment","https://doi.org/10.1007/s00477-026-03211-4",""
"2026-04-01","Extrémy","Crossref/Stochastic Environmental Research and Risk Assessment","https://doi.org/10.1007/s00477-026-03186-2",""
"2026-04-01","Klimatická změna","Crossref/Stochastic Environmental Research and Risk Assessment","https://doi.org/10.1007/s00477-026-03203-4",""
"2026-04-01","Klimatická změna","Crossref/Sustainability","https://doi.org/10.3390/su18073401","The agricultural sector faces increasing vulnerability to climate change, necessitating effective adaptation measures to maintain productivity and enhance system resilience. Despite this critical need, limited studies explore the factors influencing farmers’ adaptive responses within specific climatic zones. This study aimed to identify adaptation measures essential for agricultural sustainability in the three purposively selected Grama Niladari divisions (GNDs) known for their diverse crop varieties in the Maho Agrarian Zone, a region chara..."
"2026-04-01","Klimatická změna","Crossref/Sustainability","https://doi.org/10.3390/su18073403","Background: Phytolith-occluded carbon (PhytOC) is highly stable and constitutes an important long-term carbon pool in agroecosystems, particularly in nutrient-poor, sandy soils. Silicon (Si) uptake by plants is strongly associated with phytolith formation, with Si accounting for up to 90% of phytolith composition. However, the role of Si fertilization in enhancing PhytOC sequestration under field conditions remains insufficiently quantified."
"2026-04-01","Klimatická změna","Crossref/Sustainability","https://doi.org/10.3390/su18073411","Coral reefs around Hainan Island in the northern South China Sea represent a marginal reef system exposed to interacting climatic and anthropogenic stresses. This study used an optimized MaxEnt model, remote-sensing-derived coral reef occurrence data, key environmental variables, and CMIP6 climate projections to assess habitat suitability, identify key environmental thresholds associated with suitability change, and examine areas with potential refugial significance. The optimized model showed high predictive performance (mean AUC = 0.947)."
"2026-04-01","Klimatická změna","Crossref/Sustainable Development","https://doi.org/10.1002/sd.71007","ABSTRACTEuropean urban climate change research lacks integration across scales, geography, and climate challenges, despite Europe's coordinated policy frameworks. Through a hybrid bibliometric and systematic review of 1528 studies (2010–2025) using Cortext Manager and PRISMA 2020 guidelines, this study maps the conceptual patterns, knowledge gaps, and adaptation and mitigation measures in European urban climate change research. Findings reveal: (1) scale fragmentation between building‐ and city‐level research; (2) geographic concentration in..."
"2026-04-01","Klimatická změna","Crossref/Sustainable Development","https://doi.org/10.1002/sd.71028","ABSTRACT ‘Hard’ natural sciences have extensively been used to provide evidence that climate change is happening and climate action is needed. If the contribution of our economic activities to disturbing our climate systems is now largely accepted, the way in which we design and operationalise ‘climate action’—how we transition to more sustainable practices—is affected by political and legal systems, cultures, communication, even psychology and spirituality. For such a transition to be encouraged and sustained, social sciences are needed."
"2026-04-01","Extrémy","Crossref/npj Biodiversity","https://doi.org/10.1038/s44185-026-00126-9",""
"2026-04-01","Emise","Crossref/npj Climate and Atmospheric Science","https://doi.org/10.1038/s41612-026-01392-x","AbstractDuring July–August 2024, East Antarctica experienced the most intense winter heatwave in the 46-year satellite era, with regional mean surface air temperatures across Dronning Maud Land exceeding the climatological mean by more than 9°C for 17 consecutive days. To explore the physical drivers and quantify the anthropogenic contribution to this unprecedented event, we propose a multi-model, multi-method attribution framework integrating regional climate model-based storyline attribution, circulation analogues, and large-ensemble proba..."
"2026-03-31","Extrémy","Crossref/ACS Omega","https://doi.org/10.1021/acsomega.5c08744",NA
"2026-03-31","Emise","Crossref/Academic Journal of Science and Technology","https://doi.org/10.54097/tgc61c92","Phase change microcapsules (PCMs) represent an advanced functional material that encapsulates phase change materials within miniature protective shells. This unique characteristic endows them with significant application potential and value across diverse fields, including smart textiles, electronic thermal management, solar energy utilization, and healthcare. However, the traditionally widely used melamine-formaldehyde resin shell systems pose potential formaldehyde emission issues, which severely restrict their deployment in sensitive scen..."
"2026-03-31","Emise","Crossref/Aerospace","https://doi.org/10.3390/aerospace13040324","Avoiding contrails is one of the recent trends in ATM. Aviation contrails are considered a significant non-CO2 environmental factor worth avoiding even with a CO2 increase (lower-level cruise or horizontal avoidance, both burning more fuel). This paper is a study of the global impact of aviation on global warming considering contrails and CO2 trade-offs."
"2026-03-31","Klimatická změna","Crossref/African Journal of Hospitality Tourism and Leisure","https://doi.org/10.46222/ajhtl.19770720.721","Questions surrounding climate change and responses in urban tourism destinations are attracting a growing scholarship. Perception studies provide valuable insights into the behavioural dynamics of stakeholders, and improved understanding of the risk perceptions of tourism stakeholders is seen as critical in confronting the challenges posed by climate change in urban destinations. This study presents results from a semi-structured questionnaire administered to 160 tourism businesses in Bulawayo, Zimbabwe’s second city, about perceptions of cl..."
"2026-03-31","Extrémy","Crossref/African Journal of Reproductive Health","https://doi.org/10.29063/ajrh2026/v30i6.2","This study investigates the impact of flooding on maternal health outcomes among pregnant women in rural Hyderabad, Pakistan, using a mixed-methods approach combining retrospective facility record analysis (pre- and post-flood data), quantitative surveys (n=400), and qualitative interviews (n=10). Pre- and post-flood comparisons of facility records revealed severe healthcare disruptions, with antenatal care visits declining by 60% (120±25 to 48±18/month, p<0.001) and cesarean section availability dropping from 90% to 35% post-flood. Neonatal..."
"2026-03-31","Klimatická změna","Crossref/Agricultural Economics (Zemědělská ekonomika)","https://doi.org/10.17221/227/2025-agricecon",NA
"2026-03-31","Extrémy","Crossref/Agricultural Science Digest - A Research Journal","https://doi.org/10.18805/ag.d-6451","Background: Drought tolerance in Barnyard millet (Echinochloa frumentacea) was evaluated using ethyl methane sulphonate (EMS) induced mutagenesis in response to increasing frequency of drought events associated with climate change. Barnyard millet is a nutritionally rich cereal crop well adapted to low-input agricultural systems; however, development of drought-tolerant varieties is essential to ensure stable productivity under water-limited conditions. Methods: The present study investigated the effects of seed pre-soaking followed by EMS t..."
"2026-03-31","Klimatická změna","Crossref/Agricultural Science Digest - A Research Journal","https://doi.org/10.18805/ag.d-6451","Background: Drought tolerance in Barnyard millet (Echinochloa frumentacea) was evaluated using ethyl methane sulphonate (EMS) induced mutagenesis in response to increasing frequency of drought events associated with climate change. Barnyard millet is a nutritionally rich cereal crop well adapted to low-input agricultural systems; however, development of drought-tolerant varieties is essential to ensure stable productivity under water-limited conditions. Methods: The present study investigated the effects of seed pre-soaking followed by EMS t..."
"2026-03-31","Extrémy","Crossref/Agricultural Systems and Natural Resources","https://doi.org/10.52578/3134-8556-2026-1-73-86","The determination of wheat resistance to leaf rust is an important research priority both in Kazakhstan and worldwide. Leaf rust (Puccinia recondita) is one of the most destructive wheat diseases, causing significant yield losses and economic damage. The pathogen exhibits high adaptability to diverse soil and climatic conditions, which contributes to its broad geographical distribution."
"2026-03-31","Emise","Crossref/Agrosystems, Geosciences & Environment","https://doi.org/10.1002/agg2.70349","AbstractTropical forests in sub‐Saharan Africa (SSA) harbor around one‐third of the world's species but are becoming more fragmented due to the expansion of human settlements and small‐scale agricultural (SCA) areas. This study systematically reviewed the approaches and methods used to analyze forest fragmentation and its impact on biodiversity in SSA, with a focus on their suitability in SCA landscapes. The main findings revealed that most studies in SSA employed generalized approaches to assess fragmentation, failing to account for the dis..."
"2026-03-31","Klimatická změna","Crossref/Alternative Law Journal","https://doi.org/10.1177/1037969x261439740","As loss and damage from climate change continue to mount, there are growing calls from affected communities for both more aggressive climate action and compensation from the historically highest emitting countries that have largely caused the crisis. There is an expanding body of research exploring multiple dimensions of climate reparations. However, in Australia there has so far been limited scholarly, policy, or legal debate regarding the specific responsibilities of governments, organisations, and corporations in addressing the escalating..."
"2026-03-31","Klimatická změna","Crossref/American Journal of Agricultural Economics","https://doi.org/10.1002/ajae.70068","AbstractPerennial crops are economically important. They contribute to food security, providing essential nutrients that are often lacking in annual crops, and provide additional environmental benefits compared with annual crops. Despite their importance, empirical research on the impacts of climate change and adaptation on perennial crops remains limited."
"2026-03-31","Klimatická změna","Crossref/Archives of Health Science and Research","https://doi.org/10.5152/archealthscires.2026.25280","Objective: This study aimed to assess the levels of climate change awareness and climate change–related anxiety among actively practicing nurses in Türkiye and to examine the predictors of this relationship. Methods: A cross-sectional descriptive design was used. Data were collected online from 347 nurses using a sociodemographic form, the Climate Change Awareness Scale (CCAS), and the Climate Change Anxiety Scale (CCAnxS)."
"2026-03-31","Extrémy","Crossref/Artvin Çoruh Üniversitesi Orman Fakültesi Dergisi","https://doi.org/10.17474/artvinofd.1844300","Climate change intensifies multidimensional environmental threats in urban areas, including flooding, drought, heatwaves, and biodiversity loss, making urban resilience a critical challenge. Developing climate-resilient cities therefore requires data-driven and integrative approaches in landscape design beyond conventional engineering solutions. In this context, artificial intelligence (AI), in combination with nature-based solutions (NBS), introduces new opportunities for the planning, implementation, and management of urban landscapes."
"2026-03-31","Klimatická změna","Crossref/Artvin Çoruh Üniversitesi Orman Fakültesi Dergisi","https://doi.org/10.17474/artvinofd.1844300","Climate change intensifies multidimensional environmental threats in urban areas, including flooding, drought, heatwaves, and biodiversity loss, making urban resilience a critical challenge. Developing climate-resilient cities therefore requires data-driven and integrative approaches in landscape design beyond conventional engineering solutions. In this context, artificial intelligence (AI), in combination with nature-based solutions (NBS), introduces new opportunities for the planning, implementation, and management of urban landscapes."
"2026-03-31","Extrémy","Crossref/Asian Journal of Microbiology and Biotechnology","https://doi.org/10.56557/ajmab/2026/v11i110411","Black pepper (Piper nigrum L.) holds significant importance as a spice crop due to its widespread culinary use, economic value, medicinal properties, and historical significance. However, its susceptibility to drought stress significantly challenges sustainable production. Recent molecular markers reveal black pepper's genetic basis for drought tolerance, providing insights that could enhance cultivation strategies and crop resilience."
"2026-03-31","Emise","Crossref/Atmosphere","https://doi.org/10.3390/atmos17040360","Maritime transport is essential for global trade, yet ship emissions remain a major source of air pollution in coastal and port areas, with potential impacts on local air quality and human health. Cruise ships are particularly relevant in urban ports because, beyond propulsion, they require a continuous onboard energy supply for hotel services while berthed. This study develops a bottom-up emission inventory for cruise ship calls at Istanbul Galataport during the 2024 season, estimating CO2 as a greenhouse gas (GHG) and NOx, SOx, and particu..."
"2026-03-31","Extrémy","Crossref/Atmosphere","https://doi.org/10.3390/atmos17040352","Against the backdrop of accelerated terrestrial hydrological cycling and the increasing concurrence of drought-heatwave compound extremes under global warming, regional land-atmosphere coupling has emerged as a central mechanism shaping climate feedbacks and trajectories of ecosystem carbon uptake. However, prior studies spanning climatic regimes, observational scales, and data sources have often yielded contradictory conclusions. Here, we challenge these fragmented perspectives by constructing an integrated LST-SM-ET-GPP chain that jointly ..."
"2026-03-31","Emise","Crossref/Atmospheric Chemistry and Physics","https://doi.org/10.5194/acp-26-4405-2026","Abstract. Satellite observations of nitrogen dioxide (NO2) are a valuable tool for estimating nitrogen oxides (NOx) emissions from point sources and can support carbon dioxide (CO2) monitoring through emission ratios. We assess the capability of TROPOMI NO2 measurements to quantify the seasonal and day-to-day temporal variability of NOx emissions from eighteen power plants in Europe and the United States."
"2026-03-31","Emise","Crossref/Atmósfera","https://doi.org/10.20937/atm.53515","This study presents an updated operational ozone forecasting system for central Mexico, incorporating improvements such as a revised VOC model-ready emissions, cycling of previous-day forecasts as initial conditions, and changes to temporal profiles for Sunday emissions. A refined evaluation methodology was also introduced, in which the maximum hourly ozone concentration predicted over a selected urban area is compared against the maximum observed value reported at any RAMA monitoring station, excluding background sites. This approach is pro..."
"2026-03-31","Klimatická změna","Crossref/BIODIVERS - BIOTROP Science Magazine","https://doi.org/10.56060/bdv.2026.5.1.2857","Jakarta’s urban green spaces are more than city parks. They are small ecosystems alive with pollinators that keep urban nature functioning. To understand how vegetation and human activity influence butterfly diversity, this study surveyed five parks across the city using standardized observation methods, namely the Pollard Walk and Point Count."
"2026-03-31","Extrémy","Crossref/BMC Genomics","https://doi.org/10.1186/s12864-026-12797-6",NA
"2026-03-31","Klimatická změna","Crossref/BMC Medical Education","https://doi.org/10.1186/s12909-026-09093-y",NA
"2026-03-31","Klimatická změna","Crossref/BMJ Leader","https://doi.org/10.1136/leader-2025-001328",NA
"2026-03-31","Klimatická změna","Crossref/Bulgarian Journal of Agricultural Economics and Management","https://doi.org/10.61308/runi1820","Climate change raises pressing questions regarding the environmental impact of food systems. Carbon footprinting could serve as a potential measure to guide climate-friendly food consumption in Bulgaria. This study explores the opportunities and challenges of using carbon footprinting to guide consumer behaviour and promote sustainable consumption."
"2026-03-31","Emise","Crossref/Carbon Balance and Management","https://doi.org/10.1186/s13021-026-00428-2",NA
"2026-03-31","Extrémy","Crossref/Climatic Change","https://doi.org/10.1007/s10584-026-04113-8",NA
"2026-03-31","Extrémy","Crossref/Climatic Change","https://doi.org/10.1007/s10584-026-04112-9",NA
"2026-03-31","Klimatická změna","Crossref/Corporate Social Responsibility and Environmental Management","https://doi.org/10.1002/csr.70572","ABSTRACTThis study explores how the green backgrounds of female executives (GFEMs) influence corporate climate targets disclosure (CTD). Using a panel dataset comprising China's A‐share nonfinancial listed companies (2010–2022) and rigorous methodologies, the findings confirm that GFEMs promote CTD. We find a nonlinear correlation with CTD rising with GFEM representation to an optimal point, but again weakening due to over‐concentration of GFEM presence, an inverted U‐shaped association reminiscent of critical mass dynamics."
"2026-03-31","Klimatická změna","Crossref/Discover Environment","https://doi.org/10.1007/s44274-026-00665-9","Abstract This study assesses how teff farmers’ perception of climate change, identifies adaptation strategies, and analyzes factors influencing their adoption in the Horro Guduru Wallaga zone, Ethiopia. A survey was conducted with 352 respondents selected by a multistage sampling technique. The Climate Change Risk Perception Index (CCRPI) and Problem Confrontation Index (PCI) were used to assess farmers’ perception of climate change and constraints of climate change adaptation."
"2026-03-31","Emise","Crossref/Discover Sustainability","https://doi.org/10.1007/s43621-026-03040-z",NA
"2026-03-31","Extrémy","Crossref/Earth Systems and Environment","https://doi.org/10.1007/s41748-026-01133-3",NA
"2026-03-31","Extrémy","Crossref/Earth's Future","https://doi.org/10.1029/2025ef007370","AbstractAmple evidence has shown that cities modulate regional hydrometeorology and hydroclimatology. Because different precipitation intensities have distinct hydrological and societal impacts, with light precipitation helping to alleviate urban heat and extreme precipitation often driving flood risks, it is important to understand whether and how urban effects vary with precipitation intensity. Based on global satellite‐based observations, we demonstrate that 70.1% of large cities experience increased light precipitation frequency, while 6..."
"2026-03-31","Extrémy","Crossref/Ecohydrology","https://doi.org/10.1002/eco.70203","ABSTRACT Global climate change is intensifying extreme drought events, representing severe threats to aquatic ecosystems. In the Pampas ecoregion of Argentina, prolonged drought intersects with strong anthropogenic pressures such as agriculture and urban effluents, generating complex environmental gradients. We investigated structural and functional responses of phytoplankton assemblages in rural and urban streams of the Samborombón River basin during an extreme drought in which some of the sampling points completely dried."
