"date","keyword","source","link","abstract"
"2026-04-23","Emise","Crossref/Academia Engineering","https://doi.org/10.20935/acadeng8259","Introduction: Due to Brazil’s geographic location, the country is well-positioned to generate energy from renewable sources. With high levels of solar irradiation, the use of photovoltaic (PV) solar energy has grown in recent years, and installations are expected to continue increasing. Assessing lifecycle greenhouse gas (GHG) emissions associated with installing PV systems is key to determining net emissions reductions and evaluating the potential to reduce the carbon footprint of existing PV systems."
"2026-04-23","Extrémy","Crossref/Agriculture","https://doi.org/10.3390/agriculture16090929","Drought stress severely restricts agricultural productivity. Effective drought mitigation requires both improved rhizosphere water retention and enhanced nutrient availability. Poly-γ-glutamic acid (PGA) was expected to enhance water retention, while residue after evaporation (RAE) of 2-keto-L-gulonic acid fermentation was expected to supply labile carbon and promote nutrient mobilization."
"2026-04-23","Klimatická změna","Crossref/Agriculture & Food Security","https://doi.org/10.1186/s40066-025-00562-z",""
"2026-04-23","Extrémy","Crossref/Agronomy","https://doi.org/10.3390/agronomy16090854","Increasing freshwater scarcity alongside growing irrigation demand poses a major challenge for agricultural production. One potential response is the use of drought adaptation amendments: materials of natural or synthetic origin that, when applied to soil or crops, either increase water availability or improve plant performance under water stress. Because these amendments range from minerals and microorganisms to polymers and plant-derived compounds, they are often studied in separate disciplinary literatures rather than as a single category..."
"2026-04-23","Emise","Crossref/Atmospheric Chemistry and Physics","https://doi.org/10.5194/acp-26-5517-2026","Abstract. Croplands are the largest anthropogenic source of nitrous oxide (N2O), a potent greenhouse gas and ozone-depleting substance. Agricultural emissions produce small atmospheric signals with high spatiotemporal variability presenting a large observational challenge."
"2026-04-23","Emise","Crossref/Atmospheric Chemistry and Physics","https://doi.org/10.5194/acp-26-5531-2026","Abstract. Carbon monoxide (CO), an important atmospheric pollutant produced by incomplete combustion and hydrocarbon oxidation, significantly affects atmospheric oxidation capacity and air quality. Accurate quantification of its global emissions and the underlying driver behind its atmospheric trends is essential for understanding changes in global atmospheric environment."
"2026-04-23","Klimatická změna","Crossref/Atmospheric Chemistry and Physics","https://doi.org/10.5194/acp-26-5531-2026","Abstract. Carbon monoxide (CO), an important atmospheric pollutant produced by incomplete combustion and hydrocarbon oxidation, significantly affects atmospheric oxidation capacity and air quality. Accurate quantification of its global emissions and the underlying driver behind its atmospheric trends is essential for understanding changes in global atmospheric environment."
"2026-04-23","Klimatická změna","Crossref/BMC Public Health","https://doi.org/10.1186/s12889-026-27435-9",""
"2026-04-23","Emise","Crossref/Business Strategy and the Environment","https://doi.org/10.1002/bse.70879","ABSTRACT Although organisations are increasingly scrutinised on their CO 2 e emissions, economic growth is frequently encouraged. Eco‐efficiency–based initiatives—‘doing more with less’—could be a solution. The problem is that many organisations (e.g., smaller enterprises without access to specialist knowledge) have difficulties in gauging the impact of their initiatives on macrolevel targets of CO 2 e reduction."
"2026-04-23","Klimatická změna","Crossref/Canadian Journal of Fisheries and Aquatic Sciences","https://doi.org/10.1139/cjfas-2025-0222","Climate change is altering ocean temperatures. In the Northwest Atlantic, seasonal cooling (16ºC to -1.5ºC) is expected to drive cold adaptation through genetic or behavioral mechanisms. In fractional spawners, seasonal temperature shifts may cause phenotypic metabolic divergence between settlement pulses within a population, affecting year-class recruitment."
"2026-04-23","Extrémy","Crossref/Canadian Journal of Plant Science","https://doi.org/10.1139/cjps-2025-0218","Tomato (Solanum lycopersicum L.) production in Ghana is increasingly constrained by recurrent drought and flood events, yet the adaptive capacity of local landraces to these abiotic stresses remains poorly understood. This study evaluated the morphological, physiological, and biochemical responses of eight tomato cultivars, including Ghanaian landraces, using a CRD with four replications per cultivar–treatment combination. The experimental factors were cultivar (eight levels) and watering regimes (three levels: well-watered control, continuo..."
"2026-04-23","Klimatická změna","Crossref/Climate","https://doi.org/10.3390/cli14050090","The power system is the backbone of the energy network, and overhead lines are its vital structures. Weather threats may jeopardise the reliability of lines and make them a weak link. In particular, heavy rainfall episodes can cause failures, especially in mountain areas."
"2026-04-23","Extrémy","Crossref/Coğrafi Bilimler Dergisi","https://doi.org/10.33688/aucbd.1810574","On a regional scale, Turkey is located in a sensitive area because of its geographical position, and the region's topography makes it vulnerable to drought. The Ergene Basin, which is the research area, has been at risk of drought in recent years. Therefore, determining the potential onset time of drought and researching its possible effects and duration are of critical importance for the basin."
"2026-04-23","Klimatická změna","Crossref/Discover Applied Sciences","https://doi.org/10.1007/s42452-025-08109-4",""
"2026-04-23","Klimatická změna","Crossref/ENGINEERING Management","https://doi.org/10.1007/s42524-026-5183-6",""
"2026-04-23","Emise","Crossref/Earth: Environmental Sustainability","https://doi.org/10.53941/eesus.2026.100012","Water scarcity is a pressing global challenge affecting over 2.2 billion people. The increasing demand for freshwater, driven by population growth, water pollution, industrialisation, urbanisation and climate change, has intensified pressure on conventional freshwater sources. With over 97% of Earth’s water stored in oceans, desalination of seawater has become an increasingly attractive strategy to augment water supply, particularly in arid and semi-arid regions."
"2026-04-23","Klimatická změna","Crossref/Earth: Environmental Sustainability","https://doi.org/10.53941/eesus.2026.100012","Water scarcity is a pressing global challenge affecting over 2.2 billion people. The increasing demand for freshwater, driven by population growth, water pollution, industrialisation, urbanisation and climate change, has intensified pressure on conventional freshwater sources. With over 97% of Earth’s water stored in oceans, desalination of seawater has become an increasingly attractive strategy to augment water supply, particularly in arid and semi-arid regions."
"2026-04-23","Emise","Crossref/Environmental Research: Infrastructure and Sustainability","https://doi.org/10.1088/2634-4505/ae5a57","AbstractAs current efforts remain insufficient to limit global warming to 1.5 °C, increasing expectations are placed on emerging technologies such as urban and national digital twins (DTs). Their number and spatial coverage are rapidly expanding, alongside a growing diversity of exploratory use cases. While the literature highlights their potential across multiple domains, a knowledge gap persists regarding their methodological application to subnational spatial greenhouse gas accounting, a key evidence base for local climate action."
"2026-04-23","Emise","Crossref/Environments","https://doi.org/10.3390/environments13050241","Agricultural soils play a dual role in the climate system, acting both as carbon sinks and natural sources of greenhouse gas emissions, which may be intensified under unsustainable management. However, the comparative effectiveness of different soil management strategies, particularly organic amendments derived from agro-industrial residues, remains insufficiently clarified. This review aims to critically synthesize current scientific evidence on soil stewardship practices for mitigating greenhouse gas emissions and enhancing soil carbon seq..."
"2026-04-23","Emise","Crossref/Frontiers in Climate","https://doi.org/10.3389/fclim.2026.1735834","Urban areas, with dense populations and concentrated consumption, are major contributors to CO₂ emissions, accelerating the progression of the Anthropocene. In this context, low-carbon city transformation is essential for sustainability and climate resilience. This transformation is a complex process requiring collaboration across sectors and stakeholders, with media serving as a crucial communication bridge connecting government, the public, and other actors."
"2026-04-23","Emise","Crossref/Frontiers in Marine Science","https://doi.org/10.3389/fmars.2026.1805764","Corrosion protection systems used on offshore structures release metals or chlorine-produced oxidants into surrounding waters. Yet, their effects on marine biomonitoring species remain poorly understood. Here, we assess how emissions from induced current cathodic protection systems and zinc- and aluminium-based galvanic anodes affect the early developmental stages of the kelp Saccharina latissima."
"2026-04-23","Klimatická změna","Crossref/Frontiers in Marine Science","https://doi.org/10.3389/fmars.2026.1812238","Climate change is rapidly altering the environment in the Arctic with large implications for marine life. This study presents the first time-series analysis of epibenthic community structure in Young Sound, NE Kalaallit Nunaat (Greenland), aiming to assess the structural and functional changes over time in response to climate-driven environmental change. Using data collected by drop cameras and ROVs at depths of 20m to 60m, from years 2003–2010 and 2021-2022, we evaluated the taxonomic and functional composition of the benthic community."
"2026-04-23","Extrémy","Crossref/Geomatics, Natural Hazards and Risk","https://doi.org/10.1080/19475705.2026.2662403",""
"2026-04-23","Klimatická změna","Crossref/Iconic Research and Engineering Journals","https://doi.org/10.64388/irev9i10-1716669",""
"2026-04-23","Klimatická změna","Crossref/International Journal of Environmental Impacts","https://doi.org/10.56578/ijei090215",""
"2026-04-23","Klimatická změna","Crossref/International Journal of Latest Technology in Engineering Management & Applied Science","https://doi.org/10.51583/ijltemas.2026.150300109","Climate change has emerged as one of the most pressing global challenges, and India’s western state of Gujarat faces distinctive risks due to its semi-arid geography, long coastline, and industrial profile. Non-Governmental Organizations (NGOs) have become crucial actors in bridging local realities with national and global climate policies. This study explores the empirical role of NGOs in mitigating climate change across Gujarat."
"2026-04-23","Extrémy","Crossref/International Journal of Science and Research (IJSR)","https://doi.org/10.21275/sr26418221615",""
"2026-04-23","Klimatická změna","Crossref/International Journal of Science and Research (IJSR)","https://doi.org/10.21275/sr26418221615",""
"2026-04-23","Klimatická změna","Crossref/JRAK","https://doi.org/10.23969/jrak.v18i1.35318","Growing regulatory and stakeholder pressure underscores the importance of climate change reporting, yet the role of CEO busyness in shaping corporate disclosure remains underexplored. Prior evidence from other disclosure contexts is mixed, and few studies examine corporate governance as a moderating factor. This research investigates the influence of CEO busyness on climate change disclosure, the moderating effect of corporate governance, and the impact of disclosure on firm performance."
"2026-04-23","Emise","Crossref/Journal Siplieria Sciences","https://doi.org/10.48173/jss.v7i2.329","Climate-smart agriculture (CSA) provides a vital framework for enhancing food security, resilience, and mitigation in Sub-Saharan Africa (SSA), where agriculture is highly vulnerable to climate variability and shocks. By integrating practices that sustainably increase productivity and reduce greenhouse gas emissions, CSA addresses the region’s dual challenges of climate change and food insecurity. Computational algorithms offer critical tools for supporting CSA through simulation, predictive analytics, optimization, and decision-making."
"2026-04-23","Extrémy","Crossref/Journal Siplieria Sciences","https://doi.org/10.48173/jss.v7i2.329","Climate-smart agriculture (CSA) provides a vital framework for enhancing food security, resilience, and mitigation in Sub-Saharan Africa (SSA), where agriculture is highly vulnerable to climate variability and shocks. By integrating practices that sustainably increase productivity and reduce greenhouse gas emissions, CSA addresses the region’s dual challenges of climate change and food insecurity. Computational algorithms offer critical tools for supporting CSA through simulation, predictive analytics, optimization, and decision-making."
"2026-04-23","Klimatická změna","Crossref/Journal Siplieria Sciences","https://doi.org/10.48173/jss.v7i2.329","Climate-smart agriculture (CSA) provides a vital framework for enhancing food security, resilience, and mitigation in Sub-Saharan Africa (SSA), where agriculture is highly vulnerable to climate variability and shocks. By integrating practices that sustainably increase productivity and reduce greenhouse gas emissions, CSA addresses the region’s dual challenges of climate change and food insecurity. Computational algorithms offer critical tools for supporting CSA through simulation, predictive analytics, optimization, and decision-making."
"2026-04-23","Klimatická změna","Crossref/Journal of Fish Biology","https://doi.org/10.1111/jfb.70451","Abstract Freshwater fish biodiversity is undergoing a rapid decline worldwide due to habitat fragmentation, climate change, invasive species, overexploitation and pollution. Yet, for many regions, including biodiversity‐rich but underrepresented areas such as Türkiye, large‐scale assessments of species diversity and distribution remain limited. Environmental DNA (eDNA) metabarcoding offers a powerful, non‐invasive and scalable tool for biodiversity assessment, capable of detecting both common and cryptic taxa."
"2026-04-23","Extrémy","Crossref/Journal of Global Ecology and Environment","https://doi.org/10.56557/jogee/2026/v22i210519","The study assessed the public perception of green infrastructure as a tool in the management of storm water in Port Harcourt municipality. This research was necessitated by the inability of the natural drainage channels to drain runoff water due to the increasing use of paved and impermeable surfaces in the study area.as well as to understand the knowledge base of the residents of the study area on the technology of green infrastructure. The study adopted a cross-sectional survey with a multistage sampling method using both primary and secon..."
"2026-04-23","Klimatická změna","Crossref/Journal of Marine Science and Engineering","https://doi.org/10.3390/jmse14090771","Marine heatwaves and invasive tunicate fouling increasingly co-occur in mussel aquaculture, yet their combined effects on rope-level performance and plankton dynamics remain unclear. A 9-day field-based mesocosm experiment in Georgetown Harbour (Prince Edward Island, Canada) examined the independent and interactive effects of heatwaves (~4.5 °C above ambient) and tunicates on 50 cm sections of Mytilus edulis culture rope. Oxygen consumption rate (OCR), clearance rate (CR), capture efficiency (CE), absorption efficiency (AE), scope for growth..."
"2026-04-23","Emise","Crossref/Journal of the Knowledge Economy","https://doi.org/10.1007/s13132-026-03281-3",""
"2026-04-23","Emise","Crossref/Journal of the Saudi Society of Agricultural Sciences","https://doi.org/10.1007/s44447-026-00167-3","AbstractThis study examines the relationship between water stress, agricultural efficiency, energy use, and CO₂ emissions in GCC countries, a region characterized by extreme water scarcity and energy-intensive development patterns. The coexistence of severe freshwater constraints and carbon-intensive energy systems creates a setting in which resource management and environmental pressure are tightly interconnected within the water–energy–agriculture–environment nexus. Understanding these interdependencies is essential for designing effective..."
"2026-04-23","Emise","Crossref/Land","https://doi.org/10.3390/land15050701","Rapid urbanization in China has reshaped the coupling coordination between pollution and carbon emissions. However, existing studies largely rely on linear approaches and lack multidimensional and nonlinear assessments of urban growth patterns. Using panel data for 289 prefecture-level cities from 2010 to 2023, including built-up land, nighttime lights, CO2 emissions, and PM2.5 concentrations, this study develops three indicators: Urban Expansion Intensity (UEI), Urban Sprawl Index (USI), and Urban Compactness (UC)."
"2026-04-23","Extrémy","Crossref/Microbiology Resource Announcements","https://doi.org/10.1128/mra.01378-25","ABSTRACT We report the draft genome sequence of Bacillus velezensis CMAA1918, an osmotolerant rhizobacterium isolated from the drought-tolerant bromeliad Neoglaziovia variegata in the Caatinga biome. Genomic features associated with osmotic and drought-related stress responses, phosphate metabolism, siderophore production, and antimicrobial biosynthetic pathways underscore its potential relevance in water-limited agricultural systems."
"2026-04-23","Extrémy","Crossref/New Phytologist","https://doi.org/10.1111/nph.71196","SummaryIncreasing frequency and intensity of droughts threaten grassland ecosystems. Semi‐natural grasslands vary in age from ancient to younger sites established on former arable land. While species richness and composition are known to affect drought resilience, little is known about how grassland age shapes drought responses through eco‐evolutionary processes at the plant population level."
"2026-04-23","Extrémy","Crossref/Plant Molecular Biology","https://doi.org/10.1007/s11103-026-01709-7",""
"2026-04-23","Klimatická změna","Crossref/Plant Science Today","https://doi.org/10.14719/pst.12768","In the fight against climate change, every ring in anatomy tells a story and every leaf holds a secret. Similarly, walnut populations in Pakistan's Dir and Swat districts face varying climatic conditions that affect their anatomy. However, the current study aims to explore the anatomical variations in walnut leaves and nuts to understand climate-driven adaptations."
"2026-04-23","Extrémy","Crossref/Plant and Soil","https://doi.org/10.1007/s11104-026-08557-w",""
"2026-04-23","Emise","Crossref/Processes","https://doi.org/10.3390/pr14091344","Fugitive greenhouse gas (GHG) emissions in industrial parks are characterized by high opacity and spatial dispersion. Existing localization and quantification methods often rely on idealized meteorological assumptions and low-precision mobile monitoring data, making it difficult to achieve accurate source characterization. This study focuses on the Nansha Economic and Technological Development Zone in Guangzhou—one of the first pilot zones for synergistic pollution and carbon reduction in China—to develop an atmospheric inversion model based..."
"2026-04-23","Klimatická změna","Crossref/Research on World Agricultural Economy","https://doi.org/10.36956/rwae.v7i2.2691","Climate change poses significant threats to sustainable agricultural livelihoods, particularly in tea-growing regions such as Thai Nguyen, Vietnam. This study aims to identify and prioritize effective climate change adaptation strategies for tea-producing households. The integrated SWOT–AHP (Strengths, Weaknesses, Opportunities, and Threats – Analytic Hierarchy Process) approach enables a quantifiable and systematic evaluation of strategic elements, allowing for the determination of their relative importance and guiding the ranking of adapta..."
"2026-04-23","Klimatická změna","Crossref/Revista de Derecho Comunitario Europeo","https://doi.org/10.18042/cepc/rdce.83.01","Durante la última década, los tribunales nacionales, europeos e internacionales han recibido demandas de particulares, asociaciones y Estados que cuestionan la acción y la inacción de los Estados en respuesta a los efectos del cambio climático. Esta contribución sitúa en primer lugar este campo creciente de litigios en el contexto de una claridad científica cada vez mayor en relación con los efectos del cambio climático y una oposición política cada vez más fuerte a los instrumentos jurídicos diseñados para combatir sus efectos. Se centra pr..."
"2026-04-23","Klimatická změna","Crossref/Science Education","https://doi.org/10.1002/sce.70072","ABSTRACTThis article is based on a study that examines the practices and perspectives of selected educational actors in Kalimantan, Indonesia, on climate change education. The region is highly affected by climate crises and holds global relevance for mitigation due to its tropical forests and peatlands. Empirical insights derive from participant observation and semi‐structured interviews conducted during a 4‐week field phase."
"2026-04-23","Emise","Crossref/Science for Energy and Environment","https://doi.org/10.53941/see.2026.100002","Nitrogen (N) is an essential constituent of all living organisms and a primary nutrient limiting life on Earth, mediating critical biogeochemical processes across the atmosphere, hydrosphere, biosphere, and pedosphere. The natural nitrogen cycle is a finely tuned network of microbial, physical, and chemical transformations that regulate the availability of reactive nitrogen (Nr) while maintaining environmental equilibrium. However, anthropogenic activities—particularly industrial nitrogen fixation via the Haber–Bosch process, intensive agric..."
"2026-04-23","Klimatická změna","Crossref/Science for Energy and Environment","https://doi.org/10.53941/see.2026.100002","Nitrogen (N) is an essential constituent of all living organisms and a primary nutrient limiting life on Earth, mediating critical biogeochemical processes across the atmosphere, hydrosphere, biosphere, and pedosphere. The natural nitrogen cycle is a finely tuned network of microbial, physical, and chemical transformations that regulate the availability of reactive nitrogen (Nr) while maintaining environmental equilibrium. However, anthropogenic activities—particularly industrial nitrogen fixation via the Haber–Bosch process, intensive agric..."
"2026-04-23","Klimatická změna","Crossref/Scientific Journal of Technology","https://doi.org/10.54691/dfcyv474","The intensification of global climate change and environmental pollution has made achieving carbon peaking and carbon neutrality a core strategy for global development. With the continuous advancement of new energy technologies, the utilization of clean energy sources such as wind, solar, and hydrogen has brought profound transformations to the traditional energy structure. In this context, the fields of aero engines and gas turbines are also facing both pressure and opportunities for low-carbon transition."
"2026-04-23","Klimatická změna","Crossref/Subterranean Biology","https://doi.org/10.3897/subtbiol.56.190752","Subterranean ecosystems harbor a high diversity of narrow-range endemics, yet they remain largely invisible in conservation planning, representing a major bias that may trigger irreversible biodiversity loss under rapid climate change. This study applied an Ensemble of Small Models (ESMs) framework, coupled with a target-group background strategy, to assess the climate vulnerability and protection status of Zopherobatrus Yin & Li, 2015 (Coleoptera: Staphylinidae: Pselaphinae), an extremely rare troglobitic rove beetle genus endemic to the ka..."
"2026-04-23","Emise","Crossref/Sustainability","https://doi.org/10.3390/su18094200","This paper assesses the role of nature-based solutions as a way to scale sustainability goals, focusing on the use of carbon credits in voluntary corporate climate commitments. To accomplish this, we adapt the DICE23 model by incorporating a demand function for voluntary corporate carbon abatement and by including the costs of supplying nature-based and non-CO2 credits to that market. Through scenario analysis, we examine how likely current and proposed new commitments are to meet 1.5 °C and 2 °C climate thresholds by 2030 and 2050 with and ..."
"2026-04-23","Emise","Crossref/Sustainability","https://doi.org/10.3390/su18094205","Effective supply chain planning increasingly requires balancing cost-efficiency with environmental responsibility, particularly as organisations face growing pressure to reduce the carbon footprint of logistics operations. This study develops a mixed-integer linear programming model to optimise inventory and transportation decisions in a multi-echelon distribution network comprising a central warehouse, regional warehouses, and retailers. The model integrates a continuous-review (r,Q) replenishment policy, stochastic demand, safety stock req..."
