"date","keyword","source","link","abstract"
"2026-05-05","global warming","Crossref/The Journal of Special Education","https://doi.org/10.1177/00224669261437414","This scoping review examined 40 studies from 22 countries to explore global dimensions of parents’ positive experiences and coping strategies in raising autistic children. Three major themes emerged: diagnostic process, positive parental experiences, and positive coping strategies. Using an individualistic-collectivistic cultural lens, the analysis revealed that cultural orientations shaped how parents accepted and adapted to their child’s autism diagnosis and subsequent parenting experiences."
"2026-05-05","environmental change","Crossref/The Research Frontline - Journal","https://doi.org/10.66871/trf-j.v1i2.011",""
"2026-05-05","air pollution","Crossref/The future of Horticulture","https://doi.org/10.37229/fsa.fjh.2026.05.05","Conventional propagation methods such as seed propagation and grafting are limited by genetic variability, long juvenile periods, and technical constraints, restricting large-scale mango production. This study evaluated air layering as an alternative propagation method using natural biostimulants (honey and cinnamon) compared with an untreated control during two seasons (March and September) on the ‘Jahrawy’ mango strain. Rooting percentage, number of roots, root length, and subsequent vegetative growth parameters were assessed."
"2026-05-05","environmental change","Crossref/Toxicology and Environmental Health Sciences","https://doi.org/10.1007/s13530-026-00319-6",""
"2026-05-05","environmental change","Crossref/Toxicology and Environmental Health Sciences","https://doi.org/10.1007/s13530-026-00320-z",""
"2026-05-05","drought","Crossref/Turkish Journal of Civil Engineering","https://doi.org/10.18400/tjce.1806645","This study evaluates hydroelectric performance under drought conditions through a scenario-based hybrid turbine operation strategy. Drought-induced hydrological variability leads to fluctuations in streamflow and consequently affects energy production continuity. In response, a Francis–Pelton hybrid configuration was assessed under five drought scenarios classified using the Streamflow Drought Index (SDI).Monthly averaged synthetic discharge data were employed to represent idealized hydrological conditions."
"2026-05-05","environmental change","Crossref/Undergraduate Research Journal of Psychology (URJP) at UCLA","https://doi.org/10.5070/jp2.47348","Personality development arises from the ongoing interactions between genetic predispositions and environmental experiences throughout a person's life. This literature review synthesizes findings from published behavioral genetic studies, longitudinal twin and adoption research, molecular analyses, and environmental psychology to interpret how genetic, environmental, and gene-environment interaction processes contribute to the stability and transformation of personality traits. Evidence from twin studies and meta-analyses confirms that traits..."
"2026-05-05","global warming","Crossref/Universos Jurídicos","https://doi.org/10.25009/uj.v1i26.2793","El artículo analiza la evolución del derecho constitucional comparado como disciplina científica y como herramienta esencial para el diseño, interpretación y reforma del orden constitucional contemporáneo. Se expone cómo la globalización jurídica ha generado un diálogo internacional entre tribunales y sistemas constitucionales, lo que ha generado el enriquecimiento de las normas con la experiencia institucional, así como la generación de instituciones mixtas. Asimismo, se examinan el objeto, método y fases del análisis comparado, haciendo no..."
"2026-05-05","air pollution","Crossref/Urban Science","https://doi.org/10.3390/urbansci10050250","Urban air pollution in Skopje, a city with complex topography, is strongly influenced by traffic emissions, household heating, industrial activities, and meteorological conditions, leading to pronounced spatial and seasonal variability. The objective of this study is to assess the contribution of major urban emission sources to air quality in Skopje, with a focus on traffic pollution, and to quantify their seasonal influence on NO2, PM10, and PM2.5 concentrations using a high-resolution urban dispersion modelling approach. The methodology is..."
"2026-05-05","global warming","Crossref/Urban Science","https://doi.org/10.3390/urbansci10050249","Amid growing concerns over global warming, ensuring the outdoor thermal comfort (OTC) of public urban spaces is crucial for creating liveable and resilient cities. This study focused on the intensification of the urban heat island (UHI) effect and the heat stress experienced by the vulnerable older population. Evidence was found through the case study in a highly vulnerable area of Porto, with a high ageing ratio."
"2026-05-05","environmental change","Crossref/Veredas do Direito","https://doi.org/10.18623/rvd.v23.6341","This article investigates the legal and policy instruments required to address core environmental threats—including climate change, biodiversity loss, pollution, and illegal resource extraction—as fundamental determinants of societal safety and sustainable development. To identify strategic priorities, a sociological survey (n=1,727) was conducted, revealing a significant public prioritization of environmental concerns within the security discourse, with foremost attention to water resource quality, emissions control, and waste management. T..."
"2026-05-05","global warming","Crossref/Veredas do Direito","https://doi.org/10.18623/rvd.v23.6342","Background: the preservation of the historical and cultural heritage, as well as the religious and traditional values of society, and their transmission to the younger generation. Purpose: to identify the characteristic features of the formation of the views of the contemporary Russian younger generation on traditional values. Methods: general scientific methods of cognition."
"2026-05-05","climate change","Crossref/WORK: A Journal of Prevention, Assessment & Rehabilitation","https://doi.org/10.1177/10519815261442855","BackgroundOccupational safety climate, a key predictor of workplace safety performance and employee well-being, requires culturally adapted and psychometrically robust measurement tools such as the NOSACQ-50 to effectively assess safety perceptions across different industries and populations. ObjectiveThis study aimed to conduct the cross-cultural adaptation of the interview-administered Turkish version of the Nordic Occupational Safety Climate Questionnaire (NOSACQ-50) and to assess its psychometric properties in the metal industry. Methods..."
"2026-05-05","air pollution","Crossref/War & Society","https://doi.org/10.1080/07292473.2026.2665448",""
"2026-05-05","flood","Crossref/Water","https://doi.org/10.3390/w18091107","Small streams exhibit rapid and nonlinear flood responses due to steep slopes, short flow paths, and limited storage capacity, making real-time flood prediction difficult under both computational and data constraints. This study presents a measurement-based flood prediction framework for real-time estimation of flood discharge and depth in small-stream basins. Conventional approaches, such as physically based hydrodynamic models, require detailed boundary conditions and high computational cost, while data-driven models often lack physical in..."
"2026-05-05","climate change","Crossref/Weather, Climate, and Society","https://doi.org/10.1175/wcas-d-25-0079.1","AbstractThis study examines the meteorological conditions observed during direct heat-related mortality events across the Continental United States (CONUS). Using the publicly available NOAA Storm Events Database, the research integrates long-term records of heat-related fatalities with ERA5-Land reanalysis to identify critical thresholds for seven heat-stress indicators: maximum and minimum dry-bulb temperature, Universal Thermal Comfort Index (UTCI), Wet-Bulb Temperature (WBT), Wet-Bulb Globe Temperature (WBGT), Heat Index, and Apparent Te..."
"2026-05-05","environmental change","Crossref/Web Ecology","https://doi.org/10.5194/we-26-61-2026","Abstract. In studies on the reproduction and germination of species with indehiscent fruits containing a single seed, it is often assumed that all fruits that reach maturity contain a seed capable of generating a new plant. This is not always the case, and failing to take this into account can lead to erroneous conclusions regarding the factors affecting reproduction or germination in plants."
"2026-05-05","environmental change","Crossref/Wilderness & Environmental Medicine","https://doi.org/10.1177/10806032261445064",""
"2026-05-05","climate change","Crossref/npj Climate Action","https://doi.org/10.1038/s44168-026-00373-3",""
"2026-05-04","biodiversity loss","Crossref/ACS Applied Engineering Materials","https://doi.org/10.1021/acsaenm.6c00200",NA
"2026-05-04","climate change","Crossref/ACS Applied Engineering Materials","https://doi.org/10.1021/acsaenm.6c00280",NA
"2026-05-04","climate change","Crossref/ACS Applied Nano Materials","https://doi.org/10.1021/acsanm.6c01089",NA
"2026-05-04","air pollution","Crossref/ACS ES&T Air","https://doi.org/10.1021/acsestair.5c00513",NA
"2026-05-04","air pollution","Crossref/ACS ES&T Engineering","https://doi.org/10.1021/acsestengg.6c00187",NA
"2026-05-04","greenhouse gas emissions","Crossref/ACS Nano","https://doi.org/10.1021/acsnano.5c15014",NA
"2026-05-04","environmental change","Crossref/AI & SOCIETY","https://doi.org/10.1007/s00146-026-03064-z","AbstractAI is widely promoted as a driver of innovation and efficiency. Yet, its growing environmental footprint introduces tensions that challenge dominant narratives of technological progress. Training and deploying large-scale AI models demand substantial energy, water, and computational resources, generating environmental impacts that remain largely invisible to most consumers."
"2026-05-04","greenhouse gas emissions","Crossref/APS Open Science","https://doi.org/10.1103/3qhm-yr7d","The design and performance of a cryogenic buffer gas beam source with a load-lock system is presented. The third generation of advanced cold molecule electric dipole moment search (ACME III) uses this source to produce a beam of cold, slow thorium monoxide (ThO) molecules. A feature of the apparatus is the capability of replacing the ablation targets without interrupting the vacuum or cryogenic conditions, thus increasing the average signal in the eEDM search."
"2026-05-04","global warming","Crossref/Academia Global and Public Health","https://doi.org/10.20935/acadphealth8268","Introduction: Approximately 24.3% of female sex workers (FSWs) in Cameroon are living with human immunodeficiency virus (HIV). Social media platforms present new opportunities to improve HIV prevention efforts. This study examines the acceptance of Secret Facebook Groups (SFG) for HIV prevention education among FSWs in Western Cameroon and identifies barriers, facilitators, and recommendations for future interventions."
"2026-05-04","biodiversity loss","Crossref/Acta Obstetricia et Gynecologica Scandinavica","https://doi.org/10.1111/aogs.70238","AbstractIntroductionThis study aimed to evaluate the role of radiomic analysis applied to ultrasound images in predicting postpartum blood loss at birth in women affected by low‐lying placenta or placenta previa. Material and MethodsIn this retrospective, single‐center study, we analyzed singleton pregnancies with placenta previa or a low‐lying placenta, initially diagnosed at the second‐trimester ultrasound examination. Data were collected from ultrasound examinations conducted in the second and third trimesters, along with birth outcomes."
"2026-05-04","climate change","Crossref/Advanced Fiber Materials","https://doi.org/10.1007/s42765-026-00723-0",NA
"2026-05-04","global warming","Crossref/Advances in Atmospheric Sciences","https://doi.org/10.1007/s00376-026-6003-y",NA
"2026-05-04","greenhouse gas emissions","Crossref/African Journal of Environment and Sustainable Development","https://doi.org/10.46654/jw4mhq21","The study examined the effect of environmental accounting costs on financial performance of listed oil and gas companies in Nigeria. The objectives were to assess the effects of energy conservation costs and environmental training costs on return on assets. The scope covered NGX-listed oil and gas companies from 2014 to 2023, using audited annual reports and accounts."
"2026-05-04","climate change","Crossref/Annals of the Entomological Society of America","https://doi.org/10.1093/aesa/saag016","AbstractRearing silkworms on artificial diets (AD) is crucial for sustainable sericulture, but their oligophagous nature makes adapting to non-mulberry leaf (ML) diets challenging. To date, the issues of reduced resistance and diminished vitality in silkworms reared on AD remain unresolved, and there is a lack of comprehensive research on alterations in their intestinal immune responses. In response to this knowledge gap, this study systematically investigated the impact of AD on intestinal stress and antibacterial capacity in silkworms."
"2026-05-04","greenhouse gas emissions","Crossref/Applied Economics","https://doi.org/10.1080/00036846.2026.2664814",NA
"2026-05-04","greenhouse gas emissions","Crossref/Applied Physics B","https://doi.org/10.1007/s00340-026-08678-1",NA
"2026-05-04","greenhouse gas emissions","Crossref/Applied Physics Letters","https://doi.org/10.1063/5.0317429","Two-dimensional electron gases (2DEGs) at the surfaces of KTaO3 have become an exciting platform for exploring strong spin–orbit coupling, Rashba physics, and low-carrier-density superconductivity. Yet, a large fraction of reported KTaO3-based 2DEGs has been realized through chemically complex overlayers that both generate carriers and can obscure the native electronic structure, making spectroscopic access to the underlying 2DEG challenging. Here, we demonstrate a simple and direct method to generate a superconducting 2DEG on KTaO3(111) usi..."
"2026-05-04","environmental change","Crossref/Applied and Environmental Microbiology","https://doi.org/10.1128/aem.00556-26","ABSTRACTSelenoproteins, a unique class of proteins critical for cellular antioxidant defense, are characterized by the incorporation of selenocysteine (Sec) in their active sites. Sec is co-translationally inserted into proteins via a specialized mechanism that reprograms the UGA codon to encode Sec, involving a specific RNA structure designated the Sec insertion sequence (SECIS) element and several essential enzymes. Although numerous selenoproteins have been identified in prokaryotes (primarily bacteria), the detection of selenoprotein gen..."
"2026-05-04","biodiversity loss","Crossref/Aquaculture Environment Interactions","https://doi.org/10.3354/aei00529",NA
"2026-05-04","environmental change","Crossref/Archnet-IJAR: International Journal of Architectural Research","https://doi.org/10.1108/arch-11-2025-0506","PurposeRapid urbanization is a major driver of disruptions to the natural urban water cycle. Accelerated rates of land conversion and the use of impervious surfaces, linked to biodiversity loss and an increase in urban flooding, often produce broader social, economic and environmental consequences. This study aims to examine how Sponge City initiatives deliver broader co-benefits for public health, environmental sustainability and socio-economic development beyond primarily addressing hydrological and ecological challenges."
"2026-05-04","global warming","Crossref/Arthritis Care & Research","https://doi.org/10.1002/acr.80081","ObjectivesNon‐articular pain (NAP) may contribute to patient global assessment (PtGA), confound disease activity assessment, and influence treatment decisions. Our aims were to 1) evaluate the association between NAP and PtGA in adults with active RA starting a new DMARD; and 2) determine the extent this relationship is mediated by pain intensity. MethodsWe enrolled adults with active RA initiating a new DMARD."
"2026-05-04","greenhouse gas emissions","Crossref/Asian Journal of Environment & Ecology","https://doi.org/10.9734/ajee/2026/v25i5930","Produced water constitutes the largest fraction of waste generated in the oil and gas extraction industry, while drilling waste represents the second major fraction. Both types of waste are typically discharged into evaporation ponds, which therefore serve as the primary accumulation zones for toxic elements. The study aims to evaluate the extent of elemental contamination associated with hydrocarbon extraction activities at the Shahbazpur gas field in Bangladesh by analyzing elemental abundances in both subsurface reservoir core samples and..."
"2026-05-04","climate change","Crossref/Asian Journal of Science, Technology, Engineering, and Art","https://doi.org/10.58578/ajstea.v4i3.8920","This paper develops a stochastic optimal control framework for modeling age-structured population dynamics under climate-induced migration, with application to Nigeria’s Niger Delta region. Climate-related slow-onset and extreme hazards, including flooding, sea-level rise, and environmental degradation, drive internal displacement that disproportionately affects younger working-age groups and intensifies urban demographic pressure and infrastructure strain. The proposed model extends the deterministic McKendrick–von Foerster equation into a ..."
"2026-05-04","climate change","Crossref/Asian Research Journal of Agriculture","https://doi.org/10.9734/arja/2026/v19i2855","Climate variability poses a serious challenge to rice production in dryland, tank-fed, and coastal ecosystems of Tamil Nadu of India, particularly in drought-prone districts such as Ramanathapuram. Krishi Vigyan Kendras (KVKs) play a critical role in promoting climate-resilient agricultural technologies through Frontline Demonstrations (FLDs); however, empirical evidence on their field-level performance and adoption behaviour remains limited. The present study assessed the performance and adoption of selected climate-resilient rice technolog..."
"2026-05-04","biodiversity loss","Crossref/BMC Biology","https://doi.org/10.1186/s12915-026-02608-5",NA
"2026-05-04","global warming","Crossref/BMC Global and Public Health","https://doi.org/10.1186/s44263-026-00273-y",NA
"2026-05-04","air pollution","Crossref/BMC Pregnancy and Childbirth","https://doi.org/10.1186/s12884-026-08857-0",NA
"2026-05-04","climate change","Crossref/BMC Public Health","https://doi.org/10.1186/s12889-026-27550-7","AbstractBackgroundVibrio and Shewanella spp. (VS) are climate-sensitive bacteria found in marine environments, which sometimes cause severe human infections. VS infections have risen globally, particularly in Northern Europe."
"2026-05-04","global warming","Crossref/BMC Veterinary Research","https://doi.org/10.1186/s12917-026-05529-1","AbstractBackgroundBovine ephemeral fever (BEF) is an economically important yet under-characterized arboviral disease of cattle and water buffalo, with substantial impacts on productivity and herd health across tropical and subtropical regions. Despite decades of surveillance, global prevalence estimates remain uncertain due to pronounced diagnostic heterogeneity and uneven geographic coverage. MethodsWe conducted a systematic review and Bayesian hierarchical meta-analysis of BEF serological and molecular prevalence data."
"2026-05-04","biodiversity loss","Crossref/BioScience","https://doi.org/10.1093/biosci/biag032","AbstractThe urgent need for comprehensive biodiversity data is driven by rapid biodiversity loss due to human activity. Drawing on insights from established national biodiversity data infrastructures in Europe, this article highlights eight key considerations for strengthening national data infrastructures—particularly in enhancing stakeholder engagement through improved data availability and accessibility. We emphasize the importance of collaboration among diverse stakeholders to enhance data sharing and integration."
"2026-05-04","global warming","Crossref/Biogeosciences","https://doi.org/10.5194/bg-23-2959-2026","Abstract. Peatlands are major carbon stores that are sensitive to climate change and increasingly affected by human activity. Accurate assessment of carbon stocks and modelling of peatland responses to future climate scenarios requires robust information on peat depth."
"2026-05-04","global warming","Crossref/Biological Reviews","https://doi.org/10.1002/brv.70176","ABSTRACTThe impact of plastic pollution on ecosystems and marine fauna is well documented, although research into its effects on waders (also known as shorebirds) remains limited. Given that waders are exposed to coastal marine litter, this exposure could be a significant factor in the decline of their populations. This study aims to assess the global distribution of plastic ingestion in waders and investigate regional differences in their exposure."
"2026-05-04","air pollution","Crossref/British Journal of Contemporary Education","https://doi.org/10.52589/bjce-oxhle9zj","This study addressed the limited understanding of how African military ensembles reconcile colonial musical legacies with indigenous knowledge systems and emerging ecological concerns, focusing specifically on the Nigerian Air Force Band. The research examined how the ensemble negotiated these intersecting pressures and why this process matters for contemporary debates on culture, identity, and sustainability. A qualitative ethnographic design was employed, drawing on performance transcripts, interviews, and archival materials from a purposi..."
"2026-05-04","climate change","Crossref/British Journal of Educational Technology","https://doi.org/10.1111/bjet.70070","AbstractAs students learn and practice new skills in university courses, their behaviour can change in response to competing demands and increasing content complexity. However, most metrics used to evaluate study behaviour focus on the number or sequence of activities rather than on the change of behaviour. To address this, we replicate and extend a complex dynamical systems approach to characterise recurrence in behavioural patterns and whether it changes.Using assessment logs from 1362 students in the first 5 weeks of a semester‐long progr..."
"2026-05-04","environmental change","Crossref/Business Ethics, the Environment & Responsibility","https://doi.org/10.1111/beer.70116","ABSTRACTIn response to stricter environmental regulations and increased stakeholder awareness, firms are increasingly focused on enhancing their ESG performance. However, limited research has explored how environmental regulation affects corporate ESG environmental performance, particularly through the mediating role of green innovation. This study addresses this gap by analyzing the influence of environmental regulation on corporate ESG performance in China, using panel data from listed firms between 2010 and 2023."
"2026-05-04","environmental change","Crossref/Business Strategy and the Environment","https://doi.org/10.1002/bse.70893","ABSTRACTThis study tests whether pro‐environmental purchasing behavior (PPB) cultivates environmental citizenship. We analyze survey data from 1816 residents across seven French metropolitan areas using partial least squares structural equation modelling combined with necessary condition analysis. Environmental knowledge and related antecedents predict PPB; in turn, PPB increases both political and social participation (PSP) and internal political efficacy (IPE)."
"2026-05-04","climate change","Crossref/Carbon Neutral Systems","https://doi.org/10.1007/s44438-026-00029-z","AbstractBrazil is structuring a biochar value chain at the intersection of climate policy and industrial innovation. Although the deployment of this value chain remains at an early stage, recent regulatory advances, particularly the Brazilian Emissions Trading System (SBCE) and emerging technical standards, create new opportunities for biochar to be recognized as a carbon removal strategy. This Comment argues that Brazil’s current momentum represents a critical inflection point, but its success depends on resolving three key challenges: (i) ..."
"2026-05-04","greenhouse gas emissions","Crossref/Chemical Product and Process Modeling","https://doi.org/10.1515/cppm-2025-0256","AbstractThe rapid expansion of underground natural gas pipeline networks in urban areas increases the chances of methane leaks that are difficult to detect and thus create safety and environmental issues. In this paper, an adaptable machine learning system is introduced to locate methane leaks quickly and to decrease the risk of methane leaks in underground gas pipelines. The Evolutionary Optimization (EVO) and Firefly Algorithm (FLA) are used to optimize CATB, ANFIS, and Histogram Gradient Boosting (HGB) predictive models so that their dete..."
"2026-05-04","environmental change","Crossref/Chemistry Letters","https://doi.org/10.1093/chemle/upag074","AbstractLayered P2-type structures of MnNi oxides are attracting attention as cathode materials for sodium-ion batteries. However, life-cycle assessment analysis showed that Ni usage has environmental impact, making its substitution necessary. This paper presents a benchmarking study on machine learning interatomic potentials for P2-type layered oxides."
"2026-05-04","climate change","Crossref/Clinical Psychology: Science and Practice","https://doi.org/10.1037/cps0000342.supp",NA
