"date","keyword","source","link","abstract"
"2026-03-31","Klimatická změna","Crossref/Ecohydrology","https://doi.org/10.1002/eco.70203","ABSTRACT Global climate change is intensifying extreme drought events, representing severe threats to aquatic ecosystems. In the Pampas ecoregion of Argentina, prolonged drought intersects with strong anthropogenic pressures such as agriculture and urban effluents, generating complex environmental gradients. We investigated structural and functional responses of phytoplankton assemblages in rural and urban streams of the Samborombón River basin during an extreme drought in which some of the sampling points completely dried."
"2026-03-31","Emise","Crossref/Economic Change and Restructuring","https://doi.org/10.1007/s10644-026-09994-4",NA
"2026-03-31","Emise","Crossref/Economics of Innovation and New Technology","https://doi.org/10.1080/10438599.2026.2649915",NA
"2026-03-31","Klimatická změna","Crossref/Economics of Innovation and New Technology","https://doi.org/10.1080/10438599.2026.2649915",NA
"2026-03-31","Globální změna","Crossref/Entomologia Generalis","https://doi.org/10.1127/entomologia/4295",NA
"2026-03-31","Extrémy","Crossref/Environment & Urbanization","https://doi.org/10.1177/09562478261423458","Across the urban global South, flood adaptation is too often framed as a technical exercise, even though the deepest risks are concentrated in informal settlements shaped by long-running social and spatial injustices. This paper reframes flood adaptation as a justice project, asking who is protected, who is displaced and whose knowledge and claims to space shape decisions about risk. Using a qualitative, document-based comparison of 13 informal settlements across Africa, Asia and Latin America, the paper identifies recurring “infrastructures..."
"2026-03-31","Extrémy","Crossref/Environment & Urbanization","https://doi.org/10.1177/09562478261423202","Urban flooding, a relatively new research area in Malawi, has brought urban drainage systems under increasing scrutiny for their capacity to manage stormwater and mitigate flood risk. In the context of global practice in sustainable urban drainage systems in the face of climate change, this review analyzes the limited progress in Malawi towards sustainable urban drainage, highlighting the socio-economic, environmental and technical factors influencing urban drainage resilience, and the gaps in stormwater management practice. Results reveal a..."
"2026-03-31","Klimatická změna","Crossref/Environment & Urbanization","https://doi.org/10.1177/09562478261423202","Urban flooding, a relatively new research area in Malawi, has brought urban drainage systems under increasing scrutiny for their capacity to manage stormwater and mitigate flood risk. In the context of global practice in sustainable urban drainage systems in the face of climate change, this review analyzes the limited progress in Malawi towards sustainable urban drainage, highlighting the socio-economic, environmental and technical factors influencing urban drainage resilience, and the gaps in stormwater management practice. Results reveal a..."
"2026-03-31","Emise","Crossref/Environment, Development and Sustainability","https://doi.org/10.1007/s10668-026-07579-9",NA
"2026-03-31","Extrémy","Crossref/Environmental Management","https://doi.org/10.1007/s00267-026-02428-x",NA
"2026-03-31","Extrémy","Crossref/Environmental Management","https://doi.org/10.1007/s00267-026-02413-4","AbstractEthiopia’s food production and rural livelihoods are increasingly threatened by land degradation and climate variability, particularly in dryland areas vulnerable to climatic shocks. Exclosure, a designated area shielded from human and animal disruption, has emerged as a vital restoration approach, especially in northern Ethiopia. Empirical studies have largely focused on ecological outcomes and have provided limited and mixed results on whether exclosure enhances agricultural productivity and livelihood diversification."
"2026-03-31","Klimatická změna","Crossref/Environmental Politics","https://doi.org/10.1080/09644016.2026.2652118",NA
"2026-03-31","Klimatická změna","Crossref/Environmental Research Communications","https://doi.org/10.1088/2515-7620/ae59f4","AbstractClimate change poses an increasing threat to food security in sub-Saharan Africa. This study assesses the impact of climate change on millet yields and investigates how it may limit the potential for agricultural intensification. The STICS crop model, driven by a high-resolution, bias-corrected ensemble of CMIP6 climate projections based on the SSP5-8.5 scenario, was used to simulate millet yields under various nitrogen input scenarios in Senegal."
"2026-03-31","Klimatická změna","Crossref/Environmental Research: Food Systems","https://doi.org/10.1088/2976-601x/ae596c","AbstractClimate change is predicted to reduce the nutritional value of terrestrial crops, yet its direct impact on animal-based foods remains underexplored. The present study used farmed Atlantic salmon (Salmo salar) as a model to investigate how ocean warming may alter mineral composition and human mineral intake. Atlantic salmon were reared at optimum (15 °C) and suboptimum elevated temperatures (20 °C) to quantify tissue mineral changes, followed by projections of ocean surface temperatures in major Atlantic salmon-producing nations and d..."
"2026-03-31","Emise","Crossref/Environmental Science and Pollution Research","https://doi.org/10.1007/s11356-026-37693-0",NA
"2026-03-31","Emise","Crossref/Environmental Science and Pollution Research","https://doi.org/10.1007/s11356-026-37713-z",NA
"2026-03-31","Emise","Crossref/Environmental Science and Pollution Research","https://doi.org/10.1007/s11356-026-37699-8","AbstractThe cement industry is a major contributor to global CO₂ emissions, which has led to the development of low-carbon cements. A critical factor in ensuring the durability of these materials is their resistance to freeze-thaw (F-T) cycles, especially as climate change expands the relevance of these tests beyond traditionally cold regions to areas with increasingly variable climates. This review analyzes current testing standards for low-CO₂ cements exposed to F-T cycles, highlighting gaps in performance research in this field."
"2026-03-31","Emise","Crossref/Environmental Science and Pollution Research","https://doi.org/10.1007/s11356-026-37716-w",NA
"2026-03-31","Klimatická změna","Crossref/Environmental Science and Pollution Research","https://doi.org/10.1007/s11356-026-37717-9",NA
"2026-03-31","Klimatická změna","Crossref/Environmental Science and Pollution Research","https://doi.org/10.1007/s11356-026-37699-8","AbstractThe cement industry is a major contributor to global CO₂ emissions, which has led to the development of low-carbon cements. A critical factor in ensuring the durability of these materials is their resistance to freeze-thaw (F-T) cycles, especially as climate change expands the relevance of these tests beyond traditionally cold regions to areas with increasingly variable climates. This review analyzes current testing standards for low-CO₂ cements exposed to F-T cycles, highlighting gaps in performance research in this field."
"2026-03-31","Emise","Crossref/European Journal of Nutrition & Food Safety","https://doi.org/10.9734/ejnfs/2026/v18i42007","Climate change poses an unprecedented dual challenge to the global dairy industry: it exposes cattle to increasingly severe heat stress whilst simultaneously demanding that the sector substantially reduce its own greenhouse gas (GHG) emissions. Dairy cattle, particularly high-yielding Holstein populations selectively bred for temperate environments, are highly susceptible to rising ambient temperatures and humidity, which impair milk production, reproductive efficiency, and animal welfare. Concurrently, livestock supply chains account for ap..."
"2026-03-31","Klimatická změna","Crossref/European Journal of Nutrition & Food Safety","https://doi.org/10.9734/ejnfs/2026/v18i42007","Climate change poses an unprecedented dual challenge to the global dairy industry: it exposes cattle to increasingly severe heat stress whilst simultaneously demanding that the sector substantially reduce its own greenhouse gas (GHG) emissions. Dairy cattle, particularly high-yielding Holstein populations selectively bred for temperate environments, are highly susceptible to rising ambient temperatures and humidity, which impair milk production, reproductive efficiency, and animal welfare. Concurrently, livestock supply chains account for ap..."
"2026-03-31","Emise","Crossref/Fire Technology","https://doi.org/10.1007/s10694-026-01887-2",NA
"2026-03-31","Klimatická změna","Crossref/Focus on Health Professional Education: A Multi-Professional Journal","https://doi.org/10.11157/fohpe-vol27iss1id938","Introduction: Climate change is an increasing global health concern, affecting healthcare systems and patient care. Healthcare professionals, including physiotherapists, medical practitioners and occupational therapists, play a vital role in promoting sustainability and reducing the environmental impact of healthcare. Entry-level education provides an opportunity to equip future practitioners with the necessary knowledge to address climate-related health challenges."
"2026-03-31","Emise","Crossref/Frontiers in Forests and Global Change","https://doi.org/10.3389/ffgc.2026.1724355","Quantifying the long-term impacts of land use and land cover (LULC) change on carbon stocks is critical for guiding climate change mitigation strategies in tropical forest frontiers. In this study, we assessed the spatially explicit carbon balance of the Itacaiúnas River Basin (IRB), located in the Amazon arc of deforestation, from 1985 to 2021. To achieve this, we combined annual LULC maps with estimates of biomass and soil carbon stocks and burned area data to quantify carbon losses from deforestation, carbon gains from secondary forest re..."
"2026-03-31","Extrémy","Crossref/Frontiers in Forests and Global Change","https://doi.org/10.3389/ffgc.2026.1724355","Quantifying the long-term impacts of land use and land cover (LULC) change on carbon stocks is critical for guiding climate change mitigation strategies in tropical forest frontiers. In this study, we assessed the spatially explicit carbon balance of the Itacaiúnas River Basin (IRB), located in the Amazon arc of deforestation, from 1985 to 2021. To achieve this, we combined annual LULC maps with estimates of biomass and soil carbon stocks and burned area data to quantify carbon losses from deforestation, carbon gains from secondary forest re..."
"2026-03-31","Klimatická změna","Crossref/Frontiers in Forests and Global Change","https://doi.org/10.3389/ffgc.2026.1724355","Quantifying the long-term impacts of land use and land cover (LULC) change on carbon stocks is critical for guiding climate change mitigation strategies in tropical forest frontiers. In this study, we assessed the spatially explicit carbon balance of the Itacaiúnas River Basin (IRB), located in the Amazon arc of deforestation, from 1985 to 2021. To achieve this, we combined annual LULC maps with estimates of biomass and soil carbon stocks and burned area data to quantify carbon losses from deforestation, carbon gains from secondary forest re..."
"2026-03-31","Extrémy","Crossref/Frontiers in Plant Science","https://doi.org/10.3389/fpls.2026.1814780","IntroductionFrequency and intensity of “hot droughts” are escalating globally, yet the physiological mechanisms governing tree resilience to the synergistic impacts of water deficiency and heatwaves remain poorly understood. Methods Here, we investigated the dynamics of carbon (C), nitrogen (N), and non-structural carbohydrates (NSC) in leaves, stems, and roots of three subtropical tree seedlings ( Schima superba , Cyclobalanopsis glauca , and Phoebe bournei ) during combined stress and subsequent rehydration. ResultsOur results demonstrate ..."
"2026-03-31","Extrémy","Crossref/Frontiers in Plant Science","https://doi.org/10.3389/fpls.2026.1802920","IntroductionChamerion angustifolium (L.) Holub is a species with potential ecological and horticultural value, yet its tolerance to drought stress during early life stages remains poorly understood. This study investigated the drought tolerance of C. angustifolium by evaluating its physiological responses at both seed germination and seedling growth stages."
"2026-03-31","Extrémy","Crossref/Frontiers in Sustainability","https://doi.org/10.3389/frsus.2026.1780679","The use of gamification or serious games to deliver disaster education to children can be considered as an innovative teaching and learning model. However, traditional disaster education practices heavily rely on teacher-centered approaches, where knowledge is primarily transmitted through lectures or predefined expertise. Similarly, most serious games for disaster education are either limited to board games or fail to provide comprehensive learning experience."
"2026-03-31","Extrémy","Crossref/Frontiers in Sustainable Food Systems","https://doi.org/10.3389/fsufs.2026.1783406","In the context of global warming, frequent agricultural droughts pose a severe threat to food security. Henan Province, as a primary maize-producing hub in China, is highly susceptible to these extreme climate events. Leveraging a comprehensive dataset combining county-level meteorological indicators, satellite remote sensing observations, and agricultural statistics spanning 2013 to 2022, this study investigated the stage-specific impacts of drought on maize yield and the mitigating role of irrigation investment."
"2026-03-31","Extrémy","Crossref/Frontiers in Water","https://doi.org/10.3389/frwa.2026.1806478","Floods are among the most damaging climate-related hazards worldwide, and their health implications are being amplified by ongoing climate change. As global warming reshapes precipitation patterns, sea level, and hydrological variability, flood events are becoming more frequent, intense, and spatially widespread, with consequences that extend far beyond immediate physical damage. This perspective synthesizes current evidence to examine how climate-driven flood dynamics translate into complex and interconnected risks to human health."
"2026-03-31","Klimatická změna","Crossref/Frontiers in Water","https://doi.org/10.3389/frwa.2026.1806478","Floods are among the most damaging climate-related hazards worldwide, and their health implications are being amplified by ongoing climate change. As global warming reshapes precipitation patterns, sea level, and hydrological variability, flood events are becoming more frequent, intense, and spatially widespread, with consequences that extend far beyond immediate physical damage. This perspective synthesizes current evidence to examine how climate-driven flood dynamics translate into complex and interconnected risks to human health."
"2026-03-31","Emise","Crossref/Future Business Journal","https://doi.org/10.1186/s43093-026-00796-8","Abstract This research aims to investigate the intricate relationships among key economic variables within the BRICS (Brazil, Russia, India, China, and South Africa) economies during the period 1992–2022. The study scrutinizes the interplay between green finance (GF), non-renewable energy (NRE) consumption, foreign direct investment (FDI), gross domestic product (GDP), and carbon dioxide (CO 2 ) emissions. The analysis leverages the symmetric and asymmetric autoregressive distributed lags (ARDL) and nonlinear ARDL estimation methodologies to..."
"2026-03-31","Extrémy","Crossref/Geographia Polonica","https://doi.org/10.7163/gpol.0319","The main research aim was to determine changes in synoptic conditions during rainfall incidents that led to catastrophic flood events in southeastern Poland in 1997, 2010 and 2024. The basis of the synoptic analysis was calculated from ERA5 (ECMWF – European Center for Medium-Range Weather Forecasts) reanalysis containing information on such variables as atmospheric pressure, geopotential, moisture content or direction and speed of air flow in the lower troposphere. The study also includes information on hydrological conditions on the rivers..."
"2026-03-31","Extrémy","Crossref/Geomatics, Natural Hazards and Risk","https://doi.org/10.1080/19475705.2026.2652594",NA
"2026-03-31","Klimatická změna","Crossref/Global Change Biology","https://doi.org/10.1111/gcb.70833","ABSTRACTThe influence of climate change on emergence phenology of hibernating mammals in northern latitudes is receiving increased attention, yet for freshwater semi‐aquatic mammals such as beavers, which do not hibernate and therefore maintain an obligatory dependence on freshwater habitats throughout the year, little is known about factors influencing their spring emergence above the ice. Given documented effects of increased warming on patterns of ice formation and ice duration on boreal lakes and ponds, we recorded the date of beaver eme..."
"2026-03-31","Klimatická změna","Crossref/Global Change Biology","https://doi.org/10.1111/gcb.70826","ABSTRACT Converting cropland to planted forests improves soil organic carbon (SOC) and total nitrogen (TN) storage while contributing to climate change mitigation, primarily through the regulation of belowground organisms and mineral protection such as calcium (Ca). However, the mechanistic pathways linking exchangeable Ca 2+ , soil micro‐food web interactions, and nutrient accumulation under warming remain unclear. Here, we investigated their potential roles in driving the accumulation of mineral‐associated organic matter (MAOM), SOC, and T..."
"2026-03-31","Extrémy","Crossref/Global Economic, Social, and Development Review","https://doi.org/10.24123/gesdr.v29i2.7904","This study investigated residents' willingness to pay (WTP) for community-based flood mitigation infrastructure through a Malang, Indonesia, case study of the Glintung Go Green (G3) program. This study aimed to identify the key factors influencing WTP and assess the structural and cultural challenges in sustaining such community-based environmental programs. A mixed method approach was applied, combining focus group discussions (FGDs) with quantitative analysis using Partial Least Squares Structural Equation Modeling (PLS-SEM)."
"2026-03-31","Emise","Crossref/Global Policy","https://doi.org/10.1111/1758-5899.70135","ABSTRACT This article examines the Pacific Blue Shipping Partnership (PBSP), an ambitious initiative aimed at decarbonising maritime transport across Oceania. The study explores the cultural, historical and technological aspects of wind‐propelled shipping in the Pacific. Highlighting the recent delivery of the SV Juren Ae , a modern sailing cargo ship, as a significant milestone, the research contextualises the PBSP within the broader framework of international maritime decarbonisation efforts and the unique challenges faced by Pacific Islan..."
"2026-03-31","Emise","Crossref/Industrial & Engineering Chemistry Research","https://doi.org/10.1021/acs.iecr.5c05346",NA
"2026-03-31","Emise","Crossref/International Journal of Built Environment and Earth Science","https://doi.org/10.70382/tijbees.v11i4.073","Climate change mitigation is an urgent global priority, but its pursuit poses disproportionate challenges for developing countries that contribute minimally to global emissions yet bear the brunt of climate impacts. These countries also face immediate developmental needs, including poverty reduction, food security, healthcare, and education, creating tensions between addressing urgent socio-economic concerns and implementing long-term mitigation strategies. The central puzzle of this research is “should climate change mitigation be a priorit..."
"2026-03-31","Klimatická změna","Crossref/International Journal of Built Environment and Earth Science","https://doi.org/10.70382/tijbees.v11i4.073","Climate change mitigation is an urgent global priority, but its pursuit poses disproportionate challenges for developing countries that contribute minimally to global emissions yet bear the brunt of climate impacts. These countries also face immediate developmental needs, including poverty reduction, food security, healthcare, and education, creating tensions between addressing urgent socio-economic concerns and implementing long-term mitigation strategies. The central puzzle of this research is “should climate change mitigation be a priorit..."
"2026-03-31","Klimatická změna","Crossref/International Journal of Digital Earth","https://doi.org/10.1080/17538947.2026.2650001",NA
"2026-03-31","Emise","Crossref/International Journal of Environment and Climate Change","https://doi.org/10.9734/ijecc/2026/v16i45377","Agriculture significantly contributes to global greenhouse gas emissions, mainly from livestock and crop production, and is projected to rise by 2050 due to intensified practices. Complex biological, technical, and economic factors influence these emissions, highlighting the need for climate-smart policies and sustainable agricultural strategies. This study examines the key factors influencing greenhouse gas emissions from the agricultural sector in India using an econometric framework."
"2026-03-31","Extrémy","Crossref/International Journal of Environmental & Agriculture Research","https://doi.org/10.25125/ijoear-mar-2026-15","Maize (Zea mays L.) is one of the most important cereal crops cultivated worldwide and plays a significant role in food security, livestock feed, and industrial applications. However, environmental stresses such as drought, heat stress, and irregular rainfall patterns have severely affected maize productivity in many regions. The identification of stable and stress-tolerant maize genotypes is therefore essential for improving crop productivity under changing climatic conditions."
"2026-03-31","Extrémy","Crossref/International Journal of Molecular Sciences","https://doi.org/10.3390/ijms27073167","Drought significantly disrupts rice productivity under increasing climate volatility. Identifying robust molecular determinants for resilience remains a critical priority for crop improvement. Following the PRISMA guidelines, we performed a large-scale, dual-platform meta-analysis of RNA-Seq and microarray datasets to elucidate the robust transcriptomic landscape of Oryza sativa underwater deficit."
"2026-03-31","Klimatická změna","Crossref/International Journal of Research in Medical Sciences","https://doi.org/10.18203/2320-6012.ijrms20260998","Climate change has emerged as a major global determinant of mental health, contributing to a growing burden of psychological distress. Concurrently, artificial intelligence (AI) offers novel approaches to enhance mental health assessment, monitoring, and intervention, particularly in contexts where access to care is limited. This narrative review synthesizes current evidence on the mental health impacts of climate change and critically examines the potential role of AI-driven technologies in addressing climate-related psychological disorders."
"2026-03-31","Klimatická změna","Crossref/International Review of Public Administration","https://doi.org/10.1080/12294659.2026.2646397",NA
"2026-03-31","Klimatická změna","Crossref/Journal for the Study of Religion, Nature and Culture","https://doi.org/10.1558/jsrnc.33599","Jerusha Matsen Neal, Holy Ground: Climate Change, Preaching, and the Apocalypse of Place (New York: Baylor University Press, 2024), xx + 379 pp., $57.99 (cloth), ISBN: 978-1-4813-1907-2."
"2026-03-31","Extrémy","Crossref/Journal of Advances in Biology & Biotechnology","https://doi.org/10.9734/jabb/2026/v29i43821","Background: Climate variability and increasing rainfall irregularity in West Africa, particularly in the Sudanian savanna zones of Côte d'Ivoire, pose significant challenges to stable cereal production. Consequently, there is a critical need to identify crop varieties that combine high yield potential with resilience to drought and fluctuating environmental conditions. Aims: The study aims to evaluate the stability of grain yield under abiotic stress is a major challenge for enhancing the resilience of cereal-based cropping systems in West A..."
"2026-03-31","Extrémy","Crossref/Journal of Applied Meteorology and Climatology","https://doi.org/10.1175/jamc-d-25-0161.1","Abstract Drought is a climatic hazard that is both costly and destructive. The impacts of drought not only affect hydrologic and agricultural systems, they also cascade through the natural environment. Pollinators play a crucial role in maintaining biodiversity as well as the health of ecosystems."
"2026-03-31","Extrémy","Crossref/Journal of Disaster Research","https://doi.org/10.20965/jdr.2026.p0299","Climate change poses a significant threat to water and food security, necessitating an urgent need to quantify the evolving climate-related risks within the water-food nexus. Despite extensive research on climate change impacts on hydrometeorology, the climate–hydro–crop nexus remains underexplored. This study integrated downscaled and bias-corrected MRI-AGCM-3.2S climate outputs, a seamless hydrological model, and a rain-fed paddy model to simulate the climate change impacts on hydrological extremes, water availability, and rain-fed rice yi..."
"2026-03-31","Extrémy","Crossref/Journal of Disaster Research","https://doi.org/10.20965/jdr.2026.p0358","Flood disasters increasingly shape rural livelihoods in Southeast Asia, not only through crop losses but also through long-term socioeconomic effects. This study develops a stylized agent-based framework (ABMAAF) to analyze flood–poverty dynamics in Candaba, Philippines. The model integrates spatially heterogeneous flood risk, endogenous rice market responses, and household wealth trajectories."
