"date","keyword","source","link","abstract"
"2026-03-30","Emise","Crossref/Atmospheric Science Letters","https://doi.org/10.1002/asl.70003","ABSTRACTHigh‐resolution air pollution datasets are crucial for exposure assessment and policy support but are computationally demanding to produce with traditional models. We present a machine learning‐based framework for spatial downscaling of chemistry‐transport model outputs from 6 km to 1 km horizontal resolution over a large European domain. The model is trained on base case simulations and validated across multiple emission scenarios and temporal scales."
"2026-03-30","Klimatická změna","Crossref/Bulletin of Entomological Research","https://doi.org/10.1017/s0007485326100911","Abstract Native boxwood across Europe has been destroyed by the invasive moth Cydalima perspectalis . To date, climatic conditions and natural enemies have not been able to contain the pests. Increases in temperature due to climate change (CC) may affect insect development and voltinism, with species-specific effects."
"2026-03-30","Emise","Crossref/Environment, Development and Sustainability","https://doi.org/10.1007/s10668-026-07569-x",""
"2026-03-30","Klimatická změna","Crossref/Environmental Microbiology","https://doi.org/10.1111/1462-2920.70269","ABSTRACT The continuous exchange of molecular signals between partners in the cnidarian–dinoflagellate symbiosis is fundamental for maintaining a healthy relationship. This homeostasis is affected by rising seawater temperatures resulting from climate change (i.e., coral bleaching), though little is known about how these molecular signals are altered. Here, we investigated the localisation and abundance of four receptors in the sea anemone Exaiptasia diaphana (‘Aiptasia’) exposed to thermal stress."
"2026-03-30","Extrémy","Crossref/Jurnal Ilmiah Pertanian","https://doi.org/10.31849/29973","Drought stress is a major environmental factor limiting leafy vegetable productivity in greenhouse cultivation. Chitosan is widely reported as a biostimulant that may enhance stress tolerance through physiological and biochemical regulation. This study aimed to evaluate physiological responses of pakcoy (Brassica rapa ssp."
"2026-03-30","Extrémy","Crossref/Natural Hazards","https://doi.org/10.1007/s11069-025-07766-3",""
"2026-03-29","Extrémy","Crossref/Discover Sustainability","https://doi.org/10.1007/s43621-026-03020-3",""
"2026-03-29","Extrémy","Crossref/Discover Sustainability","https://doi.org/10.1007/s43621-026-03080-5",""
"2026-03-29","Klimatická změna","Crossref/Discover Sustainability","https://doi.org/10.1007/s43621-026-03140-w",""
"2026-03-29","Klimatická změna","Crossref/Discover Sustainability","https://doi.org/10.1007/s43621-026-02923-5",""
"2026-03-29","Extrémy","Crossref/Functional Plant Biology","https://doi.org/10.1071/fp25222","The ratio of leaf surface area to dry mass, specific leaf area (SLA), relates function to carbon investment, but how the environment impacts SLA and whether SLA represents whole-plant resource acquisition remains debated. We tested two hypotheses using 12 Rhododendron species from four taxonomic sections with different leaf habits: (1) for leaves, we hypothesized that species, leaf position and light interception impact SLA, but higher SLA would be accompanied by higher net photosynthesis (A), stomatal conductance (gs), and maximum leaf hydr..."
"2026-03-29","Klimatická změna","Crossref/Fırat Üniversitesi Mühendislik Bilimleri Dergisi","https://doi.org/10.35234/fumbd.1843972","As the impacts of climate change continue to intensify, accurate forecasting of meteorological parameters is of critical importance for many applications ranging from agricultural planning to disaster management. This study presents a systematic comparison of seven forecasting models – two baseline statistical (ARIMA, SARIMA) and five deep learning (LSTM, CNN, MLP, CNN-BiLSTM-Attention, and Wavelet-CNN-LSTM) – for daily prediction of mean temperature, humidity, wind speed, and mean pressure using Delhi climate data covering 2013–2017. Hyperp..."
"2026-03-29","Extrémy","Crossref/International Journal of Disaster Risk Management","https://doi.org/10.66050/xfxaaq83","The flood risk in the Niger-East region of Niger State is increasingly becoming an annual event. Climatic shifts, land-surface modifications, and human socioeconomic factors are among the conditions that trigger floods. This study explores geospatial technology and multicriteria decision analysis-analytical hierarchy process (MCDA-AHP) to develop a flood risk prediction system that leverages Google Earth Engine to process remote sensing data directly influencing flood risk."
"2026-03-29","Emise","Crossref/International Journal of Global Economics and Management","https://doi.org/10.62051/ijgem.v10n3.09","China's dual-carbon strategy calls for all cities to formulate carbon peaking action plans, yet the academic literature overwhelmingly focuses on megacities and core economic centers, leaving the low-carbon transition challenges facing non-core, underdeveloped cities underexplored. This paper addresses this gap by examining Nanchong, a populous yet economically peripheral prefecture-level city in the Chengdu–Chongqing Economic Zone (CCEZ), as an in-depth case study. Drawing on Gerschenkron's latecomer advantage theory and the comparative adv..."
"2026-03-29","Emise","Crossref/Journal of Geophysical Research: Atmospheres","https://doi.org/10.1029/2025jd045861","Abstract Affected by the interaction and mixing of oceanic and continental air masses, water‐soluble organic carbon (WSOC) in offshore atmospheric aerosols exhibits unique complexity and characteristics. This study examines the light‐absorption properties and chromophores of WSOC over the East China Sea (ECS). The light‐absorption properties of WSOC, termed as water‐soluble brown carbon (WS‐BrC), reached its highest level when continental outflows were dominant."
"2026-03-29","Emise","Crossref/Journal of Geophysical Research: Atmospheres","https://doi.org/10.1029/2025jd044636","AbstractUnderstanding and independently validating carbon emissions from concentrated point sources is vital to support climate policy. Satellite‐based quantifications of point source emissions have been limited by the spatial coverage of current satellite instruments. We combine three different satellite instruments to determine carbon monoxide (CO) and carbon dioxide () emissions of seven large cities and six industrial complexes."
"2026-03-29","Emise","Crossref/Journal of Geophysical Research: Atmospheres","https://doi.org/10.1029/2025jd045337","Abstract Environmentally persistent free radicals (EPFRs) can generate reactive oxygen species, leading to adverse health effects, with residential biomass burning recognized as a primary source. However, a significant knowledge gap remains regarding the effects of oxygen levels on EPFR emissions, a critical factor in emission dynamics and highly relevant for populations at varying altitudes. This study explored emission factors (EFs), formation mechanisms, and properties of EPFRs from biomass burning under varying oxygen proportions (18.2%–..."
"2026-03-29","Emise","Crossref/Journal of Geophysical Research: Atmospheres","https://doi.org/10.1029/2025jd045353","Abstract Fairbanks, Alaska is an example of a subarctic city that experiences severe wintertime air quality episodes characterized by high concentrations of fine particulate matter (PM 2.5 ) and nitrogen oxides (NO and NO 2 = NO x ). Previous research into these air quality episodes has focused on the impact of surface‐based inversions that trap local emissions. However, the availability of ozone is a limiting factor in local wintertime pollutant transformation, and sensitivity of Fairbanks air quality to ozone availability has not been inve..."
"2026-03-29","Globální změna","Crossref/MUMTAZ : Jurnal Pendidikan Agama Islam","https://doi.org/10.69552/mumtaz.v5i4.3549","In the context of rapid global change, pesantren face increasing pressure to equip santri with 21st-century skills essential for global competitiveness.This study explores how Al-Yasini Islamic Boarding School integrates 21st-century skills within an Islamic framework to sustain its religious identity while enhancing global competitiveness. Using a qualitative descriptive approach with a case study design, data were collected through in-depth interviews with kiai, teachers, and students, along with classroom observations and document analysi..."
"2026-03-29","Klimatická změna","Crossref/Nature Reviews Biodiversity","https://doi.org/10.1038/s44358-026-00147-z",""
"2026-03-29","Extrémy","Crossref/Smart Construction and Sustainable Cities","https://doi.org/10.1007/s44268-026-00093-x","AbstractFlood vulnerability assessment is a critical component of flood risk management, particularly in regions with complex river networks and limited hydrological data. This study proposes a graph neural network-based framework to evaluate river system vulnerability, representing each river segment as a node with hydrological and geomorphological attributes. Two GNN models were employed to generate vulnerability scores by jointly considering node attributes and network structure."
"2026-03-29","Emise","Crossref/VLUTE JOURNAL OF SCIENCE","https://doi.org/10.64215/temp1","The paper presents simulation results aimed at determining the effects of Brown’s gas addition into the intake manifold of a diesel engine on operating characteristics and exhaust emissions along the external characteristic curve. The investigated engine is the IVECO 8140.43R, and the simulation tool employed is AVL Boost. The results indicate that with a Brown’s gas substitution rate of 10÷20% of the torque, the average torque increases by 17%, power output increases by 25%, brake specific fuel consumption decreases by 20%, NOx emissions in..."
"2026-03-28","Emise","Crossref/AJARCDE (Asian Journal of Applied Research for Community Development and Empowerment)","https://doi.org/10.29165/ajarcde.v10i1.933","This study quantified greenhouse gas (GHG) emissions from an apartment-scale aerobic Sewage Treatment Plant (STP) in Surabaya using the 2019 IPCC Guidelines combined with a Scope 1–Scope 2 accounting framework. Direct emissions (Scope 1) consisted of methane (CH4) and nitrous oxide (N2O) generated from biological treatment processes, while indirect emissions (Scope 2) were associated with operational electricity consumption. Activity data from 2023–2025 included occupancy levels, wastewater flow rates, effluent quality, and equipment operation."
"2026-03-28","Emise","Crossref/Agricultural Science Digest - A Research Journal","https://doi.org/10.18805/ag.d-6488","Background: Livestock production is a major source of methane and nitrous oxide, two greenhouse gases with high global warming potential and long-term climate implications. Understanding how these emissions evolve over time is essential for designing effective mitigation strategies, particularly in regions where livestock systems are expanding and emission pressures are increasing. Methods: Annual data on livestock-related methane and nitrous oxide emissions covering the period 1980-2024 were analysed using time-series forecasting approaches."
"2026-03-28","Klimatická změna","Crossref/Annals of the International Communication Association","https://doi.org/10.1093/anncom/wlag011","AbstractClimate change visualizations in the media play a crucial role in conveying information, raising awareness, and motivating action. This study combines systematic and scoping literature review (2005–2024) with content analysis to analyze current research on climate change visualizations of traditional and digital media. The findings show that most existing research concentrates on traditional media, with limited focus on social media and a predominance of studies focused on Western countries."
"2026-03-28","Emise","Crossref/Global NEST Journal","https://doi.org/10.30955/gnj.08166","The construction of zero-waste cities is an important driver for achieving the “dual carbon” goals on schedule and for advancing ecological civilization to a higher level. Based on data from 287 cities in China from 2010 to 2022, a dual machine learning model was employed to empirically examine the impact of zero-waste city construction on urban carbon emissions, using the pilot policy as a quasi-natural experiment. The research yields the following conclusions: (1) The implementation of the zero-waste city policy significantly reduces carbo..."
"2026-03-28","Extrémy","Crossref/International Journal of Environment and Climate Change","https://doi.org/10.9734/ijecc/2026/v16i45371","Rainfall variability and drought occurrence pose significant challenges to water resources, agriculture, and livelihoods in semi-arid regions of India. This study examines the spatio-temporal characteristics of rainfall and drought across Haryana using long-term district-level rainfall data for the period 1981–2024. Mean annual rainfall, standard deviation, coefficient of variation, skewness, and kurtosis were employed to assess rainfall magnitude, variability, and distributional behaviour."
"2026-03-28","Emise","Crossref/Journal of Geophysical Research: Biogeosciences","https://doi.org/10.1029/2025jg009509","Abstract Rapid permafrost thaw in peatlands transforms the subarctic landscape into a mosaic of ponds and peat soil, varying in moisture, carbon and nutrients, and time since thaw. As subarctic permafrost degrades, ponds emerge and mature and can gradually infill with Sphagnum peat. These ponds are considered hotspots of methane (CH 4 ) and carbon dioxide (CO 2 ) emissions, but their potential for nitrous oxide (N 2 O) emissions is understudied."
"2026-03-28","Extrémy","Crossref/MAUSAM","https://doi.org/10.54302/mausam.v77i2.7366","Flash floods are among the most challenging hydro-meteorological hazards to forecast due to their rapid onset, short hydrological response times, and limited warning, particularly in mountainous and densely populated regions. These challenges are being amplified by climate change through increases in short-duration intense rainfall. India is highly vulnerable to such extremes, especially across the Western Himalayan region, where complex terrain and strong monsoon interactions further exacerbate flood risk."
"2026-03-28","Klimatická změna","Crossref/Tourism Economics","https://doi.org/10.1177/13548166261439171","This study examines the effects of tourism openness on climate change and circular economy outcomes within a Waste Kuznets Curve framework. Drawing on a newly compiled global panel dataset of circular economy indicators covering 64 countries over the period 1995–2022, we employ seemingly unrelated regression and dynamic panel data models to account for cross-equation dependence, persistence, and potential endogeneity. The results show that tourism openness, measured by tourism receipts and expenditures as a share of GDP, significantly promot..."
"2026-03-27","Extrémy","Crossref/Acta Biologica Slovenica","https://doi.org/10.14720/abs.69.2.24537","Drought is one of the severe abiotic stresses that limits the growth and yield of crops, mainly in arid and semi-arid regions. Cluster bean (Cyamopsis tetragonoloba L.) is relatively tolerant but suffers physiological and biochemical detriments during prolonged water scarcity. Plant growth-promoting rhizobacteria provide a sustainable biological strategy for improving plant resilience under drought stress."
"2026-03-27","Emise","Crossref/Acta IMEKO","https://doi.org/10.21014/actaimeko.v15i1.2232","Environmental issues, including global warming, dependence on fossil fuels, deforestation, and rising CO2 emissions, have become major challenges worldwide. In Türkiye, fossil fuel demand has continued to rise over the past two decades, despite policies promoting renewable energy. The effectiveness of these policies on transport-related greenhouse gas (GHG) emissions remains uncertain."
"2026-03-27","Emise","Crossref/Agronomy","https://doi.org/10.3390/agronomy16070705","Land-use change contributes significantly to climate change mitigation through biophysical changes (albedo, α) and biogeochemical (greenhouse gases, GHG) emissions (here refers to methane, CH4, and nitrous oxide, N2O). While the impact of grassland–cropland conversion on global warming potential (GWP) is well-documented globally, research remains scarce in the saline-alkaline agropastoral transition zone (APTZ) of the western Songnen Plain, Northeast China, an ecotone uniquely characterized by soil-crusting and seasonal inundation. We conduc..."
"2026-03-27","Klimatická změna","Crossref/Agronomy","https://doi.org/10.3390/agronomy16070705","Land-use change contributes significantly to climate change mitigation through biophysical changes (albedo, α) and biogeochemical (greenhouse gases, GHG) emissions (here refers to methane, CH4, and nitrous oxide, N2O). While the impact of grassland–cropland conversion on global warming potential (GWP) is well-documented globally, research remains scarce in the saline-alkaline agropastoral transition zone (APTZ) of the western Songnen Plain, Northeast China, an ecotone uniquely characterized by soil-crusting and seasonal inundation. We conduc..."
"2026-03-27","Extrémy","Crossref/Agronomía Mesoamericana","https://doi.org/10.15517/nc8qa216","Introduction. Drought can reduce grain production by up to 50 % and drastically reduce the biomass of pastures and forages used for animal feed. Objective."
"2026-03-27","Emise","Crossref/Animals","https://doi.org/10.3390/ani16071024","Global population growth has intensified the demand for productive and sustainable livestock systems. Lithothamnium calcareum, a calcareous marine alga, has been investigated as a natural feed additive for cattle diets. This study evaluated the effects of L."
"2026-03-27","Emise","Crossref/Asian Journal of Water, Environment and Pollution","https://doi.org/10.36922/ajwep025500380","Amid rapid urbanization and industrialization, the pressing challenge of air pollution, cross-border e-commerce (CBEC) has emerged as a potential driver of environmental governance in China. Using CBEC pilot zones as a quasi-natural experiment, this study employs a multi-period difference-in-differences model on panel data from 284 Chinese cities (2009–2022) to assess the effect of CBEC on urban air quality, measured by sulfur dioxide (SO2) emissions. The findings revealed that CBEC significantly reduced SO2 emissions, thereby improving air ..."
"2026-03-27","Emise","Crossref/Atmosphere","https://doi.org/10.3390/atmos17040338","Road transportation is a major contributor to global CO2 emissions, yet the influence of road geometry on vehicular emissions remains insufficiently quantified under real-world conditions. This study investigates the effects of horizontal and vertical alignments on CO2 emissions of a light-duty gasoline passenger vehicle using Portable Emissions Measurement System (PEMS) data collected along a 62.4 km highway section. Six geometric parameters longitudinal grade, cross slope, horizontal curve radius, horizontal curve length, vertical curve ra..."
"2026-03-27","Emise","Crossref/Balkan Journal of Electrical and Computer Engineering","https://doi.org/10.17694/bajece.1888550","This study analyzes the impacts of signed international environmental agreements on carbon dioxide (CO₂) emissions for the period 1990-2023 in the context of the G-7 countries. The main objective of the study is to reveal the structural transformations in emission trends resulting from the regulations developed within the framework of international environmental agreements, particularly the Kyoto Protocol and the Paris Agreement. The dates of regime shifts in the emission series were determined using the Bai-Perron multiple structural break ..."
"2026-03-27","Klimatická změna","Crossref/Climatic Change","https://doi.org/10.1007/s10584-026-04161-0","Abstract Reducing uncertainty in climate change projections is essential for developing reliable impact assessments and effective adaptation strategies in water resource management. Climate model sub-selection has become a key tool for managing large ensembles; however, trade-offs between accuracy, uncertainty coverage, and spatial consistency remain insufficiently explored. This study introduces a standardised multi-criteria framework to evaluate sub-selection methods across basins with contrasting hydrological regimes."
"2026-03-27","Emise","Crossref/Construction Materials","https://doi.org/10.3390/constrmater6020020","Construction materials are the primary source of embodied carbon in long-span bridge projects, particularly for steel-intensive structures. This study presents an empirical construction-stage carbon footprint assessment of the Anhsin Bridge, an asymmetric cable-stayed steel truss bridge in Taiwan. Using the emission factor method in accordance with ISO 14067 and Taiwan Environmental Protection Administration guidelines, a cradle-to-gate (A1–A5 equivalent) system boundary was applied, covering material production, transportation, and on-site ..."
"2026-03-27","Extrémy","Crossref/EPRA International Journal of Agriculture and Rural Economic Research","https://doi.org/10.36713/epra26692","Karakalpakstan – an Aral Sea basin region of Uzbekistan – faces severe soil salinity and water scarcity, pressuring farmers to diversify beyond water-intensive cotton and wheat. This study evaluates the economic feasibility of sugar sorghum as a climate-resilient alternative crop in the region. We conducted farm surveys and field interviews in 2024, and analyzed secondary data to compare yield and profitability of four sorghum varieties."
"2026-03-27","Klimatická změna","Crossref/Earth's Future","https://doi.org/10.1029/2025ef007442","AbstractCompound sequential heatwave‐downpour (SHD) events, characterized by abrupt shifts from heatwaves to heavy rainfall, pose serious threats to health, infrastructure, and agriculture. However, the anthropogenic influence on the increasing trend of SHD events is poorly understood, and projections also exhibit large uncertainties. Our study revealed that the affected area of SHD events has grown notably across the Northern Hemisphere."
"2026-03-27","Emise","Crossref/Energies","https://doi.org/10.3390/en19071648","Biomass combustion, as a key technology for achieving a low-carbon transformation of the energy system, faces multiple challenges in its efficient and clean utilization, including the high heterogeneity of fuels, the complex multi-scale coupling of the combustion process, and the attainment of ultra-low emissions. Traditional research methods have significant disconnections between microscopic mechanism understanding, macroscopic performance prediction of reactors, and end-of-pipe pollution control, which restricts the improvement of system ..."
"2026-03-27","Emise","Crossref/Environment and Development Economics","https://doi.org/10.1017/s1355770x26100503","AbstractThe Kyoto Protocol and the subsequent Doha Amendment represent crucial milestones in international environmental efforts to establish binding emission reduction targets for the participating members. Many studies have examined the effects of the former, but not many the latter, on emissions reduction; however, their impact is inconclusive. One major reason may be due to the heterogeneous issue arising from the fact that countries ratified and implemented those agreements at different times."
"2026-03-27","Emise","Crossref/Environmental Research Letters","https://doi.org/10.1088/1748-9326/ae5839","AbstractLarge-scale photovoltaic (PV) deployment and afforestation represent vital climate change mitigation strategies, yet the climate mitigation potential of PV deployment in regions where afforestation is constrained remains understudied. Using the Community Earth System Model (CESM2.1.3), we quantitatively assess the carbon reduction and surface temperature effects of large-scale PV deployment and afforestation across global potential afforestation areas. Our results reveal regional limitations of afforestation and demonstrate strong cl..."
"2026-03-27","Emise","Crossref/Environmental Research: Climate","https://doi.org/10.1088/2752-5295/ae583c","AbstractThe impact of climate change on droughts is typically attributed to rising temperatures and altered precipitation patterns. Yet, most drought projections overlook a major climate-induced mechanism: the effect of elevated CO₂ on plant physiology, leading to a significant potential overestimation of droughts magnitudes and impacts. In fact, elevated CO₂ enhances biomass production and reduces stomatal conductance, thereby increasing water-use efficiency ."
"2026-03-27","Klimatická změna","Crossref/Food Science & Nutrition","https://doi.org/10.1002/fsn3.71693","ABSTRACTAs a result of the increase in the world's population, natural resources have faced the danger of depletion and therefore issues such as environmental degradation and climate change have started to be addressed within the framework of “sustainability”. The aim of this study is to use bibliometrics and content analysis to visualize hotspots and emerging trends in studies examining the relationship between sustainable food and climate change. An initial search of the Web of Science Core Collection yielded 1166 records."
