"date","keyword","source","link","abstract"
"2026-04-20","Extrémy","Crossref/Frontiers in Climate","https://doi.org/10.3389/fclim.2026.1678166","Climate change remains one of the most pressing global challenges, posing significant threats to human security through its adverse effects on health, water availability, food security, and shelter. Socially and economically disadvantaged populations bear a disproportionate burden of these impacts. This study examines the health effects of drought, identifies vulnerable demographic groups, and assesses community adaptation strategies in Muyexe Village."
"2026-04-20","Klimatická změna","Crossref/Frontiers in Climate","https://doi.org/10.3389/fclim.2026.1678166","Climate change remains one of the most pressing global challenges, posing significant threats to human security through its adverse effects on health, water availability, food security, and shelter. Socially and economically disadvantaged populations bear a disproportionate burden of these impacts. This study examines the health effects of drought, identifies vulnerable demographic groups, and assesses community adaptation strategies in Muyexe Village."
"2026-04-20","Klimatická změna","Crossref/Frontiers in Climate","https://doi.org/10.3389/fclim.2026.1741389","This research evaluates the efficacy of serious games in enhancing disaster risk awareness among school children in Peshawar, Pakistan. The research aims to compare the outcomes of the Hazagora board game with traditional lecture methods at the school level. Conducted at a local government school, the study employed an experimental design to compare the educational impact of the context-specific Hazagora board game (experimental group, N = 30) with traditional lecture-based instruction (control group, N = 30)."
"2026-04-20","Klimatická změna","Crossref/Frontiers in Environmental Science","https://doi.org/10.3389/fenvs.2026.1777634","Coffee cultivation is central to rural livelihoods and Andean–Amazonian landscapes in Peru; however, it faces increasing pressure from climate change and land-use restrictions. This study aimed to assess the current and future ecological suitability of Coffea arabica at the national scale. A Maximum Entropy (MaxEnt) modeling framework was applied, integrating high-resolution bioclimatic, topographic, and edaphic variables."
"2026-04-20","Klimatická změna","Crossref/Frontiers in Human Dynamics","https://doi.org/10.3389/fhumd.2026.1786808","Mountain regions globally are increasingly confronted with the challenge of out-migration, primarily driven by systemic underdevelopment and sustained policy neglect. This issue is particularly pronounced in the Indian state of Uttarakhand, which, continues to experience stark regional disparities between its pahadi (hill) and maidani (plain) districts. Economic and industrial development remain concentrated in the plains, resulting in persistent out-migration from the resource-rich hilly regions."
"2026-04-20","Emise","Crossref/Frontiers in Public Health","https://doi.org/10.3389/fpubh.2025.1693310","IntroductionIn-theater inhalation exposure to burn pit emissions (BPEs) and sand has been linked to respiratory issues, prompting a study to identify molecular alterations and potential biomarkers related to exposure and outcomes. Methods Using a complex in vivo exposure scenario to mimic in-theater inhalation exposures, Sprague–Dawley rats were exposed to clean air (Control), BPEs, Sand, or a combination of BPE + Sand via whole-body exposure chambers. After euthanasia, bronchoalveolar lavage fluid was collected at 4 days and 90 days post-ex..."
"2026-04-20","Klimatická změna","Crossref/Functional Ecology","https://doi.org/10.1111/1365-2435.70303","AbstractAmphibians are frequently identified as highly vulnerable to climate change, yet the mechanisms driving this sensitivity remain uncertain. Approaches that explicitly link physiological mechanisms to environmental variation provide powerful tools for forecasting climate vulnerability. However, their reliability depends on assumptions that accurately reflect the conditions amphibians experience in nature."
"2026-04-20","Extrémy","Crossref/Genes","https://doi.org/10.3390/genes17040489","Background: INDETERMINATE DOMAIN proteins (IDDs) are a plant-specific transcription factor family, and members of this family play crucial roles in regulating growth and development as well as environmental adaptation. However, a comprehensive analysis of the IDD family in soybean [Glycine max (L.) Merrill] is limited. Methods and Results: A total of 27 GmIDD genes were identified in the soybean genome, unevenly distributed across 14 chromosomes, and their encoded proteins all harbor a conserved INDETERMINATE (ID) domain with two Cys2His2 (C..."
"2026-04-20","Klimatická změna","Crossref/Global Change Biology Communications","https://doi.org/10.1002/gcb4.70016","ABSTRACT Climate change significantly influences natural and semi‐natural ecosystems at global scale. This impact is further amplified in alpine environments, owing to a set of climate feedback mechanisms (i.e., elevation‐dependent warming). Due to the short snow‐free season and the consequent adaptation of alpine plants to fast growth, high‐elevation grasslands mainly act as carbon sinks during the vegetative season, with primary productivity usually exceeding ecosystem respiration."
"2026-04-20","Extrémy","Crossref/Habitable Planet","https://doi.org/10.63335/j.hp.2026.0039","Floods are among the most widespread and destructive natural hazards, posing persistent threats to human life, infrastructure, and socioeconomic systems worldwide. Over recent decades, flood mapping and modeling have evolved significantly due to advances in remote sensing, Geographic Information Systems (GIS), and data-intensive analytical methods. This review synthesizes recent progress and remaining challenges in flood susceptibility, inundation, hazard, and risk assessment, with particular emphasis on the growing role of machine learning,..."
"2026-04-20","Extrémy","Crossref/Horticulturae","https://doi.org/10.3390/horticulturae12040496","Frequent co-occurrences of high temperature and drought in tropical regions make heat and drought tolerance of landscape plants core physiological traits that determine their landscape adaptability and community stability. However, systematic elucidation of the differentiation patterns of stress resistance between specialist and generalist tropical landscape plant species, the intrinsic correlations between heat and drought tolerance traits, and the regulatory mechanisms of leaf functional traits remains lacking. In this study, eight typical..."
"2026-04-20","Extrémy","Crossref/Hydrology and Earth System Sciences","https://doi.org/10.5194/hess-30-2225-2026","Abstract. In the Horn of Africa Drylands (HAD) conflicts over water and vegetation are prominent. Additionally, large-scale land acquisitions (LSLAs) are increasing the competition of water, putting local communities at greater risk."
"2026-04-20","Extrémy","Crossref/International Agrophysics","https://doi.org/10.31545/intagr/217982",NA
"2026-04-20","Emise","Crossref/International Journal of Aquatic Research and Environmental Studies","https://doi.org/10.70102/ijares/v6i1/6-1-04","Freshwater systems are vital in the control of biogeochemical cycles, biodiversity, and deliver valuable ecosystem services. Some of the most significant processes, which support these ecosystems, include benthic-pelagic nutrient interactions and air-water gaseous exchange. The processes are important in the nutrient availability, primary productivity, and greenhouse gases."
"2026-04-20","Klimatická změna","Crossref/International Journal of Aquatic Research and Environmental Studies","https://doi.org/10.70102/ijares/v6i1/6-1-30","The paper explains how environmental science can be integrated with the aquatic ecosystem dynamics to overcome the problem of pollution and loss of biodiversity. Human activities such as pollution and climate change are a major threat to aquatic ecosystems, which are important in supporting biodiversity and in the provision of important ecosystem services. These obstacles indicate that there is a necessity for proper education in environmental science that integrates theoretical ecological concepts with practical environmental concerns."
"2026-04-20","Klimatická změna","Crossref/International Journal of Aquatic Research and Environmental Studies","https://doi.org/10.70102/ijares/v6i1/6-1-33","The paper includes a meta-analysis of the effect of invasive species on the native aquatic biodiversity in different ecosystems. The aim of the study was to measure the ecological imbalances caused by invasive species and to identify other factors that determine their success in different aquatic environments, such as freshwater lakes, river systems, coastal areas, and marine conditions. The study methodically examined and synthesized the information by examining the peer-reviewed publications over the past 20 years."
"2026-04-20","Klimatická změna","Crossref/International Journal of Aquatic Research and Environmental Studies","https://doi.org/10.70102/ijares/v6i1/6-1-16","This paper will discuss the impacts of climate-driven salinity changes on the ecosystems and ecology of estuaries. The purpose of the paper is to analyze how the drivers of climate change, such as sea-level rise, changes in precipitation intensity, and extreme weather regimes, alter salinity regimes and eventually impact biodiversity, ecosystem processes, and socio-economic services in estuaries. The methodology will involve the qualitative analytical review, conceptual model ecosystem analysis, and interpretation of secondary data."
"2026-04-20","Klimatická změna","Crossref/International Journal of Aquatic Research and Environmental Studies","https://doi.org/10.70102/ijares/v6i1/6-1-08","Aquatic bio-ecosystems are very important for ensuring sustainable tourism, as these ecosystems support healthy fish populations and strong environmental conditions. Nevertheless, international evaluations suggest that more than 37%of the managed fish stocks are overexploited, and habitat destruction and climate change have also contributed to a reduction of biodiversity of over 20% in freshwater systems over the last 30 years. These forces undermine the ecosystem services that are essential to tourism, such as recreational fisheries, biodiv..."
"2026-04-20","Emise","Crossref/International Journal of Architectural Engineering Technology","https://doi.org/10.15377/2409-9821.2026.13.4","Evaluating energy efficiency measures (EEMs) under future climate conditions is critical for climate resilient design of buildings. However, the impact of EEMs on existing buildings under projected weather conditions has been insufficiently explored. This study evaluates the energy use, peak demands, and associated emissions of a prototypical medium office buildings with typical constructions properties from 1980 to 2004 across 16 U.S."
"2026-04-20","Klimatická změna","Crossref/International Journal of Biometeorology","https://doi.org/10.1007/s00484-026-03181-w",NA
"2026-04-20","Emise","Crossref/International Journal of Business & Management Studies","https://doi.org/10.56734/ijbms.v7n4a5","This article critically examines the European Union Emissions Trading System (EU ETS) and explores how Pigouvian and Coasian approaches influence and constrain its design. While the EU ETS incorporates both corrective measures for environmental externalities (Pigouvian logic) and negotiated allowance exchanges (Coasian logic), its operation is mainly shaped by regulatory decisions on allowance allocation, ongoing adjustments, and interactions with other legal instruments. Therefore, the article argues that the EU ETS cannot be fully understo..."
"2026-04-20","Extrémy","Crossref/International Journal of Climatology","https://doi.org/10.1002/joc.70387","ABSTRACTThe growing season is the period when weather conditions (e.g., precipitation, temperature, wind, etc.) support plant growth and development, thereby enabling agricultural production in a given region. This study examines the impact of climate change on agricultural conditions and production in Poland between 1961 and 2020, using data from 47 meteorological stations. The research period was divided into two parts: the baseline period (1961–1990) and the warming phase (1991–2020), the latter characterised by more rapid global warming."
"2026-04-20","Klimatická změna","Crossref/International Journal of Climatology","https://doi.org/10.1002/joc.70387","ABSTRACTThe growing season is the period when weather conditions (e.g., precipitation, temperature, wind, etc.) support plant growth and development, thereby enabling agricultural production in a given region. This study examines the impact of climate change on agricultural conditions and production in Poland between 1961 and 2020, using data from 47 meteorological stations. The research period was divided into two parts: the baseline period (1961–1990) and the warming phase (1991–2020), the latter characterised by more rapid global warming."
"2026-04-20","Extrémy","Crossref/International Journal of Disaster Studies and Climate Resilience","https://doi.org/10.64866/j.ijdscr.2026.10027","Purpose: This study examines how perceptions of flood causality, self-efficacy, and institutional trust interact to shape household preparedness in a flood-prone downstream community in Pakistan. Methodology: A sequential explanatory mixed-methods design was employed in Taunsa Sharif, combining a household survey (n = 350) with in-depth interviews (n = 15). Quantitative data were analyzed using hierarchical regression and mediation analysis; qualitative data were examined through reflexive thematic analysis."
"2026-04-20","Klimatická změna","Crossref/International Journal of Environment and Climate Change","https://doi.org/10.9734/ijecc/2026/v16i55419","The municipality of Za-Kpota, located in southern Benin, is highly vulnerable to climate variability due to its strong dependence on rain-fed agriculture, which constitutes the main source of livelihood for local populations. This study aims to analyze the spatio-temporal variability of key climatic parameters in this municipality over the period 1993–2022. This study presents a retrospective analysis of long-term climatic data (1993–2022) obtained from the Bohicon synoptic station."
"2026-04-20","Emise","Crossref/International Journal of Innovative Science and Research Technology","https://doi.org/10.38124/ijisrt/26apr580","Direct air capture (dac) is necessary for achieving negative emissions and meeting the temperature targets outlined in the paris agreement. However, challenges of scalability and energy demands persist. This paper presents a comprehensive design framework for large-scale dac systems utilizing moisture swing adsorption (msa), an innovative method that leverages humidity cycles to regenerate sorbents with near-isothermal energy, thereby reducing energy penalties by 50-70% compared to thermal swing alternatives."
"2026-04-20","Extrémy","Crossref/International Journal of Mass Emergencies & Disasters","https://doi.org/10.1177/02807270261442551","The U.S. buyout programs relocate households out of hazard-prone areas to mitigate future risk by converting developed land into open space. The open space is managed as a public resource by local government and can offer benefits to the community beyond flood risk reduction, such as ecosystem services, recreational activities, and social interaction."
"2026-04-20","Klimatická změna","Crossref/International Journal of Sport Policy and Politics","https://doi.org/10.1080/19406940.2026.2662218",NA
"2026-04-20","Extrémy","Crossref/Journal of Agricultural and Food Chemistry","https://doi.org/10.1021/acs.jafc.5c14225",NA
"2026-04-20","Extrémy","Crossref/Journal of Agricultural and Food Chemistry","https://doi.org/10.1021/acs.jafc.5c13201",NA
"2026-04-20","Klimatická změna","Crossref/Journal of Animal Ecology","https://doi.org/10.1111/1365-2656.70257","AbstractPulsed resources, including mast production by forest trees, often have knock‐on effects on consumer populations and their prey, predators, parasites and mutualists. Response by small rodents to fluctuating acorn production in temperate forests is a widespread example. Long‐term research in Maine, USA, recently suggested combined effects of a warming climate and forest maturation on acorn production by red oak trees, leading to directional increases in average population density and body mass of white‐footed mice."
"2026-04-20","Extrémy","Crossref/Journal of Berry Research","https://doi.org/10.1177/18785093261442971","BackgroundDrought and salinity are major abiotic constraints in strawberry production, adversely affecting plant growth, photosynthesis, and cellular stability. Melatonin has emerged as a promising biostimulant due to its role in regulating stress responses and antioxidant defense mechanisms in plants. ObjectiveThis study aimed to assess the effectiveness of foliar melatonin application in mitigating the effects of individual and combined drought and salinity stress in strawberry (Fragaria × ananassa Duch."
"2026-04-20","Extrémy","Crossref/Journal of Climate","https://doi.org/10.1175/jcli-d-24-0501.1","AbstractDespite numerous studies on the drivers of southern African precipitation, important gaps remain in understanding the role of the southern continental thermal low. This paper investigates the Kalahari Thermal Low (KTL), its connections to the Angola Low (AL) and Botswana High (BH), and its influence on regional precipitation. Although the AL and the BH form at different pressure levels during austral summer, they are dynamically linked: a deepened AL is typically associated with a weakened BH."
"2026-04-20","Klimatická změna","Crossref/Journal of Cultural Economy","https://doi.org/10.1080/17530350.2026.2627488",NA
"2026-04-20","Emise","Crossref/Journal of Electronics and Electrical Engineering","https://doi.org/10.37256/jeee.5120269782","This study develops an integrated, hourly-resolved, multi-vector energy system model to assess pathways for aligning Italy's transport sector with the European Union (EU) 2030 and Fit for 55 decarbonisation targets. The model simultaneously represents electricity generation, grid constraints, storage dynamics, hydrogen production, and heterogeneous vehicle charging behaviours. Three scenarios are analysed: Battery Electric Vehicles (BEV)-dominant, Hydrogen-dominant, and Hybrid."
"2026-04-20","Emise","Crossref/Journal of Experimental Agriculture International","https://doi.org/10.9734/jeai/2026/v48i54202","The FAO CROPWAT 8.0 model, developed by the Food and Agriculture Organization (FAO), is widely used for estimating reference evapotranspiration (ETo), effective rainfall and stage‑wise crop water requirements based on climatic, soil and crop data. Anantapuramu District, located in the semi-arid Rayalaseema region of Andhra Pradesh, India, faces severe water scarcity due to high temperatures, low and erratic rainfall and frequent droughts. Agriculture, being the primary livelihood, is heavily dependent on irrigation, making precise estimation..."
"2026-04-20","Klimatická změna","Crossref/Journal of Experimental Agriculture International","https://doi.org/10.9734/jeai/2026/v48i54202","The FAO CROPWAT 8.0 model, developed by the Food and Agriculture Organization (FAO), is widely used for estimating reference evapotranspiration (ETo), effective rainfall and stage‑wise crop water requirements based on climatic, soil and crop data. Anantapuramu District, located in the semi-arid Rayalaseema region of Andhra Pradesh, India, faces severe water scarcity due to high temperatures, low and erratic rainfall and frequent droughts. Agriculture, being the primary livelihood, is heavily dependent on irrigation, making precise estimation..."
"2026-04-20","Emise","Crossref/Journal of Industrial Ecology","https://doi.org/10.1007/s44498-026-00058-4","AbstractCorporate climate strategies increasingly rely on science-based targets to demonstrate credible alignment with global decarbonization pathways. This study examines whether participation in the Science-Based Targets initiative (SBTi) is associated with measurable improvements in corporate carbon performance by disentangling effects across Scope 1, Scope 2 (both location- and market-based), and Scope 3. After applying coarsened exact matching, the analysis covers 3113 listed firms in Europe, North America, and Asia between 2015 and 202..."
"2026-04-20","Emise","Crossref/Journal of Industrial Ecology","https://doi.org/10.1007/s44498-026-00037-9","AbstractSmall Island Developing States (SIDS) contribute little to global emissions yet face disproportionate climate and market shocks. Their vulnerability is geographic and structural, driven by external resource dependence, lock-in of hazard-zone stocks, and weak circularity. The Socio-Metabolic Risk (SMR) concept addresses these drivers by linking material flows and stocks to systemic fragility."
"2026-04-20","Emise","Crossref/Journal of Industrial Ecology","https://doi.org/10.1007/s44498-026-00077-1","Abstract Industry accounts for ~ 34% of global CO₂ emissions, positioning it as the largest single contributor to anthropogenic climate change. Understanding the historical trajectory is essential for effective mitigation, yet most analyses are short-term and long-term studies rarely examine industry. This article reconstructs consistent long-run series of industrial CO₂ emissions in Spain from 1890 to 2021, disaggregated by source (direct, indirect, and process-related) and by sector."
"2026-04-20","Klimatická změna","Crossref/Journal of Industrial Ecology","https://doi.org/10.1007/s44498-026-00077-1","Abstract Industry accounts for ~ 34% of global CO₂ emissions, positioning it as the largest single contributor to anthropogenic climate change. Understanding the historical trajectory is essential for effective mitigation, yet most analyses are short-term and long-term studies rarely examine industry. This article reconstructs consistent long-run series of industrial CO₂ emissions in Spain from 1890 to 2021, disaggregated by source (direct, indirect, and process-related) and by sector."
"2026-04-20","Emise","Crossref/Journal of Physics D: Applied Physics","https://doi.org/10.1088/1361-6463/ae61c0","Abstract This study presents an experimental investigation into the statistical time lags associated with streamer inception in a ternary gas mixture of carbon dioxide (CO 2 ), oxygen (O 2 ), and 3.5% perfluoroisobutyronitrile (C 4 F 7 N), a promising alternative to SF 6 for eco-friendly insulation. Experiments were performed using needle-plane (both polarities) and rod-plane (negative polarity) configurations over pressures from 0.01 to 0.1 MPa. Time-resolved diagnostics captured the delay between voltage application and discharge onset, re..."
"2026-04-20","Extrémy","Crossref/Journal of Science and Technology","https://doi.org/10.3126/jost.v5i1.74559","Flood disasters are happening more often and are getting worse because of climate change and urbanization. This means that we need advanced mitigation systems that use the latest technologies. This systematic literature review analyzes IoT-enabled flood disaster mitigation systems, emphasizing their technological underpinnings, implementation obstacles, and prospective research trajectories."
"2026-04-20","Klimatická změna","Crossref/Journal of Science and Technology","https://doi.org/10.3126/jost.v5i1.74559","Flood disasters are happening more often and are getting worse because of climate change and urbanization. This means that we need advanced mitigation systems that use the latest technologies. This systematic literature review analyzes IoT-enabled flood disaster mitigation systems, emphasizing their technological underpinnings, implementation obstacles, and prospective research trajectories."
"2026-04-20","Emise","Crossref/Journal of the Knowledge Economy","https://doi.org/10.1007/s13132-026-03280-4",NA
"2026-04-20","Emise","Crossref/Land Degradation & Development","https://doi.org/10.1002/ldr.70551","ABSTRACT This study empirically explores the heterogeneous impacts of agricultural and natural resource‐based activities on CO 2 emissions. This study examines the impact of agricultural, forestry, and fishery value‐added, renewable energy consumption, trade openness and natural resource rents on environmental degradation in BRICS economies over the period 1992–2023. To estimate the models, this study utilizes quantile regression (QR) method, which provides efficient and unbiased estimates across different quantiles of the distribution."
"2026-04-20","Emise","Crossref/Light: Science & Applications","https://doi.org/10.1038/s41377-026-02256-y","AbstractRecent years have witnessed significant advancements in hollow-core fiber gas lasers (HCFGLs), driven by developments in hollow-core fiber (HCF) design and fabrication. These novel lasers are characterized by hollow-core structure, providing an ultralong and tiny interaction region for light and gases, thereby enabling light amplification with high efficiency, high beam quality, and tunability. HCFGLs has achieved broadband emission spanning from ultraviolet to mid-infrared (MIR) region, with a record output wavelength exceeding 4.8 ..."
