"date","keyword","source","link","abstract"
"2026-04-03","Klimatická změna","Crossref/Weather, Climate, and Society","https://doi.org/10.1175/wcas-d-25-0121.1","AbstractFloodplain communities face persistent and compounding challenges as climate change and urban development increase the frequency and severity of flooding events. This case study examines how residents living near the Shunganunga Creek floodplain in Topeka, Kansas, perceive recurring flood risks and respond to current communication strategies. Using 11 semi-structured interviews analyzed through reflexive thematic analysis, we identified four major themes shaping risk perception: socioeconomic inequities, proximity and lived experienc..."
"2026-04-03","Emise","Crossref/npj Climate Action","https://doi.org/10.1038/s44168-026-00369-z","Abstract Achieving climate change mitigation targets necessitates individual consumption and lifestyle changes that are both highly effective at cutting emissions and broadly accepted by the public. Yet, precisely which changes fit the effectiveness-acceptability criteria remains unclear. We systematically map the effectiveness-acceptability frontier with a novel priority evaluator method, an individually‑parameterized scenario generator that pinpoints which actions satisfy both crucial conditions, using a representative sample of the Swiss ..."
"2026-04-03","Klimatická změna","Crossref/npj Climate Action","https://doi.org/10.1038/s44168-026-00369-z","Abstract Achieving climate change mitigation targets necessitates individual consumption and lifestyle changes that are both highly effective at cutting emissions and broadly accepted by the public. Yet, precisely which changes fit the effectiveness-acceptability criteria remains unclear. We systematically map the effectiveness-acceptability frontier with a novel priority evaluator method, an individually‑parameterized scenario generator that pinpoints which actions satisfy both crucial conditions, using a representative sample of the Swiss ..."
"2026-04-03","Emise","Crossref/npj Climate and Atmospheric Science","https://doi.org/10.1038/s41612-026-01399-4",""
"2026-04-02","Extrémy","Crossref/Agricultural Science Digest - A Research Journal","https://doi.org/10.18805/ag.df-810","Background: Drought is one of the most severe abiotic stresses limiting soybean productivity in marginal areas. Gamma irradiation has been used to induce mutations and identify drought-tolerant soybean lines. This study aimed to screen gamma-ray-induced soybean mutant lines for drought tolerance using in vitro polyethylene glycol (PEG 6000) selection and evaluate their field performance under dryland conditions."
"2026-04-02","Klimatická změna","Crossref/Agriculture","https://doi.org/10.3390/agriculture16070791","Climate change poses increasing challenges to livestock production in tropical regions, where rising temperatures, rainfall variability, and feed cost fluctuations affect productivity and economic stability. However, few studies have jointly quantified the effects of climatic and economic variables on swine production in tropical production systems, particularly in Brazil. This study examined the effects of maximum temperature, precipitation, and feed price on swine production density in Brazil’s main producing states."
"2026-04-02","Klimatická změna","Crossref/Alternative Law Journal","https://doi.org/10.1177/1037969x261438162","This article responds to the problem of climate change and migration, and the tendency to seek solutions in legal frameworks that protect individual migrants. It analyses two alternative approaches, which argue for facilitating migration as a form of reparations and as a means for meeting adaptation obligations in the international climate regime. After analysing alignments and tensions between these two approaches, the article concludes that legal arguments for State obligations to support adaptation offer one potential means for pursuing c..."
"2026-04-02","Emise","Crossref/Animals","https://doi.org/10.3390/ani16071099","Livestock production significantly contributes to greenhouse gas (GHG) emissions, particularly methane (CH4) and nitrous oxide (N2O) originating from enteric fermentation and manure management. This study quantified the GHG emissions and cumulative carbon footprint of four commercial sheep farms (SF1, SF2, SF3, and SF4) in the Bursa region of Türkiye, with flock sizes of 200, 500, 150, and 800 adult Merino sheep (mature ewes and breeding rams), respectively. Using the IPCC Tier 2 methodology, the biogenic carbon footprint was estimated at 15..."
"2026-04-02","Klimatická změna","Crossref/Antiquity","https://doi.org/10.15184/aqy.2026.10321","Changes in settlement patterns are often argued to reflect climatic change, which may make certain areas more or less hospitable depending on the adaptability of subsistence practices. This study models the impact of El Niño-Southern Oscillation (ENSO) events on phases of occupation and abandonment over the past 4500 years at Pashimbi in the Ecuadorian Amazon. While earlier occupations and abandonments seem to correlate with climatic events, associations post-3000 BP are less clear, potentially indicating that populations adapted to wetter c..."
"2026-04-02","Emise","Crossref/Asian Journal of Advances in Agricultural Research","https://doi.org/10.9734/ajaar/2026/v26i3717","Livestock production is indispensable to African livelihoods, strengthening food security and significantly contributing to agricultural GDP. However, climate change presents a formidable challenge, with rising temperatures, recurrent droughts, and proliferating diseases severely Impacting productivity and the sustainability of pastoral systems. Climate-smart livestock (CSL) farming emerges as a promising solution, offering a triple-win strategy: enhancing adaptation to climate shocks, sustainably increasing livestock production, and reducin..."
"2026-04-02","Klimatická změna","Crossref/Asian Journal of Advances in Agricultural Research","https://doi.org/10.9734/ajaar/2026/v26i3717","Livestock production is indispensable to African livelihoods, strengthening food security and significantly contributing to agricultural GDP. However, climate change presents a formidable challenge, with rising temperatures, recurrent droughts, and proliferating diseases severely Impacting productivity and the sustainability of pastoral systems. Climate-smart livestock (CSL) farming emerges as a promising solution, offering a triple-win strategy: enhancing adaptation to climate shocks, sustainably increasing livestock production, and reducin..."
"2026-04-02","Extrémy","Crossref/Atmosphere","https://doi.org/10.3390/atmos17040367","Climate extremes are major constraints on agricultural productivity, especially in tropical regions experiencing rapid expansion and intensification of soybean agriculture. This study analyzes spatiotemporal changes in soybean yields in response to droughts and heatwaves across highly productive municipalities in Brazil’s five macroregions from 1989 to 2020. By combining high-resolution meteorological data, satellite-based evapotranspiration estimates, and municipal-level crop yield data, we used standardized drought indices (Standardized Pr..."
"2026-04-02","Emise","Crossref/Atmospheric Chemistry and Physics","https://doi.org/10.5194/acp-26-4509-2026","Abstract. Isoprene is the most significant non-methane hydrocarbon by total emissions and an important control on the tropospheric oxidative capacity. In the atmosphere, isoprene is oxidized by the hydroxyl radical (OH) on the order of hours depending on local OH concentrations."
"2026-04-02","Emise","Crossref/Atmospheric Environment: X","https://doi.org/10.1016/j.aeaoa.2026.100446",NA
"2026-04-02","Klimatická změna","Crossref/BMC Public Health","https://doi.org/10.1186/s12889-026-27194-7",NA
"2026-04-02","Klimatická změna","Crossref/Biodiversity Data Journal","https://doi.org/10.3897/bdj.14.e186353","This study aimed to detect shifts in the floristic composition of the holy sites of Makkah over the past three decades, with special emphasis on the impact of afforestation and climate change. Results from a study carried out thirty years ago were compared with a contemporary survey (excluding afforested habitats) to isolate the impacts of climate change. An afforested area was compared to a nearby natural habitat to evaluate the effects of afforestation."
"2026-04-02","Klimatická změna","Crossref/Biodiversity Informatics","https://doi.org/10.17161/bi.v20i1.24561","The global biodiversity crisis, driven by habitat loss, climate change, and overexploitation, demands efficient data management and accessibility to inform conservation decisions. While open-access biodiversity data have increased, a substantial portion, termed “dark data,” remains unpublished and inaccessible. We explored the mobilization of dark data existing in Environmental Assessment (EA) reports in Spain to improve the Digital Accessible Knowledge for 43 field-recorded threatened species."
"2026-04-02","Emise","Crossref/Canadian Journal of Animal Science","https://doi.org/10.1139/cjas-2025-0070","Grass-based beef cattle systems have limited opportunities to adopt novel input-based greenhouse gas (GHG) mitigation options. Furthermore, these systems are highly susceptible to extreme weather events, triggering large fluctuations in the quality and quantity of forage supplies. Early weaning is a common management practice used in grazing beef cattle systems, a climate change adaptation measure to reduce economic and productivity risks."
"2026-04-02","Klimatická změna","Crossref/Canadian Journal of Animal Science","https://doi.org/10.1139/cjas-2025-0070","Grass-based beef cattle systems have limited opportunities to adopt novel input-based greenhouse gas (GHG) mitigation options. Furthermore, these systems are highly susceptible to extreme weather events, triggering large fluctuations in the quality and quantity of forage supplies. Early weaning is a common management practice used in grazing beef cattle systems, a climate change adaptation measure to reduce economic and productivity risks."
"2026-04-02","Extrémy","Crossref/Climate","https://doi.org/10.3390/cli14040081","Climate-induced migration is increasingly recognized as a major demographic consequence of environmental change, yet projections vary widely due to differences in spatial scale, hazard coverage, and modeling approaches. This study introduces the First Street Global Climate Migration Model (FS-GCMM), a globally consistent, multi-hazard framework that estimates climate-driven population redistribution at a 12.5 km resolution across all countries through 2100. The model integrates high-resolution global climate hazard datasets, including flood ..."
"2026-04-02","Klimatická změna","Crossref/Climatic Change","https://doi.org/10.1007/s10584-026-04158-9",NA
"2026-04-02","Klimatická změna","Crossref/Conservation","https://doi.org/10.3390/conservation6020041","Our knowledge of the marbled polecat (Vormela peregusna), a vulnerable mustelid species, is inadequate and fragmentary. Developing effective conservation strategies is significantly hampered by a lack of information on its distribution and preferred habitats. This research uses 77 recent species’ presence records to model its current distribution and predict its near-future distribution across a significant part of its European range under two climate change scenarios."
"2026-04-02","Klimatická změna","Crossref/Earth","https://doi.org/10.3390/earth7020057","Accurate forecasting of local weather patterns is essential for climate resilience and sustainable planning. This study analysed 35 years (1990–2025) of hourly temperature and precipitation data from Thohoyandou, South Africa, to assess the impacts of climate change and improve anomaly prediction. Exploratory analysis and Bayesian Estimator of Abrupt change, Seasonal change, and Trend (BEAST) decomposition revealed accelerated warming trends of 0.025 °C per year in temperature anomalies, alongside highly irregular rainfall patterns character..."
"2026-04-02","Emise","Crossref/Earth Science Informatics","https://doi.org/10.1007/s12145-026-02112-y",NA
"2026-04-02","Klimatická změna","Crossref/Ecography","https://doi.org/10.1002/ecog.08355","Species distribution models (SDMs) have been increasingly combined with thermal performance data to enhance their transferability and to provide a physiological explanation for the predicted geographic patterns. Yet, while it is widely acknowledged that thermal sensitivities may vary among biological traits, it remains largely unexplored to what extent predictions obtained using hybrid models depend on the choice of trait, and, hence, the type of thermal performance data considered. In this study, we examine the thermal performance of three ..."
"2026-04-02","Klimatická změna","Crossref/Economics and Environment","https://doi.org/10.34659/eis.2025.95.4.1189","Climate change is a global challenge and highly affects agriculture, particularly in Africa and Asia. These regions rely on agriculture as the main driver of their economies, making them highly vulnerable to climate-related risks. This research aims to forecast the Climate Risk Index (CRI) and Global Food Security Index (GFSI), and to analyse the impact of food security on climate risk."
"2026-04-02","Klimatická změna","Crossref/Energy RESEARCH LETTERS","https://doi.org/10.46557/001c.156409","Using a quantile-on-quantile approach, this study examines how physical (natural disasters) and transition (policy uncertainty) climate risks affect the S&P Global Clean Energy and Green Bond indices in the U.S. from 2015 to 2023. The findings reveal complex, market-specific relationships, with green assets providing better hedging against transition risks."
"2026-04-02","Emise","Crossref/Energy and Buildings","https://doi.org/10.1016/j.enbuild.2026.117407",NA
"2026-04-02","Emise","Crossref/Energy and Climate Change","https://doi.org/10.1016/j.egycc.2026.100247",NA
"2026-04-02","Emise","Crossref/Environmental Management","https://doi.org/10.1007/s00267-026-02426-z",NA
"2026-04-02","Extrémy","Crossref/Environmental Monitoring and Assessment","https://doi.org/10.1007/s10661-026-15129-z",NA
"2026-04-02","Klimatická změna","Crossref/Environmental Monitoring and Assessment","https://doi.org/10.1007/s10661-026-15129-z",NA
"2026-04-02","Emise","Crossref/Environmental Research Communications","https://doi.org/10.1088/2515-7620/ae5b4c","AbstractSmartphone apps hold significant potential to encourage and measure personal climate action at scale. Using global data from the AWorld app, we analysed 139 self-reported actions from 4,369 users (1,088,258 logged actions) to investigate which actions are reported, the temporal patterns, and the relationship with self-reported carbon footprint. The reported action set for a given user is moderately stable over time."
"2026-04-02","Klimatická změna","Crossref/Environmental Research Communications","https://doi.org/10.1088/2515-7620/ae5b4f","AbstractExposure to heat during pregnancy may increase the risk of adverse birth outcomes, particularly in low- and middle-income countries (LMIC) where healthcare access and adaptive capacity are limited. Here, using a generalised logistic mixed model where potential confounders were adjusted for, we examined the impact of extreme heat stress (defined as the number of consecutive sweltering days throughout the gestational period) on preterm birth (PTB), low birth weight (LBW), stillbirth (SB), and miscarriages (MC) in women aged 15-49 years..."
"2026-04-02","Emise","Crossref/Environmental Science & Technology","https://doi.org/10.1021/acs.est.5c13494",NA
"2026-04-02","Extrémy","Crossref/Environmental and Sustainability Indicators","https://doi.org/10.1016/j.indic.2026.101235",NA
"2026-04-02","Emise","Crossref/Environments","https://doi.org/10.3390/environments13040195","The decarbonization of agri-food supply chains represents a critical challenge and an opportunity for achieving global climate targets and Sustainable Development Goals, extending beyond pure environmental mitigation to integrated sustainability management. This study focuses on the wine industry, a major global sector with significant macroeconomic weight and substantial potential for emission reductions. Through a systematic literature review, this research maps scientific trends and identifies strategies to reduce greenhouse gas emissions..."
"2026-04-02","Klimatická změna","Crossref/Environments","https://doi.org/10.3390/environments13040197","The adoption of biogas technology in smallholder livestock systems is increasingly recognized as a dual solution for rural energy transition and livestock waste management; however, actual implementation remains limited due to low community readiness, particularly driven by knowledge gaps and resource constraints. This study examines the determinants of community readiness for biogas adoption in rural Indonesia, addressing the limited attention of prior studies to readiness factors at the household level. A cross-sectional survey of 98 small..."
"2026-04-02","Extrémy","Crossref/Frontiers in Built Environment","https://doi.org/10.3389/fbuil.2026.1831352",NA
"2026-04-02","Extrémy","Crossref/Frontiers in Forests and Global Change","https://doi.org/10.3389/ffgc.2026.1746510","Temperate forests which provide vital ecosystem functions through the provision of timber resources, carbon sequestration, and recreational value are increasingly affected by extreme weather events, with wind and precipitation extremes (drought and excessive rainfall) posing significant challenges to forest resilience. This review synthesizes current knowledge on the impacts of wind and precipitation extremes on temperate forests, focusing on compound disturbance interactions, vulnerability factors, and recovery processes through a systemati..."
"2026-04-02","Klimatická změna","Crossref/Frontiers in Medicine","https://doi.org/10.3389/fmed.2026.1793544","The relationship between kidney health and the environment is increasingly recognized as a bidirectional “vicious cycle.” As global temperatures rise due to climate change, the incidence of heat-stress nephropathy, acute kidney injury (AKI), and nephrolithiasis increases, thereby increasing demand for renal care. Paradoxically, the life-saving treatment for end-stage kidney disease (ESKD)—hemodialysis (HD)—is among the most resource-intensive interventions in modern medicine, with high water use, energy consumption, and waste generation. Thi..."
"2026-04-02","Klimatická změna","Crossref/Frontiers in Psychology","https://doi.org/10.3389/fpsyg.2026.1696411","IntroductionPublic responses to climate change are influenced by interpretations of scientific information and individual differences. Understanding these factors can improve targeted climate communication. Methods We conducted a nationally representative survey of Lithuanian adults ( N = 1,005; fieldwork 21 June–7 July 2024) to examine (a) distinct profiles of climate-change beliefs, (b) the science attitudes differentiating these profiles, and (c) whether personality traits relate to climate-change attitudes directly and indirectly via sci..."
"2026-04-02","Emise","Crossref/Frontiers in Public Health","https://doi.org/10.3389/fpubh.2026.1724402","Air pollution (AIRP) remains a critical public health and environmental challenge in developing Asia, where rapid industrialization and fossil fuel dependence continue to undermine population health and longevity. This study examines the impact of AIRP on life expectancy (LIFE) and investigates whether renewable energy adoption moderates this relationship. AIRP is proxied by carbon dioxide (CO₂) and nitrous oxide (N₂O) emissions, which capture pollution-intensive energy systems, industrial activity, and agricultural practices that jointly ge..."
"2026-04-02","Extrémy","Crossref/G-Tech: Jurnal Teknologi Terapan","https://doi.org/10.70609/g-tech.v10i2.9280","The Oyo Hilir River in Bantul Regency is an area with a high level of flood vulnerability due to rainfall intensity, changes in land use, and river morphological characteristics. Repeated flooding events have an impact on community activities in downstream areas. This study aims to analyze the flood discharge of the Oyo Hilir River design and map the distribution and area of the flood-affected area based on the classification of inundation depth."
"2026-04-02","Extrémy","Crossref/G-Tech: Jurnal Teknologi Terapan","https://doi.org/10.70609/g-tech.v10i2.9229","Maize production stability in drought-prone environments is crucial to ensure continuous raw material supply for the food industry. This study aimed to evaluate the interaction between mutant maize genotypes and different water availability levels to identify drought-tolerant genotypes during the vegetative growth stage. The experiment was conducted in a screen house at the Faculty of Agriculture, Hasanuddin University, using a factorial split-plot design with three replications."
"2026-04-02","Klimatická změna","Crossref/Geopsychiatry","https://doi.org/10.1016/j.geopsy.2026.100067",NA
"2026-04-02","Klimatická změna","Crossref/Geoscience Communication","https://doi.org/10.5194/gc-9-145-2026","Abstract. Misinformation about climate change leads to societal damage in a number of ways and consequently, resources are required to support interventions that counter their influence. Aiming to meet this need, Skeptical Science is a highly-visited website featuring 250 rebuttals of misinformation about climate change."
"2026-04-02","Klimatická změna","Crossref/Global Change Biology","https://doi.org/10.1111/gcb.70835","ABSTRACTCompound dry–hot events (CDHEs) are intensifying globally, positioning the Yellow River Basin (YRB) as a critical sentinel for understanding semi‐arid ecosystem stability under climate change. This study investigates the spatiotemporal dynamics of vegetation resilience in the YRB (2001–2023) by integrating satellite‐derived vegetation indices (NDVI), meteorological data, and Critical Slowing Down (CSD) indicators. Testing the hypothesis of a “Resilience Paradox,” we reveal a counter‐intuitive buffering mechanism: while high‐intensity..."
"2026-04-02","Extrémy","Crossref/ISPRS International Journal of Geo-Information","https://doi.org/10.3390/ijgi15040152","Railway transport plays a crucial role in sustainable and low-carbon mobility; however, the safety and resilience of railway systems are increasingly challenged by aging infrastructure, spatial inequality, and intensifying climate extremes. These challenges are particularly evident in Serbia, where railway stations in rural and peripheral areas often lack adequate safety infrastructure, accessibility, and climate-adaptive design, especially affecting women and other vulnerable passengers. The aim of this study is to develop a GIS-based spati..."
"2026-04-02","Emise","Crossref/Indian Journal of Corporate Governance","https://doi.org/10.1177/09746862261434856","This study employs Poisson regression to empirically analyse climate disclosure by mid-cap firms in India. We have developed a Climate Disclosure Index based on Task Force on Climate-related Financial Disclosures recommendations and the Business Responsibility and Sustainability Reporting (BRSR) framework in India. Seventy-eight mid-cap firms from NSE were selected for analysis, whose required data were available from their sustainability reports and annual reports for the period 2023–2024."
"2026-04-02","Klimatická změna","Crossref/Indian Journal of Corporate Governance","https://doi.org/10.1177/09746862261434856","This study employs Poisson regression to empirically analyse climate disclosure by mid-cap firms in India. We have developed a Climate Disclosure Index based on Task Force on Climate-related Financial Disclosures recommendations and the Business Responsibility and Sustainability Reporting (BRSR) framework in India. Seventy-eight mid-cap firms from NSE were selected for analysis, whose required data were available from their sustainability reports and annual reports for the period 2023–2024."
"2026-04-02","Klimatická změna","Crossref/Insects","https://doi.org/10.3390/insects17040383","Outbreaks of emerging and re-emerging diseases in both animals and plants are increasing due to climate change, globalization, land-use change, and agricultural intensification. While most pathogen monitoring programs focus on zoonotic threats, wildlife and other organisms in natural habitats can also serve as reservoirs and sentinels for pathogens of agricultural and ecological concern. Plant communities and the pathogens circulating within them are underrepresented in integrated disease monitoring frameworks."
"2026-04-02","Klimatická změna","Crossref/International Journal of Environment and Climate Change","https://doi.org/10.9734/ijecc/2026/v16i45381","Kailana and Takhatsagar reservoirs are two key water bodies in Jodhpur, Rajasthan (India), serving as the principal raw water storage sources for the city’s water supply. This study quantifies evaporation losses from these reservoirs and evaluates their implications for water management in an arid environment. Kailana and Takhatsagar have storage capacities of 4.81 Mm³ and 6.52 Mm³, respectively."
