"date","keyword","source","link","abstract"
"2026-06-22","global warming","Crossref/Acta Oeconomica","https://doi.org/10.1556/032.2026.00295","AbstractThis study examines spillovers between Southeast European (SEE) equities and global and alternative assets and embeds these dynamics into portfolio allocation. Using the Diebold-Yilmaz framework within a TVP-VAR, we trace return spillovers across thirteen markets: SEE indices; developed benchmarks (S&P 500, Euro Stoxx 50); commodities (oil, gold); listed alternatives (private equity, real estate); and Bitcoin. Three results emerge."
"2026-06-22","drought","Crossref/Acta Scientiarum Polonorum Hortorum Cultus","https://doi.org/10.24326/asphc.2026.5575","Cyclic 3-hydroxymelatonin (3-OHM), a significant metabolite derived from melatonin (MEL) through its interaction with oxygen-containing compounds, is believed to play a crucial role in enhancing plant resistance to various abiotic stresses. Despite its importance, research on 3-OHM remains limited. Therefore, this study aimed to investigate the effects of exogenous 3-OHM treatments on the drought stress tolerance of pepper seedlings during the emergence phase."
"2026-06-22","climate change","Crossref/African Research Reports","https://doi.org/10.65221/0287","This study assessed the adoption and climate change mitigation potential of organic soil management practices (OSMPs) among smallholder farmers in Abia State, Nigeria. A multi-stage sampling technique was employed, and data were collected using a well-structured questionnaire. Data analysis involved descriptive and inferential statistics."
"2026-06-22","climate change","Crossref/Agregat: Jurnal Ekonomi dan Bisnis","https://doi.org/10.22236/agregat_vol10.i1/23282","This study aims to understand how Low Carbon Leader companies integrate sustainability aspects, specifically carbon emission disclosure, climate change disclosure, environmental performance, and their impact on company value. The population used in this study consists of all companies listed in the Low-Carbon Leader Index on the Indonesia Stock Exchange, selected using a purposive sampling approach, comprising 24 companies with a 3-year mandate period (2022-2024). This study uses a quantitative approach, with panel data regression analysis p..."
"2026-06-22","drought","Crossref/Annals of the American Association of Geographers","https://doi.org/10.1080/24694452.2026.2681727",""
"2026-06-22","climate change","Crossref/Archives of Current Research International","https://doi.org/10.9734/acri/2026/v26i71987","Animal husbandry is central to global food systems because it supports food security, livelihoods, nutrition and rural economies. At the same time, livestock systems are linked to climate change through greenhouse gas emissions, land use, water demand and pollution, while also being vulnerable to climate variability. This review examines the role of animal husbandry in climate change mitigation and adaptation, with emphasis on livestock-related emissions, system resilience and sustainable management options."
"2026-06-22","climate change","Crossref/Arthritis & Rheumatology","https://doi.org/10.1002/art.70258",""
"2026-06-22","flood","Crossref/Artificial Intelligence Review","https://doi.org/10.1007/s10462-026-11594-7","AbstractBayesian belief networks BBNs effectively model uncertainty in interconnected systems, though their construction and parameterisation present significant methodological challenges. This study introduces a Published Scientific Literature (PSL) review as a novel, evidence‑synthesis‑driven method for constructing a transparent and traceable Bayesian Belief Network structure in data‑poor environmental domains. My method helps capture this resource’s knowledge systematically, resulting in the construction of a BBN structure and data curat..."
"2026-06-22","climate change","Crossref/Atmospheric Chemistry and Physics","https://doi.org/10.5194/acp-26-8637-2026","Abstract. Since 1991, continuous, consistently calibrated and openly archived ground-based measurements from the Network for the Detection of Atmospheric Composition Change (NDACC) have been collected to investigate processes responsible for decadal-scale changes, anomalies in atmospheric composition, and to validate satellite observations and model simulations. These measurements, from nearly 120 stations, support fundamental research in the area of stratospheric and tropospheric processes impacting ozone chemistry, greenhouse gases, atmosp..."
"2026-06-22","heatwave","Crossref/Atmospheric Chemistry and Physics","https://doi.org/10.5194/acp-26-8717-2026","Abstract. This study presents results from an Intensive Measurement Period (IMP2022) conducted during the European heatwave of July 2022, focusing on ozone, volatile organic compounds (VOCs), and carbonaceous aerosols at 31 sites across Europe. The episode featured persistent high-pressure systems, record-breaking temperatures, widespread ozone exceedances and concurrent atmospheric new particle formation and growth events."
"2026-06-22","climate change","Crossref/BMC Public Health","https://doi.org/10.1186/s12889-026-28203-5",""
"2026-06-22","global warming","Crossref/BMJ","https://doi.org/10.1136/bmj-2026-343297",""
"2026-06-22","heatwave","Crossref/BMJ","https://doi.org/10.1136/bmj-2026-100057",""
"2026-06-22","climate change","Crossref/BioScience","https://doi.org/10.1093/biosci/biag084","AbstractHabitat loss to agricultural production is expected to increase globally more than 3 million square kilometers by 2050. Food from wildlife harvests is critical to the livelihoods of millions of people worldwide and when done sustainably, could help mitigate habitat loss in response to increasing food demands. Even in the United States, wildlife harvests through sustainable hunting can significantly contribute to the sustainable maintenance of landscapes."
"2026-06-22","climate change","Crossref/Biomolecules and Biomedicine","https://doi.org/10.17305/bb.2026.14499","Hantaviruses are not emerging pathogens in the strict sense, but their public health relevance is being reshaped by climate change, environmental disruption, land-use change, and increasing human mobility. In Southeast Europe, where Dobrava-Belgrade virus and Puumala virus remain endemic, these infections should no longer be viewed only as sporadic rodent-borne diseases of rural or forested environments. Changing ecological conditions can alter reservoir abundance, virus circulation, and human exposure, while fragmented surveillance and vari..."
"2026-06-22","climate change","Crossref/British Journal of Industrial Relations","https://doi.org/10.1111/bjir.70067","ABSTRACTThis article examines the impact of rapidly changing skill requirements on skills mismatch in Europe and the role of training in mitigating adverse effects. Using data on approximately 70 million online job vacancies, we estimate the extent to which occupational skill requirements changed between 2019 and 2023 across European Union (EU) countries plus Norway and the United Kingdom. STEM‐related occupations saw the greatest degree of change, whereas lower skilled manual jobs saw the least."
"2026-06-22","climate change","Crossref/Business Process Management Journal","https://doi.org/10.1108/bpmj-11-2025-1818","PurposeIn the digital economy, digital transformation has become a strategic imperative for firms seeking to build core competitiveness. Yet how organizational structures adapt to digitalization remains insufficiently understood. In particular, the widespread claim that digital transformation inevitably leads to organizational flattening still lacks a systematic theoretical explanation and robust empirical evidence."
"2026-06-22","climate change","Crossref/CEN Case Reports","https://doi.org/10.1007/s13730-026-01145-y","AbstractEpstein–Barr virus (EBV), a member of the herpesvirus family, establishes lifelong latency following primary infection and may be reactivated under conditions of immunosuppression. EBV reactivation is classically associated with infectious mononucleosis and Burkitt lymphoma and rarely associated with cold agglutinin syndrome. Here, we describe a case of minimal change nephrotic syndrome complicated by cold agglutinin syndrome secondary to EBV reactivation in the setting of human immunodeficiency virus (HIV) infection and corticostero..."
"2026-06-22","global warming","Crossref/Cancer Cell International","https://doi.org/10.1186/s12935-025-03921-9","AbstractBackgroundAberrant alternative splicing (AS) generates multiple isoforms from a single gene, leading to functional diversity and potentially contributing to tumorigenesis. The spliceosome pathway is significantly activated in esophageal squamous cell carcinoma (ESCC). However, the functional implications and drug-response relevance of protein-coding and long non-coding RNA (lncRNA) AS and splicing factors (SFs) have not been fully characterized in ESCC."
"2026-06-22","global warming","Crossref/Cardiovascular Diabetology","https://doi.org/10.1186/s12933-026-03269-y",NA
"2026-06-22","global warming","Crossref/Chinese Physics B","https://doi.org/10.1088/1674-1056/ae8001","Abstract We examine the thermal fluctuations of the polarization p , the charge density $\rho$, and the electric field E in dilute electrolytes inserted between parallel metallic electrodes, where we fix the applied potential difference $\Phi_a$ between the two electrodes. If the film thickness $H$ is shorter than the Debye screening length $\kappa^{-1}$, the space correlation of the polarization $p_z$ and the electric field $E_z$ along the surface normal (in the $z$ direction) acquire global components, which vary slowly along the $z$ axis ..."
"2026-06-22","climate change","Crossref/Climate","https://doi.org/10.3390/cli14060131","Grazing lands are foundational for the United States (US) livestock industry. In Arkansas, pastures are essential for rotational grazing and dairy operations. Climate change is an increasing concern in agriculture due to anthropogenic activities promoting greenhouse gas (GHG) emissions, partly due to nutrient recycling that occurs from animal manure additions."
"2026-06-22","climate change","Crossref/Climate and Development","https://doi.org/10.1080/17565529.2026.2683120",""
"2026-06-22","climate change","Crossref/Climate of the Past","https://doi.org/10.5194/cp-22-1223-2026","Abstract. The Marine Isotope Stage 7 (MIS 7, ∼ 245–190 ka) displays an unusual morphology compared to the other interglacials of the late Pleistocene. It comprises two major warm periods (MIS 7e and MIS 7c) each preceded by multi-millennial-scale warming intervals (Termination III (TIII) and TIIIa, respectively) and separated by a brief return to glacial conditions (MIS 7d)."
"2026-06-22","climate change","Crossref/Clinical and Experimental Rheumatology","https://doi.org/10.55563/clinexprheumatol/1qsk0c",""
"2026-06-22","drought","Crossref/Communications Earth & Environment","https://doi.org/10.1038/s43247-026-03729-z","AbstractMore frequent and severe droughts in Central Europe threaten water security and ecosystem resilience. The winter North Atlantic Oscillation (NAO), which regulates much of Europe’s hydroclimate, increasingly drives summer drought propagation across the region. Here we combined a process-based, isotope-enabled ecohydrological model with teleconnection diagnostics, large-scale reanalysis, field observations and drought indices to link continental-scale winter circulation variability to local drought propagation through the Soil–Plant–At..."
"2026-06-22","climate change","Crossref/Computational Economics","https://doi.org/10.1007/s10614-026-11388-7",""
"2026-06-22","climate extremes","Crossref/Discover Applied Sciences","https://doi.org/10.1007/s42452-026-09091-1",""
"2026-06-22","climate change","Crossref/Discover Forests","https://doi.org/10.1007/s44415-026-00093-w",""
"2026-06-22","climate change","Crossref/Discover Oceans","https://doi.org/10.1007/s44289-026-00151-3",""
"2026-06-22","drought","Crossref/Discover Soil","https://doi.org/10.1007/s44378-026-00259-0",""
"2026-06-22","climate change","Crossref/Discover Sustainability","https://doi.org/10.1007/s43621-026-03788-4",""
"2026-06-22","climate change","Crossref/Discover Sustainability","https://doi.org/10.1007/s43621-026-03867-6",""
"2026-06-22","global warming","Crossref/Educational Linguistics","https://doi.org/10.1515/eduling-2025-0023","Abstract This article investigates interpreter-mediated “manner of speech” as a site of language governance and linguistic justice in digitally mediated courts serving migrants from the Global South. Drawing on 3,250 min (102,500 words) of Mandarin–English remote-court interpreting by fifty certified practitioners, it examines how direction, mode, and condition affect the conservation of discourse markers, hedges, and hesitations. Quantitative patterns show higher pragmatic accuracy in defendant answers ( M = 77.1) than lawyer questions ( M ..."
"2026-06-22","climate change","Crossref/Employee Relations: The International Journal","https://doi.org/10.1108/er-07-2025-0530","PurposeThis study investigated the mediating relationship between service employees' insomnia, resilience, and job performance, as well as the moderating role of organizational health climate on this relationship. Design/methodology/approachThree-wave data were collected from 318 South Korean employees in various service sectors. FindingsAs predicted, the insomnia experienced by service employees was negatively associated with their subsequent job performance, and resilience played a mediating role in this association."
"2026-06-22","global warming","Crossref/Frontiers in Allergy","https://doi.org/10.3389/falgy.2026.1799211","BackgroundThe Chronic Angioedema Registry (CARE) is the first international, multicenter observational registry established to systematically collect clinical and patient-reported data from patients with recurrent angioedema of any type during routine clinical care. Here we report enrollment after 2 years of CARE, discuss challenges and present ideas to overcome them. MethodsRegistry growth, recruitment yield, and distribution of angioedema diagnosis were analyzed descriptively as of December 12, 2025."
"2026-06-22","climate change","Crossref/Frontiers in Climate","https://doi.org/10.3389/fclim.2026.1812618","BackgroundThe urban heat island (UHI) significantly affects the health of people living under its influence. Urban children are highly exposed to environmental exposures that can affect the occurrence of atopic diseases. This study aimed to determine the link between air pollution, the UHI phenomenon, and allergic diseases in preschoolers."
"2026-06-22","climate change","Crossref/Frontiers in Climate","https://doi.org/10.3389/fclim.2026.1733203","Myrothecium leaf spot, caused by Myrothecium roridum , is an emerging disease threat to coffee ( Coffea arabica L. cv. Chandragiri) nurseries, resulting up to 30% seedling loss and occasionally affecting young field transplants."
"2026-06-22","climate extremes","Crossref/Frontiers in Climate","https://doi.org/10.3389/fclim.2026.1733203","Myrothecium leaf spot, caused by Myrothecium roridum , is an emerging disease threat to coffee ( Coffea arabica L. cv. Chandragiri) nurseries, resulting up to 30% seedling loss and occasionally affecting young field transplants."
"2026-06-22","global warming","Crossref/Frontiers in Endocrinology","https://doi.org/10.3389/fendo.2026.1799202","BackgroundThe link between metabolic syndrome (MetS) and cancer has been widely studied, but overall research patterns, shared mechanisms, and applications remain unclear. A bibliometric and bioinformatics analysis is needed to identify trends and clarify the molecular pathways connecting MetS to cancer. MethodsA bibliometric analysis using Web of Science and PubMed assessed publication trends, collaboration, key authors/journals, and research topics from 2000 to 2024."
"2026-06-22","climate change","Crossref/Frontiers in Forests and Global Change","https://doi.org/10.3389/ffgc.2026.1840645","Tropical ecosystems are increasingly exposed to fire disturbance and their responses have been assessed at regional to global scales. However, these fire-vegetation relationships remain insufficiently understood particularly in intact systems that have not been altered by human activities. Here, we conduct a national-scale assessment of fire impacts on tree cover across Indonesia over two decades, explicitly distinguishing between intact and modified peatlands and comparing their responses with intact and modified non-peatland ecosystems."
"2026-06-22","global warming","Crossref/Frontiers in Immunology","https://doi.org/10.3389/fimmu.2026.1866067","Gastric cancer (GC) remains a leading cause of cancer-related death worldwide, and PD-1 monotherapy offers limited clinical benefit due to intrinsic and acquired immune tolerance. PD-1-containing bispecific antibodies (BsAbs) represent an emerging immunotherapeutic strategy to reverse immune suppression, enhance antitumor immunity, and overcome therapy resistance. Here, we present a systematic clinical trial landscape analysis to characterize the global development of PD-1-based BsAbs for GC."
"2026-06-22","global warming","Crossref/Frontiers in Pharmacology","https://doi.org/10.3389/fphar.2026.1830589","Aconitum carmichaelii Debeaux (Ranunculaceae), commonly used as Aconiti Lateralis Radix Praeparata (Fuzi), is a clinically important but highly toxic herb in traditional Chinese medicine. Despite long-standing use for cardiovascular, rheumatologic, gastrointestinal, and pain-related conditions, its application is constrained by a narrow therapeutic index, variable processing practices, and recurrent reports of poisoning. Given the substantial number of existing reviews on aconite, this article is deliberately positioned as a clinical-regulat..."
"2026-06-22","climate change","Crossref/Frontiers in Plant Science","https://doi.org/10.3389/fpls.2026.1838248","Phytophthora cinnamomi , the causal agent of Phytophthora root rot (PRR), poses a persistent threat to the United States avocado industry, the top domestic producer and consumer. Avocado growers are facing clonal A2 P. cinnamomi populations challenging their current PRR control methods."
"2026-06-22","global warming","Crossref/Frontiers in Psychiatry","https://doi.org/10.3389/fpsyt.2026.1903585",""
"2026-06-22","climate change","Crossref/Frontiers in Psychology","https://doi.org/10.3389/fpsyg.2026.1834315","IntroductionTeacher innovation is a key manifestation of teachers’ professional competence and is essential for school development and student learning. Although previous research has identified a positive association between school climate and teacher innovation, the underlying mechanisms remain insufficiently explored, particularly in the Chinese context. MethodsDrawing on psychological empowerment theory, this study examines the relationship between school climate and teacher innovation and tests a sequential mediation model involving tea..."
"2026-06-22","global warming","Crossref/Frontiers in Remote Sensing","https://doi.org/10.3389/frsen.2026.1822070","Accurate and timely fine-grained crop type classification from satellite image time series is crucial for large-scale agricultural monitoring and decision support in food-security management. However, fine-grained classification remains challenging due to extreme class imbalance and high inter-crop spectral similarity, especially when rare crops occupy only small and fragmented parcels. We propose a rare-class-aware framework with global semantic consistency regularization for fine-grained crop classification from Sentinel-2 multispectral ti..."
"2026-06-22","climate change","Crossref/Frontiers in Sustainable Food Systems","https://doi.org/10.3389/fsufs.2026.1900108",""
"2026-06-22","climate change","Crossref/Giresun Üniversitesi İktisadi ve İdari Bilimler Dergisi","https://doi.org/10.46849/guiibd.1907119","This study provides a comprehensive examination of how political ideologies, economic liberalization, and privatization collectively shape climate action and environmental sustainability. The study argues that effective climate governance depends on the synergy between political will, economic frameworks, and societal participation. It examines the interplay across various dimensions, from international climate agreements to national policies, with a particular focus on India's experience in balancing development and sustainability."
"2026-06-22","global warming","Crossref/Global Constitutionalism","https://doi.org/10.1017/s2045381726100379","AbstractAn increasing number of jurisdictions have incorporated references to animals into their constitutions, granting non-humans some degree of constitutional relevance. This article examines the global trend of recognising animals in constitutions through a temporal lens. It distinguishes three temporal dimensions of animal constitutionalism: a symbolic rupture with a past of purely instrumental protection; a potential standstill effect that stabilises present levels of protection and a future-oriented shift towards recognising animals a..."
"2026-06-22","climate change","Crossref/Global Journal of Medical Students","https://doi.org/10.25259/gjms_19_2026",""
"2026-06-22","global warming","Crossref/Global Journal of Medical Students","https://doi.org/10.25259/gjms_15_2026",""
"2026-06-22","global warming","Crossref/Global Journal of Medical Students","https://doi.org/10.25259/gjms_2_2026",""
"2026-06-22","global warming","Crossref/Global Journal of Medical Students","https://doi.org/10.25259/gjms_8_2026","Pancreatic pseudocysts are common complications associated with acute or chronic pancreatitis, characterised by a localised accumulation of serosanguinous fluid lacking an epithelial lining. While these collections are often sterile, secondary bacterial infection can occur. Infected pancreatic pseudocysts involving multidrug-resistant (MDR) Gram-positive pathogens like Streptococcus species (spp.) are exceedingly rare and present a significant therapeutic challenge."
"2026-06-22","global warming","Crossref/Global Knowledge, Memory and Communication","https://doi.org/10.1108/gkmc-01-2025-0007","PurposeThe use of chatbots has rapidly increased worldwide. However, research exploring the factors that influence user satisfaction and continuance intention, particularly in the banking sector, remains limited. This study aims to address this gap by examining the roles of confirmation, anthropomorphism, virtual flow experience (VFE) and trust in artificial intelligence (AI) within the expectation-confirmation model framework."
"2026-06-22","global warming","Crossref/Global Political Review","https://doi.org/10.31703/gpr.2026(xi-ii).04","The world is experiencing another paradigm shift in the 21st century in form of an emerging economy driven world. BRICS has become an important forum for developing countries to cooperate in fields of trade, finance, diplomacy and global governance. The bloc was created in 2009 by Brazil, Russia, India and China and subsequently South Africa joined, all representing the desire to achieve a more balanced and multipolar international order."
"2026-06-22","global warming","Crossref/Global Public Policy and Governance","https://doi.org/10.1007/s43508-026-00147-x","AbstractGovernments are increasingly experimenting with Artificial Intelligence (AI) innovations as tools for improving the efficiency of governance processes in various aspects of public administration, including information gathering, processing and decision making. While AI has the potential to support the objectives of good governance, it has also raised legal, ethical and democratic concerns about the technology’s opacity, biases, accountability deficits, and adverse impacts on human rights of individuals. In response to these concerns,..."
"2026-06-22","global warming","Crossref/Global Public Policy and Governance","https://doi.org/10.1007/s43508-026-00145-z",""
"2026-06-22","global warming","Crossref/Global South Literary Studies","https://doi.org/10.1080/30684781.2026.2691837",""
"2026-06-22","global warming","Crossref/Global and Regional Dimensions of International Economic Relations","https://doi.org/10.58861/tae.grdier.2026.01","This article examines the problem of the decreasing efficiency of international investing during financial crises. Traditionally, it is believed that if you invest in different countries, you reduce risk. However, new research shows that when there is great market stress, all markets start to fall simultaneously."
"2026-06-22","global warming","Crossref/Global and Regional Dimensions of International Economic Relations","https://doi.org/10.58861/tae.grdier.2026.02","The tourism industry is one of the most dynamically developing industries of great importance for the development of the Bulgarian economy. Tourism also has a beneficial impact on many other sectors with which it is closely interconnected - transport, trade, construction, healthcare. This integration makes it extremely vulnerable to crises."
"2026-06-22","global warming","Crossref/Global and Regional Dimensions of International Economic Relations","https://doi.org/10.58861/tae.grdier.2026.07","Customs administrations are experiencing a significant transformation propelled by the swift growth of international trade and the rising complexity of global supply chains. Digitalization has become a crucial element in this evolution, enhancing efficiency, transparency, and risk management within customs operations. This paper examines the economic and institutional ramifications of digitalization in contemporary customs administration through qualitative document analysis of institutional reports and scholarly literature."
