"date","keyword","source","link","abstract"
"2026-05-04","climate change","Crossref/Frontiers in Public Health","https://doi.org/10.3389/fpubh.2025.1684097","IntroductionThe complex interplay between environmental dynamics, biodiversity loss, and public health necessitates advanced methodologies for quantifying and interpreting their interactions. Respiratory health, highly sensitive to environmental changes, requires particular attention as ecosystems undergo transformations driven by climate stressors. Traditional epidemiological and statistical models often fail to adequately capture the high-dimensional, non-linear, and spatiotemporal characteristics of environmental exposures and their diver..."
"2026-05-04","climate change","Crossref/Frontiers in Public Health","https://doi.org/10.3389/fpubh.2026.1789098","BackgroundNurses are vital in addressing global healthcare workforce shortages. The shortage of nurses and high turnover rates are concerned with the quality of care. To further explore the mechanisms underlying nurse turnover, this study focuses on the mediating role of work engagement, examining the relationship between hospital safety climate, work engagement, and turnover intention."
"2026-05-04","global warming","Crossref/Frontiers in Public Health","https://doi.org/10.3389/fpubh.2026.1672856","ObjectiveThis study aimed to analyze global and regional trends in the burden of subarachnoid hemorrhage (SAH) from 1990 to 2021, focusing on incidence, prevalence, disability-adjusted life years (DALYs), and mortality, and to examine socioeconomic inequalities across 204 countries and territories using Global Burden of Disease (GBD) data. MethodsUtilizing GBD 2021 data, we assessed SAH burden by incidence, prevalence, DALYs, and mortality, stratified by Socio-Demographic Index (SDI), sex, and region. Age-standardized rates were calculated t..."
"2026-05-04","global warming","Crossref/Frontiers in Public Health","https://doi.org/10.3389/fpubh.2026.1797084","BackgroundItaly’s rehabilitation workforce is fragmented and regulated by outdated decrees, limiting alignment with WHO and EU standards, and hindering efficiency, equity, and international comparability. MethodologyNarrative policy and health systems analysis, with comparative review of selected European models, based on secondary data and illustrative comparators. Policy issueWorkforce planning relies on historical professional categories and regional variability rather than population functioning needs and evidence-based competencies."
"2026-05-04","environmental change","Crossref/Frontiers in Sustainability","https://doi.org/10.3389/frsus.2026.1751337","IntroductionToday, the rapid acceleration of urbanization has made it necessary to reconsider the balance among energy consumption, environmental sustainability, and quality of life. Buildings, which account for a significant share of cities’ carbon footprint, play a critical role in efforts to improve energy efficiency and ensure user well-being. In this context, advances in digitalization and Internet of Things (IoT) technologies have enabled buildings to evolve beyond mere physical structures into dynamic, data-driven, and user-interactiv..."
"2026-05-04","global warming","Crossref/Frontiers in Sustainable Food Systems","https://doi.org/10.3389/fsufs.2026.1809910","IntroductionAmid rising concerns over the fragility of global cereal supply chains under geopolitical tensions, infrastructure underutilization, and decarbonization pressures, this study examines how counterfactual reallocation can reshape the cost-emissions profile of international cereal logistics under transparent allocation rules. MethodsThe analysis combines bilateral cereal trade data with dyadic conflict information from the Uppsala Conflict Data Program (UCDP) to identify politically tense links during non-war periods. Missing route-..."
"2026-05-04","flood","Crossref/Frontiers in Water","https://doi.org/10.3389/frwa.2026.1820304","IntroductionUrban wetlands are considered an important nature-based solution to mitigate flood impacts in built-up areas like Colombo, Sri Lanka, due to rapid urbanization and intensifying rainfall events. Wetlands within the Colombo metropolitan region offer significant potential as nature-based solutions for flood mitigation; however, their hydrological functioning remains insufficiently quantified at high temporal resolution. MethodsThis study analyzes hourly water-level data from multiple locations over multiple years within the Colombo ..."
"2026-05-04","global warming","Crossref/Geoscientific Model Development","https://doi.org/10.5194/gmd-19-3595-2026","Abstract. The competition, especially for light, is a fundamental determinant of the structure and composition of a forest. Large-scale forest models must balance real-world complexity with computational demand and poorly constrained parameters."
"2026-05-04","global warming","Crossref/Global Health Promotion","https://doi.org/10.1177/17579759261441587","This study examines the pre-program knowledge levels, needs and expectations of preschool teachers and parents regarding disasters, first aid and psychological resilience, with a view to informing the development of an early childhood disaster resilience education program. The study was conducted using a qualitative case study design, with data being collected through semi-structured interviews with 17 preschool teachers and 48 parents. The collected data were analysed using both descriptive and content analysis methods, with the MAXQDA soft..."
"2026-05-04","global warming","Crossref/Global Journal of Artificial Intelligence and Technology Development","https://doi.org/10.46654/p10vg607","The study explores the relationship between artificial intelligence (AI)-driven talent management and workforce competitiveness of the banking sector in Rivers State. The predictor variable AI-driven talent management was operationalized with talent acquisition and retention optimisation, while the criterion variable workforce competitiveness was measured with work efficiency and innovation capacity. The study was a cross-sectional survey study."
"2026-05-04","global warming","Crossref/Global Responsibility to Protect","https://doi.org/10.1163/1875984x-20262013","AbstractTwenty years on from its endorsement at the 2005 World Summit, the Responsibility to Protect (R2P) is widely described as being in crisis. Ongoing mass atrocities in Gaza, Ukraine, Myanmar, Sudan, and elsewhere underscore a stark tension between R2P’s entrenchment within the UN system and the apparent permanence of atrocity crimes. Engaging with post- and de-colonial critiques, this piece interrogates whether R2P represents a ‘delusion of saviour’, or a norm with potential for meaningful reform and continued relevance."
"2026-05-04","global warming","Crossref/Global Social Science and Humanities Journal","https://doi.org/10.59088/gi.v4i2.28","Hallucinations defined as factually incorrect or fabricated outputs remain a critical limitation of Large Language Models (LLMs), significantly undermining their reliability in high-stakes applications. This paper presents a systematic and reproducible comparative evaluation of prominent hallucination mitigation strategies, including prompt engineering, retrieval-augmented generation (RAG), and self-consistency decoding. Using benchmark factual question-answering datasets, we assess these approaches across multiple evaluation dimensions, inc..."
"2026-05-04","global warming","Crossref/Global Social Science and Humanities Journal","https://doi.org/10.59088/gi.v4i2.29","The rapid growth of pre-trained language models has substantially improved performance across Natural Language Processing (NLP) tasks. However, full fine-tuning remains computationally expensive because it requires updating and storing all model parameters for each downstream task. This limitation is particularly important in resource-constrained environments where access to high-performance computing infrastructure is limited."
"2026-05-04","global warming","Crossref/Global Social Welfare","https://doi.org/10.1007/s40609-026-00462-5","AbstractThis paper reflects on encounters with two contrasting Zimbabwean rural communities of Birchenough Bridge and Honde Valley. The study explored rural communities’ experiences with Indigenous environment-driven community development. The paper positions the natural environment as a metaphorical teacher and moral educator."
"2026-05-04","global warming","Crossref/Global Social Welfare","https://doi.org/10.1007/s40609-026-00463-4",NA
"2026-05-04","climate change","Crossref/Group Processes & Intergroup Relations","https://doi.org/10.1177/13684302261436867","Social change can take different forms, including incremental reforms within the existing system and radical transformations that dismantle and rebuild institutions. This research examined how historical trajectory narratives, specifically the progress narrative, and the longstanding injustice narrative, shape support for different types of social change. Across one experimental and two correlational studies ( ntotal = 2,520) with a diverse sample of Americans from different racial groups, we found that the progress narrative was associated ..."
"2026-05-04","global warming","Crossref/Heart","https://doi.org/10.1136/heartjnl-2025-327445","BackgroundWhile some studies have investigated the characteristics of patients from Asian versus European regions with bicuspid aortic valve (BAV) disease undergoing transcatheter aortic valve implantation (TAVI), geographic differences in a worldwide population remain poorly understood. The aim of our study was to evaluate the geographic differences of aortic valve morphology, annular size and associated aortopathy in a large, diverse population of India, West Europe, East Europe, Latin America, Middle East, Russia Commonwealth of Independe..."
"2026-05-04","climate change","Crossref/Heat Transfer","https://doi.org/10.1002/htj.70263","ABSTRACTThermal management of lithium‐ion batteries in high‐temperature environments is challenging because the available temperature range for safe operation is significantly limited. Therefore, this study proposes a novel immersion cooling of cylindrical 18650 Li‐ion batteries using a phase‐change material (PCM)‐based slurry. The phase‐change slurry, consisting of Organic Mixture‐42 dispersed in silicone oil, is used as the coolant for the battery module, and its thermal and hydraulic performance is compared with that of a single‐phase coo..."
"2026-05-04","climate change","Crossref/Heat Transfer Engineering","https://doi.org/10.1080/01457632.2026.2658888",NA
"2026-05-04","biodiversity loss","Crossref/Human Reproduction","https://doi.org/10.1093/humrep/deag060","AbstractSTUDY QUESTIONDoes artificial cycle (AC) endometrial preparation result in increased pregnancy loss rates in patients undergoing vitrified-warmed euploid blastocyst transfer (frozen embryo transfer (FET))? SUMMARY ANSWERThe randomized controlled trial (RCT) demonstrates that artificial endometrial preparation is associated with significantly higher early pregnancy loss (EPL) compared to natural cycles when transferring euploid embryos. WHAT IS KNOWN ALREADYThe increased use of FET cycles has fueled discussion regarding the optimal en..."
"2026-05-04","global warming","Crossref/Human Resources for Health","https://doi.org/10.1186/s12960-026-01075-x","AbstractBackgroundGlobal Health Capacity Building (GHCB) initiatives are central to strengthening health systems and workforce readiness in Fragile and Conflict-Affected Settings (FCAS). While many evaluation frameworks exist, most were developed for stable contexts and offer limited guidance on how to adapt evaluation processes to environments rife with political instability, limited infrastructure, population mobility, and rapidly shifting conditions. As innovative learning modalities, such as online and blended learning modalities expand ..."
"2026-05-04","global warming","Crossref/Human Service Organizations: Management, Leadership & Governance","https://doi.org/10.1080/23303131.2026.2667152",NA
"2026-05-04","air pollution","Crossref/Hydrogen","https://doi.org/10.3390/hydrogen7020062","The main goal of this study was to develop and validate a laboratory-scale prototype of a rechargeable metal hydride (MH)–air battery integrating gas diffusion electrodes (GDEs) and MH electrodes with stable performance over extended operation (>500 h) and repeated charge–discharge cycling (>100 cycles). This work addresses the critical transition from optimized electrode materials to a functioning system by investigating its operation under deep-discharge conditions, a key but still insufficiently explored regime in the context of stationar..."
"2026-05-04","climate change","Crossref/Hydrogeology Journal","https://doi.org/10.1007/s10040-026-03079-2",NA
"2026-05-04","air pollution","Crossref/ISH Journal of Hydraulic Engineering","https://doi.org/10.1080/09715010.2026.2664167",NA
"2026-05-04","global warming","Crossref/Indian Pediatrics","https://doi.org/10.1007/s13312-026-00331-6",NA
"2026-05-04","environmental change","Crossref/Indonesian Journal of Environmental Management and Sustainability","https://doi.org/10.26554/ijems.2026.10.2.102-11","The rapid growth of industry in Indonesia has led to an increase in Hazardous and Toxic Waste (B3), including liquid waste with complex chemical characteristics that pose high environmental risks. Treatment facilities for B3 wastewater can generate significant impacts such as Global Warming Potential (GWP), Human Toxicity Potential (HTP), and Freshwater Aquatic Ecotoxicity Potential (FAETP). This study evaluates the implementation of treated water recycling using the Life Cycle Assessment (LCA) method with the CML-IA Baseline approach."
"2026-05-04","environmental change","Crossref/Indonesian Journal of Environmental Management and Sustainability","https://doi.org/10.26554/ijems.2026.10.2.120-133","This study conducts a cross-case analysis of compost-related technical cooperation projects implemented by the Japan International Cooperation Agency (JICA) in Southeast Asia, applying the six OECD/DAC evaluation criteria (relevance, coherence, effectiveness, efficiency, impact, and sustainability). The analysis covers six projects in Indonesia, Malaysia, Thailand, and Vietnam. First, publicly available ex-post evaluation reports were analysed through close reading of report narratives and cited evidence."
"2026-05-04","air pollution","Crossref/Industrial & Engineering Chemistry Research","https://doi.org/10.1021/acs.iecr.6c00732",NA
"2026-05-04","greenhouse gas emissions","Crossref/Industrial & Engineering Chemistry Research","https://doi.org/10.1021/acs.iecr.6c00141",NA
"2026-05-04","climate change","Crossref/International Environmental Agreements: Politics, Law and Economics","https://doi.org/10.1007/s10784-026-09721-4","AbstractThe adoption of the 2030 Agenda marked a global commitment to address interconnected challenges through the Sustainable Development Goals (SDGs). Multi-stakeholder partnerships (MSPs) – involving public, private, and civil society actors – have been widely promoted as vital instruments for achieving the SDGs due to their potential for pooling diverse resources and fostering cross-sector collaboration. However, empirical evidence of their effectiveness remains mixed."
"2026-05-04","air pollution","Crossref/International Journal of Advanced Research in Commerce, Management & Social Science","https://doi.org/10.62823/ijarcmss/09.02(i).8796","The objective of the Study on Cost-Time-Trade-offs Between Air and Sea Freight Transportation from the Port of Chennai, India to the Port of Rotterdam, Netherlands is to determine the methodology incorporated by businesses when deciding between utilizing air versus sea freight. These decisions are influenced by numerous variables including the cost of transportation, transit time, and customer demand. In an international logistics perspective, how a company chooses to transport goods will ultimately affect the overall efficiency of their sup..."
"2026-05-04","biodiversity loss","Crossref/International Journal of Audiology","https://doi.org/10.1080/14992027.2026.2661713",NA
"2026-05-04","climate change","Crossref/International Journal of Creative and Open Research in Engineering and Management","https://doi.org/10.55041/ijcope.v2i5.046","In this work, the incorporation of polyethylene glycol (PEG) as a phase change material (PCM) and nano silica into concrete was investigated to enhance its thermal and mechanical performance. The study aims to improve energy efficiency and durability of concrete structures by utilizing PCM for thermal regulation and nano silica for strength enhancement. The concrete specimens were prepared by partially replacing cement with nano silica and adding PEG in varying proportions."
"2026-05-04","climate change","Crossref/International Journal of Environment and Climate Change","https://doi.org/10.9734/ijecc/2026/v16i55441","Background and Aims: Sorghum (Sorghum bicolor L.) is a climate-resilient cereal crop widely valued for its high productivity and adaptability to drought, heat, and low-fertility soils, making it crucial for sustainable agriculture and food security. The aim of this study was to optimize in vitro anther culture conditions in sorghum (Sorghum bicolor L.) by evaluating the effects of different iron sources and temperature regimes on callus induction, embryogenic response, and plant regeneration efficiency. The influence of two iron formulations..."
"2026-05-04","climate change","Crossref/International Journal of Environment and Climate Change","https://doi.org/10.9734/ijecc/2026/v16i55442","Terminal heat stress is a major constraint for taking a profitable wheat crop by small and marginal farmers in the Indo-Gangetic Plains of south Asia. Hence, breeders remain in constant search for heat-tolerant genotypes. The present study was conducted on 15 wheat genotypes (G1 to G15)."
"2026-05-04","environmental change","Crossref/International Journal of Environmental Analytical Chemistry","https://doi.org/10.1080/03067319.2026.2666865",NA
"2026-05-04","global warming","Crossref/International Journal of Production Research","https://doi.org/10.1080/00207543.2026.2658758",NA
"2026-05-04","climate change","Crossref/International Journal of Remote Sensing","https://doi.org/10.1080/01431161.2026.2665974",NA
"2026-05-04","environmental change","Crossref/International Journal of Transgender Health","https://doi.org/10.1080/26895269.2026.2666243",NA
"2026-05-04","global warming","Crossref/International Journal: Canada’s Journal of Global Policy Analysis","https://doi.org/10.1177/00207020261445602","This study examines the Narendra Modi government's sea change towards the Global South. Initially, the Global South became less prominent for India under the Modi governments. But with India on the verge of assuming the presidency of the G20, New Delhi promulgated that it would be the voice of the Global South."
"2026-05-04","air pollution","Crossref/International Scientific Journal of Engineering and Management","https://doi.org/10.55041/isjem07089","-Air pollution poses a severe threat to public health and the environment due to the presence of pollutants such as PM2.5, PM10, NOₓ, CO, and volatile organic compounds (VOCs). Conventional air purification systems are primarily limited to indoor environments and lack scalability for outdoor applications. This paper proposes a solar-powered outdoor air purification system integrated with real-time air quality monitoring."
"2026-05-04","global warming","Crossref/Istanbul Business Research","https://doi.org/10.26650/ibr.2026.55.1635772","This study thoroughly investigates the impact of cultural factors on capital structure decisions and explores the role of cultural variables in financial decision-making processes. The existing literature was reviewed as part of the research. The effects of cultural differences on capital structure decisions were analyzed through the interaction between Hofstede’s subregional continent classification and Gelfand’s cultural tightness classification, alongside the financial performance of companies listed on the stock exchanges of selected cou..."
"2026-05-04","biodiversity loss","Crossref/JMIR mHealth and uHealth","https://doi.org/10.2196/80339","AbstractBackgroundBeing overweight and obese are major health concerns worldwide, contributing to lifestyle-related diseases such as hypertension, dyslipidemia, type 2 diabetes, and cardiovascular disease. Increasing physical activity is an effective strategy for weight management. However, earlier step count studies have remained limited to small populations, short-term measurements of 1‐2 weeks, and mainly cross-sectional comparisons of average step counts."
"2026-05-04","climate change","Crossref/Journal of Alzheimer’s Disease","https://doi.org/10.1177/13872877261446477","BackgroundPrevious work has shown that proper name recall from the Logical Memory (LM) task is sensitive to PET and cerebrospinal fluid biomarkers of Alzheimer's disease (AD) in older adult populations. These findings indicate potential utility in identifying preclinical AD. ObjectiveThe purpose of this study is to validate previous findings of the association of proper name recall and blood-based plasma pTau217."
"2026-05-04","greenhouse gas emissions","Crossref/Journal of Animal and Feed Sciences","https://doi.org/10.22358/jafs/210765/2026",NA
"2026-05-04","environmental change","Crossref/Journal of Business Ethics","https://doi.org/10.1007/s10551-026-06322-8","AbstractScholarly work on corporate social irresponsibility (CSiR) has frequently focussed on incident-based narratives, with more recent studies exploring the complex interplay among various stakeholders and their involvement in perpetuating environmental injustice (EI). Focussing on the relationship between CSiR and EI, we examine the factors that increase the risk of CSiR occurrences, their impact on various stakeholders and related responses, and measures that can prevent or mitigate CSiR. These issues are investigated via means of media..."
"2026-05-04","global warming","Crossref/Journal of Child Neurology","https://doi.org/10.1177/08830738261441084","The global burden of stroke in children is poorly characterized. We aimed to quantify the global burden of pediatric stroke. A systematic review and meta-analysis was conducted in accordance with Preferred Reporting Items for Systematic Reviews and Meta-Analyses (PRISMA) guidelines."
"2026-05-04","climate change","Crossref/Journal of Climate","https://doi.org/10.1175/jcli-d-25-0543.1","AbstractThis study examines Utah’s changing hydroclimate landscape, specifically wintertime conditions, using 1981–2024 surface weather station observations and gridded precipitation, 1950–2024 ERA5 reanalysis, and 2001–2024 satellite remote sensing products. Since 1981, 1–2 °C of warming was found in both observational and reanalysis datasets, with northern Utah warming trends exceeding 2.0–2.5 °C. A statewide reduction of total cold-season (Oct.–Apr.) precipitation was found with the greatest drying occurring during the Spring and Fall sea..."
"2026-05-04","climate change","Crossref/Journal of Climate","https://doi.org/10.1175/jcli-d-25-0213.1","AbstractThe spatiotemporal variation of summer precipitation on the Tibetan Plateau (TP) is complex. This study proposes that there exist visible differences in the dominant modes of the interannual variability of eastern TP (ETP) precipitation between early (June) and peak (July–August) summers during 1979–2022. A north-south dipole pattern of the precipitation interannual variability appears in early summer, whereas in peak summer, the dominant mode is changed to be a monopole pattern."
"2026-05-04","climate change","Crossref/Journal of Coatings Technology and Research","https://doi.org/10.1007/s11998-026-01290-0",NA
"2026-05-04","climate change","Crossref/Journal of Cultural Analysis and Social Change","https://doi.org/10.64753/jcasc.v11i2.4821","This study examines the effects of familiarity with polarization, religious effects, knowledge polarization, awareness of government efforts, Internet use, security, leadership style, media, education & ideology understanding, tolerance, digital respect, low self-control, and strain on violent polarization in college students. A convenient sample of college students (n=142) was used, of whom 61% were males, 43% were science college students, and 30% were military college students. The scales were highly reliable (Cronbach’s alpha = 0.81) and..."
"2026-05-04","biodiversity loss","Crossref/Journal of Dairy Research","https://doi.org/10.1017/s0022029926102362","AbstractDespite the significant contribution of the dairy sector to global food systems, data on food loss during dairy farming and processing are scarce. This research aimed to quantify and understand the drivers, and strategies that prevent food loss and waste. Using a mixed-method approach combining quantitative (processor quantities and farmer estimates) and qualitative (interview) data, two New Zealand case studies (dairy farmers and staff who worked for a dairy processor) were assessed to estimate the quantity of milk solids lost, iden..."
"2026-05-04","greenhouse gas emissions","Crossref/Journal of Dairy Research","https://doi.org/10.1017/s0022029926102337","Abstract This Research Communication addresses the hypothesis that calf faeces can be used as a microbial inoculum in the in vitro gas production (GP) technique to model rumen digestibility in calves. In vitro GP is a valuable method of screening dietary interventions in ruminants. However, the technique requires a microbial inoculum, typically obtained from the rumens of fistulated animals."
