"date","keyword","source","link","abstract"
"2026-05-18","global warming","Crossref/Advances in Atmospheric Sciences","https://doi.org/10.1007/s00376-026-6004-x",""
"2026-05-18","flood","Crossref/Annual Review of Applied Linguistics","https://doi.org/10.1017/s0267190526100257","AbstractUnderstanding how attitudinal prosody is processed in a second language (L2) remains an open question, particularly regarding its neural mechanisms and the role of real-world experiences. Using functional magnetic resonance imaging (fMRI), we examined how native Japanese learners processed attitudinal versus linguistic prosody in their L1 (Japanese) and L2 (English) during a forced-choice judgment task. Across languages, attitudinal and linguistic prosody engaged partially dissociable networks: attitudinal prosody recruited socio-cog..."
"2026-05-18","greenhouse gas emissions","Crossref/Astronomy & Astrophysics","https://doi.org/10.1051/0004-6361/202558529","Tracing the origin of the gas emission lines in galaxies can prove challenging in certain cases. Buried active galactic nuclei (AGNs) and obscured young stellar clusters pose significant obstacles with respect to traditional optical diagnostic diagrams. Therefore, developing new tools to trace the excitation sources across the spectrum is a necessary effort for the advancement of the field."
"2026-05-18","greenhouse gas emissions","Crossref/Astronomy & Astrophysics","https://doi.org/10.1051/0004-6361/202555815","The physical and chemical characterization of galaxies formed within the first billion years after the Big Bang remains one of the central goals in contemporary astrophysics. For the last two decades, optical and near-infrared spectroscopy of long gamma-ray bursts (GRBs) have been heralded as an effective diagnostic to probe the interstellar medium (ISM) of the galaxies hosting these events and their metal and dust content, reaching even the most distant redshifts. An opportunity to fulfill this expectation was provided by the recent blast t..."
"2026-05-18","greenhouse gas emissions","Crossref/Atmospheric Chemistry and Physics","https://doi.org/10.5194/acp-26-6579-2026","Abstract. This article, the ninth in the series, presents kinetic and photochemical data sheets evaluated by the International Union of Pure and Applied Chemistry (IUPAC) Task Group on Atmospheric Chemical Kinetic Data Evaluation. It covers an extension of the gas phase and photochemical reactions of halogenated alkanes, alkenes, and oxygenated organic compounds implemented on the IUPAC website since 2008."
"2026-05-18","global warming","Crossref/BMC Public Health","https://doi.org/10.1186/s12889-026-27787-2","AbstractBackgroundIntestinal parasitic infections (IPIs) remain a significant public health concern worldwide, particularly affecting children under five years old. These infections contribute to malnutrition, impaired growth, diarrhea, and increased morbidity and mortality, disproportionately impacting low- and middle-income countries. This systematic review and meta-analysis aims to estimate the global prevalence of IPIs in children under five and examine the influence of socioeconomic, environmental, and diagnostic factors."
"2026-05-18","global warming","Crossref/Communications Earth & Environment","https://doi.org/10.1038/s43247-026-03647-0",""
"2026-05-18","global warming","Crossref/Eduvest - Journal of Universal Studies","https://doi.org/10.59188/eduvest.v6i5.53142","The increase in the elderly population globally and nationally encourages the need for professional caregivers while opening up strategic opportunities in poverty alleviation. This research aims to formulate a model for strengthening social counselling in the development of elderly caregivers that is integrated with the needs of the global market through a collaborative approach. This study used a qualitative approach with literature study and policy analysis methods, with reference to the theoretical framework of Ansell and Gash as well as ..."
"2026-05-18","global warming","Crossref/Evidence-based HRM: a Global Forum for Empirical Scholarship","https://doi.org/10.1108/ebhrm-05-2025-0239","PurposeThe study aims to explore the mediating effect of decent workplace in the nexus between employee relations and employee engagement. Design/methodology/approachBy administering a structured questionnaire, a total of 334 responses were gathered from an Indian power sector undertaking. The proposed research model was validated applying structural equation modeling (AMOS 20)."
"2026-05-18","global warming","Crossref/Frontiers in Applied Mathematics and Statistics","https://doi.org/10.3389/fams.2026.1786071","This study examines left-tail risk spillovers across nine developed real estate investment trust (REIT) markets during two distinct systemic shock regimes: the COVID-19 pandemic and the Sino–US Trade Frictions. Employing an integrated multi-stage framework that combines quantile-based tail correlations, vector autoregressions, GARCH volatility models, and dyadic Logit specifications linked to institutional transparency indices, we document three principal findings. First, contagion topology differs fundamentally by shock type: the pandemic g..."
"2026-05-18","climate change","Crossref/Frontiers in Forests and Global Change","https://doi.org/10.3389/ffgc.2026.1824795","Over the last decade, researchers have demonstrated that invasive earthworms significantly re-engineer surface soil conditions. Following the invasion of European earthworms, the recent expansion of Asian jumping worms has alarmed land managers and gardeners, as they are known to create loose granular aggregates, alter seasonal soil coverage of the forest floor by litter, and affect soil temperature. Because their primary introduction agents are mulch and container-grown ornamental plants, it is not surprising that much of the jumping worm i..."
"2026-05-18","climate change","Crossref/Frontiers in Plant Science","https://doi.org/10.3389/fpls.2026.1815325","Finger millet ( Eleusine coracana (L.) Gaertn.) is a resilient yet underutilized cereal with exceptional potential to withstand adverse environmental conditions. Despite its adaptability, the genetic and physiological bases of its stress tolerance remain insufficiently characterized and poorly integrated into modern crop improvement pipelines. This review critically evaluates current knowledge of finger millet responses to major abiotic stresses such as drought, salinity, temperature extremes, and heavy metal toxicity with the aim of identif..."
"2026-05-18","climate change","Crossref/Frontiers in Toxicology","https://doi.org/10.3389/ftox.2026.1833046","Microplastics (MPs) have become a cause for concern in aquatic ecosystems due to their potential to cause toxicity, which can be enhanced when co-occurring with other stressors. The contribution of climate change to MP toxicity mechanisms has been shown to be diverse, with more questions still remaining unanswered. Climate change influences the hydrologic dynamics of the aquatic environment through floods, which result in an increased abundance of MPs, whereas increased temperature in the aquatic ecosystem accelerates the leaching of additiv..."
"2026-05-18","global warming","Crossref/Glosains: Jurnal Sains Global Indonesia","https://doi.org/10.59784/glosains.v7i2.687","Background: In the legal profession, lawyers often face high workloads, ethical pressures, and demanding client expectations, which can affect their psychological well-being and level of work engagement. Leadership plays a vital role in shaping employees' attitudes and experiences at work. Leadership styles such as servant leadership and ethical leadership are increasingly recognized for their potential to foster a supportive and value-driven work environment."
"2026-05-18","global warming","Crossref/Glosains: Jurnal Sains Global Indonesia","https://doi.org/10.59784/glosains.v7i2.708","Background: Acne scars are a clinically prevalent and psychologically significant sequela of acne vulgaris, affecting up to 95% of patients and associated with reduced quality of life, social withdrawal, and diminished self-esteem. Despite decades of research, evidence for fat grafting in mixed-type atrophic acne scars remains limited to small case series. Objective: This case report aims to evaluate the short-term clinical outcomes of autologous fat grafting in a 37-year-old female with Goodman and Baron Grade IV mixed-type atrophic acne sc..."
"2026-05-18","global warming","Crossref/Glosains: Jurnal Sains Global Indonesia","https://doi.org/10.59784/glosains.v7i2.719","Background: Conventional mathematics instruction rarely integrates environmental sustainability themes, limiting students' opportunities to develop both mathematical reasoning and ecological awareness. Objective: This study developed and evaluated a PjBL–STEM learning design to simultaneously enhance mathematical critical thinking and environmental literacy among elementary students through plastic waste recycling projects. Methods: Using the 4-D R&D model followed by a quasi-experimental nonequivalent control group design, 32 elementary stu..."
"2026-05-18","global warming","Crossref/Inovasi Kesehatan Global","https://doi.org/10.62383/ikg.v3i2.3047","tuberculosis (TB) is one of the oldest infectious diseases that has been present throughout human history and remains a significant public health problem worldwide today. Technological developments have enabled TB detection using the GeneXpert® MTB/RIF Molecular Rapid Test (TCM). Fast and accurate laboratory testing is essential in healthcare services."
"2026-05-18","global warming","Crossref/International Journal of Asian Studies","https://doi.org/10.1017/s1479591426100771","AbstractMany institutions today promote “Global Asia(s)” and “Global Asian Studies” as both a method and an initiative. As a growing field, these institutions are committed to reimagining the studies of Asia through transnational, comparative, and boundary-crossing approaches. To map its contemporary landscape and identify emerging challenges, this study draws on interviews with ten directors from diverse institutions around the world, each engaged in Global Asia(s)/Global Asian Studies in distinct and pioneering ways."
"2026-05-18","climate change","Crossref/International Journal of Diabetes in Developing Countries","https://doi.org/10.1007/s13410-026-01679-y",""
"2026-05-18","global warming","Crossref/International Journal of Ophthalmology","https://doi.org/10.18240/ijo.2026.05.14","AIM: To assess the long-term safety of orthokeratology (ortho-k) in myopic children by evaluating changes in corneal endothelial morphology and central corneal thickness (CCT) after prolonged ortho-k lens wear. METHODS: This study included 65 myopic children (130 eyes). The ortho-k group comprised 39 children who had worn ortho-k lenses for more than 10y."
"2026-05-18","global warming","Crossref/International Journal of Organizational Analysis","https://doi.org/10.1108/ijoa-05-2026-7004",""
"2026-05-18","climate change","Crossref/Ionics","https://doi.org/10.1007/s11581-026-07183-x",""
"2026-05-18","climate change","Crossref/Journal of Climate Change","https://doi.org/10.70917/jcc-2026-006","Rainfall extremes in the Mono River Basin (MRB) exhibit marked spatial and temporal heterogeneity, and their accurate characterization is essential for sustainable water governance and natural hazard mitigation. This study evaluated the capacity of a multimodel ensemble built from CMIP6 General Circulation Models (GCMs) to capture and project the spatiotemporal evolution of extreme precipitation indices across the MRB. The methodological framework integrates three successive components: a performance-based selection of GCMs using a multicrit..."
"2026-05-18","climate change","Crossref/Journal of Epidemiology and Global Health","https://doi.org/10.1007/s44197-026-00586-z",""
"2026-05-18","climate change","Crossref/Journal of Integrative Bioinformatics","https://doi.org/10.1515/jib-2025-0049","Abstract Open Science is reshaping how research is conducted, yet the sustainable adoption of FAIR (Findable, Accessible, Interoperable, Reusable) research data management (RDM) requires more than technical infrastructures. In agrosystem sciences, heterogeneous data and diverse institutional contexts make cultural change particularly challenging. FAIRagro, the NFDI consortium for agrosystem sciences in Germany, developed the Community Engagement and Empowerment Cycle to address three persistent gaps in FAIR implementation: limited engagement..."
"2026-05-18","climate change","Crossref/Journal of Occupational & Environmental Medicine","https://doi.org/10.1097/jom.0000000000003757","Objective:To examine the association between PSC and psychological distress, and decompose this relationship into direct, indirect and interaction pathways involving workplace MH stigma. Method:A cross-sectional survey assessed 999 Canadian workers. Mediation was explored using a model-based potential outcomes approach, while moderation was analysed via logistic regression."
"2026-05-18","global warming","Crossref/Journal of Robotic Surgery","https://doi.org/10.1007/s11701-026-03476-5",""
"2026-05-18","global warming","Crossref/Leadership & Organization Development Journal","https://doi.org/10.1108/lodj-05-2025-0373","PurposeThis study synthesises global research on leadership styles and employee engagement using a bibliometric and science-mapping approach. It addresses persistent fragmentation across theoretical lenses, methodologies and regional contexts by examining how the field has evolved, identifying influential contributors, and uncovering dominant themes and research gaps. Design/methodology/approachFollowing the PRISMA protocol, we retrieved 349 peer-reviewed journal articles published between 2000 and 2024 from the Scopus database."
"2026-05-18","climate change","Crossref/Parasitology Research","https://doi.org/10.1007/s00436-026-08693-3","Abstract Understanding how host-parasite relationships respond to environmental factors across long periods of time is vital to understanding the dynamics of parasitic infections. We studied blood parasite infections in two sympatric species of Podarcis lizards in Northern Portugal between 2011 and 2013 and in 2021, analysing parasite data together with host traits and microclimatic conditions to understand how this relationship was maintained through time. Relationships between host traits and parasite infection remained consistent across y..."
"2026-05-18","global warming","Crossref/Pediatric Infectious Disease Journal","https://doi.org/10.1097/inf.0000000000005284","Objective:To comprehensively determine global estimates of Q fever seroprevalence in children and adolescents by conducting a systematic review and meta-analysis. Data sources:Searches of published articles in MEDLINE, Embase and Scopus databases were conducted from inception until February 2025. Study selection: Cross-sectional studies reporting seroprevalence of Q fever/ Coxiella burnetii antibodies, using any established laboratory test, in any population of healthy children and adolescents <20 years old were included."
"2026-05-18","global warming","Crossref/Scientific Data","https://doi.org/10.1038/s41597-026-07446-2",""
"2026-05-18","climate change","Crossref/Scientific Reports","https://doi.org/10.1038/s41598-026-50559-2","AbstractThe Makgadikgadi Basin in central Botswana is a key region for understanding Stone Age archaeology and human evolution. However, paleoenvironmental reconstructions have so far offered only fragmentary insights into past hydroclimatic and environmental conditions. We present the first environmental record from Sowa Pan, paleolake Makgadikgadi, covering the last 82–20 ka (Marine Isotope Stages 5–2)."
"2026-05-18","drought","Crossref/Scientific Reports","https://doi.org/10.1038/s41598-026-52246-8","Abstract This study investigated foliar-applied Lactic Acid Bacteria (LAB) as a biostimulant to enhance postharvest resilience and quality of tomato ( Solanum lycopersicum L.) fruit under drought stress. A randomized greenhouse experiment was conducted with four treatments: optimal irrigation, drought stress, and LAB applications combined with both irrigation regimes. Upon reaching physiological maturity, harvested fruits were stored at 7°C for a 20-day period, with evaluations of physicochemical and biochemical markers at regular intervals."
"2026-05-18","greenhouse gas emissions","Crossref/Solid State Phenomena","https://doi.org/10.4028/p-ndif3k","Seed crystal stabilization during the initial stage of 200-mm 4H-SiC crystal growth is critical for achieving high-quality wafers with large diameters. This study investigated the effects of heating ramp rates (0 - 6 °C/min) and SiC source powder porosity through both simulation and experimental approaches. Low ramp rates resulted in surface degradation of the seed crystal, whereas high ramp rates induced significant thermal stress, leading to cracking."
"2026-05-18","climate change","Crossref/Studies in Economics and Finance","https://doi.org/10.1108/sef-09-2025-0695","PurposeThe purpose of this study is to examine the specific relationships across various forms of climate-related events and assorted segments of the energy market in diverse geographic regions in the US. Design/methodology/approachNumerous wavelet coherence analyses inspect the co-movements of 15 key energy economic indicators (average price, production, and consumption estimates of oil, gasoline, coal, electricity, natural gas, renewable energy, wood and biofuels) and diverse climate-related events (temperature-related, precipitation-relat..."
"2026-05-18","climate change","Crossref/To Improve the Academy: A Journal of Educational Development","https://doi.org/10.3998/tia.6959","This article introduces and defines the term Institution Age, arguing that Centers for Teaching and Learning, while long-predicted to play a central role in institutional change, no longer have the luxury of deciding whether they will play such a role following the pandemic, and in order to help their institutions respond to the ongoing disruptions and challenges in higher education in the 21st century. Narrative reflection of one director’s experience moving from former “ages” within educational development to the “Institutional Age” recoun..."
"2026-05-18","climate change","Crossref/To Improve the Academy: A Journal of Educational Development","https://doi.org/10.3998/tia.7163","This study explores how Centers for Teaching and Learning (CTLs) can adjust their programming and services to address evolving faculty needs in a post-pandemic context. To illustrate this, we provide an example of a comprehensive needs assessment, drawing on results from a survey and focus groups conducted at a mid-sized private university in the southwestern United States. The findings highlight key factors influencing faculty engagement and perceptions of professional learning opportunities."
"2026-05-18","global warming","Crossref/Transformation in Higher Education","https://doi.org/10.4102/the.v11i0.716","This study aims to provide a comprehensive bibliometric analysis of global research on entrepreneurial literacy in higher education. Using the Scopus database, 408 publications from 2005 to 2025 were collected and refined to 336 relevant articles for analysis. The period from 2005 to 2025 was chosen because it marked a turning point in how entrepreneurial literacy was integrated into higher education curricula worldwide, prompting a surge in academic discourse and publications on the subject."
"2026-05-18","greenhouse gas emissions","Crossref/Volcanica","https://doi.org/10.30909/vol/odlf5080","The VEI 4 eruption of La Soufrière Volcano underwent a dramatic transition in style from initial lava dome effusion in December 2020 to hazardous explosive activity in April 2021. Understanding the magmatic processes underpinning such transitions is critical. We provide the first comprehensive dataset of the compositions and volatile contents of melt inclusions from the 2021 explosive activity, including the first measurements of pre-eruptive total CO2 at La Soufrière and estimates of magmatic temperature."
"2026-05-17","climate change","Crossref/AIChE Journal","https://doi.org/10.1002/aic.70468","Abstract In cryogenic CO 2 desublimation systems where phase change dominates both heat transfer and separation, conventional lumped thermal‐resistance treatments embed interfacial latent heat into an overall heat‐transfer coefficient, obscuring how phase‐change heat is partitioned between the gas phase and the coolant and limiting diagnostic insight into energy efficiency. In this study, CO 2 desublimation experiments were conducted using CO 2 /N 2 mixtures, and a coupled heat‐ and mass‐transfer model incorporating phase‐change effects was ..."
"2026-05-17","global warming","Crossref/Annals of the International Communication Association","https://doi.org/10.1093/anncom/wlag025","AbstractStructural inequalities continue to influence global communication in the digital age, despite assumptions of digital equity. While digital platforms have transformed the scale and speed of information spread, ownership and control over data, algorithms, governance systems, and infrastructure remain concentrated. This article reexamines the New World Information and Communication Order (NWICO) as a critical framework for analyzing contemporary global communication."
"2026-05-17","global warming","Crossref/Asian Journal of Control","https://doi.org/10.1002/asjc.70168","AbstractThis article focuses on the global and semi‐global fixed‐time synchronization problems of delayed inertial neural networks (DINNs) with mixed impulsive effects. By constructing a drive‐response model, a nonsingular fixed‐time controller including linear terms and double power terms is designed to achieve fast convergence, whether the initial error is large or small. An improved radially unbounded Lyapunov function is proposed, which combines delay‐dependent integral terms and impulsive attenuation coefficients to effectively characte..."
"2026-05-17","climate change","Crossref/Bollettino della Società Geografica Italiana","https://doi.org/10.36253/bsgi-7621","This paper investigates the temperature dynamics within the Metropolitan Area of Florence, and particularly in the Piana Fiorentina. It focuses on the Urban Heat Island (UHI) effect by utilizing Local Climate Zones (LCZs), Land Surface Temperature (LST), and crowdsourced air temperature data. The study aims to map LCZs and explore temperature variations across urban and peri-urban landscapes."
"2026-05-17","global warming","Crossref/Critical Policy Studies","https://doi.org/10.1080/19460171.2026.2669065",""
"2026-05-17","heatwave","Crossref/Current Issues in Language Planning","https://doi.org/10.1080/14664208.2026.2669100",""
"2026-05-17","global warming","Crossref/Discover Global Society","https://doi.org/10.1007/s44282-026-00407-5","AbstractBelom Bahadat is a philosophy that governs the behavior of the Dayak Ngaju community in Palangka Raya as a guideline for ethics, order, honesty, social solidarity, and wisdom. This research uses a qualitative approach with a single case study through interviews, observations of technology use, and literature review. The research questions highlight how the assimilation of Belom Bahadat with Islam occurs through the rational actions of actors, as well as the influence of technology on cultural decisions and practices."
"2026-05-17","climate change","Crossref/Discover Public Health","https://doi.org/10.1186/s12982-026-02073-z",""
"2026-05-17","climate change","Crossref/Discover Sustainability","https://doi.org/10.1007/s43621-026-03333-3","AbstractClimate change poses a significant threat to smallholder farmers. Despite increasing attention on supply chain resilience, an integrated model tailored to inclusive fresh product supply chains remains lacking. This gap is particularly pronounced in developing countries whose supply chains are characterized by the dominance of smallholder farmers, resource constraints, and chronic threats from inherent socio-political-economic conditions, distinct from the large-scale risks generally studied in developed countries."
"2026-05-17","climate change","Crossref/Discover Sustainability","https://doi.org/10.1007/s43621-026-03385-5",""
"2026-05-17","global warming","Crossref/Discover Sustainability","https://doi.org/10.1007/s43621-026-03219-4",""
"2026-05-17","greenhouse gas emissions","Crossref/Discover Sustainability","https://doi.org/10.1007/s43621-026-03419-y","Abstract Livestock production in sub-Saharan Africa is both a significant source of greenhouse gas emissions and highly vulnerable to the impacts of climate change. In Ethiopia, livestock significantly contribute to emissions, undermining pastoralists’ adaptive capacity and requiring effective emission-reduction and adaptation measures. This study assessed the impact of strategic Animal Health Interventions (AHI) on greenhouse gas (GHG) emissions from grazing sheep and the adaptive capacity of sheep-keepers in Ethiopia."
"2026-05-17","climate change","Crossref/Environmental Science & Technology","https://doi.org/10.1021/acs.est.5c17262",""
"2026-05-17","greenhouse gas emissions","Crossref/Environmental Science & Technology","https://doi.org/10.1021/acs.est.6c01819",""
"2026-05-17","global warming","Crossref/Infectious Diseases and Therapy","https://doi.org/10.1007/s40121-026-01352-1",""
