"date","keyword","source","link","abstract"
"2026-03-26","Klimatická změna","Crossref","https://doi.org/10.1002/sd.70939","ABSTRACTClimate change and rising global temperatures are significantly affecting energy consumption patterns and carbon emissions. This study directly contributes to the United Nations Sustainable Development Goals (SDGs), particularly SDG 13 (Climate Action), SDG 7 (Affordable and Clean Energy), and SDG 12 (Responsible Consumption and Production). This study investigates the relationship between temperature and energy‐related emissions from coal, diesel, electricity, and natural gas using panel data from eight Chinese provinces covering th..."
"2026-03-26","Klimatická změna","Crossref","https://doi.org/10.1007/s44187-026-00948-3",""
"2026-03-26","Klimatická změna","Crossref","https://doi.org/10.1007/s00704-026-06162-6",""
"2026-03-26","Klimatická změna","Crossref","https://doi.org/10.1186/s12940-026-01273-z",""
"2026-03-26","Klimatická změna","Crossref","https://doi.org/10.17159/sajs.2026/23208","Freshwater systems are among the most endangered ecosystems, with anthropogenic climate change causing detrimental ecological and economic impacts. Due to climate change, increased air temperatures will translate into the warming of rivers, and at the same time will alter flow regimes and increase evaporation and stochastic events. In this study, we used validated statistical water temperature models that predict average water temperatures (WTavg) from air temperature to project monthly and daily WTavg from 2025 to 2100 CE in the heavily pol..."
"2026-03-26","Klimatická změna","Crossref","https://doi.org/10.5871/jba/014.a03","Climate change is driven by the fossil fuel consumption of past and current generations. Its effects will disproportionately fall on today’s children and those yet to be born (‘future generations’). We chart the historical contribution of high-income countries, including the UK, to their climate futures before exploring the intergenerational orientations of two key actors in climate politics: the United Nations (UN), the collective voice of sovereign states, and adults with the right to vote in these states."
"2026-03-26","Klimatická změna","Crossref","https://doi.org/10.70267/ic-aimees.2026020107","In view of the increasingly serious air pollution problem in China in recent years, especially the significant threat of PM2.5 to public health, this study focuses on the key driving factor of meteorological conditions, aiming to reveal the specific impact path of PM2.5 concentration in Beijing, and provide a solid theoretical basis and practical guidance for scientific formulation of provention and control strategies and effective response to climate change. Spearman correlation analysis, multiple linear regression and stepwise regression w..."
"2026-03-26","Klimatická změna","Crossref","https://doi.org/10.22337/2587-9618-2026-22-1-169-178","The main regional features of subsidence clay soils common in Mongolia are high porosity, low humidity and underfilling within the seasonal deep freezing due to their heaving and sublimation loosening. Using such soils as foundations for buildings and structures under conditions of increasing humidity is difficult at the design and construction stages, as well as during operation. This paper examines the results of analytical calculations to identify the dependence of a decrease in the physical and mechanical properties of subsidence soils o..."
"2026-03-26","Klimatická změna","Crossref","https://doi.org/10.18619/2072-9146-2026-1-141-153","Relevance. Climate change is a severe problem in Ethiopia as a whole, but especially in the study area, where people rely on subsistence rain-fed farming. Effective adaption changes in climatic conditions are critical to securing resilient farmers' livelihoods."
"2026-03-26","Klimatická změna","Crossref","https://doi.org/10.1111/jog.70254","ABSTRACTAimsThis study aimed to assess the level of climate change awareness among pregnant women and identify associated sociodemographic and obstetric factors. Methods A cross‐sectional study was conducted at a training and research hospital in Turkey between March and July 2025. A total of 243 pregnant women were surveyed using a sociodemographic questionnaire and the validated climate change awareness scale."
"2026-03-26","Klimatická změna","Crossref","https://doi.org/10.1093/evolut/qpag054","AbstractClimate change is reshaping environments, raising questions about how species will endure. Pinto & Stelkens (2026) investigate whether hybridization aids adaptation using four yeast species and their interspecific F2 hybrids exposed to extreme temperature stress. While the parental species and their hybrids adapted to temperature extremes, hybrids exhibited unique evolutionary trajectories."
"2026-03-26","Klimatická změna","Crossref","https://doi.org/10.3389/fclim.2026.1764243","BackgroundRainfed grape cultivation in the occupied West Bank of Palestine, a vital source of livelihood for over 7,000 farmers is under significant threat from climate change. While effective extension is crucial for building resilience, access to these services is highly limited by political and logistic challenges, with only 7.1% of farmers currently reached. Digital extension presents a potential solution to overcome these barriers, but rigorous evidence of its effectiveness in conflict-prone environments is lacking, as observational dat..."
"2026-03-26","Klimatická změna","Crossref","https://doi.org/10.1111/imig.70160","ABSTRACTThis study examines the role of climate change in shaping return migration intentions among international migrants. Using an original representative survey of over 1000 first‐generation West African migrants in Germany, we correlate variation in climate conditions in respondents' subnational regions of origin in West Africa to their return migration intentions. We also embed a survey experiment to test whether informational cues about future climate disasters in migrants' origin countries affect their desire to return home."
"2026-03-26","Klimatická změna","Crossref","https://doi.org/10.3828/bjcs.2026.4","This article examines Canada’s climate change record since the early 1990s. Early signs of global leadership soon evaporated and Canada became the worst climate change laggard in the G7. The article maintains that much of this poor record may be understood as a product of rapid growth in Alberta’s oil sands production, one of the world’s most GHG-intensive sources of petroleum."
"2026-03-26","Klimatická změna","Crossref","https://doi.org/10.64758/gazavy05","Climate change is most important topic for discussion of the current century. The main obstacle to understand is not only scientific but also how it impacts humans to human culturally and linguistically. Due to the changes happening in the 21st century climate change is now a threat to the humankind."
"2026-03-26","Klimatická změna","Crossref","https://doi.org/10.1038/s41598-026-45612-z",""
"2026-03-26","Klimatická změna","Crossref","https://doi.org/10.1007/s41207-026-01104-0",""
"2026-03-26","Klimatická změna","Crossref","https://doi.org/10.1186/s13717-026-00690-9",""
"2026-03-26","Klimatická změna","Crossref","https://doi.org/10.1007/s10343-026-01305-1",""
"2026-03-26","Klimatická změna","Crossref","https://doi.org/10.1371/journal.pclm.0000879","Heatwaves and extreme heat already exert significant pressure on healthcare systems – a burden expected to intensify with climate change. During hot periods, ambulance callouts, emergency presentations, hospital admissions, and mortality all rise sharply. Hospital at Home (HaH) delivers hospital-level care in patients’ homes, replacing the need for an inpatient admission."
"2026-03-26","Klimatická změna","Crossref","https://doi.org/10.1038/s44304-025-00152-w","AbstractAlthough drought is a natural hazard, growing global concern surrounds its increasing frequency and severity due to climate change. Projections indicate that drought conditions are expected to intensify worldwide in the future, and Europe is no exception. Therefore, understanding the pattern and characteristics of future drought is crucial to developing region-specific adaptation strategies to enhance resilience."
"2026-03-26","Klimatická změna","Crossref","https://doi.org/10.1080/00958964.2026.2618238",""
"2026-03-26","Klimatická změna","Crossref","https://doi.org/10.3390/land15040541","Climate change and rapid urbanization are intensifying flood risks in China, particularly in regions with complex terrain and dense populations. Traditional risk assessment methods often lack the flexibility to handle uncertainties in multi-dimensional risk systems. This study proposes a probabilistic flood risk assessment framework integrating Monte Carlo simulation with a composite indicator system from the perspective of disaster system theory."
"2026-03-26","Klimatická změna","Crossref","https://doi.org/10.1111/amet.70080","AbstractIn recent years, Berlin has emerged as an epicenter of climate activism in Germany. There, a range of groups have mobilized in opposition to the role of the German state and the EU in accelerating the climate crisis. Many activists now see conventional political responses as exhausted and have turned to increasingly radical forms of civil disobedience."
"2026-03-26","Klimatická změna","Crossref","https://doi.org/10.1007/s12518-026-00719-w",""
"2026-03-26","Klimatická změna","Crossref","https://doi.org/10.3390/f17040414","Against the backdrop of climate change, forest fires increasingly undermine ecosystem stability and reshape species distributions in Heilongjiang Province. Therefore, quantifying the drivers of fire occurrence and conducting long-term fire risk forecasting holds critical value for regional ecological security. Centered on the forested regions of Heilongjiang Province, this study systematically assessed the relative contributions of multi-source factors—including topography, vegetation, and meteorological conditions—to fire occurrence and com..."
"2026-03-26","Klimatická změna","Crossref","https://doi.org/10.18805/ijare.a-6469","Background: This study evaluates the impact of climatic factors (CFs) on rice production and yield in 19 states of India. The elasticities of rice yield and production with CFs were determined. Future projections of rice production and yield were also estimated."
"2026-03-26","Klimatická změna","Crossref","https://doi.org/10.1007/s12273-026-1393-4",""
"2026-03-26","Klimatická změna","Crossref","https://doi.org/10.1175/jcli-d-25-0418.1","AbstractThe westerly jet streams are a key component of North Atlantic climate, particularly during winter. Projections of European surface climate change depend largely on models’ ability to capture jet behaviour, which requires sufficient resolution in both the atmosphere and ocean. We evaluated the impact of model resolution on the winter climatological zonal wind and on eddy-driven jet position and speed simulated under historical (1950–2014) and future (2015–2050) climate conditions in an ensemble of fully coupled global climate models,..."
"2026-03-26","Klimatická změna","Crossref","https://doi.org/10.1080/19475705.2026.2649615",""
"2026-03-26","Klimatická změna","Crossref","https://doi.org/10.52589/ajensr-5hjrotyh","Climate change is a significant threat to pastoralism in East Africa, particularly in South Sudan, where rising temperatures and increasingly frequent extreme weather events such as prolonged droughts and severe floods have disrupted traditional livelihood systems. Increased g rainfall variability has made it difficult for pastoralists to predict seasonal patterns, undermining livestock production, worsening food insecurity, and intensifying socio-economic vulnerabilities. This study examines the impacts of climate change on pastoralist live..."
"2026-03-26","Klimatická změna","Crossref","https://doi.org/10.1017/sas.2026.10050","AbstractThis article examines the semiotics of epistemic politics surrounding climate change denial on Tangier Island, Virginia, a shrinking inhabited island in the Chesapeake Bay, USA. Using long-term ethnographic field research, the paper analyzes how islanders’ professed disbelief in climate change functions not as ignorance but as political and poetic positioning. Denial is treated as a symbolic act, not reducible to misinformation or scientific illiteracy, but shaped by classed and embodied relations with state knowledge regimes, media ..."
"2026-03-26","Klimatická změna","Crossref","https://doi.org/10.1017/s0376892926100356","SummaryClimate change is a significant challenge for biodiversity conservation in Australia and globally; conservation practitioners, researchers and policymakers need to find new ways to protect species, communities and habitats from the impacts of it. These new approaches – or adaptation interventions – require testing, approvals, permissions, funding and, in many cases, social licence. As such, there is a strong appetite for peer-to-peer sharing of research, new ideas and experiences in adapting biodiversity conservation to climate change..."
"2026-03-26","Klimatická změna","Crossref","https://doi.org/10.1162/glep.a.704","AbstractSites of global environmental governance (GEG), like the UN Framework Convention on Climate Change Conference of Parties (UNFCCC COP), are critical spaces where state and nonstate actors grapple with our planet’s most pressing challenges. Failure to address the unequal impacts of the climate crisis has led scholars and decision makers to call for more transparent, inclusive, and accountable decision-making processes. However, the ever-increasing number and variety of participants has failed to translate into more equitable outcomes."
"2026-03-26","Klimatická změna","Crossref","https://doi.org/10.65713/ijtbiv2i127","Transformer models are emerging as practical solutions for climate change and ecological issues. Their ability to spot patterns and correlations in massive amounts of environmental data collected from sensors, satellites, and reports allows them to outperform earlier approaches. Their ability to document climatic patterns over extended periods makes them invaluable for risk assessment and real-time monitoring of changes."
"2026-03-26","Klimatická změna","Crossref","https://doi.org/10.1038/s41467-026-71187-4","AbstractTropical rainfall plays a central role in the climate system, shaping ecosystems and societies. Here we show that recent tropical rainfall changes are primarily driven by spatial shifts in atmospheric circulation rather than thermodynamic processes, and cannot be explained by the “Wet Get Wetter” or “Warm Get Wetter” paradigms. Observations reveal a northward shift in precipitation with wetting in the western and northern equatorial Pacific, northern Indian region, and drying south of the equator in the Pacific and South America."
"2026-03-26","Klimatická změna","Crossref","https://doi.org/10.1111/camh.70091","Understanding the mental health impact of climate change is of paramount importance to promoting youth resilience and pro‐environmental engagement. Here, we reflect on the study of Park et al. ( Child and Adolescent Mental Health , 2026) on the prevalence and mental health correlates of climate worry in young adolescents."
"2026-03-26","Klimatická změna","Crossref","https://doi.org/10.3389/fsufs.2026.1771937","Achieving Sustainable Food Production Systems (SFPS) remain the fundamental challenge of the agricultural sector across the world. This comes at a time where human population grows at approximately 0.84% worldwide, which then increases human needs for food and fibre. While dealing with this challenge, climate change presents another dimension of agricultural challenge, of both growth and development and also as a threat to the sector."
"2026-03-26","Rekordy","Crossref","https://doi.org/10.3390/hydrology13040103","Floods are among the extreme events associated with climate variability in the Lacramarca River basin, located in the department of Ancash, Peru. Meteorological phenomena such as El Niño during the periods 1982–1983 and 1997–1998, as well as the Coastal El Niño in 2017, constitute key reference events that motivated the development of the present study, based on a case study conducted in the area between the rural settlements of Santa Clemencia and Pampadura. This research is based on maximum precipitation data derived from historical climat..."
"2026-03-26","Extrémy","OpenAlex","https://doi.org/10.1016/j.jenvman.2026.129445",""
"2026-03-26","Emise","The Guardian World","https://www.theguardian.com/environment/2026/mar/26/fears-net-zero-is-next-brexit-as-oil-crisis-fuels-political-climate-divide","Rising energy bills give Reform and Tories opening to attack net zero while government hesitant to make case for clean energyCould net zero become “the next Brexit”? That is the fear stalking climate advocates as the oil crisis caused by the war on Iran starts to bite.A powerful coalition of the well-funded Reform party, led by Nigel Farage, the Conservative party, some business interests, and the UK’s right-wing media, are engaged in an onslaught against the longstanding target of reaching net zero greenhouse gas emissions by 2050. Continue..."
"2026-03-25","Emise","CT24","https://ct24.ceskatelevize.cz/clanek/ekonomika/nemecko-chce-splnit-klimaticke-cile-i-pomoci-2000-vetrnych-elektraren-371687","Výstavbou dvou tisíc nových větrných elektráren, rozšířením plochy smíšených lesů či větší podporou elektromobility chce Německo dosáhnout toho, že splní své klimatické cíle do roku 2030. Na tiskové konferenci to oznámil ministr životního prostředí Carsten Schneider, který představil plán s celkem 67 body. Berlín si vytyčil cíl, že do roku 2030 sníží emise skleníkových plynů o 65 procent ve srovnání s rokem 1990."
"2026-03-25","Emise","Crossref","https://doi.org/10.1080/10962247.2026.2651550",""
"2026-03-25","Emise","Crossref","https://doi.org/10.21605/cukurovaumfd.1721137","In this study, vehicle-related emissions in Yozgat province were quantified and their impacts on air quality were analyzed. Emission calculations were performed based on traffic density and vehicle categories using data obtained from the General Directorate of Highways, and the resulting estimates were compared with data from the National Air Quality Monitoring Network. Within the scope of the study, road transport–related emissions of CO, NOₓ, VOC, and PM in Yozgat province were calculated according to road segments and vehicle types, revea..."
"2026-03-25","Emise","Crossref","https://doi.org/10.1021/acsestair.5c00280",""
"2026-03-25","Emise","Crossref","https://doi.org/10.1002/advs.202519769","ABSTRACTGlobal warming and unintentionally produced persistent organic pollutants (UPOPs) are well‐recognized global concerns. Climate action under the Paris Agreement and UPOPs control under the Stockholm Convention proceed on separate tracks. Evidence of shared health gains is limited."
"2026-03-25","Emise","Crossref","https://doi.org/10.3390/en19071604","Hydrogen-enriched compressed natural gas (HCNG) is a promising transitional fuel for residential-scale distributed power, yet its impacts on direct-combustion thermoelectric generator (TEG) systems remain insufficiently quantified. In this study, a micro-scale TEG integrated with a commercially available self-aspirating household burner was experimentally investigated under thermal inputs of 700–2500 W and hydrogen blending ratios of 0–20 vol%, using open-loop water cooling to maximize heat rejection. The hot- and cold-side temperatures exhi..."
"2026-03-25","Emise","Crossref","https://doi.org/10.1088/2515-7620/ae5765","AbstractFine particulate matter (PM_(2.5)) and black carbon (BC) are major air pollutants with impacts on human health and regional climate, yet very little information on spatiotemporal distributions in African cities currently exists. This study analysed spatiotemporal variations in the concentration of PM_(2.5) and BC in African urban and rural areas, with special attention to Kigali, in Rwanda. The data revealed average values for PM_(2.5) of 22 to 38 μg/m³, well above the recommended thresholds, with higher values recorded in the dry se..."
"2026-03-25","Emise","Crossref","https://doi.org/10.1088/1572-9494/ae56de","AbstractWe investigate the possibility of constraining primordial black holes (PBHs) with masses $M_\mathrm{PBH}\gtrsim 10^{15}\,\mathrm{g}$ through Galactic diffuse synchrotron emissions. Due to Hawking radiation, these types of PBHs are expected to be stable sources of cosmic-ray (CR) electrons and positrons with energies below $\mathcal{O}(10\,\mathrm{MeV})$. In many CR propagation models with diffusive re-acceleration characterized by a significant Alfv'{e}n velocity $V_a\sim \mathcal{O}(10)\,\mathrm{km/s}$, the energies of the evaporate..."
"2026-03-25","Emise","Crossref","https://doi.org/10.1007/s11027-026-10305-5",""
"2026-03-25","Emise","Crossref","https://doi.org/10.26832/24566632.2026.110104","Household food waste presents a growing challenge to both economic security and environmental sustainability, particularly in rural agricultural regions. This study evaluated the economic and environmental implications of food waste at household level in Gauradaha Municipality, Jhapa district, Nepal. Based on a structured survey of 51 households using a self-administered questionnaire, the research examined factors influencing food waste generation and its associated costs."
"2026-03-25","Emise","Crossref","https://doi.org/10.1108/baj-04-2024-0016","PurposeThis study aims to understand the impact of carbon pricing on greenhouse gas emissions. It is necessary to evaluate the effectiveness of the carbon pricing mechanism on the ground level; therefore, this study provides valuable input about the policies of carbon taxes in OECD countries. Design/methodology/approachThis study examines the effects of carbon prices on greenhouse gas emissions in five OECD nations (Denmark, Finland, Sweden, Norway and Slovenia), for the sample period of 1990–2019."
"2026-03-25","Emise","Crossref","https://doi.org/10.1021/acs.est.5c18681",""
"2026-03-25","Emise","Crossref","https://doi.org/10.1080/21683565.2026.2650798",""
"2026-03-25","Emise","Crossref","https://doi.org/10.1007/s10677-026-10548-w",""
"2026-03-25","Emise","Crossref","https://doi.org/10.1007/s43621-026-03093-0",""
"2026-03-25","Emise","Crossref","https://doi.org/10.3390/fractalfract10040212","Wetting–air-drying cycling significantly alters the internal damage evolution and failure behavior of sandstone, and identifying reliable acoustic-emission (AE) precursors during loading is important for understanding the rupture mechanism of water-affected rock. In this study, uniaxial compression tests with AE monitoring were conducted on green sandstone subjected to different numbers of wetting–air-drying cycles. Ringing counts, RA–AF parameters, b-value evolution, AE spatial localization, and the correlation dimension D2 were jointly use..."
"2026-03-25","Emise","Crossref","https://doi.org/10.17221/323/2025-pse",""
"2026-03-25","Emise","Crossref","https://doi.org/10.1108/sasbe-06-2025-0296","PurposeThe materials used in the structural system account for a significant share of a building's total embodied carbon emissions. Thus, to mitigate the climate impact of construction projects, it is essential to consider carbon emissions in early conceptual design and understand how structural decisions affect costs. Therefore, this study explores integrating set-based design with genetic algorithm optimisation to evaluate a wide range of building designs in terms of cost and carbon performance."
"2026-03-25","Emise","Crossref","https://doi.org/10.3390/ani16071007","Reducing enteric methane emissions from ruminants has emerged as a critical environmental priority in the face of global climate change, given the substantial contribution of methane to agricultural greenhouse gas outputs. This study evaluated the potential of spearmint essential oil (SEO) to reduce methane production and enhance energy utilization efficiency using an in vitro rumen fermentation system. The experiment comprised a control (CON, no additive), three SEO doses (L-SEO: 100 mg/L; M-SEO: 200 mg/L; H-SEO: 400 mg/L), and a commercial..."
"2026-03-25","Emise","Crossref","https://doi.org/10.1007/s00531-026-02573-y",""
"2026-03-25","Emise","Crossref","https://doi.org/10.1007/s43621-026-02850-5",""
"2026-03-25","Emise","Crossref","https://doi.org/10.1007/s10668-026-07497-w",""
"2026-03-25","Emise","Crossref","https://doi.org/10.1080/15567036.2026.2646288",""
"2026-03-25","Emise","Crossref","https://doi.org/10.7546/crabs.2026.03.14","The use of biochar (BC) improves soil properties and crop yields, as well as reduces greenhouse gas emissions. The aim of this study was to evaluate the long-term effect of BC added to soil on CO2 emissions in a Fluvisol. The study was conducted in the experimental field of Tsalapitsa village, where BC and nitrogen fertilization were applied 4, 5, and 6 years ago."
"2026-03-25","Emise","Crossref","https://doi.org/10.1007/s00374-026-02002-x",""
"2026-03-25","Emise","Crossref","https://doi.org/10.1080/14686996.2026.2650843",""
"2026-03-25","Emise","Crossref","https://doi.org/10.1103/6m7q-qf1p",""
"2026-03-25","Emise","Crossref","https://doi.org/10.1007/s42729-026-03200-0",""
